Index,Title,Session/Area,Authors,Affiliation,Country,Status,Proceeding URL,PDF URL,CVF URL,Arxiv URL
474,Improving Local Trajectory Optimisation using Probabilistic Movement Primitives,,RB Ashith Shyam;Peter Lightbody;Gautham Das;Pengcheng Liu;Sebastian Gomez-Gonzalez;Gerhard Neumann;RB Ashith Shyam;Peter Lightbody;Gautham Das;Pengcheng Liu;Sebastian Gomez-Gonzalez;Gerhard Neumann;,University of Lincoln;Cardiff Metropolitan University;Max Planck Institute for Intelligent Systems;,United Kingdom;Germany;,Poster,https://ieeexplore.ieee.org/document/8967980/,,,
475,Improving Robot Success Detection using Static Object Data,,Rosario Scalise;Jesse Thomason;Yonatan Bisk;Siddhartha Srinivasa;Rosario Scalise;Jesse Thomason;Yonatan Bisk;Siddhartha Srinivasa;,University of Washington;,United States;,Poster,https://ieeexplore.ieee.org/document/8968142/,,,
476,Improving Task-Parameterised Movement Learning Generalisation with Frame-Weighted Trajectory Generation,,Aran Sena;Brendan Michael;Matthew Howard;Aran Sena;Brendan Michael;Matthew Howard;,King’s College London;,United Kingdom;,Poster,https://ieeexplore.ieee.org/document/8967688/,,,
477,Inchworm-inspired soft climbing robot using microspine arrays,,Qiqiang Hu;Erbao Dong;Gang Cheng;Hu Jin;Jie Yang;Dong Sun;Qiqiang Hu;Erbao Dong;Gang Cheng;Hu Jin;Jie Yang;Dong Sun;,University of Science and Technology of China;Beijing Institute of Spacecraft System Engineering;City University of Hong Kong;,China;,Poster,https://ieeexplore.ieee.org/document/8967601/,,,
478,Inertial-based Motion Capturing and Smart Training System,,Jens Windau;Laurent Itti;Jens Windau;Laurent Itti;,University of Southern California;,United States;,Poster,https://ieeexplore.ieee.org/document/8967727/,,,
479,INFER: INtermediate representations for FuturE pRediction,,Shashank Srikanth;Junaid Ahmed Ansari;R. Karnik Ram;Sarthak Sharma;J. Krishna Murthy;K. Madhava Krishna;Shashank Srikanth;Junaid Ahmed Ansari;R. Karnik Ram;Sarthak Sharma;J. Krishna Murthy;K. Madhava Krishna;,"International Institute of Information Technology, Hyderabad;Quebec AI Institute;",India;Canada;,Poster,https://ieeexplore.ieee.org/document/8968553/,,,
480,Inference of user-intention in remote robot wheelchair assistance using multimodal interfaces,,Vinicius Schettino;Yiannis Demiris;Vinicius Schettino;Yiannis Demiris;,Imperial College London;,United Kingdom;,Poster,https://ieeexplore.ieee.org/document/8968203/,,,
481,Inferring Distributions Over Depth from a Single Image,,Gengshan Yang;Peiyun Hu;Deva Ramanan;Gengshan Yang;Peiyun Hu;Deva Ramanan;,Carnegie Mellon University;,United States;,Poster,https://ieeexplore.ieee.org/document/8968065/,,,
482,Influence of parameters uncertainties on the positioning of cable-driven parallel robots,,J-P. Merlet;J-P. Merlet;,INRIA;,France;,Poster,https://ieeexplore.ieee.org/document/8967942/,,,
483,Information Filter Occupancy Mapping using Decomposable Radial Kernels,,Siwei Guo;Nikolay A. Atanasov;Siwei Guo;Nikolay A. Atanasov;,"Brain Corp;University of California, San Diego;",United States;,Poster,https://ieeexplore.ieee.org/document/8968609/,,,
484,Informed Region Selection for Efficient UAV-based Object Detectors: Altitude-aware Vehicle Detection with CyCAR Dataset,,Alexandros Kouris;Christos Kyrkou;Christos-Savvas Bouganis;Alexandros Kouris;Christos Kyrkou;Christos-Savvas Bouganis;,Imperial College London;University of Cyprus;,United Kingdom;Cyprus;,Poster,https://ieeexplore.ieee.org/document/8967722/,,,
485,Infrastructure-free NLoS Obstacle Detection for Autonomous Cars,,Felix Naser;Igor Gilitschenski;Alexander Amini;Christina Liao;Guy Rosman;Sertac Karaman;Daniela Rus;Felix Naser;Igor Gilitschenski;Alexander Amini;Christina Liao;Guy Rosman;Sertac Karaman;Daniela Rus;,Massachusetts Institute of Technology;Toyota Research Institute;,United States;,Poster,https://ieeexplore.ieee.org/document/8967554/,,,
486,"Integer Programming as a General Solution Methodology for Path-Based Optimization in Robotics: Principles, Best Practices, and Applications",,Shuai D. Han;Jingjin Yu;Shuai D. Han;Jingjin Yu;,"Rutgers, the State University of New Jersey;",United States;,Poster,https://ieeexplore.ieee.org/document/8968479/,,,
487,Interaction-aware Decision Making with Adaptive Strategies under Merging Scenarios,,Yeping Hu;Alireza Nakhaei;Masayoshi Tomizuka;Kikuo Fujimura;Yeping Hu;Alireza Nakhaei;Masayoshi Tomizuka;Kikuo Fujimura;,"University of California, Berkeley;Honda Research Institute;",United States;,Poster,https://ieeexplore.ieee.org/document/8968478/,,,
488,Interactive Trajectory Adaptation through Force-guided Bayesian Optimization,,Leonel Rozo;Leonel Rozo;,Bosch Center for Artificial Intelligence;,Germany;,Poster,https://ieeexplore.ieee.org/document/8968571/,,,
489,Introducing a Scalable and Modular Control Framework for Low-cost Monocular Robots in Hazardous Environments,,Hazel M. Taylor;Christian Dondrup;Katrin S. Lohan;Hazel M. Taylor;Christian Dondrup;Katrin S. Lohan;,Heriot-Watt University;,United Kingdom;,Poster,https://ieeexplore.ieee.org/document/8967521/,,,
490,Inverse Dynamics Modeling of Robotic Manipulator with Hierarchical Recurrent Network,,Pengfei Sun;Zhenzhou Shao;Ying Qu;Yong Guan;Jindong Tan;Pengfei Sun;Zhenzhou Shao;Ying Qu;Yong Guan;Jindong Tan;,Capital Normal University;University of Tennessee;,China;United States;,Poster,https://ieeexplore.ieee.org/document/8967903/,,,
491,Inverse Kinematics and Sensitivity Minimization of an n-Stack Stewart Platform,,David Balaban;John Cooper;Erik Komendera;David Balaban;John Cooper;Erik Komendera;,University of Massachusetts Amherst;NASA Langley Research Center;Virginia Polytechnic Institute and State University;,United States;,Poster,https://ieeexplore.ieee.org/document/8968190/,,,
492,Inverse Optimal Planning for Air Traffic Control,,Ekaterina Tolstaya;Alejandro Ribeiro;Vijay Kumar;Ashish Kapoor;Ekaterina Tolstaya;Alejandro Ribeiro;Vijay Kumar;Ashish Kapoor;,University of Pennsylvania;Microsoft;,United States;,Poster,https://ieeexplore.ieee.org/document/8968460/,,,
493,Iterative Learning Control for Fast and Accurate Position Tracking with an Articulated Soft Robotic Arm,,Matthias Hofer;Lukas Spannagl;Raffaello D’Andrea;Matthias Hofer;Lukas Spannagl;Raffaello D’Andrea;,ETH Zurich;,Switzerland;,Poster,https://ieeexplore.ieee.org/document/8967636/,,,
494,IVOA: Introspective Vision for Obstacle Avoidance,,Sadegh Rabiee;Joydeep Biswas;Sadegh Rabiee;Joydeep Biswas;,University of Massachusetts Amherst;,United States;,Poster,https://ieeexplore.ieee.org/document/8968176/,,,
495,JISAP: Joint Inference for Surgeon Attributes Prediction during Robot-Assisted Surgery,,Tian Zhou;Jackie S. Cha;Glebys T. Gonzalez;Chandru P. Sundaram;Juan P. Wachs;Denny Yu;Tian Zhou;Jackie S. Cha;Glebys T. Gonzalez;Chandru P. Sundaram;Juan P. Wachs;Denny Yu;,Purdue University;Indiana University;,United States;,Poster,https://ieeexplore.ieee.org/document/8968097/,,,
496,Joint Torque Estimation toward Dynamic and Compliant Control for Gear-Driven Torque Sensorless Quadruped Robot,,Bingchen Jin;Caiming Sun;Aidong Zhang;Ning Ding;Jing Lin;Ganyu Deng;Zuwen Zhu;Zhenglong Sun;Bingchen Jin;Caiming Sun;Aidong Zhang;Ning Ding;Jing Lin;Ganyu Deng;Zuwen Zhu;Zhenglong Sun;,Chinese University of Hong Kong;,China;,Poster,https://ieeexplore.ieee.org/document/8968168/,,,
497,Joint Velocity and Acceleration Estimation in Serial Chain Rigid Body and Flexible Joint Manipulators,,Seyed Ali Baradaran Birjandi;Johannes Kühn;Sami Haddadin;Seyed Ali Baradaran Birjandi;Johannes Kühn;Sami Haddadin;,Technical University Munich;,Germany;,Poster,https://ieeexplore.ieee.org/document/8968475/,,,
498,Jointly Learnable Behavior and Trajectory Planning for Self-Driving Vehicles,,Abbas Sadat;Mengye Ren;Andrei Pokrovsky;Yen-Chen Lin;Ersin Yumer;Raquel Urtasun;Abbas Sadat;Mengye Ren;Andrei Pokrovsky;Yen-Chen Lin;Ersin Yumer;Raquel Urtasun;,Uber Advanced Technologies Group;;Massachusetts Institute of Technology;,Canada;;United States;,Poster,https://ieeexplore.ieee.org/document/8967615/,,,
499,Kinematic Modeling of a Soft Pneumatic Actuator Using Cubic Hermite Splines,,Mats Wiese;Kenneth Rüstmann;Annika Raatz;Mats Wiese;Kenneth Rüstmann;Annika Raatz;,Leibniz Universität Hannover;,Germany;,Poster,https://ieeexplore.ieee.org/document/8967776/,,,
500,"Kinematics, Design and Experimental Validation of a Novel Parallel Robot for Two-Fingered Dexterous Manipulation",,Wissem Haouas;Guillaume J. Laurent;Sébastien Thibaud;Redwan Dahmouche;Wissem Haouas;Guillaume J. Laurent;Sébastien Thibaud;Redwan Dahmouche;,FEMTO-ST Institute;,France;,Poster,https://ieeexplore.ieee.org/document/8968570/,,,
501,Lambda-Field: A Continuous Counterpart of the Bayesian Occupancy Grid for Risk Assessment,,Johann Laconte;Christophe Debain;Roland Chapuis;François Pomerleau;Romuald Aufrère;Johann Laconte;Christophe Debain;Roland Chapuis;François Pomerleau;Romuald Aufrère;,Université Clermont Auvergne;Irstea;Université Laval;,France;Canada;,Poster,https://ieeexplore.ieee.org/document/8968100/,,,
502,Laminated foam-based soft actuator for actuatable flexible structure,,Yasuyuki Yamada;Taro Nakamura;Yasuyuki Yamada;Taro Nakamura;,Chuo University;,Japan;,Poster,https://ieeexplore.ieee.org/document/8967522/,,,
503,Landing of a Multirotor Aerial Vehicle on an Uneven Surface Using Multiple On-board Manipulators,,Hannibal Paul;Ryo Miyazaki;Robert Ladig;Kazuhiro Shimonomura;Hannibal Paul;Ryo Miyazaki;Robert Ladig;Kazuhiro Shimonomura;,Ritsumeikan University;,Japan;,Poster,https://ieeexplore.ieee.org/document/8968529/,,,
504,Lane Marking Learning based on Crowdsourced Data,,David Pannen;Martin Liebner;Wolfram Burgard;David Pannen;Martin Liebner;Wolfram Burgard;,BMW Group;University of Freiburg;,Germany;,Poster,https://ieeexplore.ieee.org/document/8967818/,,,
505,Large-scale 6D Object Pose Estimation Dataset for Industrial Bin-Picking,,Kilian Kleeberger;Christian Landgraf;Marco F. Huber;Kilian Kleeberger;Christian Landgraf;Marco F. Huber;,Fraunhofer Institute for Manufacturing Engineering and Automation IPA;,Germany;,Poster,https://ieeexplore.ieee.org/document/8967594/,,,
506,Lazy Compilation of Variants of Multi-robot Path Planning with Satisfiability Modulo Theory (SMT) Approach,,Pavel Surynek;Pavel Surynek;,Czech Technical University in Prague;,Czech Republic;,Poster,https://ieeexplore.ieee.org/document/8967962/,,,
507,Learning 2D to 3D Lifting for Object Detection in 3D for Autonomous Vehicles,,Siddharth Srivastava;Frederic Jurie;Gaurav Sharma;Siddharth Srivastava;Frederic Jurie;Gaurav Sharma;,Indian Institute of Technology Delhi;Normandie University;NEC Labs America;,India;France;United States;,Poster,https://ieeexplore.ieee.org/document/8967624/,,,
508,Learning Actions from Human Demonstration Video for Robotic Manipulation,,Shuo Yang;Wei Zhang;Weizhi Lu;Hesheng Wang;Yibin Li;Shuo Yang;Wei Zhang;Weizhi Lu;Hesheng Wang;Yibin Li;,Shandong University;Shanghai Jiao Tong University;,China;,Poster,https://ieeexplore.ieee.org/document/8968278/,,,
509,Learning Barrier Functions for Constrained Motion Planning with Dynamical Systems,,Matteo Saveriano;Dongheui Lee;Matteo Saveriano;Dongheui Lee;,University of Innsbruck;Technical University of Munich;,Austria;Germany;,Poster,https://ieeexplore.ieee.org/document/8967981/,,,
510,Learning Based Robotic Bin-picking for Potentially Tangled Objects,,Ryo Matsumura;Yukiyasu Domae;Weiwei Wan;Kensuke Harada;Ryo Matsumura;Yukiyasu Domae;Weiwei Wan;Kensuke Harada;,Osaka University;National Institute of Advanced Industrial Science and Technology;,Japan;,Poster,https://ieeexplore.ieee.org/document/8968295/,,,
511,Learning by Demonstration and Robust Control of Dexterous In-Hand Robotic Manipulation Skills,,Gokhan Solak;Lorenzo Jamone;Gokhan Solak;Lorenzo Jamone;,Queen Mary University of London;,United Kingdom;,Poster,https://ieeexplore.ieee.org/document/8967567/,,,
512,Learning Event-based Height from Plane and Parallax,,Kenneth Chaney;Alex Zihao Zhu;Kostas Daniilidis;Kenneth Chaney;Alex Zihao Zhu;Kostas Daniilidis;,University of Pennsylvania;,United States;,Poster,https://ieeexplore.ieee.org/document/8968223/,,,
513,Learning footstep planning on irregular surfaces with partial placements,,Germán Castro;Claude Sammut;Germán Castro;Claude Sammut;,University of New South Wales;,Australia;,Poster,https://ieeexplore.ieee.org/document/8967606/,,,
514,Learning from Demonstration Based on a Mechanism to Utilize an Object’s Invisibility,,Kotaro Nagahama;Kimitoshi Yamazaki;Kotaro Nagahama;Kimitoshi Yamazaki;,Shinshu University;,Japan;,Poster,https://ieeexplore.ieee.org/document/8967917/,,,
515,Learning Interactive Behaviors for Musculoskeletal Robots Using Bayesian Interaction Primitives,,Joseph Campbell;Arne Hitzmann;Simon Stepputtis;Shuhei Ikemoto;Koh Hosoda;Heni Ben Amor;Joseph Campbell;Arne Hitzmann;Simon Stepputtis;Shuhei Ikemoto;Koh Hosoda;Heni Ben Amor;,Arizona State University;Osaka University;Kyushu Institute of Technology;,United States;Japan;,Poster,https://ieeexplore.ieee.org/document/8967845/,,,
516,Learning Local Feature Descriptor with Motion Attribute For Vision-based Localization,,Yafei Song;Di Zhu;Jia Li;Yonghong Tian;Mingyang Li;Yafei Song;Di Zhu;Jia Li;Yonghong Tian;Mingyang Li;,Alibaba Group;Beihang University;Peking University;,China;,Poster,https://ieeexplore.ieee.org/document/8967749/,,,
517,Learning Multimodal Representations for Sample-efficient Recognition of Human Actions,,Miguel Vasco;Francisco S. Melo;David Martins de Matos;Ana Paiva;Tetsunari Inamura;Miguel Vasco;Francisco S. Melo;David Martins de Matos;Ana Paiva;Tetsunari Inamura;,University of Lisbon;SOKENDAI (The Graduate University for Advanced Studies);,Portugal;Japan;,Poster,https://ieeexplore.ieee.org/document/8967635/,,,
518,Learning Multiple Sensorimotor Units to Complete Compound Tasks using an RNN with Multiple Attractors,,Kei Kase;Ryoichi Nakajo;Hiroki Mori;Tetsuya Ogata;Kei Kase;Ryoichi Nakajo;Hiroki Mori;Tetsuya Ogata;,Waseda University;,Japan;,Poster,https://ieeexplore.ieee.org/document/8967780/,,,
519,Learning Object Models For Non-prehensile Manipulation,,Siddharth Sanan;Mason Bretan;Larry Heck;Siddharth Sanan;Mason Bretan;Larry Heck;,Samsung;,United States;,Poster,https://ieeexplore.ieee.org/document/8968211/,,,
520,Learning Physics-Based Manipulation in Clutter: Combining Image-Based Generalization and Look-Ahead Planning,,Wissam Bejjani;Mehmet R. Dogar;Matteo Leonetti;Wissam Bejjani;Mehmet R. Dogar;Matteo Leonetti;,University of Leeds;,United Kingdom;,Poster,https://ieeexplore.ieee.org/document/8967717/,,,
521,Learning Q-network for Active Information Acquisition,,Heejin Jeong;Brent Schlotfeldt;Hamed Hassani;Manfred Morari;Daniel D. Lee;George J. Pappas;Heejin Jeong;Brent Schlotfeldt;Hamed Hassani;Manfred Morari;Daniel D. Lee;George J. Pappas;,University of Pennsylvania;Cornell University;,United States;,Poster,https://ieeexplore.ieee.org/document/8968173/,,,
522,Learning Real-time Closed Loop Robotic Reaching from Monocular Vision by Exploiting A Control Lyapunov Function Structure,,Zheyu Zhuang;Jürgen Leitner;Robert Mahony;Zheyu Zhuang;Jürgen Leitner;Robert Mahony;,Australian National University;Queensland University of Technology;,Australia;,Poster,https://ieeexplore.ieee.org/document/8968136/,,,
523,Learning Real-World Robot Policies by Dreaming,,Aj Piergiovanni;Alan Wu;Michael S. Ryoo;Aj Piergiovanni;Alan Wu;Michael S. Ryoo;,Indiana University Bloomington;,United States;,Poster,https://ieeexplore.ieee.org/document/8967559/,,,
524,Learning Residual Flow as Dynamic Motion from Stereo Videos,,Seokju Lee;Sunghoon Im;Stephen Lin;In So Kweon;Seokju Lee;Sunghoon Im;Stephen Lin;In So Kweon;,KAIST;Microsoft;,South Korea;China;,Poster,https://ieeexplore.ieee.org/document/8967970/,,,
525,Learning Safe Unlabeled Multi-Robot Planning with Motion Constraints,,Arbaaz Khan;Chi Zhang;Shuo Li;Jiayue Wu;Brent Schlotfeldt;Sarah Y. Tang;Alejandro Ribeiro;Osbert Bastani;Vijay Kumar;Arbaaz Khan;Chi Zhang;Shuo Li;Jiayue Wu;Brent Schlotfeldt;Sarah Y. Tang;Alejandro Ribeiro;Osbert Bastani;Vijay Kumar;,University of Pennsylvania;Nuro;,United States;,Poster,https://ieeexplore.ieee.org/document/8968483/,,,
526,Learning Singularity Avoidance,,Jeevan Manavalan;Matthew Howard;Jeevan Manavalan;Matthew Howard;,King’s College London;,United Kingdom;,Poster,https://ieeexplore.ieee.org/document/8967990/,,,
527,"Learning State-Dependent, Sensor Measurement Models for Localization",,Troi Williams;Yu Sun;Troi Williams;Yu Sun;,University of South Florida;,United States;,Poster,https://ieeexplore.ieee.org/document/8968185/,,,
528,Learning the Scope of Applicability for Task Planning Knowledge in Experience-Based Planning Domains,,Vahid Mokhtari;Roman Manevich;Luís Seabra Lopes;Armando J. Pinho;Vahid Mokhtari;Roman Manevich;Luís Seabra Lopes;Armando J. Pinho;,University of Aveiro;University of Texas at Austin;,Portugal;United States;,Poster,https://ieeexplore.ieee.org/document/8968013/,,,
529,Learning to Augment Synthetic Images for Sim2Real Policy Transfer,,Alexander Pashevich;Robin Strudel;Igor Kalevatykh;Ivan Laptev;Cordelia Schmid;Alexander Pashevich;Robin Strudel;Igor Kalevatykh;Ivan Laptev;Cordelia Schmid;,INRIA;,France;,Poster,https://ieeexplore.ieee.org/document/8967622/,,,
530,Learning to Estimate Centers of Mass of Arbitrary Objects,,Sean McGovern;Huitan Mao;Jing Xiao;Sean McGovern;Huitan Mao;Jing Xiao;,Worcester Polytechnic Institute;University of North Carolina at Charlotte;,United States;,Poster,https://ieeexplore.ieee.org/document/8967678/,,,
531,Learning to Estimate Pose and Shape of Hand-Held Objects from RGB Images,,Mia Kokic;Danica Kragic;Jeannette Bohg;Mia Kokic;Danica Kragic;Jeannette Bohg;,KTH - Royal Institute of Technology;Stanford University;,Sweden;United States;,Poster,https://ieeexplore.ieee.org/document/8967961/,,,
532,Learning to Explore in Motion and Interaction Tasks,,Miroslav Bogdanovic;Ludovic Righetti;Miroslav Bogdanovic;Ludovic Righetti;,Max-Planck Institute for Intelligent Systems;,Germany;,Poster,https://ieeexplore.ieee.org/document/8968584/,,,
533,Learning to Generate Unambiguous Spatial Referring Expressions for Real-World Environments,,Fethiye Irmak Doğan;Sinan Kalkan;Iolanda Leite;Fethiye Irmak Doğan;Sinan Kalkan;Iolanda Leite;,KTH Royal Institute of Technology;Middle East Technical University;,Sweden;Türkiye;,Poster,https://ieeexplore.ieee.org/document/8968510/,,,
534,Learning to Grasp Arbitrary Household Objects from a Single Demonstration,,Elias De Coninck;Tim Verbelen;Pieter Van Molle;Pieter Simoens;Bart Dhoedt IDLab;Elias De Coninck;Tim Verbelen;Pieter Van Molle;Pieter Simoens;Bart Dhoedt IDLab;,Ghent University;,Belgium;,Poster,https://ieeexplore.ieee.org/document/8967638/,,,
535,Learning to Sequence Multiple Tasks with Competing Constraints,,Anqing Duan;Raffaello Camoriano;Diego Ferigo;Yanlong Huang;Daniele Calandriello;Lorenzo Rosasco;Daniele Pucci;Anqing Duan;Raffaello Camoriano;Diego Ferigo;Yanlong Huang;Daniele Calandriello;Lorenzo Rosasco;Daniele Pucci;,Istituto Italiano di Tecnologia;Massachusetts Institute of Technology;Università degli Studi di Genova;,Italy;United States;,Poster,https://ieeexplore.ieee.org/document/8968496/,,,
536,Learning Topometric Semantic Maps from Occupancy Grids,,Markus Hiller;Chen Qiu;Florian Particke;Christian Hofmann;Jörn Thielecke;Markus Hiller;Chen Qiu;Florian Particke;Christian Hofmann;Jörn Thielecke;,Friedrich-Alexander-Universität Erlangen-Nürnberg;,Germany;,Poster,https://ieeexplore.ieee.org/document/8968111/,,,
537,Learning Via-Point Movement Primitives with Inter- and Extrapolation Capabilities,,You Zhou;Jianfeng Gao;Tamim Asfour;You Zhou;Jianfeng Gao;Tamim Asfour;,Karlsruhe Institute of Technology;,Germany;,Poster,https://ieeexplore.ieee.org/document/8968586/,,,
538,Learning Virtual Borders through Semantic Scene Understanding and Augmented Reality,,Dennis Sprute;Philipp Viertel;Klaus Tönnies;Matthias König;Dennis Sprute;Philipp Viertel;Klaus Tönnies;Matthias König;,Bielefeld University of Applied Sciences;Otto-von-Guericke University Magdeburg;,Germany;,Poster,https://ieeexplore.ieee.org/document/8967576/,,,
539,Learning Virtual Grasp with Failed Demonstrations via Bayesian Inverse Reinforcement Learning,,Xu Xie;Changyang Li;Chi Zhang;Yixin Zhu;Song-Chun Zhu;Xu Xie;Changyang Li;Chi Zhang;Yixin Zhu;Song-Chun Zhu;,"University of California, Los Angeles;",United States;,Poster,https://ieeexplore.ieee.org/document/8968063/,,,
540,Learning-based Nonlinear Model Predictive Control of Reconfigurable Autonomous Robotic Boats: Roboats,,Erkan Kayacan;Shinkyu Park;Carlo Ratti;Daniela Rus;Erkan Kayacan;Shinkyu Park;Carlo Ratti;Daniela Rus;,University of Queensland;Massachusetts Institute of Technology;,Australia;United States;,Poster,https://ieeexplore.ieee.org/document/8967525/,,,
541,LEGO: Leveraging Experience in Roadmap Generation for Sampling-Based Planning,,Rahul Kumar;Aditya Mandalika;Sanjiban Choudhury;Siddhartha Srinivasa;Rahul Kumar;Aditya Mandalika;Sanjiban Choudhury;Siddhartha Srinivasa;,"Indian Institute of Technology, Kharagpur;",India;,Poster,https://ieeexplore.ieee.org/document/8968503/,,,
542,LIC-Fusion: LiDAR-Inertial-Camera Odometry,,Xingxing Zuo;Patrick Geneva;Woosik Lee;Yong Liu;Guoquan Huang;Xingxing Zuo;Patrick Geneva;Woosik Lee;Yong Liu;Guoquan Huang;,Zhejiang University;University of Delaware;,China;United States;,Poster,https://ieeexplore.ieee.org/document/8967746/,,,
543,LiDAR Based Navigable Region Detection for Unmanned Surface Vehicles,,Xiangtong Yao;Yunxiao Shan;Jieling Li;Donghui Ma;Kai Huang;Xiangtong Yao;Yunxiao Shan;Jieling Li;Donghui Ma;Kai Huang;,Sun Yat-sen University;,China;,Poster,https://ieeexplore.ieee.org/document/8967860/,,,
544,LiDAR-Flow: Dense Scene Flow Estimation from Sparse LiDAR and Stereo Images,,Ramy Battrawy;René Schuster;Oliver Wasenmüller;Qing Rao;Didier Stricker;Ramy Battrawy;René Schuster;Oliver Wasenmüller;Qing Rao;Didier Stricker;,German Research Center for Artificial Intelligence;BMW Group;,Germany;,Poster,https://ieeexplore.ieee.org/document/8967739/,,,
545,Lifelong Federated Reinforcement Learning: A Learning Architecture for Navigation in Cloud Robotic Systems,,Boyi Liu;Lujia Wang;Ming Liu;Boyi Liu;Lujia Wang;Ming Liu;,Shenzhen Institute of Advanced Technology;Hong Kong University of Science and Technology;,China;,Poster,https://ieeexplore.ieee.org/document/8967908/,,,
546,Line-based Absolute and Relative Camera Pose Estimation in Structured Environments,,Haoang Li;Ji Zhao;Jean-Charles Bazin;Wen Chen;Kai Chen;Yun-Hui Liu;Haoang Li;Ji Zhao;Jean-Charles Bazin;Wen Chen;Kai Chen;Yun-Hui Liu;,Chinese University of Hong Kong;TuSimple;Korea Advanced Institute of Science and Technology;Wuhan University;,China;South Korea;,Poster,https://ieeexplore.ieee.org/document/8968444/,,,
547,Local Online Motor Babbling: Learning Motor Abundance of a Musculoskeletal Robot Arm,,Zinan Liu;Arne Hitzmann;Shuhei Ikemoto;Svenja Stark;Jan Peters;Koh Hosoda;Zinan Liu;Arne Hitzmann;Shuhei Ikemoto;Svenja Stark;Jan Peters;Koh Hosoda;,Technische Universität Darmstadt;Osaka University;Kyushu Institute of Technology;,Germany;Japan;,Poster,https://ieeexplore.ieee.org/document/8967791/,,,
548,Local Pose optimization with an Attention-based Neural Network,,Yiling Liu;Hesheng Wang;Fan Xu;Yong Wang;Weidong Chen;Qirong Tang;Yiling Liu;Hesheng Wang;Fan Xu;Yong Wang;Weidong Chen;Qirong Tang;,Shanghai Jiao Tong University;Harbin Institute of Technology;Beijing Institute of Control Engineering;Tongji University;,China;,Poster,https://ieeexplore.ieee.org/document/8968524/,,,
549,Localization and Mapping using Instance-specific Mesh Models,,Qiaojun Feng;Yue Meng;Mo Shan;Nikolay Atanasov;Qiaojun Feng;Yue Meng;Mo Shan;Nikolay Atanasov;,"University of California, San Diego;",United States;,Poster,https://ieeexplore.ieee.org/document/8967662/,,,
550,Long Range Neural Navigation Policies for the Real World,,Ayzaan Wahid;Alexander Toshev;Marek Fiser;Tsang-Wei Edward Lee;Ayzaan Wahid;Alexander Toshev;Marek Fiser;Tsang-Wei Edward Lee;,Google;,United States;,Poster,https://ieeexplore.ieee.org/document/8968004/,,,
551,Long-term Prediction of Motion Trajectories Using Path Homology Clusters,,J. Frederico Carvalho;Mikael Vejdemo-Johansson;Florian T. Pokorny;Danica Kragic;J. Frederico Carvalho;Mikael Vejdemo-Johansson;Florian T. Pokorny;Danica Kragic;,Royal Institute of Technology;CUNY College of Staten Island;,Sweden;United States;,Poster,https://ieeexplore.ieee.org/document/8968125/,,,
552,Long-Term Visual Inertial SLAM based on Time Series Map Prediction,,Bowen Song;Weidong Chen;Jingchuan Wang;Hesheng Wang;Bowen Song;Weidong Chen;Jingchuan Wang;Hesheng Wang;,Shanghai Jiao Tong University;,China;,Poster,https://ieeexplore.ieee.org/document/8968017/,,,
553,Look Further to Recognize Better: Learning Shared Topics and Category-Specific Dictionaries for Open-Ended 3D Object Recognition,,S. Hamidreza Kasaei;S. Hamidreza Kasaei;,University of Groningen;,Netherlands;,Poster,https://ieeexplore.ieee.org/document/8967823/,,,
554,Low-cost Sonar Navigation System,,Tiziano Guadagnino;Bartolomeo Della Corte;Giorgio Grisetti;Tiziano Guadagnino;Bartolomeo Della Corte;Giorgio Grisetti;,Sapienza University of Rome;,Italy;,Poster,https://ieeexplore.ieee.org/document/8967877/,,,
555,Macro-Micro Multi-Arm Robot for Single-Port Access Surgery,,T. Vandebroek;M. Ourak;C. Gruijthuijsen;A. Javaux;J. Legrand;T. Vercauteren;S. Ourselin;J. Deprest;E.Vander Poorten;T. Vandebroek;M. Ourak;C. Gruijthuijsen;A. Javaux;J. Legrand;T. Vercauteren;S. Ourselin;J. Deprest;E.Vander Poorten;,Catholic University of Leuven;King’s College London;University Hospital Leuven;,Belgium;United Kingdom;,Poster,https://ieeexplore.ieee.org/document/8968219/,,,
