Index,Title,Session/Area,Authors,Affiliation,Country,Status,Proceeding URL,PDF URL,CVF URL,Arxiv URL
661,Performance analysis and characterization of bio-inspired whisker sensors for underwater applications,,Pablo Valdivia Alvarado;Vignesh Subramaniam;Michael Triantafyllou;Pablo Valdivia Alvarado;Vignesh Subramaniam;Michael Triantafyllou;,Singapore-MIT Alliance for Research and Technology;,Singapore;,Poster,https://ieeexplore.ieee.org/document/6697220/,,,
662,Personal robot assisting transportation to support active human life — Posture stabilization based on feedback compensation of lateral acceleration,,Noriaki Hirose;Ryosuke Tajima;Kazutoshi Sukigara;Noriaki Hirose;Ryosuke Tajima;Kazutoshi Sukigara;,"Toyota Central R&D Labs., Inc.;",Japan;,Poster,https://ieeexplore.ieee.org/document/6696421/,,,
663,Photorealistic 3D mapping of indoors by RGB-D scanning process,,Tommi Tykkälä;Andrew I. Comport;Joni-Kristian Kämäräinen;Tommi Tykkälä;Andrew I. Comport;Joni-Kristian Kämäräinen;,Lappeenranta-Lahti University of Technology;University of Nice Sophia-Antipolis;Tampere University of Technology;,Finland;France;,Poster,https://ieeexplore.ieee.org/document/6696480/,,,
664,Physical contact using haptic and gestural expressions for ubiquitous partner robot,,Tomoko Yonezawa;Hirotake Yamazoe;Shinji Abe;Tomoko Yonezawa;Hirotake Yamazoe;Shinji Abe;,Kansai University;Osaka University;Hiroshima Institute of Technology;,Japan;,Poster,https://ieeexplore.ieee.org/document/6697179/,,,
665,Physically feasible dynamic parameter identification of the 7-DOF WAM robot,,Cristóvão D. Sousa;Rui Cortesão;Cristóvão D. Sousa;Rui Cortesão;,University of Coimbra;,Portugal;,Poster,https://ieeexplore.ieee.org/document/6696762/,,,
666,Picking favorites: The influence of robot eye-gaze on interactions with multiple users,,Daphne E. Karreman;Gilberto U. Sepúlveda Bradford;Elisabeth M. A. G. van Dijk;Manja Lohse;Vanessa Evers;Daphne E. Karreman;Gilberto U. Sepúlveda Bradford;Elisabeth M. A. G. van Dijk;Manja Lohse;Vanessa Evers;,University of Twente;Universiteit Twente;,Netherlands;,Poster,https://ieeexplore.ieee.org/document/6696342/,,,
667,Piezoelectric inkjet-based one cell per one droplet automatic printing by image processing,,Ryanto The;Shuichi Yamaguchi;Akira Ueno;Yoshitake Akiyama;Keisuke Morishima;Ryanto The;Shuichi Yamaguchi;Akira Ueno;Yoshitake Akiyama;Keisuke Morishima;,Osaka University;Microjet Corporation;,Japan;,Poster,https://ieeexplore.ieee.org/document/6696398/,,,
668,Pipe mapping with monocular fisheye imagery,,Peter Hansen;Hatem Alismail;Peter Rander;Brett Browning;Peter Hansen;Hatem Alismail;Peter Rander;Brett Browning;,Carnegie Mellon University;,Qatar;United States;,Poster,https://ieeexplore.ieee.org/document/6697105/,,,
669,Planning for opportunistic surveillance with multiple robots,,Dinesh Thakur;Maxim Likhachev;James Keller;Vijay Kumar;Vladimir Dobrokhodov;Kevin Jones;Jeff Wurz;Isaac Kaminer;Dinesh Thakur;Maxim Likhachev;James Keller;Vijay Kumar;Vladimir Dobrokhodov;Kevin Jones;Jeff Wurz;Isaac Kaminer;,University of Pennsylvania;Carnegie Mellon University;Naval Postgraduate School;,United States;,Poster,https://ieeexplore.ieee.org/document/6697189/,,,
670,Planning stable paths for concentric tube robots,,Christos Bergeles;Pierre E. Dupont;Christos Bergeles;Pierre E. Dupont;,Harvard Medical School;,United States;,Poster,https://ieeexplore.ieee.org/document/6696792/,,,
671,Planning with a task modeling framework in manufacturing robotics,,Jacob Huckaby;Stavros Vassos;Henrik I. Christensen;Jacob Huckaby;Stavros Vassos;Henrik I. Christensen;,Georgia Institute of Technology;Sapienza University of Rome;,United States;Italy;,Poster,https://ieeexplore.ieee.org/document/6697194/,,,
672,Pneupard: A biomimetic musculoskeletal approach for a feline-inspired quadruped robot,,Andre Rosendo;Shogo Nakatsu;Kenichi Narioka;Koh Hosoda;Andre Rosendo;Shogo Nakatsu;Kenichi Narioka;Koh Hosoda;,Osaka University;,Japan;,Poster,https://ieeexplore.ieee.org/document/6696540/,,,
673,Point cloud based dynamical system modulation for reactive avoidance of convex and concave obstacles,,Matteo Saveriano;Dongheui Lee;Matteo Saveriano;Dongheui Lee;,Technische Universität München;,Germany;,Poster,https://ieeexplore.ieee.org/document/6697135/,,,
674,Point cloud video object segmentation using a persistent supervoxel world-model,,Jeremie Papon;Tomas Kulvicius;Eren Erdal Aksoy;Florentin Wörgötter;Jeremie Papon;Tomas Kulvicius;Eren Erdal Aksoy;Florentin Wörgötter;,Georg-August University of Göttingen;,Germany;,Poster,https://ieeexplore.ieee.org/document/6696886/,,,
675,Pop-up assembly of a quadrupedal ambulatory MicroRobot,,Andrew T. Baisch;Robert J. Wood;Andrew T. Baisch;Robert J. Wood;,Harvard University;,United States;,Poster,https://ieeexplore.ieee.org/document/6696550/,,,
676,Pose and paste — An intuitive interface for remote navigation of a multi-robot system,,Michael Lichtenstern;Michael Angermann;Martin Frassl;Gunther Berthold;Brian J. Julian;Daniela Rus;Michael Lichtenstern;Michael Angermann;Martin Frassl;Gunther Berthold;Brian J. Julian;Daniela Rus;,German Aerospace Center (DLR);Massachusetts Institute of Technology Lincoln Laboratory;Massachusetts Institute of Technology;,Germany;United States;,Poster,https://ieeexplore.ieee.org/document/6696568/,,,
677,Pose estimation for contact manipulation with manifold particle filters,,Michael C. Koval;Mehmet R. Dogar;Nancy S. Pollard;Siddhartha S. Srinivasa;Michael C. Koval;Mehmet R. Dogar;Nancy S. Pollard;Siddhartha S. Srinivasa;,Carnegie Mellon University;,United States;,Poster,https://ieeexplore.ieee.org/document/6697009/,,,
678,Position regulation of flexible-joint robots with input/output constant delays,,Yen-Chen Liu;Nikhil Chopra;Yen-Chen Liu;Nikhil Chopra;,National Cheng Kung University;University of Maryland;,China;United States;,Poster,https://ieeexplore.ieee.org/document/6697209/,,,
679,Posture estimation of hose-shaped robot using microphone array localization,,Yoshiaki Bando;Takeshi Mizumoto;Katsutoshi Itoyama;Kazuhiro Nakadai;Hiroshi G. Okuno;Yoshiaki Bando;Takeshi Mizumoto;Katsutoshi Itoyama;Kazuhiro Nakadai;Hiroshi G. Okuno;,"Kyoto University;Honda Research Institute Japan Co., Ltd.;",Japan;,Poster,https://ieeexplore.ieee.org/document/6696847/,,,
680,Posture recognition with a top-view camera,,Ninghang Hu;Gwenn Englebienne;Ben Kröse;Ninghang Hu;Gwenn Englebienne;Ben Kröse;,University of Amsterdam;Amsterdam University of Applied Science;,Netherlands;,Poster,https://ieeexplore.ieee.org/document/6696657/,,,
681,Power steering system for electrically assisted bicycles riding with toddlers — Experimental implementation and verification,,Taiki Kowata;Naonari Sato;Masami Iwase;Taiki Kowata;Naonari Sato;Masami Iwase;,Tokyo Denki University;,Japan;,Poster,https://ieeexplore.ieee.org/document/6696424/,,,
682,Practical object-grasp estimation without visual or tactile information for heavy-duty work machines,,Mitsuhiro Kamezaki;Hiroyasu Iwata;Shigeki Sugano;Mitsuhiro Kamezaki;Hiroyasu Iwata;Shigeki Sugano;,"Waseda University;Shinjuku-ku, Tokyo, Japan;Tokyo Institute of Technology;",Japan;,Poster,https://ieeexplore.ieee.org/document/6696812/,,,
683,Pre-shaping for various objects by the robot hand equipped with resistor network structure proximity sensors,,Keisuke Koyama;Hiroaki Hasegawa;Yosuke Suzuki;Aiguo Ming;Makoto Shimojo;Keisuke Koyama;Hiroaki Hasegawa;Yosuke Suzuki;Aiguo Ming;Makoto Shimojo;,University of Electro-Communications;,Japan;,Poster,https://ieeexplore.ieee.org/document/6696932/,,,
684,Precise point positioning for mobile robots using software GNSS receiver and QZSS LEX signal,,Taro Suzuki;Nobuaki Kubo;Taro Suzuki;Nobuaki Kubo;,Tokyo University of Marine Science and Technology;,Japan;,Poster,https://ieeexplore.ieee.org/document/6696378/,,,
685,Precision grasp planning with Gifu Hand III based on fast marching square,,David Álvarez;Alejandro Lumbier;Javier V. Gómez;Santiago Garrido;Luis Moreno;David Álvarez;Alejandro Lumbier;Javier V. Gómez;Santiago Garrido;Luis Moreno;,University Carlos III of Madrid;,Spain;,Poster,https://ieeexplore.ieee.org/document/6697010/,,,
686,Predicting object functionality using physical simulations,,Lauren Hinkle;Edwin Olson;Lauren Hinkle;Edwin Olson;,University of Michigan;,United States;,Poster,https://ieeexplore.ieee.org/document/6696750/,,,
687,Prediction-based interception control strategy design with a specified approach angle constraint for wheeled service robots,,Wanfeng He;Yongchun Fang;Xuebo Zhang;Wanfeng He;Yongchun Fang;Xuebo Zhang;,Nankai University;,China;,Poster,https://ieeexplore.ieee.org/document/6696741/,,,
688,Preliminary experiments of a miniature robotic system for tooth ablation using ultra-short pulsed lasers,,Lei Wang;Dangxiao Wang;Lei Ma;Yuru Zhang;Fusong Yuan;Yuchun Sun;Peijun Lv;Lei Wang;Dangxiao Wang;Lei Ma;Yuru Zhang;Fusong Yuan;Yuchun Sun;Peijun Lv;,Beihang University;Peking University;,China;,Poster,https://ieeexplore.ieee.org/document/6696718/,,,
689,Preloaded hopping with linear multi-modal actuation,,Fabian Günther;Fumiya Iida;Fabian Günther;Fumiya Iida;,ETH Zurich;,Switzerland;,Poster,https://ieeexplore.ieee.org/document/6697203/,,,
690,Preview coordination: An enhanced execution model for online scheduling of mobile manipulation tasks,,Enea Scioni;Markus Klotzbuecher;Tinne De Laet;Herman Bruyninckx;Marcello Bonfè;Enea Scioni;Markus Klotzbuecher;Tinne De Laet;Herman Bruyninckx;Marcello Bonfè;,University of Leuven;University of Ferrara;,Belgium;Italy;,Poster,https://ieeexplore.ieee.org/document/6697193/,,,
691,Primary experimental results of the navigation method of multiple autonomous underwater vehicles,,Takumi Matsuda;Toshihiro Maki;Takashi Sakamaki;Tamaki Ura;Takumi Matsuda;Toshihiro Maki;Takashi Sakamaki;Tamaki Ura;,University of Tokyo;Kyushu Institute of Technology;,Japan;,Poster,https://ieeexplore.ieee.org/document/6696730/,,,
692,Probabilistic decision making for collision avoidance systems: Postponing decisions,,Stéphanie Lefèvre;Ruzena Bajcsy;Christian Laugier;Stéphanie Lefèvre;Ruzena Bajcsy;Christian Laugier;,"INRIA Grenoble Rhône-Alpes;University of California, Berkeley;INRIA;",France;United States;,Poster,https://ieeexplore.ieee.org/document/6696983/,,,
693,Probabilistic object tracking using a range camera,,Manuel Wüthrich;Peter Pastor;Mrinal Kalakrishnan;Jeannette Bohg;Stefan Schaal;Manuel Wüthrich;Peter Pastor;Mrinal Kalakrishnan;Jeannette Bohg;Stefan Schaal;,Max-Planck-Institute for Intelligent Systems;University of Southern California;,Germany;United States;,Poster,https://ieeexplore.ieee.org/document/6696810/,,,
694,Probabilistic place recognition with covisibility maps,,Elena Stumm;Christopher Mei;Simon Lacroix;Elena Stumm;Christopher Mei;Simon Lacroix;,LAAS-CNRS;,France;,Poster,https://ieeexplore.ieee.org/document/6696952/,,,
695,Probabilistic surface classification for rover instrument targeting,,Greydon Foil;David R. Thompson;William Abbey;David S. Wettergreen;Greydon Foil;David R. Thompson;William Abbey;David S. Wettergreen;,Carnegie Mellon University;California Institute of Technology;,United States;,Poster,https://ieeexplore.ieee.org/document/6696439/,,,
696,"Progressive, continuum grasping in cluttered space",,Jinglin Li;Jing Xiao;Jinglin Li;Jing Xiao;,,,Poster,https://ieeexplore.ieee.org/document/6697012/,,,
697,Projection-based force reflection algorithms for teleoperated rehabilitation therapy,,S. Farokh Atashzar;Ilia G. Polushin;Rajni V. Patel;S. Farokh Atashzar;Ilia G. Polushin;Rajni V. Patel;,Western University;,Canada;,Poster,https://ieeexplore.ieee.org/document/6696394/,,,
698,Proposal of tactile sensor development based on tissue engineering,,Pham Quang Trung;Takayuki Hoshi;Yoshihiro Tanaka;Akihito Sano;Pham Quang Trung;Takayuki Hoshi;Yoshihiro Tanaka;Akihito Sano;,Nagoya Institute of Technology;,Japan;,Poster,https://ieeexplore.ieee.org/document/6696627/,,,
699,"Provably-correct robot control with LTLMoP, OMPL and ROS",,Kai Weng Wong;Cameron Finucane;Hadas Kress-Gazit;Kai Weng Wong;Cameron Finucane;Hadas Kress-Gazit;,Cornell University;,United States;,Poster,https://ieeexplore.ieee.org/document/6696636/,,,
700,Quadrocopter pole acrobatics,,Dario Brescianini;Markus Hehn;Raffaello D'Andrea;Dario Brescianini;Markus Hehn;Raffaello D'Andrea;,ETH Zurich;,Switzerland;,Poster,https://ieeexplore.ieee.org/document/6696851/,,,
701,Quadrupedal bounding with spring-damper body joint,,Ryuta Yamasaki;Yuichi Ambe;Shinya Aoi;Fumitoshi Matsuno;Ryuta Yamasaki;Yuichi Ambe;Shinya Aoi;Fumitoshi Matsuno;,Kyoto University;,Japan;,Poster,https://ieeexplore.ieee.org/document/6696685/,,,
702,Quadtree-based polynomial polygon fitting,,Joshua Hampp;Richard Bormann;Joshua Hampp;Richard Bormann;,Fraunhofer Institute for Manufacturing Engineering and Automation IPA;,Germany;,Poster,https://ieeexplore.ieee.org/document/6696959/,,,
703,Randomized planning and control strategy for whole-arm manipulation of a slippery polygonal object,,Tasuku Yamawaki;Masahito Yashima;Tasuku Yamawaki;Masahito Yashima;,National Defense Academy of Japan;,Japan;,Poster,https://ieeexplore.ieee.org/document/6696706/,,,
704,RANSAC for motion-distorted 3D visual sensors,,Sean Anderson;Timothy D. Barfoot;Sean Anderson;Timothy D. Barfoot;,University of Toronto;,Canada;,Poster,https://ieeexplore.ieee.org/document/6696649/,,,
705,Rapid application development of constrained-based task modelling and execution using domain specific languages,,Dominick Vanthienen;Markus Klotzbu¨cher;Joris De Schutter;Tinne De Laet;Herman Bruyninckx;Dominick Vanthienen;Markus Klotzbu¨cher;Joris De Schutter;Tinne De Laet;Herman Bruyninckx;,Belgium;Katholieke Universiteit Leuven;,Belgium;,Poster,https://ieeexplore.ieee.org/document/6696602/,,,
706,Rapid semantic mapping: Learn environment classifiers on the fly,,Bertrand Le Saux;Martial Sanfourche;Bertrand Le Saux;Martial Sanfourche;,Office National d'Etudes et de Recherches Aerospatiales;ONERA;,France;,Poster,https://ieeexplore.ieee.org/document/6696888/,,,
707,Rapid turning at high-speed: Inspirations from the cheetah's tail,,Amir Patel;M. Braae;Amir Patel;M. Braae;,University of Cape Town;,South Africa;,Poster,https://ieeexplore.ieee.org/document/6697154/,,,
708,Real-time dense multi-scale workspace modeling on a humanoid robot,,René Wagner;Udo Frese;Berthold Bäuml;René Wagner;Udo Frese;Berthold Bäuml;,University of Bremen;,Germany;,Poster,https://ieeexplore.ieee.org/document/6697103/,,,
709,Real-time feature-based video mosaicing at 500 fps,,Ken-ichi Okumura;Sushil Raut;Qingyi Gu;Tadayoshi Aoyama;Takeshi Takaki;Idaku Ishii;Ken-ichi Okumura;Sushil Raut;Qingyi Gu;Tadayoshi Aoyama;Takeshi Takaki;Idaku Ishii;,Hiroshima University;,Japan;,Poster,https://ieeexplore.ieee.org/document/6696732/,,,
710,Real-time SLAM with piecewise-planar surface models and sparse 3D point clouds,,Paul Ozog;Ryan M. Eustice;Paul Ozog;Ryan M. Eustice;,University of Michigan;,United States;,Poster,https://ieeexplore.ieee.org/document/6696479/,,,
711,Real-time super-resolution three-dimensional sound source localization for robots,,Keisuke Nakamura;Randy Gomez;Kazuhiro Nakadai;Keisuke Nakamura;Randy Gomez;Kazuhiro Nakadai;,Honda Research Institute Japan Co. Ltd.;,Japan;,Poster,https://ieeexplore.ieee.org/document/6696921/,,,
712,Real-time tracking of a bevel-tip needle with varying insertion depth: Toward teleoperated MRI-guided needle steering,,Reza Seifabadi;Esteban Escobar Gomez;Fereshteh Aalamifar;Gabor Fichtinger;Iulian Iordachita;Reza Seifabadi;Esteban Escobar Gomez;Fereshteh Aalamifar;Gabor Fichtinger;Iulian Iordachita;,Queen's University;Johns Hopkins University;,Canada;United States;,Poster,https://ieeexplore.ieee.org/document/6696393/,,,
713,Real-time vision based dynamic sinkage detection for exploration rovers,,Said Al-Milli;Conrad Spiteri;Francisco Comin;Yang Gao;Said Al-Milli;Conrad Spiteri;Francisco Comin;Yang Gao;,University of Surrey;University of Cambridge;laCaixa;,United Kingdom;Spain;,Poster,https://ieeexplore.ieee.org/document/6697029/,,,
714,Realtime 3D segmentation for human-robot interaction,,Andre Ückermann;Robert Haschke;Helge Ritter;Andre Ückermann;Robert Haschke;Helge Ritter;,Bielefeld University;,Germany;,Poster,https://ieeexplore.ieee.org/document/6696655/,,,
715,Reassessment of COM-ZMP model for the identification of lateral standing controller of a human,,Daishi Kaneta;Nobuyuki Murai;Tomomichi Sugihara;Daishi Kaneta;Nobuyuki Murai;Tomomichi Sugihara;,Osaka University;,Japan;,Poster,https://ieeexplore.ieee.org/document/6696686/,,,
716,Recognition of ballet micro-movements for use in choreography,,Justin Dancs;Ravishankar Sivalingam;Guruprasad Somasundaram;Vassilios Morellas;Nikolaos Papanikolopoulos;Justin Dancs;Ravishankar Sivalingam;Guruprasad Somasundaram;Vassilios Morellas;Nikolaos Papanikolopoulos;,University of Minnesota;,United States;,Poster,https://ieeexplore.ieee.org/document/6696497/,,,
717,Recognizing context-aware activities of daily living using RGBD sensor,,Jie Fu;Chengyin Liu;Yen-Pin Hsu;Li-Chen Fu;Jie Fu;Chengyin Liu;Yen-Pin Hsu;Li-Chen Fu;,,,Poster,https://ieeexplore.ieee.org/document/6696667/,,,
718,Recursive Bayesian initialization of localization based on ranging and dead reckoning,,John-Olof Nilsson;Peter Händel;John-Olof Nilsson;Peter Händel;,KTH Royal Institute of Technology;,Sweden;,Poster,https://ieeexplore.ieee.org/document/6696532/,,,
719,Reducing failure rates of robotic systems though inferred invariants monitoring,,Hengle Jiang;Sebastian Elbaum;Carrick Detweiler;Hengle Jiang;Sebastian Elbaum;Carrick Detweiler;,University of Nebraska-Lincoln;,United States;,Poster,https://ieeexplore.ieee.org/document/6696608/,,,
720,Reinforcement learning of single legged locomotion,,Péter Fankhauser;Marco Hutter;Christian Gehring;Michael Bloesch;Mark A. Hoepflinger;Roland Siegwart;Péter Fankhauser;Marco Hutter;Christian Gehring;Michael Bloesch;Mark A. Hoepflinger;Roland Siegwart;,ETH Zurich;,Switzerland;,Poster,https://ieeexplore.ieee.org/document/6696352/,,,
721,REM-Seg: A robust EM algorithm for parallel segmentation and registration of point clouds,,Benjamin Eckart;Alonzo Kelly;Benjamin Eckart;Alonzo Kelly;,Carnegie Mellon University;,United States;,Poster,https://ieeexplore.ieee.org/document/6696981/,,,
722,"ReMod3D: A high-performance simulator for autonomous, self-reconfigurable robots",,Thomas Collins;Nadeesha Oliver Ranasinghe;Wei-Min Shen;Thomas Collins;Nadeesha Oliver Ranasinghe;Wei-Min Shen;,University of Southern California;,United States;,Poster,https://ieeexplore.ieee.org/document/6696970/,,,
723,RGB-D based cognitive map building and navigation,,Bo Tian;Vui Ann Shim;Miaolong Yuan;Chithra Srinivasan;Huajin Tang;Haizhou Li;Bo Tian;Vui Ann Shim;Miaolong Yuan;Chithra Srinivasan;Huajin Tang;Haizhou Li;,Institute for Infocomm Research;Sichuan University;University of New South Wales;,Singapore;China;Australia;,Poster,https://ieeexplore.ieee.org/document/6696557/,,,
724,RGB-D edge detection and edge-based registration,,Changhyun Choi;Alexander J. B. Trevor;Henrik I. Christensen;Changhyun Choi;Alexander J. B. Trevor;Henrik I. Christensen;,Georgia Institute of Technology;,United States;,Poster,https://ieeexplore.ieee.org/document/6696558/,,,
725,RGB-D object tracking: A particle filter approach on GPU,,Changhyun Choi;Henrik I. Christensen;Changhyun Choi;Henrik I. Christensen;,Georgia Institute of Technology;,United States;,Poster,https://ieeexplore.ieee.org/document/6696485/,,,
726,RGB-D sensor data correction and enhancement by introduction of an additional RGB view,,Artashes Mkhitaryan;Darius Burschka;Artashes Mkhitaryan;Darius Burschka;,Technical University of Munich;,Germany;,Poster,https://ieeexplore.ieee.org/document/6696484/,,,
727,Rigid body pose and twist scene graph founded on geometric relations semantics for robotic applications,,Tinne De Laet;Herman Bruyninckx;Joris De Schutter;Tinne De Laet;Herman Bruyninckx;Joris De Schutter;,KU Leuven;,Belgium;,Poster,https://ieeexplore.ieee.org/document/6696693/,,,
728,Road recognition from a single image using prior information,,Kiyoshi Irie;Masahiro Tomono;Kiyoshi Irie;Masahiro Tomono;,Chiba Institute of Technology;,Japan;,Poster,https://ieeexplore.ieee.org/document/6696613/,,,
729,Robot companion: A social-force based approach with human awareness-navigation in crowded environments,,Gonzalo Ferrer;Anaís Garrell;Alberto Sanfeliu;Gonzalo Ferrer;Anaís Garrell;Alberto Sanfeliu;,Institut de Robòtica i Informàtica Industrial;,Spain;,Poster,https://ieeexplore.ieee.org/document/6696576/,,,
730,Robot design for high flow liquid pipe networks,,Changrak Choi;Kamal Youcef-Toumi;Changrak Choi;Kamal Youcef-Toumi;,Massachusetts Institute of Technology;,United States;,Poster,https://ieeexplore.ieee.org/document/6696360/,,,
731,Robot learning and use of affordances in goal-directed tasks,,Chang Wang;Koen V. Hindriks;Robert Babuska;Chang Wang;Koen V. Hindriks;Robert Babuska;,Delft University of Technology;,Netherlands;,Poster,https://ieeexplore.ieee.org/document/6696676/,,,
732,Robot skin with integrated micro rubber suction cups adhering rough surfaces,,Ryoichi Manabe;Koichi Suzumori;Shuichi Wakimoto;Ryoichi Manabe;Koichi Suzumori;Shuichi Wakimoto;,Okayama University;,Japan;,Poster,https://ieeexplore.ieee.org/document/6696936/,,,
733,Robotic adversarial coverage: Introduction and preliminary results,,Roi Yehoshua;Noa Agmon;Gal A. Kaminka;Roi Yehoshua;Noa Agmon;Gal A. Kaminka;,Bar-Ilan University;,Israel;,Poster,https://ieeexplore.ieee.org/document/6697227/,,,
734,Robotic assembly of emergency stop buttons,,Andreas Stolt;Magnus Linderoth;Anders Robertsson;Rolf Johansson;Andreas Stolt;Magnus Linderoth;Anders Robertsson;Rolf Johansson;,Lund University;,Sweden;,Poster,https://ieeexplore.ieee.org/document/6696644/,,,
735,Robotic calligraphy — Learning how to write single strokes of Chinese and Japanese characters,,Samuel Mueller;Nico Huebel;Markus Waibel;Raffaello D'Andrea;Samuel Mueller;Nico Huebel;Markus Waibel;Raffaello D'Andrea;,ETH Zurich;,Switzerland;,Poster,https://ieeexplore.ieee.org/document/6696583/,,,
736,Robotic force estimation using motor torques and modeling of low velocity friction disturbances,,Magnus Linderoth;Andreas Stolt;Anders Robertsson;Rolf Johansson;Magnus Linderoth;Andreas Stolt;Anders Robertsson;Rolf Johansson;,Lund University;,Sweden;,Poster,https://ieeexplore.ieee.org/document/6696862/,,,
737,Robotic in situ stiffness cartography of InP membranes by dynamic force sensing,,Jean-Ochin Abrahamians;Bruno Sauvet;Jérôme Polesel-Maris;Rémy Braive;Stéphane Régnier;Jean-Ochin Abrahamians;Bruno Sauvet;Jérôme Polesel-Maris;Rémy Braive;Stéphane Régnier;,Université Pierre et Marie Curie;Commissariat à l'Énergie Atomique et aux Énergies Alternatives;LPN-CNRS;,France;,Poster,https://ieeexplore.ieee.org/document/6696475/,,,
738,Robotic visual servoing of moving targets,,Navid Shahriari;Silvia Fantasia;Fabrizio Flacco;Giuseppe Oriolo;Navid Shahriari;Silvia Fantasia;Fabrizio Flacco;Giuseppe Oriolo;,Sapienza Universitá di Roma;,Italy;,Poster,https://ieeexplore.ieee.org/document/6696335/,,,
739,Robust landmark selection for mobile robot navigation,,Maximilian Beinhofer;Jörg Müller;Andreas Krause;Wolfram Burgard;Maximilian Beinhofer;Jörg Müller;Andreas Krause;Wolfram Burgard;,University of Freiburg;ETH Zurich;,Germany;Switzerland;,Poster,https://ieeexplore.ieee.org/document/6696728/,,,
740,Robust laser beam tracking control using micro/nano dual-stage manipulators,,Nabil Amari;David Folio;Antoine Ferreira;Nabil Amari;David Folio;Antoine Ferreira;,Ecole Nationale Supérieure d'Ingénieurs de Bourges;University of Bourges;,France;,Poster,https://ieeexplore.ieee.org/document/6696554/,,,
741,Robust path following for robot manipulators,,Rajan Gill;Dana Kulic;Christopher Nielsen;Rajan Gill;Dana Kulic;Christopher Nielsen;,University of Waterloo;,Canada;,Poster,https://ieeexplore.ieee.org/document/6696842/,,,
742,Robust pose estimation algorithm for wrist motion tracking,,F. Cordella;F. Di Corato;G. Loianno;B. Siciliano;L. Zollo;F. Cordella;F. Di Corato;G. Loianno;B. Siciliano;L. Zollo;,Università di Napoli Federico II;Università di Pisa;Università Campus Bio-Medico di Roma;,Italy;,Poster,https://ieeexplore.ieee.org/document/6696891/,,,
743,Robust pose-graph loop-closures with expectation-maximization,,Gim Hee Lee;Friedrich Fraundorfer;Marc Pollefeys;Gim Hee Lee;Friedrich Fraundorfer;Marc Pollefeys;,ETH Zurich;Technische Universität München;,Switzerland;Germany;,Poster,https://ieeexplore.ieee.org/document/6696406/,,,
744,Robust scale initialization for long-range stereo visual odometry,,Michael Warren;Ben Upcroft;Michael Warren;Ben Upcroft;,Queensland University of Technology;,Australia;,Poster,https://ieeexplore.ieee.org/document/6696652/,,,
745,Robust sensor characterization via max-mixture models: GPS sensors,,Ryan Morton;Edwin Olson;Ryan Morton;Edwin Olson;,University of Michigan;,United States;,Poster,https://ieeexplore.ieee.org/document/6696402/,,,
746,Robust stereo visual odometry using iterative closest multiple lines,,Jonas Witt;Uwe Weltin;Jonas Witt;Uwe Weltin;,Hamburg University of Technology;,Germany;,Poster,https://ieeexplore.ieee.org/document/6696953/,,,
747,Robustness of centipede-inspired millirobot locomotion to leg failures,,Katie L. Hoffman;Robert J. Wood;Katie L. Hoffman;Robert J. Wood;,Harvard University;,United States;,Poster,https://ieeexplore.ieee.org/document/6696543/,,,
748,Rolling a dynamic object with a planar soft-fingertip robot arm,,R. García-Rodríguez;V. Parra-Vega;R. García-Rodríguez;V. Parra-Vega;,Universidad de los Andes;Research Center for Advanced Studies (Cinvestav);,Chile;Mexico;,Poster,https://ieeexplore.ieee.org/document/6696704/,,,
