Index,Title,Session/Area,Authors,Affiliation,Country,Status,Proceeding URL,PDF URL,CVF URL,Arxiv URL
485,HERI II: A Robust and Flexible Robotic Hand based on Modular Finger design and Under Actuation Principles,,Zeyu Ren;Navvab Kashiri;Chengxu Zhou;Nikos G. Tsagarakis;Zeyu Ren;Navvab Kashiri;Chengxu Zhou;Nikos G. Tsagarakis;,Istituto Italiano di Tecnologia;,Italy;,Poster,https://ieeexplore.ieee.org/document/8594507/,,,
486,HERO: Accelerating Autonomous Robotic Tasks with FPGA,,Xuesong Shi;Lu Cao;Dawei Wang;Ling Liu;Ganmei You;Shuang Liu;Chunjie Wang;Xuesong Shi;Lu Cao;Dawei Wang;Ling Liu;Ganmei You;Shuang Liu;Chunjie Wang;,Intel;,China;,Poster,https://ieeexplore.ieee.org/document/8593522/,,,
487,Heterogeneous Sensor-Robot Team Positioning and Mixed Strategy Scheduling,,Benjamin T. Hartman;Richard D. Tatum;Matthew J. Bays;Benjamin T. Hartman;Richard D. Tatum;Matthew J. Bays;,Naval Surface Warfare Center;,United States;,Poster,https://ieeexplore.ieee.org/document/8594263/,,,
488,Heterogeneous Vehicles Routing for Water Canal Damage Assessment,,Di Deng;Prasanth Palli;Fang Shu;Kenji Shimada;Tao Pang;Di Deng;Prasanth Palli;Fang Shu;Kenji Shimada;Tao Pang;,Carnegie Mellon University;Massachusetts Institute of Technology;,United States;,Poster,https://ieeexplore.ieee.org/document/8593365/,,,
489,Hierarchical Path Planner Using Workspace Decomposition and Parallel Task-Space RRTs,,George Mesesan;Máximo A. Roa;Esra Icer;Matthias Althoff;George Mesesan;Máximo A. Roa;Esra Icer;Matthias Althoff;,German Aerospace Center;Technische Universitat Munchen;,Germany;,Poster,https://ieeexplore.ieee.org/document/8593870/,,,
490,High Power Hand with Retention Mechanism,,Tetsuya Mouri;Haruhisa Kawasaki;Tetsuya Mouri;Haruhisa Kawasaki;,Gifu University;,Japan;,Poster,https://ieeexplore.ieee.org/document/8594216/,,,
491,High-frame-rate Target Tracking with CNN-based Object Recognition,,Mingjun Jiang;Yihao Gu;Takeshi Takaki;Idaku Ishii;Mingjun Jiang;Yihao Gu;Takeshi Takaki;Idaku Ishii;,Hiroshima University;,Japan;,Poster,https://ieeexplore.ieee.org/document/8594300/,,,
492,High-Speed and Intelligent Pre-Grasp Motion by a Robotic Hand Equipped with Hierarchical Proximity Sensors,,Yuji Hirai;Yosuke Suzuki;Tokuo Tsuji;Tetsuyou Watanabe;Yuji Hirai;Yosuke Suzuki;Tokuo Tsuji;Tetsuyou Watanabe;,Kanazawa University;,Japan;,Poster,https://ieeexplore.ieee.org/document/8594261/,,,
493,High-Speed Stealth Walking of Underactuated Biped Utilizing Effects of Upper-Body Control and Semicircular Feet,,Fumihiko Asano;Fumihiko Asano;,Japan Advanced Institute of Science and Technology;,Japan;,Poster,https://ieeexplore.ieee.org/document/8593821/,,,
494,History-Aware Autonomous Exploration in Confined Environments Using MAVs,,Christian Witting;Marius Fehr;Rik Bähnemann;Helen Oleynikova;Roland Siegwart;Christian Witting;Marius Fehr;Rik Bähnemann;Helen Oleynikova;Roland Siegwart;,Technical University of Denmark;ETH Zurich;,Denmark;Switzerland;,Poster,https://ieeexplore.ieee.org/document/8594502/,,,
495,HMAPs - Hybrid Height- Voxel Maps for Environment Representation,,Luís Garrote;Cristiano Premebida;David Silva;Urbano J. Nunes;Luís Garrote;Cristiano Premebida;David Silva;Urbano J. Nunes;,University of Coimbra;,Portugal;,Poster,https://ieeexplore.ieee.org/document/8594113/,,,
496,How do humans read robotics? The matter of the lexical ambiguity resolution,,C. Pieters;E. Danblon;J.P. Laumond;LAAS–CNRS ULB;C. Pieters;E. Danblon;J.P. Laumond;LAAS–CNRS ULB;,LAAS-CNRS;Free University of Brussels;CNRS;,France;Belgium;,Poster,https://ieeexplore.ieee.org/document/8594138/,,,
497,HTC Vive: Analysis and Accuracy Improvement,,Miguel Borges;Andrew Symington;Brian Coltin;Trey Smith;Rodrigo Ventura;Miguel Borges;Andrew Symington;Brian Coltin;Trey Smith;Rodrigo Ventura;,Universidade de Lisboa;SGT Inc.;NASA Ames Research Center;,Portugal;United States;,Poster,https://ieeexplore.ieee.org/document/8593707/,,,
498,Human Gaze Following for Human-Robot Interaction,,Akanksha Saran;Srinjoy Majumdar;Elaine Schaertl Short;Andrea Thomaz;Scott Niekum;Akanksha Saran;Srinjoy Majumdar;Elaine Schaertl Short;Andrea Thomaz;Scott Niekum;,University of Texas at Austin;,United States;,Poster,https://ieeexplore.ieee.org/document/8593580/,,,
499,Human Intention Estimation based on Neural Networks for Enhanced Collaboration with Robots,,Davide Nicolis;Andrea Maria Zanchettin;Paolo Rocco;Davide Nicolis;Andrea Maria Zanchettin;Paolo Rocco;,Politecnico di Milano;,Italy;,Poster,https://ieeexplore.ieee.org/document/8594415/,,,
500,Human Motion Classification Based on Multi-Modal Sensor Data for Lower Limb Exoskeletons,,Jonas Beil;Isabel Ehrenberger;Clara Scherer;Christian Mandery;Tamim Asfour;Jonas Beil;Isabel Ehrenberger;Clara Scherer;Christian Mandery;Tamim Asfour;,Karlsruhe Institute of Technology;,Germany;,Poster,https://ieeexplore.ieee.org/document/8594110/,,,
501,Human Motion Prediction Under Social Grouping Constraints,,Andrey Rudenko;Luigi Palmieri;Achim J. Lilienthal;Kai O. Arras;Andrey Rudenko;Luigi Palmieri;Achim J. Lilienthal;Kai O. Arras;,Bosch Corporate Research;Orebro University;,Germany;Sweden;,Poster,https://ieeexplore.ieee.org/document/8594258/,,,
502,"Human Pose Estimation in Presence of Occlusion Using Depth Camera Sensors, in Human-Robot Coexistence Scenarios",,Andrea Casalino;Sebastian Guzman;Andrea Maria Zanchettin;Paolo Rocco;Andrea Casalino;Sebastian Guzman;Andrea Maria Zanchettin;Paolo Rocco;,Politecnico di Milano;,Italy;,Poster,https://ieeexplore.ieee.org/document/8593816/,,,
503,Human-in-the-loop Augmented Mapping,,Abbas Sidaoui;Imad H. Elhajj;Daniel Asmar;Abbas Sidaoui;Imad H. Elhajj;Daniel Asmar;,American University of Beirut;,Lebanon;,Poster,https://ieeexplore.ieee.org/document/8594494/,,,
504,Human-Robot Cooperative Object Manipulation with Contact Changes,,Michael Gienger;Dirk Ruiken;Tamas Bates;Mohamed Regaieg;Michael MeiBner;Jens Kober;Philipp Seiwald;Arne-Christoph Hildebrandt;Michael Gienger;Dirk Ruiken;Tamas Bates;Mohamed Regaieg;Michael MeiBner;Jens Kober;Philipp Seiwald;Arne-Christoph Hildebrandt;,Honda Research Institute Europe;Delft University of Technology;Technical University of Munich;,Germany;Netherlands;,Poster,https://ieeexplore.ieee.org/document/8594140/,,,
505,Human-Robot-Cooperation Real Time Robot Path Planning for Dynamic HRC-Applications,,Mohamad Bdiwi;Shuxiao Hou;Kathleen Delang;Mohamad Bdiwi;Shuxiao Hou;Kathleen Delang;,Fraunhofer-Institut fur Werkzeugmaschinen und Umformtechnik;;,Germany;;,Poster,https://ieeexplore.ieee.org/document/8594014/,,,
506,Humanoid Navigation Planning in Large Unstructured Environments Using Traversability - Based Segmentation,,Yu-Chi Lin;Dmitry Berenson;Yu-Chi Lin;Dmitry Berenson;,University of Michigan;,United States;,Poster,https://ieeexplore.ieee.org/document/8593694/,,,
507,Humanoid Robot COM Kinematics Estimation based on Compliant Inverted Pendulum Model and Robust State Estimator,,Hyoin Bae;Hyobin Jeong;Jaesung Oh;KangKyu Lee;Jun-Ho Oh;Hyoin Bae;Hyobin Jeong;Jaesung Oh;KangKyu Lee;Jun-Ho Oh;,Korea Advanced Institute of Science and Technology;,South Korea;,Poster,https://ieeexplore.ieee.org/document/8593966/,,,
508,Humanoid Teleoperation Using Task-Relevant Haptic Feedback,,Firas Abi-Farrajl;Bernd Henze;Alexander Werner;Michael Panzirsch;Christian Ott;Máximo A Roa;Firas Abi-Farrajl;Bernd Henze;Alexander Werner;Michael Panzirsch;Christian Ott;Máximo A Roa;,CNRS;German Aerospace Center (DLR);,France;Germany;,Poster,https://ieeexplore.ieee.org/document/8593521/,,,
509,Hybrid Approach for Human Activity Recognition by Ubiquitous Robots,,Roghayeh Mojarad;Ferhat Attal;Abdelghani Chibani;Sandro Rama Fiorini;Yacine Amirat;Roghayeh Mojarad;Ferhat Attal;Abdelghani Chibani;Sandro Rama Fiorini;Yacine Amirat;,University of Paris-Est Créteil;,France;,Poster,https://ieeexplore.ieee.org/document/8594173/,,,
510,Hybrid Bayesian Eigenobjects: Combining Linear Subspace and Deep Network Methods for 3D Robot Vision,,Benjamin Burchfiel;George Konidaris;Benjamin Burchfiel;George Konidaris;,Duke University;Brown University;,United States;,Poster,https://ieeexplore.ieee.org/document/8593795/,,,
511,Hybrid Bio-Inspired Architecture for Walking Robots Through Central Pattern Generators Using Open Source FPGAs,,Julián Caro Linares;Antonio Barrientos;Enric Mayas Márquez;Julián Caro Linares;Antonio Barrientos;Enric Mayas Márquez;,Universidad Politécnica de Madrid;everis - NTT DATA;,Spain;,Poster,https://ieeexplore.ieee.org/document/8594288/,,,
512,Hybrid Contact Preintegration for Visual-Inertial-Contact State Estimation Using Factor Graphs,,Ross Hartley;Maani Ghaffari Jadidi;Lu Gan;Jiunn-Kai Huang;Jessy W. Grizzle;Ryan M. Eustice;Ross Hartley;Maani Ghaffari Jadidi;Lu Gan;Jiunn-Kai Huang;Jessy W. Grizzle;Ryan M. Eustice;,University of Michigan;,United States;,Poster,https://ieeexplore.ieee.org/document/8593801/,,,
513,Hybrid Multi-camera Visual Servoing to Moving Target,,Hanz Cuevas-Velasquez;Nanbo Li;Radim Tylecek;Marcelo Saval-Calvo;Robert B. Fisher;Hanz Cuevas-Velasquez;Nanbo Li;Radim Tylecek;Marcelo Saval-Calvo;Robert B. Fisher;,University of Edinburgh;University of Alicante;,United Kingdom;Spain;,Poster,https://ieeexplore.ieee.org/document/8593652/,,,
514,Hydrodynamics Parameter Identification of Submerged Bodies: Numerical Methods Comparison and Friction Model Analysis,,Nicolas Gartner;Mathieu Richier;Vincent Hugel;Nicolas Gartner;Mathieu Richier;Vincent Hugel;,Université de Toulon;,France;,Poster,https://ieeexplore.ieee.org/document/8593770/,,,
515,I Can See Your Aim: Estimating User Attention from Gaze for Handheld Robot Collaboration,,Janis Stolzenwald;Walterio W. Mayol-Cuevas;Janis Stolzenwald;Walterio W. Mayol-Cuevas;,University of Bristol;,United Kingdom;,Poster,https://ieeexplore.ieee.org/document/8594184/,,,
516,Identification of the User's Habits based on Activity Information,,Nicholas Melo;Jaeryoung Lee;Ryo Suzuki;Nicholas Melo;Jaeryoung Lee;Ryo Suzuki;,Chubu University;,Japan;,Poster,https://ieeexplore.ieee.org/document/8593873/,,,
517,Identifying Driver Behaviors Using Trajectory Features for Vehicle Navigation,,Ernest Cheung;Aniket Bera;Emily Kubin;Kurt Gray;Dinesh Manocha;Ernest Cheung;Aniket Bera;Emily Kubin;Kurt Gray;Dinesh Manocha;,University of North Carolina at Chapel Hill;University of Maryland;,United States;,Poster,https://ieeexplore.ieee.org/document/8594348/,,,
518,Image Based Visual Servoing for Tumbling Objects,,P Mithun;Harit Pandya;Ayush Gaud;Suril V. Shah;K. Madhava Krishna;P Mithun;Harit Pandya;Ayush Gaud;Suril V. Shah;K. Madhava Krishna;,"International Institute of Information Technology;Indian Institute of Technology, Jodhpur;",India;,Poster,https://ieeexplore.ieee.org/document/8594176/,,,
519,Image-Based Visual Servoing Controller for Multirotor Aerial Robots Using Deep Reinforcement Learning,,Carlos Sampedro;Alejandro Rodriguez-Ramos;Ignacio Gil;Luis Mejias;Pascual Campoy;Carlos Sampedro;Alejandro Rodriguez-Ramos;Ignacio Gil;Luis Mejias;Pascual Campoy;,Universidad Politécnica de Madrid;Queensland University of Technology;,Spain;Australia;,Poster,https://ieeexplore.ieee.org/document/8594249/,,,
520,Imitation Learning for Object Manipulation Based on Position/Force Information Using Bilateral Control,,Tsuyoshi Adachi;Kazuki Fujimoto;Sho Sakaino;Toshiaki Tsuji;Tsuyoshi Adachi;Kazuki Fujimoto;Sho Sakaino;Toshiaki Tsuji;,Saitama University;,Japan;,Poster,https://ieeexplore.ieee.org/document/8594489/,,,
521,Impedance Based Force Control for Aerial Robot Peg-in-Hole Insertion Tasks,,Marko Car;Antun Ivanovic;Matko Orsag;Stjepan Bogdan;Marko Car;Antun Ivanovic;Matko Orsag;Stjepan Bogdan;,University of Zagreb;,Croatia;,Poster,https://ieeexplore.ieee.org/document/8593808/,,,
522,Impedance Control of a High Performance Twisted-Coiled Polymer Actuator,,Tuan Luong;Kihyeon Kim;Sungwon Seo;Jae Hyeong Park;Youngeun Kim;Sang Yul Yang;Kyeong Ho Cho;Ja Choon Koo;Hyouk Ryeol Choi;Hyungpil Moon;Tuan Luong;Kihyeon Kim;Sungwon Seo;Jae Hyeong Park;Youngeun Kim;Sang Yul Yang;Kyeong Ho Cho;Ja Choon Koo;Hyouk Ryeol Choi;Hyungpil Moon;,Sungkyunkwan University;,South Korea;,Poster,https://ieeexplore.ieee.org/document/8593937/,,,
523,Implementation of a Versatile 3D ZMP Trajectory Optimization Algorithm on a Multi-Modal Legged Robotic Platform,,Joshua Hooks;Dennis Hong;Joshua Hooks;Dennis Hong;,"University of California, Los Angeles;",United States;,Poster,https://ieeexplore.ieee.org/document/8593968/,,,
524,Implementation of Augmented Teleoperation System Based on Robot Operating System (ROS),,Donghyeon Lee;Young Soo Park;Donghyeon Lee;Young Soo Park;,Korea Atomic Energy Research Institute;,United States;,Poster,https://ieeexplore.ieee.org/document/8594482/,,,
525,Implementing Full-body Torque Control in Humanoid Robot with High Gear Ratio Using Pulse Width Modulation Voltage,,KangKyu Lee;Okkee Sim;Hyobin Jeong;Jaesung Oh;Hyoin Bae;Seungwoo Hong;Jun-Ho Oh;KangKyu Lee;Okkee Sim;Hyobin Jeong;Jaesung Oh;Hyoin Bae;Seungwoo Hong;Jun-Ho Oh;,Korea Advanced Institute of Science and Technology;,South Korea;,Poster,https://ieeexplore.ieee.org/document/8593908/,,,
526,Improved Quadcopter Disturbance Rejection Using Added Angular Momentum,,Nathan Bucki;Mark W. Mueller;Nathan Bucki;Mark W. Mueller;,"University of California, Berkeley;",United States;,Poster,https://ieeexplore.ieee.org/document/8594109/,,,
527,Improving Grasping Forces During the Manipulation of Unknown Objects,,Andrés Montaño;Raúl Suárez;Andrés Montaño;Raúl Suárez;,Universitat Politècnica de Catalunya;,Spain;,Poster,https://ieeexplore.ieee.org/document/8593655/,,,
528,Improving indoor robots localisation by fusing different sensors,,Biel Piero Alvarado;Fernando Matía;Ramón Galán;Biel Piero Alvarado;Fernando Matía;Ramón Galán;,UPM-CSIC;Universidad Politécnica de Madrid;,Spain;,Poster,https://ieeexplore.ieee.org/document/8593667/,,,
529,Improving Offline Value-Function Approximations for POMDPs by Reducing Discount Factors,,Yi-Chun Chen;Mykel J. Kochenderfer;Matthijs T. J. Spaan;Yi-Chun Chen;Mykel J. Kochenderfer;Matthijs T. J. Spaan;,"University of California, Los Angeles;Stanford University;Delft University of Technology;",United States;Netherlands;,Poster,https://ieeexplore.ieee.org/document/8594418/,,,
530,Improving Reinforcement Learning Pre-Training with Variational Dropout,,Tom Blau;Lionel Ott;Fabio Ramos;Tom Blau;Lionel Ott;Fabio Ramos;,University of Sydney;,Australia;,Poster,https://ieeexplore.ieee.org/document/8594341/,,,
531,Improving Repeatability of Experiments by Automatic Evaluation of SLAM Algorithms,,Francesco Amigoni;Valerio Castelli;Matteo Luperto;Francesco Amigoni;Valerio Castelli;Matteo Luperto;,Politecnico di Milano;Universita degli Studi di Milano;,Italy;,Poster,https://ieeexplore.ieee.org/document/8594189/,,,
532,Improving the Parallel Execution of Behavior Trees,,Michele Colledanchise;Lorenzo Natale;Michele Colledanchise;Lorenzo Natale;,Istituto Italiano di Tecnologia;,Italy;,Poster,https://ieeexplore.ieee.org/document/8593504/,,,
533,Improving Trajectory Optimization Using a Roadmap Framework,,Siyu Dai;Matthew Orton;Shawn Schaffert;Andreas Hofmann;Brian Williams;Siyu Dai;Matthew Orton;Shawn Schaffert;Andreas Hofmann;Brian Williams;,Massachusetts Institute of Technology;Boston Dynamics;,United States;,Poster,https://ieeexplore.ieee.org/document/8594274/,,,
534,In pixels we trust: From Pixel Labeling to Object Localization and Scene Categorization,,Carlos Herranz-Perdiguero;Carolina Redondo-Cabrera;Roberto J. López-Sastre;Carlos Herranz-Perdiguero;Carolina Redondo-Cabrera;Roberto J. López-Sastre;,University of Alcalá;,Spain;,Poster,https://ieeexplore.ieee.org/document/8593736/,,,
535,Incorporating Kinematic Properties into Fused Deposition Toolpath Optimization,,Samuel Lensgraf;Ramgopal R. Mettu;Samuel Lensgraf;Ramgopal R. Mettu;,Tulane University;,United States;,Poster,https://ieeexplore.ieee.org/document/8594398/,,,
536,Incremental Learning-Based Adaptive Object Recognition for Mobile Robots,,Mehmet Ozgur Turkoglu;Frank B. Ter Haar;Nanda van der Stap;Mehmet Ozgur Turkoglu;Frank B. Ter Haar;Nanda van der Stap;,University of Twente;TNO;,Netherlands;,Poster,https://ieeexplore.ieee.org/document/8593810/,,,
537,Incremental Object Database: Building 3D Models from Multiple Partial Observations,,Fadri Furrer;Tonci Novkovic;Marius Fehr;Abel Gawel;Margarita Grinvald;Torsten Sattler;Roland Siegwart;Juan Nieto;Fadri Furrer;Tonci Novkovic;Marius Fehr;Abel Gawel;Margarita Grinvald;Torsten Sattler;Roland Siegwart;Juan Nieto;,ETH Zurich;,Switzerland;,Poster,https://ieeexplore.ieee.org/document/8594391/,,,
538,Incremental Semi-Supervised Learning from Streams for Object Classification,,Ioannis Chiotellis;Franziska Zimmermann;Daniel Cremers;Rudolph Triebel;Ioannis Chiotellis;Franziska Zimmermann;Daniel Cremers;Rudolph Triebel;,Technical University of Munich;,Germany;,Poster,https://ieeexplore.ieee.org/document/8593901/,,,
539,Incremental Skill Learning of Stable Dynamical Systems,,Matteo Saveriano;Dongheui Lee;Matteo Saveriano;Dongheui Lee;,German Aerospace Center (DLR);Technical University of Munich;,Germany;,Poster,https://ieeexplore.ieee.org/document/8594474/,,,
540,Indoor Mapping and Localization for Pedestrians using Opportunistic Sensing with Smartphones,,Qing Liang;Lujia Wang;Youfu Li;Ming Liu;Qing Liang;Lujia Wang;Youfu Li;Ming Liu;,Hong Kong University of Science and Technology;Chinese Academy of Sciences;City University of Hong Kong;,China;,Poster,https://ieeexplore.ieee.org/document/8594254/,,,
541,Inertial Velocity and Attitude Estimation for Quadrotors,,James Svacha;Kartik Mohta;Michael Watterson;Giuseppe Loianno;Vijay Kumar;James Svacha;Kartik Mohta;Michael Watterson;Giuseppe Loianno;Vijay Kumar;,University of Pennsylvania;New York University;,United States;,Poster,https://ieeexplore.ieee.org/document/8593616/,,,
542,Inferring Semantic State Transitions During Telerobotic Manipulation,,Adrian S. Bauer;Peter Schmaus;Alin Albu-Schäffer;Daniel Leidner;Adrian S. Bauer;Peter Schmaus;Alin Albu-Schäffer;Daniel Leidner;,German Aerospace Center;Technische Universitat Munchen;,Germany;,Poster,https://ieeexplore.ieee.org/document/8594458/,,,
543,Information Sparsification in Visual-Inertial Odometry,,Jerry Hsiung;Ming Hsiao;Eric Westman;Rafael Valencia;Michael Kaess;Jerry Hsiung;Ming Hsiao;Eric Westman;Rafael Valencia;Michael Kaess;,Carnegie Mellon University;,United States;,Poster,https://ieeexplore.ieee.org/document/8594007/,,,
544,Inspection System for Automatic Measurement of Level Differences in Belt Conveyors Using Inertial Measurement Unit,,André Yuji Yasutomi;Hideo Enoki;Shigeki Yamaguchi;Kazuma Tamura;André Yuji Yasutomi;Hideo Enoki;Shigeki Yamaguchi;Kazuma Tamura;,"Hitachi, Ltd.;Hitachi High-Technologies Co.;",Japan;,Poster,https://ieeexplore.ieee.org/document/8593906/,,,
545,Instance Segmentation of Visible and Occluded Regions for Finding and Picking Target from a Pile of Objects,,Kentaro Wada;Shingo Kitagawa;Kei Okada;Masayuki Inaba;Kentaro Wada;Shingo Kitagawa;Kei Okada;Masayuki Inaba;,,,Poster,https://ieeexplore.ieee.org/document/8593690/,,,
546,Integrating Human-Provided Information into Belief State Representation Using Dynamic Factorization,,Rohan Chitnis;Leslie Pack Kaelbling;Tomás Lozano-Pérez;Rohan Chitnis;Leslie Pack Kaelbling;Tomás Lozano-Pérez;,Massachusetts Institute of Technology;,United States;,Poster,https://ieeexplore.ieee.org/document/8594468/,,,
547,Integrating Path Planning and Pivoting,,Silvia Cruciani;Christian Smith;Silvia Cruciani;Christian Smith;,KTH Royal Institute of Technology;,Sweden;,Poster,https://ieeexplore.ieee.org/document/8593584/,,,
548,Integration of a Canine Agent in a Wireless Sensor Network for Information Gathering in Search and Rescue Missions,,J.J. Fernández-Lozano;A. Mandow;M. Martín-Guzmán;J. Martín-Ávila;J. Serón;J.L. Martínez;J.A. Gornez-Ruiz;C. Socarras-Bertiz;J. Miranda-Páez;A. García-Cerezo;J.J. Fernández-Lozano;A. Mandow;M. Martín-Guzmán;J. Martín-Ávila;J. Serón;J.L. Martínez;J.A. Gornez-Ruiz;C. Socarras-Bertiz;J. Miranda-Páez;A. García-Cerezo;,Andalucía Tech;Universidad de Málaga;Universidad de La Guajira;,Spain;Colombia;,Poster,https://ieeexplore.ieee.org/document/8593849/,,,
549,Intelligent Robotic IoT System (IRIS)Testbed,,Jason A. Tran;Pradipta Ghosh;Yutong Gu;Richard Kim;Daniel D'Souza;Nora Ayanian;Bhaskar Krishnamachari;Jason A. Tran;Pradipta Ghosh;Yutong Gu;Richard Kim;Daniel D'Souza;Nora Ayanian;Bhaskar Krishnamachari;,University of Southern California;Unknown Institution;,United States;;,Poster,https://ieeexplore.ieee.org/document/8593636/,,,
550,Interacting with a “Transparent” Upper-Limb Exoskeleton: A Human Motor Control Approach,,Simon Bastide;Nicolas Vignais;Franck Geffard;Bastien Berret;Simon Bastide;Nicolas Vignais;Franck Geffard;Bastien Berret;,Université d'Orléans;CEA;,France;,Poster,https://ieeexplore.ieee.org/document/8593991/,,,
551,Interaction System Based on an Avatar Projected on a Pyramidal Display,,David Loza Matovelle;Samuel Marcos;Eduardo Zalama;Jaime Gómez García Bermejo;David Loza Matovelle;Samuel Marcos;Eduardo Zalama;Jaime Gómez García Bermejo;,University of Valladolid;CARTIF Foundation;,Spain;,Poster,https://ieeexplore.ieee.org/document/8593740/,,,
552,Interaction-Aware Probabilistic Behavior Prediction in Urban Environments,,Jens Schulz;Constantin Hubmann;Julian Löchner;Darius Burschka;Jens Schulz;Constantin Hubmann;Julian Löchner;Darius Burschka;,BMW Group;Technical University of Munich;,Germany;,Poster,https://ieeexplore.ieee.org/document/8594095/,,,
553,Interactive Robotic Manipulation of Elastic Objects,,Simon Duenser;James M. Bern;Roi Poranne;Stelian Coros;Simon Duenser;James M. Bern;Roi Poranne;Stelian Coros;,ETH Zurich;,Switzerland;,Poster,https://ieeexplore.ieee.org/document/8594291/,,,
554,Interactive Training of Object Detection Without ImageNet,,Eric Martinson;Eric Martinson;,Soar Technologies;,United States;,Poster,https://ieeexplore.ieee.org/document/8593614/,,,
555,Interleaving Hierarchical Task Planning and Motion Constraint Testing for Dual-Arm Manipulation,,Alejandro Suárez-Hernández;Guillem Alenyà;Carme Torras;Alejandro Suárez-Hernández;Guillem Alenyà;Carme Torras;,Institut de Robòtica i Informàtica Industrial;,Spain;,Poster,https://ieeexplore.ieee.org/document/8593847/,,,
556,Interspecies Retargeting of Homologous Body Posture Based on Skeletal Morphing,,Ko Ayusawa;Yosuke Ikegami;Akihiko Murai;Yusuke Yoshiyasu;Eiichi Yoshida;Satoshi Oota;Yoshihiko Nakamura;Ko Ayusawa;Yosuke Ikegami;Akihiko Murai;Yusuke Yoshiyasu;Eiichi Yoshida;Satoshi Oota;Yoshihiko Nakamura;,National Institute of Advanced Industrial Science and Technology;University of Tokyo;RIKEN;,Japan;,Poster,https://ieeexplore.ieee.org/document/8594240/,,,
557,Interval-Based Cooperative Uavs Pose Domain Characterization from Images and Ranges,,Ide-Flore Kenmogne;Vincent Drevelle;Eric Marchand;Ide-Flore Kenmogne;Vincent Drevelle;Eric Marchand;,University of Rennes;,France;,Poster,https://ieeexplore.ieee.org/document/8593742/,,,
558,Intrinsically Motivated Self-Supervised Deep Sensorimotor Learning for Grasping,,Takeshi Takahashi;Michael W. Lanighan;Roderic A. Grupen;Takeshi Takahashi;Michael W. Lanighan;Roderic A. Grupen;,University of Massachusetts;,United States;,Poster,https://ieeexplore.ieee.org/document/8593424/,,,
559,Intuitive Gaze-Control of a Robotized Flexible Endoscope,,T.J.C. Oude Vrielink;J. González-Bueno Puyal;A. Kogkas;A. Darzi;G. Mylonas;T.J.C. Oude Vrielink;J. González-Bueno Puyal;A. Kogkas;A. Darzi;G. Mylonas;,Imperial College London;,United Kingdom;,Poster,https://ieeexplore.ieee.org/document/8594426/,,,
560,Invariant smoothing on Lie Groups,,Paul Chauchat;Axel Barrau;Silvere Bonnabel;Paul Chauchat;Axel Barrau;Silvere Bonnabel;,MINES ParisTech;Groupe Safran;,France;,Poster,https://ieeexplore.ieee.org/document/8594068/,,,
561,Inverse Error Function Trajectories for Image Reconstruction,,Rohan Katoch;Beatriz Fusaro;Jun Ueda;Rohan Katoch;Beatriz Fusaro;Jun Ueda;,Georgia Institute of Technology;,United States;,Poster,https://ieeexplore.ieee.org/document/8594315/,,,
562,Inverse Learning of Robot Behavior for Collaborative Planning,,Maulesh Trivedi;Prashant Doshi;Maulesh Trivedi;Prashant Doshi;,University of Georgia;,United States;,Poster,https://ieeexplore.ieee.org/document/8593745/,,,
563,IROS 2018 Fan Challenge - Team DLR Augsburg,,Manfred Schönheits;Alfons Schuster;Philipp Gänswürger;Lars Larsen;Manfred Schönheits;Alfons Schuster;Philipp Gänswürger;Lars Larsen;,German Aerospace Center (DLR);,Germany;,Poster,https://ieeexplore.ieee.org/document/8593792/,,,
564,Iterative Learning of Energy-Efficient Dynamic Walking Gaits,,Felix H. Kong;Ian R. Manchester;Felix H. Kong;Ian R. Manchester;,University of Sydney;,Australia;,Poster,https://ieeexplore.ieee.org/document/8593548/,,,
565,Iterative Learning Vector Field for FES-Supported Cyclic Upper Limb Movements in Combination with Robotic Weight Compensation,,Arne Passon;Thomas Seel;Jonas Massmann;Chris Freeman;Thomas Schauer;Arne Passon;Thomas Seel;Jonas Massmann;Chris Freeman;Thomas Schauer;,Technical University of Berlin;University of Southampton;,Germany;United Kingdom;,Poster,https://ieeexplore.ieee.org/document/8594120/,,,
566,Jacquard: A Large Scale Dataset for Robotic Grasp Detection,,Amaury Depierre;Emmanuel Dellandréa;Liming Chen;Amaury Depierre;Emmanuel Dellandréa;Liming Chen;,Siléane;University of Lyon;,France;,Poster,https://ieeexplore.ieee.org/document/8593950/,,,
567,Jet-HR1: Stepping Posture Optimization for Bipedal Robot Over Large Ditch Based on a Ducted-fan Propulsion System,,Biao Liu;Zhifeng Huang;Jiapeng Wei;Chaoyang Shi;Jun Ota;Yun Zhang;Biao Liu;Zhifeng Huang;Jiapeng Wei;Chaoyang Shi;Jun Ota;Yun Zhang;,Guangdong University of Technology;University of Tokyo;Tianjin University;,China;Japan;,Poster,https://ieeexplore.ieee.org/document/8594055/,,,
