Index,Title,Session/Area,Authors,Affiliation,Country,Status,Proceeding URL,PDF URL,CVF URL,Arxiv URL
410,Grasping the object with collision avoidance of wheeled mobile manipulator in dynamic environments,,Pei-Wen Wu;Yu-Chi Lin;Chia-Ming Wang;Li-Chen Fu;Pei-Wen Wu;Yu-Chi Lin;Chia-Ming Wang;Li-Chen Fu;,National Taiwan University;,China;,Poster,https://ieeexplore.ieee.org/document/6697123/,,,
411,Grasping unknown objects by exploiting shape adaptability and environmental constraints,,Clemens Eppner;Oliver Brock;Clemens Eppner;Oliver Brock;,Technische Universität Berlin;,Germany;,Poster,https://ieeexplore.ieee.org/document/6696928/,,,
412,Grounding spatial relations for human-robot interaction,,Sergio Guadarrama;Lorenzo Riano;Dave Golland;Daniel Go¨hring;Yangqing Jia;Dan Klein;Pieter Abbeel;Trevor Darrell;Sergio Guadarrama;Lorenzo Riano;Dave Golland;Daniel Go¨hring;Yangqing Jia;Dan Klein;Pieter Abbeel;Trevor Darrell;,"University of California, Berkeley;International Computer Science Institute;",United States;,Poster,https://ieeexplore.ieee.org/document/6696569/,,,
413,Group induction,,Alex Teichman;Sebastian Thrun;Alex Teichman;Sebastian Thrun;,Stanford University;,United States;,Poster,https://ieeexplore.ieee.org/document/6696746/,,,
414,Guaranteeing reactive high-level behaviors for robots with complex dynamics,,Jonathan A. DeCastro;Hadas Kress-Gazit;Jonathan A. DeCastro;Hadas Kress-Gazit;,Cornell University;,United States;,Poster,https://ieeexplore.ieee.org/document/6696435/,,,
415,Haptic cue of forces on tools: Investigation of multi-point cutaneous activity on skin using suction pressure stimuli,,Lope Ben Porquis;Daiki Maemori;Naohisa Nagaya;Masashi Konyo;Satoshi Tadokoro;Lope Ben Porquis;Daiki Maemori;Naohisa Nagaya;Masashi Konyo;Satoshi Tadokoro;,Tohoku University;,Japan;,Poster,https://ieeexplore.ieee.org/document/6696626/,,,
416,Haptic feedback of real soft objects with haptic device using flexible sheet,,Kenji Inoue;Masanori Shimoe;Suwoong Lee;Kenji Inoue;Masanori Shimoe;Suwoong Lee;,Yamagata University;,Japan;,Poster,https://ieeexplore.ieee.org/document/6697074/,,,
417,Haptic rendering of interacting dynamic deformable objects simulated in real-time at different frequencies,,Francois Dervaux;Igor Peterlik;Jérémie Dequidt;Stéphane Cotin;Christian Duriez;Francois Dervaux;Igor Peterlik;Jérémie Dequidt;Stéphane Cotin;Christian Duriez;,INRIA Lille - Nord-Europe;Institut Hospitalo-Universitaire Strasbourg;,France;,Poster,https://ieeexplore.ieee.org/document/6696624/,,,
418,Hemispherical net-structure proximity sensor detecting azimuth and elevation for guide dog robot,,Hikaru Arita;Yosuke Suzuki;Hironori Ogawa;Kazuteru Tobita;Makoto Shimojo;Hikaru Arita;Yosuke Suzuki;Hironori Ogawa;Kazuteru Tobita;Makoto Shimojo;,University of Electro-Communications;NSK Ltd.;,Japan;,Poster,https://ieeexplore.ieee.org/document/6696420/,,,
419,Heterogeneous map merging using WiFi signals,,Gorkem Erinc;Benjamin Balaguer;Stefano Carpin;Gorkem Erinc;Benjamin Balaguer;Stefano Carpin;,"University of California, Merced;",United States;,Poster,https://ieeexplore.ieee.org/document/6697117/,,,
420,Heterogeneous UGV-MAV exploration using integer programming,,Ayush Dewan;Aravindh Mahendran;Nikhil Soni;K. Madhava Krishna;Ayush Dewan;Aravindh Mahendran;Nikhil Soni;K. Madhava Krishna;,"International Institute of Information Technology, Hyderabad;Carnegie Mellon University;",India;United States;,Poster,https://ieeexplore.ieee.org/document/6697188/,,,
421,HiDDeN: Cooperative plan execution and repair for heterogeneous robots in dynamic environments,,Thibault Gateau;Charles Lesire;Magali Barbier;Thibault Gateau;Charles Lesire;Magali Barbier;,Institut Supérieur de l'Aéronautique et de l'Espace;ONERA - The French Aerospace Lab;,France;,Poster,https://ieeexplore.ieee.org/document/6697047/,,,
422,Hierarchical control of a team of quadrotors for cooperative active target tracking,,Utku Gürcüoglu;Gustavo A. Puerto-Souza;Fabio Morbidi;Gian Luca Mariottini;Utku Gürcüoglu;Gustavo A. Puerto-Souza;Fabio Morbidi;Gian Luca Mariottini;,University of Texas at Arlington;INRIA Grenoble Rhône-Alpes;,United States;France;,Poster,https://ieeexplore.ieee.org/document/6697186/,,,
423,Hierarchical underwater localization in dominating background flow fields,,Zhuoyuan Song;Kamran Mohseni;Zhuoyuan Song;Kamran Mohseni;,University of Florida;,United States;,Poster,https://ieeexplore.ieee.org/document/6696834/,,,
424,Hierarchical visual mapping with omnidirectional images,,Hemanth Korrapati;Ferit Uzer;Youcef Mezouar;Hemanth Korrapati;Ferit Uzer;Youcef Mezouar;,Université Blaise Pascal;Institut Française Mécanique Avancée;,France;,Poster,https://ieeexplore.ieee.org/document/6696882/,,,
425,High fidelity day/night stereo mapping with vegetation and negative obstacle detection for vision-in-the-loop walking,,Max Bajracharya;Jeremy Ma;Matt Malchano;Alex Perkins;Alfred A. Rizzi;Larry Matthies;Max Bajracharya;Jeremy Ma;Matt Malchano;Alex Perkins;Alfred A. Rizzi;Larry Matthies;,California Institute of Technology;Boston Dynamics;,United States;,Poster,https://ieeexplore.ieee.org/document/6696879/,,,
426,High speed parallel kinematic manipulator state estimation from legs observation,,Eroi Özgür;Redwan Dahmouche;Nicolas Andreff;Philippe Martinet;Eroi Özgür;Redwan Dahmouche;Nicolas Andreff;Philippe Martinet;,CNRS;Université de Franche-Comté;,France;,Poster,https://ieeexplore.ieee.org/document/6696386/,,,
427,High speed/accuracy visual servoing based on virtual visual servoing with stereo cameras,,Takashi Nammoto;Koichi Hashimoto;Shingo Kagami;Kazuhiro Kosuge;Takashi Nammoto;Koichi Hashimoto;Shingo Kagami;Kazuhiro Kosuge;,Tohoku University;,Japan;,Poster,https://ieeexplore.ieee.org/document/6696330/,,,
428,High throughput mechanical characterization of oocyte using robot integrated microfluidic chip,,Shinya Sakuma;Bilal Turan;Fumihito Arai;Shinya Sakuma;Bilal Turan;Fumihito Arai;,Nagoya University;,Japan;,Poster,https://ieeexplore.ieee.org/document/6696630/,,,
429,High-speed humanoid running through control with a 3D-SLIP model,,Patrick M. Wensing;David E. Orin;Patrick M. Wensing;David E. Orin;,Ohio State University;,United States;,Poster,https://ieeexplore.ieee.org/document/6697099/,,,
430,High-speed limit cycle walking for biped robots using active up-and-down motion control of wobbling mass,,Yuta Hanazawa;Terumitsu Hayashi;Masaki Yamakita;Fumihiko Asano;Yuta Hanazawa;Terumitsu Hayashi;Masaki Yamakita;Fumihiko Asano;,Kyushu Institute of Technology;Japan Advanced Institute of Science and Technology;,Japan;,Poster,https://ieeexplore.ieee.org/document/6696877/,,,
431,Highly deformable 3-D printed soft robot generating inching and crawling locomotions with variable friction legs,,Takuya Umedachi;Vishesh Vikas;Barry A. Trimmer;Takuya Umedachi;Vishesh Vikas;Barry A. Trimmer;,Hiroshima University;Tufts University;,Japan;United States;,Poster,https://ieeexplore.ieee.org/document/6697016/,,,
432,How to manipulate an object robustly with only one actuator (An application of caging),,Weiwei Wan;Rui Fukui;Masamichi Shimosaka;Tomomasa Sato;Yasuo Kuniyoshi;Weiwei Wan;Rui Fukui;Masamichi Shimosaka;Tomomasa Sato;Yasuo Kuniyoshi;,University of Tokyo;,Japan;,Poster,https://ieeexplore.ieee.org/document/6696780/,,,
433,HRA∗: Hybrid randomized path planning for complex 3D environments,,Ernesto H. Teniente;Juan Andrade-Cetto;Ernesto H. Teniente;Juan Andrade-Cetto;,Institut de Robòtica i Informàtica Industrial;,Spain;,Poster,https://ieeexplore.ieee.org/document/6696588/,,,
434,HRI in the sky: Creating and commanding teams of UAVs with a vision-mediated gestural interface,,Valiallah Mani Monajjemi;Jens Wawerla;Richard Vaughan;Greg Mori;Valiallah Mani Monajjemi;Jens Wawerla;Richard Vaughan;Greg Mori;,Simon Fraser University;,Canada;,Poster,https://ieeexplore.ieee.org/document/6696415/,,,
435,HRTF-based source azimuth estimation and activity detection from a binaural sensor,,Alban Portello;Patrick Danès;Sylvain Argentieri;Sylvain Pledel;Alban Portello;Patrick Danès;Sylvain Argentieri;Sylvain Pledel;,CNRS;UPMC Univ. Paris 06;,France;,Poster,https://ieeexplore.ieee.org/document/6696768/,,,
436,Human like learning algorithm for simultaneous force control and haptic identification,,Chenguang Yang;Zhijun Li;Etienne Burdet;Chenguang Yang;Zhijun Li;Etienne Burdet;,University of Plymouth;Ministry of Education;Imperial College of Science;,United Kingdom;China;,Poster,https://ieeexplore.ieee.org/document/6696429/,,,
437,Human-centered evaluation of multi-user teleoperation for mobile manipulator in unmanned offshore plants,,Dong Gun Lee;Gun Rae Cho;Min Su Lee;Byung-Su Kim;Sehoon Oh;Hyoung Il Son;Dong Gun Lee;Gun Rae Cho;Min Su Lee;Byung-Su Kim;Sehoon Oh;Hyoung Il Son;,Samsung;Sogang University;,South Korea;,Poster,https://ieeexplore.ieee.org/document/6697142/,,,
438,Human-comfortable navigation for an autonomous robotic wheelchair,,Yoichi Morales;Nagasrikanth Kallakuri;Kazuhiro Shinozawa;Takahiro Miyashita;Norihiro Hagita;Yoichi Morales;Nagasrikanth Kallakuri;Kazuhiro Shinozawa;Takahiro Miyashita;Norihiro Hagita;,Advanced Telecommunications Research Institute International;,Japan;,Poster,https://ieeexplore.ieee.org/document/6696743/,,,
439,Human-humanoid joint haptic table carrying task with height stabilization using vision,,Don Joven Agravante;Andrea Cherubini;Antoine Bussy;Abderrahmane Kheddar;Don Joven Agravante;Andrea Cherubini;Antoine Bussy;Abderrahmane Kheddar;,CNRS-UM2 LIRMM UMR 5506;,France;,Poster,https://ieeexplore.ieee.org/document/6697019/,,,
440,Human-inspired chemical sensing for mobile robots,,R. Andrew Russell;R. Andrew Russell;,Monash University;,Australia;,Poster,https://ieeexplore.ieee.org/document/6697221/,,,
441,Human-robot collaborative manipulation planning using early prediction of human motion,,Jim Mainprice;Dmitry Berenson;Jim Mainprice;Dmitry Berenson;,Worcester Polytechnic Institute;,United States;,Poster,https://ieeexplore.ieee.org/document/6696368/,,,
442,Human-robot cooperative swinging of complex pendulum-like objects,,Philine Donner;Franz Christange;Martin Buss;Philine Donner;Franz Christange;Martin Buss;,Technische Universität München;,Germany;,Poster,https://ieeexplore.ieee.org/document/6697018/,,,
443,Humanoid push recovery control in case of multiple non-coplanar contacts,,Darine Mansour;Alain Micaelli;Pierre Lemerle;Darine Mansour;Alain Micaelli;Pierre Lemerle;,Commissariat à l'Énergie Atomique et aux Énergies Alternatives (CEA);INRS;,France;,Poster,https://ieeexplore.ieee.org/document/6696949/,,,
444,Humanoid self-correction of posture using a mirror,,Naohiro Hayashi;Tetsuo Tomizawa;Takashi Suehiro;Shunsuke Kudoh;Naohiro Hayashi;Tetsuo Tomizawa;Takashi Suehiro;Shunsuke Kudoh;,University of Electro-Communications;,Japan;,Poster,https://ieeexplore.ieee.org/document/6696565/,,,
445,Hybrid force/motion control and internal dynamics of quadrotors for tool operation,,Hai-Nguyen Nguyen;Dongjun Lee;Hai-Nguyen Nguyen;Dongjun Lee;,Seoul National University;,South Korea;,Poster,https://ieeexplore.ieee.org/document/6696849/,,,
446,Identification of a piecewise controller of lateral human standing based on returning recursive-least-square method,,Nobuyuki Murai;Daishi Kaneta;Tomomichi Sugihara;Nobuyuki Murai;Daishi Kaneta;Tomomichi Sugihara;,Osaka University;,Japan;,Poster,https://ieeexplore.ieee.org/document/6696338/,,,
447,Identification of standard dynamic parameters of robots with positive definite inertia matrix,,Maxime Gautier;Gentiane Venture;Maxime Gautier;Gentiane Venture;,University of Nantes;Tokyo University of Agriculture and Technology;,France;Japan;,Poster,https://ieeexplore.ieee.org/document/6697198/,,,
448,Identifying the singularity conditions of Canadarm2 based on elementary Jacobian transformation,,Wenfu Xu;Jintao Zhang;Huihuan Qian;Yongquan Chen;Yangsheng Xu;Wenfu Xu;Jintao Zhang;Huihuan Qian;Yongquan Chen;Yangsheng Xu;,Harbin Institute of Technology;Chinese University of Hong Kong;,China;,Poster,https://ieeexplore.ieee.org/document/6696442/,,,
449,Image moments for higher-level feature based navigation,,Ashwin Dani;Ghazaleh Panahandeh;Soon-Jo Chung;Seth Hutchinson;Ashwin Dani;Ghazaleh Panahandeh;Soon-Jo Chung;Seth Hutchinson;,University of Illinois Urbana-Champaign;KTH-Royal Institute of Technology;,United States;Sweden;,Poster,https://ieeexplore.ieee.org/document/6696413/,,,
450,Implicit robot coordination using Case-Based Reasoning behaviors,,J. M. Peula;C. Urdiales;I. Herrero;F. Sandoval;J. M. Peula;C. Urdiales;I. Herrero;F. Sandoval;,Universidad de Málaga;,Spain;,Poster,https://ieeexplore.ieee.org/document/6697216/,,,
451,Improved local shape feature stability through dense model tracking,,Daniel R. Canelhas;Todor Stoyanov;Achim J. Lilienthal;Daniel R. Canelhas;Todor Stoyanov;Achim J. Lilienthal;,Orebro University;,Sweden;,Poster,https://ieeexplore.ieee.org/document/6696811/,,,
452,Improving aggregate behavior in parking lots with appropriate local maneuvers,,Samuel Rodriguez;Andrew Giese;Nancy M. Amato;Samuel Rodriguez;Andrew Giese;Nancy M. Amato;,Texas A&M University;,United States;,Poster,https://ieeexplore.ieee.org/document/6696906/,,,
453,Improving robot plans for information gathering tasks through execution monitoring,,Minlue Wang;Sebastien Canu;Richard Dearden;Minlue Wang;Sebastien Canu;Richard Dearden;,University of Birmingham;,United Kingdom;,Poster,https://ieeexplore.ieee.org/document/6697121/,,,
454,Improving the energy efficiency of autonomous underwater vehicles by learning to model disturbances,,Petar Kormushev;Darwin G. Caldwell;Petar Kormushev;Darwin G. Caldwell;,Istituto Italiano di Tecnologia;,Italy;,Poster,https://ieeexplore.ieee.org/document/6696912/,,,
455,Improving the performance of self-organized robotic clustering: Modeling and planning sequential changes to the division of labor,,Jung-Hwan Kim;Dylan A. Shell;Jung-Hwan Kim;Dylan A. Shell;,Texas A & M University;,United States;,Poster,https://ieeexplore.ieee.org/document/6696975/,,,
456,Improving transparency in passive teleoperation by combining cutaneous and kinesthetic force feedback,,Claudio Pacchierotti;Asad Tirmizi;Gianni Bianchini;Domenico Prattichizzo;Claudio Pacchierotti;Asad Tirmizi;Gianni Bianchini;Domenico Prattichizzo;,Istituto Italiano di Tecnologia;University of Siena;,Italy;,Poster,https://ieeexplore.ieee.org/document/6697072/,,,
457,Impulse force generator based on snap-through buckling of robotic closed elastica: Analysis by quasi-static shape transition simulation,,Hiromi Mochiyama;Aya Kinoshita;Ryosuke Takasu;Hiromi Mochiyama;Aya Kinoshita;Ryosuke Takasu;,University of Tsukuba;,Japan;,Poster,https://ieeexplore.ieee.org/document/6697015/,,,
458,IMU-RGBD camera navigation using point and plane features,,Chao X. Guo;Stergios I. Roumeliotis;Chao X. Guo;Stergios I. Roumeliotis;,University of Minnesota;,United States;,Poster,https://ieeexplore.ieee.org/document/6696806/,,,
459,In-channel experiments on vertical swimming with bacteria-like robots,,Ahmet Fatih Tabak;Serhat Yesilyurt;Ahmet Fatih Tabak;Serhat Yesilyurt;,Sabanci University;,Türkiye;,Poster,https://ieeexplore.ieee.org/document/6697017/,,,
460,InchBot: A novel swarm microrobotic platform,,Donghwa Jeong;Kiju Lee;Donghwa Jeong;Kiju Lee;,Case Western Reserve University;,United States;,Poster,https://ieeexplore.ieee.org/document/6697163/,,,
461,Increased robustness of humanoid standing balance in the sagittal plane through adaptive joint torque reduction,,Markus Giftthaler;Katie Byl;Markus Giftthaler;Katie Byl;,"Swiss Federal Institute of Technology (ETH);University of California, Santa Barbara;",Switzerland;United States;,Poster,https://ieeexplore.ieee.org/document/6696948/,,,
462,Incremental light bundle adjustment for robotics navigation,,Vadim Indelman;Andrew Melim;Frank Dellaert;Vadim Indelman;Andrew Melim;Frank Dellaert;,Georgia Institute of Technology;,United States;,Poster,https://ieeexplore.ieee.org/document/6696615/,,,
463,Inferring categories to accelerate the learning of new classes,,Robert Goeddel;Edwin Olson;Robert Goeddel;Edwin Olson;,University of Michigan;,United States;,Poster,https://ieeexplore.ieee.org/document/6696336/,,,
464,Insertion planning for steerable flexible needles reaching multiple planar targets,,Jaeyeon Lee;Wooram Park;Jaeyeon Lee;Wooram Park;,University of Texas at Dallas;,United States;,Poster,https://ieeexplore.ieee.org/document/6696690/,,,
465,Integrated concept of objects and human motions based on multi-layered multimodal LDA,,Muhammad Fadlil;Keisuke Ikeda;Kasumi Abe;Tomoaki Nakamura;Takayuki Nagai;Muhammad Fadlil;Keisuke Ikeda;Kasumi Abe;Tomoaki Nakamura;Takayuki Nagai;,University of Electro-Communications;Denki Tsushin Daigaku;,Japan;,Poster,https://ieeexplore.ieee.org/document/6696672/,,,
466,Integrated motion and clasp planning with virtual linking,,Johannes A. Stork;Florian T. Pokorny;Danica Kragic;Johannes A. Stork;Florian T. Pokorny;Danica Kragic;,KTH Royal Institute of Technology;,Sweden;,Poster,https://ieeexplore.ieee.org/document/6696782/,,,
467,Integrated navigation system using camera and gimbaled laser scanner for indoor and outdoor autonomous flight of UAVs,,Sungsik Huh;David Hyunchul Shim;Jonghyuk Kim;Sungsik Huh;David Hyunchul Shim;Jonghyuk Kim;,Korea Advanced Institute of Science and Technology;Australian National University;,South Korea;Australia;,Poster,https://ieeexplore.ieee.org/document/6696805/,,,
468,"Integrated perception, mapping, and footstep planning for humanoid navigation among 3D obstacles",,Daniel Maier;Christian Lutz;Maren Bennewitz;Daniel Maier;Christian Lutz;Maren Bennewitz;,University of Freiburg;,Germany;,Poster,https://ieeexplore.ieee.org/document/6696731/,,,
469,Integrated time-optimal trajectory planning and control design for industrial robot manipulator,,Stepan S. Pchelkin;Anton S. Shiriaev;Anders Robertsson;Leonid B. Freidovich;Stepan S. Pchelkin;Anton S. Shiriaev;Anders Robertsson;Leonid B. Freidovich;,Norwegian University of Science and Technology;Umeå University;,Norway;Sweden;,Poster,https://ieeexplore.ieee.org/document/6696711/,,,
470,Integrating the whole cost-curve of stereo into occupancy grids,,Martim Brandão;Ricardo Ferreira;Kenji Hashimoto;José Santos-Victor;Atsuo Takanishi;Martim Brandão;Ricardo Ferreira;Kenji Hashimoto;José Santos-Victor;Atsuo Takanishi;,Waseda University;Instituto Superior Técnico;,Japan;Portugal;,Poster,https://ieeexplore.ieee.org/document/6697030/,,,
471,"Integrating vision, haptics and proprioception into a feedback controller for in-hand manipulation of unknown objects",,Qiang Li;Christof Elbrechter;Robert Haschke;Helge Ritter;Qiang Li;Christof Elbrechter;Robert Haschke;Helge Ritter;,Bielefeld University;,Germany;,Poster,https://ieeexplore.ieee.org/document/6696703/,,,
472,Interactive environment exploration in clutter,,Megha Gupta;Thomas Rühr;Michael Beetz;Gaurav S. Sukhatme;Megha Gupta;Thomas Rühr;Michael Beetz;Gaurav S. Sukhatme;,University of Southern California;University of Bremen;,United States;Germany;,Poster,https://ieeexplore.ieee.org/document/6697118/,,,
473,Interactive object classification using sensorimotor contingencies,,Virgile Högman;Marten Björkman;Danica Kragic;Virgile Högman;Marten Björkman;Danica Kragic;,KTH Royal Institute of Technology;,Sweden;,Poster,https://ieeexplore.ieee.org/document/6696752/,,,
474,Intercontinental haptic teleoperation of a flying vehicle: A step towards real-time applications,,Abeje Y. Mersha;Xiaolei Hou;Robert Mahony;Stefano Stramigioli;Peter Corke;Raffaella Carloni;Abeje Y. Mersha;Xiaolei Hou;Robert Mahony;Stefano Stramigioli;Peter Corke;Raffaella Carloni;,University of Twente;Australian National University;Universiteit Twente;Queensland University of Technology;,Netherlands;Australia;,Poster,https://ieeexplore.ieee.org/document/6697071/,,,
475,Inversion based direct position control and trajectory following for micro aerial vehicles,,Markus W. Achtelik;Simon Lynen;Margarita Chli;Roland Siegwart;Markus W. Achtelik;Simon Lynen;Margarita Chli;Roland Siegwart;,ETH Zurich;,Switzerland;,Poster,https://ieeexplore.ieee.org/document/6696772/,,,
476,Iterative learning identification and computed torque control of robots,,M. Gautier;A. Jubien;A. Janot;M. Gautier;A. Jubien;A. Janot;,University of Nantes;ONERA;,France;,Poster,https://ieeexplore.ieee.org/document/6696843/,,,
477,Joint action understanding improves robot-to-human object handover,,Elena Corina Grigore;Kerstin Eder;Anthony G. Pipe;Chris Melhuish;Ute Leonards;Elena Corina Grigore;Kerstin Eder;Anthony G. Pipe;Chris Melhuish;Ute Leonards;,University of Bristol;Bristol Robotics Laboratory;,United Kingdom;,Poster,https://ieeexplore.ieee.org/document/6697021/,,,
478,Juggling on a bouncing ball apparatus via hybrid control,,Xiaolu Tian;Jeffrey H. Koessler;Ricardo G. Sanfelice;Xiaolu Tian;Jeffrey H. Koessler;Ricardo G. Sanfelice;,State Grid Shandong Electric Power Company;University of Arizona;,China;United States;,Poster,https://ieeexplore.ieee.org/document/6696600/,,,
479,Kernel-based tracking for improving sign detection performance,,JongHo Lee;Young-Woo Seo;David Wettergreen;JongHo Lee;Young-Woo Seo;David Wettergreen;,Carnegie Mellon University;,United States;,Poster,https://ieeexplore.ieee.org/document/6696986/,,,
480,KidsArm — An image-guided pediatric anastomosis robot,,Thomas Looi;Benny Yeung;Manickham Umasthan;James Drake;Thomas Looi;Benny Yeung;Manickham Umasthan;James Drake;,Hospital for Sick Children;MDA Corporation;,Canada;,Poster,https://ieeexplore.ieee.org/document/6696944/,,,
481,Kinesthetic teaching of humanoid motion based on whole-body compliance control with interaction-aware balancing,,Christian Ott;Bernd Henze;Dongheui Lee;Christian Ott;Bernd Henze;Dongheui Lee;,Institute of Robotics and Mechatronics;Technical University of Munich;,Germany;,Poster,https://ieeexplore.ieee.org/document/6697020/,,,
482,Kinodynamic motion planning and control for an X4-Flyer using anisotropic damping forces,,Kimiko Motonaka;Keigo Watanabe;Shoichi Maeyama;Kimiko Motonaka;Keigo Watanabe;Shoichi Maeyama;,Okayama University;,Japan;,Poster,https://ieeexplore.ieee.org/document/6696989/,,,
483,Knowledge transfer for high-performance quadrocopter maneuvers,,Michael Hamer;Markus Waibel;Raffaello D'Andrea;Michael Hamer;Markus Waibel;Raffaello D'Andrea;,ETH Zurich;Eidgenossische Technische Hochschule Zurich;,Switzerland;,Poster,https://ieeexplore.ieee.org/document/6696580/,,,
484,KVP: A knowledge of volumes approach to robot task planning,,Andre Gaschler;Ronald P. A. Petrick;Manuel Giuliani;Markus Rickert;Alois Knoll;Andre Gaschler;Ronald P. A. Petrick;Manuel Giuliani;Markus Rickert;Alois Knoll;,Technische Universität München;University of Edinburgh;,Germany;United Kingdom;,Poster,https://ieeexplore.ieee.org/document/6696354/,,,
485,Landmine buried depth estimation by curve characterization of metal mine detector signals,,Alex M. Kaneko;Gen Endo;Edwardo F. Fukushima;Alex M. Kaneko;Gen Endo;Edwardo F. Fukushima;,Tokyo Institute of Technology;,Japan;,Poster,https://ieeexplore.ieee.org/document/6697127/,,,
486,Laser-based segment classification using a mixture of bag-of-words,,Jens Behley;Volker Steinhage;Armin B. Cremers;Jens Behley;Volker Steinhage;Armin B. Cremers;,University of Bonn;,Germany;,Poster,https://ieeexplore.ieee.org/document/6696957/,,,
487,Learning an internal representation of the end-effector configuration space,,Alban Laflaquière;Alexander V. Terekhov;Bruno Gas;J. Kevin O'Regan;Alban Laflaquière;Alexander V. Terekhov;Bruno Gas;J. Kevin O'Regan;,UPMC Univ Paris 06;University of Paris;,France;,Poster,https://ieeexplore.ieee.org/document/6696507/,,,
488,Learning how to increase the chance of human-robot engagement,,Douglas G. Macharet;Dinei A. Florencio;Douglas G. Macharet;Dinei A. Florencio;,Universidade Federal de Minas Gerais;Microsoft;,Brazil;United States;,Poster,https://ieeexplore.ieee.org/document/6696660/,,,
489,Learning impedance controller parameters for lower-limb prostheses,,Navid Aghasadeghi;Huihua Zhao;Levi J. Hargrove;Aaron D. Ames;Eric J. Perreault;Timothy Bretl;Navid Aghasadeghi;Huihua Zhao;Levi J. Hargrove;Aaron D. Ames;Eric J. Perreault;Timothy Bretl;,University of Illinois Urbana-Champaign;Texas A&M University;Rehabilitation Institute of Chicago;,United States;,Poster,https://ieeexplore.ieee.org/document/6696968/,,,
490,Learning muscle activation patterns via nonlinear oscillators: Application to lower-limb assistance,,Gabriel Aguirre-Ollinger;Gabriel Aguirre-Ollinger;,University of Technology Sydney;,Australia;,Poster,https://ieeexplore.ieee.org/document/6696500/,,,
491,Learning responsive robot behavior by imitation,,Heni Ben Amor;David Vogt;Marco Ewerton;Erik Berger;Bernhard Jung;Jan Peters;Heni Ben Amor;David Vogt;Marco Ewerton;Erik Berger;Bernhard Jung;Jan Peters;,Technische Universitaet Darmstadt;Technische Universitaet Bergakademie Freiberg;,Germany;,Poster,https://ieeexplore.ieee.org/document/6696819/,,,
492,Learning robot gait stability using neural networks as sensory feedback function for Central Pattern Generators,,Sébastien Gay;José Santos-Victor;Auke Ijspeert;Sébastien Gay;José Santos-Victor;Auke Ijspeert;,EPFL;Instituto Superior Técnico;,Switzerland;Portugal;,Poster,https://ieeexplore.ieee.org/document/6696353/,,,
493,Learning sequential tasks interactively from demonstrations and own experience,,Kathrin Gräve;Sven Behnke;Kathrin Gräve;Sven Behnke;,B-IT Research School;,Germany;,Poster,https://ieeexplore.ieee.org/document/6696816/,,,
494,Learning support order for manipulation in clutter,,Swagatika Panda;A.H. Abdul Hafez;C.V. Jawahar;Swagatika Panda;A.H. Abdul Hafez;C.V. Jawahar;,International Institute of Information Technology;,India;,Poster,https://ieeexplore.ieee.org/document/6696444/,,,
