Index,Title,Session/Area,Authors,Affiliation,Country,Status,Proceeding URL,PDF URL,CVF URL,Arxiv URL
236,Cooperative decentralised circumnavigation with application to algal bloom tracking,,Joana Fonseca;Jieqiang Wei;Karl H. Johansson;Tor Ame Johansen;Joana Fonseca;Jieqiang Wei;Karl H. Johansson;Tor Ame Johansen;,KTH Royal Institute of Technology;Norwegian University of Science and Technology;,Sweden;Norway;,Poster,https://ieeexplore.ieee.org/document/8967632/,,,
237,Cooperative Range-only SLAM based on Sum of Gaussian Filter in Dynamic Environments,,Jung-Hee Kim;Doik Kim;Jung-Hee Kim;Doik Kim;,Korea Institute of Science and Technology;,South Korea;,Poster,https://ieeexplore.ieee.org/document/8967646/,,,
238,Cooperative Schedule-Driven Intersection Control with Connected and Autonomous Vehicles,,Hsu-Chieh Hu;Stephen F. Smith;Rick Goldstein;Hsu-Chieh Hu;Stephen F. Smith;Rick Goldstein;,Carnegie Mellon University;,United States;,Poster,https://ieeexplore.ieee.org/document/8967975/,,,
239,Coupling Disturbance Compensated MIMO Control of Parallel Ankle Rehabilitation Robot Actuated by Pneumatic Muscles,,Jie Zuo;Wei Meng;Quan Liu;Qingsong Ai;Sheng Q. Xie;Zude Zhou;Jie Zuo;Wei Meng;Quan Liu;Qingsong Ai;Sheng Q. Xie;Zude Zhou;,Wuhan University of Technology;University of Leeds;,China;United Kingdom;,Poster,https://ieeexplore.ieee.org/document/8967684/,,,
240,Covariance Pre-Integration for Delayed Measurements in Multi-Sensor Fusion,,Eren Allak;Roland Jung;Stephan Weiss;Eren Allak;Roland Jung;Stephan Weiss;,Universität Klagenfurt;Alpen-Adria-Universität Klagenfurt;,Austria;,Poster,https://ieeexplore.ieee.org/document/8967886/,,,
241,Coverage Path Planning using Path Primitive Sampling and Primitive Coverage Graph for Visual Inspection,,Wei Jing;Di Deng;Zhe Xiao;Yong Liu;Kenji Shimada;Wei Jing;Di Deng;Zhe Xiao;Yong Liu;Kenji Shimada;,A*TAR Artificial Intelligence Initiative;Carnegie Mellon University;Institute of High Performance Computing;,Singapore;United States;,Poster,https://ieeexplore.ieee.org/document/8967969/,,,
242,Coverage Sampling Planner for UAV-enabled Environmental Exploration and Field Mapping,,Teng Li;Chaoqun Wang;Meng Max Q.-H.;Clarence W. de Silva;Teng Li;Chaoqun Wang;Meng Max Q.-H.;Clarence W. de Silva;,University of British Columbia;Chinese University of Hong Kong;,Canada;China;,Poster,https://ieeexplore.ieee.org/document/8967735/,,,
243,Criteria for Maintaining Desired Contacts for Quasi-Static Systems,,Yifan Hou;Matthew T. Mason;Yifan Hou;Matthew T. Mason;,Carnegie Mellon University;,United States;,Poster,https://ieeexplore.ieee.org/document/8968592/,,,
244,Crowd-sourced Semantic Edge Mapping for Autonomous Vehicles,,Markus Herb;Tobias Weiherer;Nassir Navab;Federico Tombari;Markus Herb;Tobias Weiherer;Nassir Navab;Federico Tombari;,AUDI AG;Technical University of Munich;,Germany;,Poster,https://ieeexplore.ieee.org/document/8968020/,,,
245,Curved-Voxel Clustering for Accurate Segmentation of 3D LiDAR Point Clouds with Real-Time Performance,,Seungcheol Park;Shuyu Wang;Hunjung Lim;U Kang;Seungcheol Park;Shuyu Wang;Hunjung Lim;U Kang;,Seoul National University;Samsung;,South Korea;,Poster,https://ieeexplore.ieee.org/document/8968026/,,,
246,Data Association Aware Semantic Mapping and Localization via a Viewpoint-Dependent Classifier Model,,Vladimir Tchuiev;Yuri Feldman;Vadim Indelman;Vladimir Tchuiev;Yuri Feldman;Vadim Indelman;,Technion - Israel Institute of Technology;,Israel;,Poster,https://ieeexplore.ieee.org/document/8967855/,,,
247,Data Flow ORB-SLAM for Real-time Performance on Embedded GPU Boards,,Stefano Aldegheri;Nicola Bombieri;Domenico D. Bloisi;Alessandro Farinelli;Stefano Aldegheri;Nicola Bombieri;Domenico D. Bloisi;Alessandro Farinelli;,University of Verona;University of Basilicata;,Italy;,Poster,https://ieeexplore.ieee.org/document/8967814/,,,
248,"Decentralized Control for 3D M-Blocks for Path Following, Line Formation, and Light Gradient Aggregation",,John W. Romanishin;John Mamish;Daniela Rus;John W. Romanishin;John Mamish;Daniela Rus;,Massachusetts Institute of Technology;,United States;,Poster,https://ieeexplore.ieee.org/document/8967810/,,,
249,Decentralized Coordination Mechanism between Neck and Limbs for Efficient Quadrupedal Walking,,Akira Fukuhara;Shura Suzuki;Takeshi Kano;Akio Ishiguro;Akira Fukuhara;Shura Suzuki;Takeshi Kano;Akio Ishiguro;,Tohoku University;,Japan;,Poster,https://ieeexplore.ieee.org/document/8967619/,,,
250,Decentralized Pose Control of Modular Reconfigurable Robots Operating in Liquid Environments,,João V. Amorim Marques;Anil Özdemir;Matthew J. Doyle;Daniela Rus;Roderich Groß;João V. Amorim Marques;Anil Özdemir;Matthew J. Doyle;Daniela Rus;Roderich Groß;,University of Sheffield;Massachusetts Institute of Technology;,United Kingdom;United States;,Poster,https://ieeexplore.ieee.org/document/8967698/,,,
251,Decentralized Visual-Inertial Localization and Mapping on Mobile Devices for Augmented Reality,,Kourosh Sartipi;Ryan C. DuToit;Christopher B. Cobar;Stergios I. Roumeliotis;Kourosh Sartipi;Ryan C. DuToit;Christopher B. Cobar;Stergios I. Roumeliotis;,Google;,United States;,Poster,https://ieeexplore.ieee.org/document/8967804/,,,
252,DEDUCE: Diverse scEne Detection methods in Unseen Challenging Environments,,Anwesan Pal;Carlos Nieto-Granda;Henrik I. Christensen;Anwesan Pal;Carlos Nieto-Granda;Henrik I. Christensen;,"University of California, San Diego;",United States;,Poster,https://ieeexplore.ieee.org/document/8968108/,,,
253,Deep Dive into Faces: Pose & Illumination Invariant Multi-Face Emotion Recognition System,,Suchitra Saxena;Shikha Tripathi;T S B Sudarshan;Suchitra Saxena;Shikha Tripathi;T S B Sudarshan;,PES University;,India;,Poster,https://ieeexplore.ieee.org/document/8967874/,,,
254,Deep Generative Modeling of LiDAR Data,,Lucas Caccia;Herke van Hoof;Aaron Courville;Joelle Pineau;Lucas Caccia;Herke van Hoof;Aaron Courville;Joelle Pineau;,McGill University;Université de Montréal;,Canada;,Poster,https://ieeexplore.ieee.org/document/8968535/,,,
255,Deep Imitation Learning for Autonomous Driving in Generic Urban Scenarios with Enhanced Safety,,Jianyu Chen;Bodi Yuan;Masayoshi Tomizuka;Jianyu Chen;Bodi Yuan;Masayoshi Tomizuka;,"University of California, Berkeley;",United States;,Poster,https://ieeexplore.ieee.org/document/8968225/,,,
256,Deep Lagrangian Networks for end-to-end learning of energy-based control for under-actuated systems,,Michael Lutter;Kim Listmann;Jan Peters;Michael Lutter;Kim Listmann;Jan Peters;,Technische Universit’ Darmstadt;ABB Corporate Research Center;,Germany;,Poster,https://ieeexplore.ieee.org/document/8968268/,,,
257,Deep Learning of Proprioceptive Models for Robotic Force Estimation,,Erik Berger;Daniel Eger Passos;Steve Grehl;Heni Ben Amor;Bernhard Jung;Erik Berger;Daniel Eger Passos;Steve Grehl;Heni Ben Amor;Bernhard Jung;,Siemens AG;Technical University Bergakademie Freiberg;Arizona State University;,Germany;United States;,Poster,https://ieeexplore.ieee.org/document/8968052/,,,
258,Deep Learning-Based Mutual Detection and Collaborative Localization for Mobile Robot Fleets Using Solely 2D LIDAR Sensors,,Robin Dietrich;Stefan Dörr;Robin Dietrich;Stefan Dörr;,,,Poster,https://ieeexplore.ieee.org/document/8967574/,,,
259,Deep Multi-Task Learning for Anomalous Driving Detection Using CAN Bus Scalar Sensor Data,,Vidyasagar Sadhu;Teruhisa Misu;Dario Pompili;Vidyasagar Sadhu;Teruhisa Misu;Dario Pompili;,Rutgers University;Honda Research Institute;,United States;,Poster,https://ieeexplore.ieee.org/document/8967753/,,,
260,Deep Neural Network Approach in Electrical Impedance Tomography-based Real-time Soft Tactile Sensor,,Hyunkyu Park;Hyosang Lee;Kyungseo Park;Sangwoo Mo;Jung Kim;Hyunkyu Park;Hyosang Lee;Kyungseo Park;Sangwoo Mo;Jung Kim;,Korea Advanced Institute of Science and Technology;Max Planck Institute of Intelligent Systems;,South Korea;Germany;,Poster,https://ieeexplore.ieee.org/document/8968532/,,,
261,Deep Neural Network based Visual Inspection with 3D Metric Measurement of Concrete Defects using Wall-climbing Robot,,Liang Yang;Bing Li;Guoyong Yang;Yong Chang;Zhaoming Liu;Biao Jiang;Jizhong Xiaol;Liang Yang;Bing Li;Guoyong Yang;Yong Chang;Zhaoming Liu;Biao Jiang;Jizhong Xiaol;,Shenyang Institute of Automation;Clemson University;Chinese Academy of Sciences;Hostos Community College;,United States;China;,Poster,https://ieeexplore.ieee.org/document/8968195/,,,
262,Deep orientation: Fast and Robust Upper Body orientation Estimation for Mobile Robotic Applications,,Benjamin Lewandowski;Daniel Seichter;Tim Wengefeld;Lennard Pfennig;Helge Drumm;Horst-Michael Gross;Benjamin Lewandowski;Daniel Seichter;Tim Wengefeld;Lennard Pfennig;Helge Drumm;Horst-Michael Gross;,Technische Universität Ilmenau;,Germany;,Poster,https://ieeexplore.ieee.org/document/8968506/,,,
263,Deep Predictive Autonomous Driving Using Multi-Agent Joint Trajectory Prediction and Traffic Rules,,Kyunghoon Cho;Timothy Ha;Gunmin Lee;Songhwai Oh;Kyunghoon Cho;Timothy Ha;Gunmin Lee;Songhwai Oh;,Seoul National University;,South Korea;,Poster,https://ieeexplore.ieee.org/document/8967708/,,,
264,Deep Reinforcement Learning for Robotic Pushing and Picking in Cluttered Environment,,Yuhong Deng;Xiaofeng Guo;Yixuan Wei;Kai Lu;Bin Fang;Di Guo;Huaping Liu;Fuchun Sun;Yuhong Deng;Xiaofeng Guo;Yixuan Wei;Kai Lu;Bin Fang;Di Guo;Huaping Liu;Fuchun Sun;,Tsinghua University;,China;,Poster,https://ieeexplore.ieee.org/document/8967899/,,,
265,Deep Sensor Fusion for Real-Time Odometry Estimation,,Michelle Valente;Cyril Joly;Atnaud de La Fortelle;Michelle Valente;Cyril Joly;Atnaud de La Fortelle;,MINES ParisTech;,France;,Poster,https://ieeexplore.ieee.org/document/8967803/,,,
266,Deep Supervised Hashing with Similar Hierarchy for Place Recognition,,Lang Wu;Yihong Wu;Lang Wu;Yihong Wu;,Peking University;Chinese Academy of Sciences;University of Chinese Academy of Sciences;,China;,Poster,https://ieeexplore.ieee.org/document/8968599/,,,
267,DeepControl: Energy-Efficient Control of a Quadrotor using a Deep Neural Network,,Pratyush Varshney;Gajendra Nagar;Indranil Saha;Pratyush Varshney;Gajendra Nagar;Indranil Saha;,Indian Institute of Technology Kanpur;,India;,Poster,https://ieeexplore.ieee.org/document/8968236/,,,
268,DeepLocNet: Deep Observation Classification and Ranging Bias Regression for Radio Positioning Systems,,Sahib Singh Dhanjal;Maani Ghaffari;Ryan M. Eustice;Sahib Singh Dhanjal;Maani Ghaffari;Ryan M. Eustice;,University of Michigan;,United States;,Poster,https://ieeexplore.ieee.org/document/8967767/,,,
269,DeepPCO: End-to-End Point Cloud Odometry through Deep Parallel Neural Network,,Wei Wang;Muhamad Risqi U. Saputra;Peijun Zhao;Pedro Gusmao;Bo Yang;Changhao Chen;Andrew Markham;Niki Trigoni;Wei Wang;Muhamad Risqi U. Saputra;Peijun Zhao;Pedro Gusmao;Bo Yang;Changhao Chen;Andrew Markham;Niki Trigoni;,University of Oxford;,United Kingdom;,Poster,https://ieeexplore.ieee.org/document/8967756/,,,
270,DeepVIO: Self-supervised Deep Learning of Monocular Visual Inertial Odometry using 3D Geometric Constraints,,Liming Han;Yimin Lin;Guoguang Du;Shiguo Lian;Liming Han;Yimin Lin;Guoguang Du;Shiguo Lian;,CloudMinds Technologies Inc;,China;,Poster,https://ieeexplore.ieee.org/document/8968467/,,,
271,Degeneracy in Self-Calibration Revisited and a Deep Learning Solution for Uncalibrated SLAM,,Bingbing Zhuang;Quoc-Huy Tran;Gim Hee Lee;Loong Fah Cheong;Manmohan Chandraker;Bingbing Zhuang;Quoc-Huy Tran;Gim Hee Lee;Loong Fah Cheong;Manmohan Chandraker;,National University of Singapore;NEC Laboratories America;,Singapore;United States;,Poster,https://ieeexplore.ieee.org/document/8967912/,,,
272,Degeneracy-Aware Factors with Applications to Underwater SLAM,,Akshay Hinduja;Bing-Jui Ho;Michael Kaess;Akshay Hinduja;Bing-Jui Ho;Michael Kaess;,Carnegie Mellon University;Aptiv;,United States;,Poster,https://ieeexplore.ieee.org/document/8968577/,,,
273,Delivering Cognitive Behavioral Therapy Using A Conversational Social Robot,,Francesca Dino;Rohola Zandie;Hojjat Abdollahi;Sarah Schoeder;Mohammad H. Mahoor;Francesca Dino;Rohola Zandie;Hojjat Abdollahi;Sarah Schoeder;Mohammad H. Mahoor;,University of Denver;Eaton Senior Community;,United States;,Poster,https://ieeexplore.ieee.org/document/8968576/,,,
274,Dempster Shafer Grid-based Hybrid Fusion of Virtual Lanes for Autonomous Driving,,Ferit Uzer;Rachid Benmokhtar;Salma Moujtahid;Xavier Perrotton;Ferit Uzer;Rachid Benmokhtar;Salma Moujtahid;Xavier Perrotton;,Valeo Vision;,France;,Poster,https://ieeexplore.ieee.org/document/8967610/,,,
275,Dense 3D Reconstruction for Visual Tunnel Inspection using Unmanned Aerial Vehicle,,Ramanpreet Singh Pahwa;Kennard Yanting Chan;Jiamin Bai;Vincensius Billy Saputra;Minh N. Do;Shaohui Foong;Ramanpreet Singh Pahwa;Kennard Yanting Chan;Jiamin Bai;Vincensius Billy Saputra;Minh N. Do;Shaohui Foong;,Institute for Infocomm Research;Nanyang Technological University;University of Illinois Urbana-Champaign;Singapore University of Technology and Design;,Singapore;United States;,Poster,https://ieeexplore.ieee.org/document/8967577/,,,
276,"Dense, Sonar-based Reconstruction of Underwater Scenes",,Pedro V. Teixeira;Dehann Fourie;Michael Kaess;John J. Leonard;Pedro V. Teixeira;Dehann Fourie;Michael Kaess;John J. Leonard;,Massachusetts Institute of Technology;Carnegie Mellon University;,United States;,Poster,https://ieeexplore.ieee.org/document/8968071/,,,
277,DensePeds: Pedestrian Tracking in Dense Crowds Using Front-RVO and Sparse Features,,Rohan Chandra;Uttaran Bhattacharya;Aniket Bera;Dinesh Manocha;Rohan Chandra;Uttaran Bhattacharya;Aniket Bera;Dinesh Manocha;,University of Maryland;University of North Carolina;,United States;,Poster,https://ieeexplore.ieee.org/document/8968470/,,,
278,Design and Analysis of a New 3-DOF Active-Type Constant-Force Compliant Parallel Stage,,Xiaozhi Zhang;Qingsong Xu;Yuzhang Wei;Xiaozhi Zhang;Qingsong Xu;Yuzhang Wei;,University of Macau;,China;,Poster,https://ieeexplore.ieee.org/document/8968602/,,,
279,Design and Characterization of a Fully Autonomous Under-actuated Soft Batoid-like Robot,,T.V. Truong;V.K. Viswanathan;V.S. Joseph;P. Valdivia y Alvarado;T.V. Truong;V.K. Viswanathan;V.S. Joseph;P. Valdivia y Alvarado;,Singapore University of Technology and Design;,Singapore;,Poster,https://ieeexplore.ieee.org/document/8967999/,,,
280,Design and Comparative Analysis of 1D Hopping Robots,,Eric Ambrose;Noel Csomay-Shanklin;Yizhar Or;Aaron Ames;Eric Ambrose;Noel Csomay-Shanklin;Yizhar Or;Aaron Ames;,California Institute of Technology;Georgia Institute of Technology;Technion-Israel Institute of Technology;,United States;Israel;,Poster,https://ieeexplore.ieee.org/document/8967692/,,,
281,Design and Development of Compactly Folding Parallel Open-Close Gripper with Wide Stroke,,Akinari Kobayashi;Jun Kinugawa;Shogo Arai;Kazuhiro Kosuge;Akinari Kobayashi;Jun Kinugawa;Shogo Arai;Kazuhiro Kosuge;,Tohoku University;,Japan;,Poster,https://ieeexplore.ieee.org/document/8967838/,,,
282,Design and Implementation of a Contact Aerial Manipulator System for Glass-Wall Inspection Tasks,,Xiangdong Meng;Yuqing He;Jianda Han;Xiangdong Meng;Yuqing He;Jianda Han;,"Chinese Academy of Sciences;Shenyang Institute of Automation, Chinese Academy of Sciences;",China;,Poster,https://ieeexplore.ieee.org/document/8968123/,,,
283,Design and Take-Off Flight of a Samara-Inspired Revolving-Wing Robot,,Songnan Bai;Pakpong Chirarattananon;Songnan Bai;Pakpong Chirarattananon;,City University of Hong Kong;,China;,Poster,https://ieeexplore.ieee.org/document/8967600/,,,
284,Design and Verification of A Portable Master Manipulator Based on an Effective Workspace Analysis Framework,,Dandan Zhang;Jindong Liu;Lin Zhang;Guang-Zhong Yang;Dandan Zhang;Jindong Liu;Lin Zhang;Guang-Zhong Yang;,Imperial College London;,United Kingdom;,Poster,https://ieeexplore.ieee.org/document/8968542/,,,
285,Design of a 3-DOF Linkage-Driven Underactuated Finger for Multiple Grasping,,Long Kang;Jong-Tae Seo;Dukchan Yoon;Sang-Hwa Kim;Il Hong Suh;Byung-Ju Yi;Long Kang;Jong-Tae Seo;Dukchan Yoon;Sang-Hwa Kim;Il Hong Suh;Byung-Ju Yi;,Hanyang University;,South Korea;,Poster,https://ieeexplore.ieee.org/document/8968037/,,,
286,Design of a Ballistically-Launched Foldable Multirotor,,Daniel Pastor;Jacob Izraelevitz;Paul Nadan;Amanda Bouman;Joel Burdick;Brett Kennedy;Daniel Pastor;Jacob Izraelevitz;Paul Nadan;Amanda Bouman;Joel Burdick;Brett Kennedy;,California Institute of Technology;Olin College;,United States;,Poster,https://ieeexplore.ieee.org/document/8968549/,,,
287,Design of a Fail-Safe Wearable Robot with Novel Extendable Arms for Ergonomic Accommodation during Floor Work,,Katie S. Hahm;H. Harry Asada;Katie S. Hahm;H. Harry Asada;,Massachusetts Institute of Technology;,United States;,Poster,https://ieeexplore.ieee.org/document/8967956/,,,
288,Design of a Growing Robot Inspired by Plant Growth,,Tongxi Yan;Seiichi Teshigawara;H. Harry Asada;Tongxi Yan;Seiichi Teshigawara;H. Harry Asada;,Massachusetts Institute of Technology;,United States;,Poster,https://ieeexplore.ieee.org/document/8968200/,,,
289,Design of a Novel Gripper System with 3D- and Inkjet-printed Multimodal Sensors for Automated Grasping of a Forestry Robot,,Lisa-Marie Faller;Christian Stetco;Hubert Zangl;Lisa-Marie Faller;Christian Stetco;Hubert Zangl;,FH Kärnten;Alpen-Adria-Universität Klagenfurt;,Austria;,Poster,https://ieeexplore.ieee.org/document/8968134/,,,
290,Design of a Semi-Humanoid Telepresence Robot for Plant Disaster Response and Prevention,,Irvin Steve Cardenas;Jong-Hoon Kim;Irvin Steve Cardenas;Jong-Hoon Kim;,Kent State University;,United States;,Poster,https://ieeexplore.ieee.org/document/8967859/,,,
291,Design of an Adhesion-Aware Façade Cleaning Robot,,M. A. Viraj J. Muthugala;M. Vega-Heredia;A. Vengadesh;G. Sriharsha;Mohan Rajesh Elara;M. A. Viraj J. Muthugala;M. Vega-Heredia;A. Vengadesh;G. Sriharsha;Mohan Rajesh Elara;,Singapore University of Technology and Design;,Singapore;,Poster,https://ieeexplore.ieee.org/document/8967978/,,,
292,Design of Compact Variable Gravity Compensator (CVGC) Based on Cam and Variable Pivot of a Lever Mechanism,,Jehyeok Kim;Junyoung Moon;Jongwon Kim;Giuk Lee;Jehyeok Kim;Junyoung Moon;Jongwon Kim;Giuk Lee;,Seoul National University;Chung-Ang University;,South Korea;,Poster,https://ieeexplore.ieee.org/document/8967609/,,,
293,Design of Low-Profile Compliant Transmission Mechanisms,,Frederic H. Giraud;Zhenishbek Zhakypov;Jamie Paik;Frederic H. Giraud;Zhenishbek Zhakypov;Jamie Paik;,;Jamie Paik;,,Poster,https://ieeexplore.ieee.org/document/8967701/,,,
294,Design of Robot Leg with Variable Reduction Ratio Crossed Four-bar Linkage Mechanism,,Kohei Tomishiro;Ryuki Sato;Yasuji Harada;Aiguo Ming;Fei Meng;Huaxin Liu;Xuxiao Fan;Xuechao Chen;Zhangguo Yu;Qiang Huang;Kohei Tomishiro;Ryuki Sato;Yasuji Harada;Aiguo Ming;Fei Meng;Huaxin Liu;Xuxiao Fan;Xuechao Chen;Zhangguo Yu;Qiang Huang;,University of Electro-Communications;Nippon Veterinary and Life Science University;Beijing Advanced Innovation Center for Intelligent Robots and Systems;,Japan;China;,Poster,https://ieeexplore.ieee.org/document/8968034/,,,
295,Design of Soft Flexible Wire-driven Finger Mechanism for Contact Pressure Distribution,,Toshinori Hirose;Yohei Kakiuchi;Kei Okada;Masayuki Inaba;Toshinori Hirose;Yohei Kakiuchi;Kei Okada;Masayuki Inaba;,University of Tokyo;,Japan;,Poster,https://ieeexplore.ieee.org/document/8968011/,,,
296,"Design, Characterization, and Mechanical Programming of Fabric-Reinforced Textile Actuators for a Soft Robotic Hand",,Pham H. Nguyen;Francisco Lopez-Arellano;Wenlong Zhang;Panagiotis Polygerinos;Pham H. Nguyen;Francisco Lopez-Arellano;Wenlong Zhang;Panagiotis Polygerinos;,Arizona State University;,United States;,Poster,https://ieeexplore.ieee.org/document/8968497/,,,
297,"Design, Modeling and Control of Fully Actuated 2D Transformable Aerial Robot with 1 DoF Thrust Vectorable Link Module",,Tomoki Anzai;Moju Zhao;Masaki Murooka;Fan Shi;Kei Okada;Masayuki Inaba;Tomoki Anzai;Moju Zhao;Masaki Murooka;Fan Shi;Kei Okada;Masayuki Inaba;,University of Tokyo;,Japan;,Poster,https://ieeexplore.ieee.org/document/8967725/,,,
298,"Design, Modeling and Testing of a Flagellum-inspired Soft Underwater Propeller Exploiting Passive Elasticity",,Marcello Calisti;Francesco Giorgio-Serchi;Cesare Stefanini;Madiha Farman;Irfan Hussain;Costanza Armanini;Dongming Gan;Lakmal Seneviratne;Federico Renda;Marcello Calisti;Francesco Giorgio-Serchi;Cesare Stefanini;Madiha Farman;Irfan Hussain;Costanza Armanini;Dongming Gan;Lakmal Seneviratne;Federico Renda;,Scuola Superiore Sant’Anna;University of Edinburgh;Khalifa University of Science and Technology;,Italy;United Kingdom;United Arab Emirates;,Poster,https://ieeexplore.ieee.org/document/8967700/,,,
299,"Design, modelling and control of a novel agricultural robot with interlock drive system",,David Reiser;Volker Nannen;Gero Hubel;Hans W. Griepentrog;David Reiser;Volker Nannen;Gero Hubel;Hans W. Griepentrog;,University Hohenheim;Koblenz-Landau University;,Germany;,Poster,https://ieeexplore.ieee.org/document/8968449/,,,
300,DESK: A Robotic Activity Dataset for Dexterous Surgical Skills Transfer to Medical Robots,,Naveen Madapana;Md Masudur Rahman;Natalia Sanchez-Tamayo;Mythra V. Balakuntala;Glebys Gonzalez;Jyothsna Padmakumar Bindu;L. N. Vishnunandan Venkatesh;Xingguang Zhang;Juan Barragan Noguera;Thomas Low;Richard M. Voyles;Yexiang Xue;Juan Wachs;Naveen Madapana;Md Masudur Rahman;Natalia Sanchez-Tamayo;Mythra V. Balakuntala;Glebys Gonzalez;Jyothsna Padmakumar Bindu;L. N. Vishnunandan Venkatesh;Xingguang Zhang;Juan Barragan Noguera;Thomas Low;Richard M. Voyles;Yexiang Xue;Juan Wachs;,Purdue University;SRI International;,United States;,Poster,https://ieeexplore.ieee.org/document/8967760/,,,
301,Detecting layered structures of partially occluded objects for bin picking,,Yusuke Inagaki;Ryosuke Araki;Takayoshi Yamashita;Hironobu Fujiyoshi;Yusuke Inagaki;Ryosuke Araki;Takayoshi Yamashita;Hironobu Fujiyoshi;,Chubu University;,Japan;,Poster,https://ieeexplore.ieee.org/document/8968093/,,,
302,Development of a Continuous Vertical-pulling Automatic Doffing Robot for the Ring Spinning,,Wenzeng Zhang;Sicheng Yang;Chao Luo;Siyun Liu;Hong Fu;Wenzeng Zhang;Sicheng Yang;Chao Luo;Siyun Liu;Hong Fu;,Tsinghua University;,China;,Poster,https://ieeexplore.ieee.org/document/8967831/,,,
303,Development of a Location estimation System for Minute Sound Source by Using Human Acoustic System with Stochastic Resonance,,Katsuyoshi Tsujita;Katsuyoshi Tsujita;,,,Poster,https://ieeexplore.ieee.org/document/8968273/,,,
304,Development of a Navigation Algorithm for Optimal Path Planning for Autonomous Electric Vehicles,,Marco Dinges;Daniel Schilberg;Stephan Ciethier;Marco Dinges;Daniel Schilberg;Stephan Ciethier;,Bertrandt Ingenieurbüro GmbH;Hochschule Bochum;,Germany;,Poster,https://ieeexplore.ieee.org/document/8968036/,,,
305,Development of a Steel Bridge Climbing Robot,,Son Thanh Nguyen;Hung Manh La;Son Thanh Nguyen;Hung Manh La;,"University of Nevada, Reno;",United States;,Poster,https://ieeexplore.ieee.org/document/8967748/,,,
306,Development of Adjustable Knee Assist Device for Wearable Robot based on Linkage and Rolling Joint,,Byungiune Choi;Younbaek Lee;Jongwon Lee;Minhyung Lee;Bokman Lim;Young Jin Park;Kyungrock Kim;Yong-Jae Kim;Youngbo Shim;Byungiune Choi;Younbaek Lee;Jongwon Lee;Minhyung Lee;Bokman Lim;Young Jin Park;Kyungrock Kim;Yong-Jae Kim;Youngbo Shim;,Samsung;Korea University of Technology and Education;,South Korea;,Poster,https://ieeexplore.ieee.org/document/8967826/,,,
307,Development of an adaptive hexapod robot based on Follow-the-contact-point gait control and Timekeeper control,,Yuki Murata;Shinkichi Inagaki;Tatsuya Suzuki;Yuki Murata;Shinkichi Inagaki;Tatsuya Suzuki;,Nagoya University;,Japan;,Poster,https://ieeexplore.ieee.org/document/8968158/,,,
308,Development of an Arm Curl Machine with Variable Resistance Using Pneumatic Artificial Rubber Muscle,,Tomoya Nakanishi;Toshihiro Kawase;Junya Aizawa;Shintaro Yoshida;Shingo Ohno;Ryo Sakurai;Tetsuro Miyazaki;Takahiro Kanno;Kenji Kawashima;Tomoya Nakanishi;Toshihiro Kawase;Junya Aizawa;Shintaro Yoshida;Shingo Ohno;Ryo Sakurai;Tetsuro Miyazaki;Takahiro Kanno;Kenji Kawashima;,Tokyo Medical and Dental University;Bridgestone Corporation;,Japan;,Poster,https://ieeexplore.ieee.org/document/8968259/,,,
309,Development of an Autonomous Sanding Robot with Structured-Light Technology,,Yingxin Huo;Diancheng Chen;Xiang Li;Peng Li;Yun-Hui Liu;Yingxin Huo;Diancheng Chen;Xiang Li;Peng Li;Yun-Hui Liu;,Chinese University of Hong Kong;Tsinghua University;Harbin Institute of Technology;,China;,Poster,https://ieeexplore.ieee.org/document/8968067/,,,
310,Development of Flexible Dual-type Proximity Sensor with Resonant Frequency for Robotic Applications,,Taeseung Kim;Jiho Noh;Tien Dat Nguyen;Hyouk Ryeol Choi;Taeseung Kim;Jiho Noh;Tien Dat Nguyen;Hyouk Ryeol Choi;,Sungkyunkwan University;,South Korea;,Poster,https://ieeexplore.ieee.org/document/8967664/,,,
311,Development of Joint Module with Two-speed Gear Transmission and Joint Lock Mechanism during Driving for Task Adaptable Robot,,Tasuku Makabe;Takuma Shirai;Yuya Nagamatsu;Kento Kawaharazuka;Fumihito Sugai;Kei Okada;Masayuki Inaba;Tasuku Makabe;Takuma Shirai;Yuya Nagamatsu;Kento Kawaharazuka;Fumihito Sugai;Kei Okada;Masayuki Inaba;,University of Tokyo;,Japan;,Poster,https://ieeexplore.ieee.org/document/8968232/,,,
312,Development of Load Weight and Height Classifier in Lifting-Up Task Using Body Motion Metrics,,Naoya Ishibashi;Fumitake Fujii;Naoya Ishibashi;Fumitake Fujii;,Yamaguchi University;,Japan;,Poster,https://ieeexplore.ieee.org/document/8968289/,,,
313,Development of Micro Ultrasonic Actuator and Micro Rotor Blade for Micro Aerial Vehicle,,Eric Tan Kai Chiang;Tomoaki Mashimo;Eric Tan Kai Chiang;Tomoaki Mashimo;,Toyohashi University of Technology;,Japan;,Poster,https://ieeexplore.ieee.org/document/8968476/,,,
