Index,Title,Session/Area,Authors,Affiliation,Country,Status,Proceeding URL,PDF URL,CVF URL,Arxiv URL
1,“Anti-fatigue” control for over-actuated bionic arm with muscle force constraints,,Haiwei Dong;Setareh Yazdkhasti;Nadia Figueroa;Abdulmotaleb El Saddik;Haiwei Dong;Setareh Yazdkhasti;Nadia Figueroa;Abdulmotaleb El Saddik;,New York University;Al Ghurair University;University of Ottawa;,United Arab Emirates;Canada;,Poster,https://ieeexplore.ieee.org/document/6696373/,,,
2,"“You two! Take off!”: Creating, modifying and commanding groups of robots using face engagement and indirect speech in voice commands",,Shokoofeh Pourmehr;Valiallah Mani Monajjemi;Richard Vaughan;Greg Mori;Shokoofeh Pourmehr;Valiallah Mani Monajjemi;Richard Vaughan;Greg Mori;,Simon Fraser University;,Canada;,Poster,https://ieeexplore.ieee.org/document/6696344/,,,
3,1 MS tracking of target boundaries using contour propagation,,Niklas Bergström;Masatoshi Ishikawa;Niklas Bergström;Masatoshi Ishikawa;,University of Tokyo;,Japan;,Poster,https://ieeexplore.ieee.org/document/6696656/,,,
4,2-DOF synchronous electrostatic actuator with transparent electrodes arranged in checkerboard patterns,,Takuya Hosobata;Akio Yamamoto;Toshiro Higuchi;Takuya Hosobata;Akio Yamamoto;Toshiro Higuchi;,University of Tokyo;,Japan;,Poster,https://ieeexplore.ieee.org/document/6697066/,,,
5,3D motion estimation based on pitch and azimuth from respective camera and laser rangefinder sensing,,Van-Dung Hoang;Danilo Cáceres Hernández;My-Ha Le;Kang-Hyun Jo;Van-Dung Hoang;Danilo Cáceres Hernández;My-Ha Le;Kang-Hyun Jo;,University of Ulsan;,South Korea;,Poster,https://ieeexplore.ieee.org/document/6696433/,,,
6,3D path planning and execution for search and rescue ground robots,,Francis Colas;Srivatsa Mahesh;François Pomerleau;Ming Liu;Roland Siegwart;Francis Colas;Srivatsa Mahesh;François Pomerleau;Ming Liu;Roland Siegwart;,ETH Zurich;Eidgenossische Technische Hochschule Zurich;,Switzerland;,Poster,https://ieeexplore.ieee.org/document/6696431/,,,
7,3D perception for accurate row following: Methodology and results,,Ji Zhang;Andrew Chambers;Silvio Maeta;Marcel Bergerman;Sanjiv Singh;Ji Zhang;Andrew Chambers;Silvio Maeta;Marcel Bergerman;Sanjiv Singh;,Carnegie Mellon University;,United States;,Poster,https://ieeexplore.ieee.org/document/6697124/,,,
8,4DoF drift free navigation using inertial cues and optical flow,,Stephan Weiss;Roland Brockers;Larry Matthies;Stephan Weiss;Roland Brockers;Larry Matthies;,California Institute of Technology;,United States;,Poster,https://ieeexplore.ieee.org/document/6696955/,,,
9,6DOF iterative closest point matching considering a priori with maximum a posteriori estimation,,Yoshitaka Hara;Shigeru Bando;Takashi Tsuboucffl;Akira Oshima;Itaru Kitahara;Yoshinari Kameda;Yoshitaka Hara;Shigeru Bando;Takashi Tsuboucffl;Akira Oshima;Itaru Kitahara;Yoshinari Kameda;,University of Tsukuba;Doog Inc.;,Japan;,Poster,https://ieeexplore.ieee.org/document/6696954/,,,
10,A 3T2R parallel and partially decoupled kinematic architecture,,Matteo Malosio;Simone Pio Negri;Nicola Pedrocchi;Federico Vicentini;Lorenzo Molinari Tosatti;Matteo Malosio;Simone Pio Negri;Nicola Pedrocchi;Federico Vicentini;Lorenzo Molinari Tosatti;,University of Brescia;Italian National Research Council;,Italy;,Poster,https://ieeexplore.ieee.org/document/6696389/,,,
11,A 4-point algorithm for relative pose estimation of a calibrated camera with a known relative rotation angle,,Bo Li;Lionel Heng;Gim Hee Lee;Marc Pollefeys;Bo Li;Lionel Heng;Gim Hee Lee;Marc Pollefeys;,ETH Zurich;,Switzerland;,Poster,https://ieeexplore.ieee.org/document/6696562/,,,
12,A back-end L1 norm based solution for factor graph SLAM,,J. J Casafranca;L. M Paz;P. Piniés;J. J Casafranca;L. M Paz;P. Piniés;,Universidad de Zaragoza;,Spain;,Poster,https://ieeexplore.ieee.org/document/6696326/,,,
13,A bilinear formulation for the motion planning of non-holonomic parallel orienting platforms,,Patrick Grosch;Federico Thomas;Patrick Grosch;Federico Thomas;,Institut de Robotica i Informatica Industrial;,Spain;,Poster,https://ieeexplore.ieee.org/document/6696465/,,,
14,A case study of trajectory transfer through non-rigid registration for a simplified suturing scenario,,John Schulman;Ankush Gupta;Sibi Venkatesan;Mallory Tayson-Frederick;Pieter Abbeel;John Schulman;Ankush Gupta;Sibi Venkatesan;Mallory Tayson-Frederick;Pieter Abbeel;,"University of California, Berkeley;",United States;,Poster,https://ieeexplore.ieee.org/document/6696945/,,,
15,A communication-bandwidth-aware hybrid estimation framework for multi-robot cooperative localization,,Esha D. Nerurkar;Stergios I. Roumeliotis;Esha D. Nerurkar;Stergios I. Roumeliotis;,University of Minnesota;,United States;,Poster,https://ieeexplore.ieee.org/document/6696535/,,,
16,A comparison of scale estimation schemes for a quadrotor UAV based on optical flow and IMU measurements,,Volker Grabe;Heinrich H. Bülthoff;Paolo Robuffo Giordano;Volker Grabe;Heinrich H. Bülthoff;Paolo Robuffo Giordano;,Institute for Biological Cybernetics;Korea University;University of Rennes 1;,Germany;South Korea;France;,Poster,https://ieeexplore.ieee.org/document/6697107/,,,
17,A compliant humanoid walking strategy based on the switching of state feedback gravity compensation controllers,,Emmanouil Spyrakos-Papastavridis;Gustavo A. Medrano-Cerda;Nikos G. Tsagarakis;Jian S. Dai;Darwin G. Caldwell;Emmanouil Spyrakos-Papastavridis;Gustavo A. Medrano-Cerda;Nikos G. Tsagarakis;Jian S. Dai;Darwin G. Caldwell;,Istituto Italiano di Tecnologia;King's College London;,Italy;United Kingdom;,Poster,https://ieeexplore.ieee.org/document/6696874/,,,
18,A computationally efficient algorithm for state-to-state quadrocopter trajectory generation and feasibility verification,,Mark W. Mueller;Markus Hehn;Raffaello D'Andrea;Mark W. Mueller;Markus Hehn;Raffaello D'Andrea;,ETH Zurich;Eidgenossische Technische Hochschule Zurich;,Switzerland;,Poster,https://ieeexplore.ieee.org/document/6696852/,,,
19,A constraint-based strategy for task-consistent safe human-robot interaction,,Nicola Maria Ceriani;Andrea Maria Zanchettin;Paolo Rocco;Andreas Stolt;Anders Robertsson;Nicola Maria Ceriani;Andrea Maria Zanchettin;Paolo Rocco;Andreas Stolt;Anders Robertsson;,Politecnico di Milano;Lund University;,Italy;Sweden;,Poster,https://ieeexplore.ieee.org/document/6697022/,,,
20,A cooperatively controlled robot for ultrasound monitoring of radiation therapy,,H. Tutkun Sen;Muyinatu A. Lediju Bell;Iulian Iordachita;John Wong;Peter Kazanzides;H. Tutkun Sen;Muyinatu A. Lediju Bell;Iulian Iordachita;John Wong;Peter Kazanzides;,Johns Hopkins University;Johns Hopkins Hospital;,United States;,Poster,https://ieeexplore.ieee.org/document/6696791/,,,
21,A CPG-based locomotion control architecture for hexapod robot,,Haitao Yu;Wei Guo;Jing Deng;Mantian Li;Hegao Cai;Haitao Yu;Wei Guo;Jing Deng;Mantian Li;Hegao Cai;,Harbin Institute of Technology;,China;,Poster,https://ieeexplore.ieee.org/document/6697170/,,,
22,A data-driven kinematic model of the human hand with soft-tissue artifact compensation mechanism for grasp synergy analysis,,Marco Gabiccini;Georg Stillfried;Hamal Marino;Matteo Bianchi;Marco Gabiccini;Georg Stillfried;Hamal Marino;Matteo Bianchi;,Universita degli Studi di Pisa;German Aerospace Center;Istituto Italiano di Tecnologia;,Italy;Germany;,Poster,https://ieeexplore.ieee.org/document/6696890/,,,
23,A device for mimicking the contact force/contact area relationship of different materials with applications to softness rendering,,Alessandro Serio;Matteo Bianchi;Antonio Bicchi;Alessandro Serio;Matteo Bianchi;Antonio Bicchi;,Università di Pisa;,Italy;,Poster,https://ieeexplore.ieee.org/document/6697001/,,,
24,A disturbance observer for the sigma.7 haptic device,,Andreas Tobergte;Patrick Helmer;Andreas Tobergte;Patrick Helmer;,DLR-German Aerospace Center;Force Dimension;,Germany;Switzerland;,Poster,https://ieeexplore.ieee.org/document/6697073/,,,
25,A dynamic active constraints approach for hands-on robotic surgery,,Joshua G. Petersen;Ferdinando Rodriguez Baena;Joshua G. Petersen;Ferdinando Rodriguez Baena;,Imperial College London;,United Kingdom;,Poster,https://ieeexplore.ieee.org/document/6696617/,,,
26,A fast motion planning algorithm for car parking based on static optimization,,Patrik Zips;Martin Bock;Andreas Kugi;Patrik Zips;Martin Bock;Andreas Kugi;,Vienna University of Technology;,Austria;,Poster,https://ieeexplore.ieee.org/document/6696692/,,,
27,A fast multi-camera tracking system with heterogeneous lenses,,Xiaorong Zhao;Qingyi Gu;Tadayoshi Aoyama;Takeshi Takaki;Idaku Ishii;Xiaorong Zhao;Qingyi Gu;Tadayoshi Aoyama;Takeshi Takaki;Idaku Ishii;,Wuhan University of Technology;Idaku Ishii;,China;;,Poster,https://ieeexplore.ieee.org/document/6696733/,,,
28,A fast streaming spanner algorithm for incrementally constructing sparse roadmaps,,Weifu Wang;Devin Balkcom;Amit Chakrabarti;Weifu Wang;Devin Balkcom;Amit Chakrabarti;,Dartmouth College;,United States;,Poster,https://ieeexplore.ieee.org/document/6696511/,,,
29,A feed-forward neural network learning the inverse kinetics of a soft cable-driven manipulator moving in three-dimensional space,,Michele Giorelli;Federico Renda;Gabriele Ferri;Cecilia Laschi;Michele Giorelli;Federico Renda;Gabriele Ferri;Cecilia Laschi;,BioRobotics Institute;,Italy;,Poster,https://ieeexplore.ieee.org/document/6697084/,,,
30,A flying robot with adaptive morphology for multi-modal locomotion,,Ludovic Daler;Julien Lecoeur;Patrizia Bernadette Hählen;Dario Floreano;Ludovic Daler;Julien Lecoeur;Patrizia Bernadette Hählen;Dario Floreano;,EPFL;Ecole Polytechnique Federale de Lausanne;,Switzerland;,Poster,https://ieeexplore.ieee.org/document/6696526/,,,
31,A frequency domain iterative feed-forward learning scheme for high performance periodic quadrocopter maneuvers,,Markus Hehn;Raffaello D'Andrea;Markus Hehn;Raffaello D'Andrea;,ETH Zurich;Eidgenossische Technische Hochschule Zurich;,Switzerland;,Poster,https://ieeexplore.ieee.org/document/6696700/,,,
32,A gain-scheduling approach to model human simultaneous visual tracking and balancing,,Adina M. Panchea;Nacim Ramdani;Philippe Fraisse;Sukyung Park;Adina M. Panchea;Nacim Ramdani;Philippe Fraisse;Sukyung Park;,ENSI de Bourges;University of Montpellier;Korea Advanced Institute of Science and Technology;,France;South Korea;,Poster,https://ieeexplore.ieee.org/document/6696577/,,,
33,A general tactile approach for grasping unknown objects with a humanoid robot,,Philipp Mittendorfer;Eichii Yoshida;Thomas Moulard;Gordon Cheng;Philipp Mittendorfer;Eichii Yoshida;Thomas Moulard;Gordon Cheng;,Technische Universität München;CNRS-AIST Joint Robotics Laboratory;,Germany;Japan;,Poster,https://ieeexplore.ieee.org/document/6697040/,,,
34,A global control scheme for free-floating vehicle-manipulators,,Olivier Kermorgant;Yvan Pétillot;Matt Dunnigan;Olivier Kermorgant;Yvan Pétillot;Matt Dunnigan;,INRIA;Heriot-Watt University;,France;United Kingdom;,Poster,https://ieeexplore.ieee.org/document/6697081/,,,
35,A hybrid algorithm for coverage path planning with imperfect sensors,,Michael Morin;Irène Abi-Zeid;Yvan Petillot;Claude-Guy Quimper;Michael Morin;Irène Abi-Zeid;Yvan Petillot;Claude-Guy Quimper;,Université Laval;Heriot-Watt University;,Canada;United Kingdom;,Poster,https://ieeexplore.ieee.org/document/6697225/,,,
36,A jumping robotic insect based on a torque reversal catapult mechanism,,Je-sung Koh;Sun-pil Jung;Robert J. Wood;Kyu-jin Cho;Je-sung Koh;Sun-pil Jung;Robert J. Wood;Kyu-jin Cho;,Seoul National University;Harvard University;,South Korea;United States;,Poster,https://ieeexplore.ieee.org/document/6696899/,,,
37,A large-area tactile force sensor for measuring ground reaction forces from small legged robots,,Shivam S. Desai;Asa M. Eckert-Erdheim;Aaron M. Hoover;Shivam S. Desai;Asa M. Eckert-Erdheim;Aaron M. Hoover;,Olin College of Engineering;,United States;,Poster,https://ieeexplore.ieee.org/document/6697041/,,,
38,A learning-based approach to robust binaural sound localization,,Karim Youssef;Sylvain Argentieri;Jean-Luc Zarader;Karim Youssef;Sylvain Argentieri;Jean-Luc Zarader;,CNRS;,France;,Poster,https://ieeexplore.ieee.org/document/6696771/,,,
39,A learning-free method for anthropomorphic grasping,,David Flavigné;Véronique Perdereau;David Flavigné;Véronique Perdereau;,Université Pierre et Marie Curie;,France;,Poster,https://ieeexplore.ieee.org/document/6696779/,,,
40,A lightweight modular 12-DOF print-and-fold hexapod,,Daniel E. Soltero;Brian J. Julian;Cagdas D. Onal;Daniela Rus;Daniel E. Soltero;Brian J. Julian;Cagdas D. Onal;Daniela Rus;,Massachusetts Institute of Technology;Worcester Polytechnic Institute;,United States;,Poster,https://ieeexplore.ieee.org/document/6696542/,,,
41,A methodology for testing mobile autonomous robots,,Jannik Laval;Luc Fabresse;Noury Bouraqadi;Jannik Laval;Luc Fabresse;Noury Bouraqadi;,Mines-Telecom Institute;,France;,Poster,https://ieeexplore.ieee.org/document/6696599/,,,
42,A minimal set of coordinates for describing humanoid shoulder motion,,David Ingram;Christoph Engelhardt;Alain Farron;Alexandre Terrier;Philippe Müllhaupt;David Ingram;Christoph Engelhardt;Alain Farron;Alexandre Terrier;Philippe Müllhaupt;,Ecole Polytechnique Federale de Lausanne;University Hospital Center and University of Lausanne;,Switzerland;,Poster,https://ieeexplore.ieee.org/document/6697159/,,,
43,A modally adaptive control for multi-contact cyclic motions in compliantly actuated robotic systems,,Dominic Lakatos;Martin Görner;Florian Petit;Alexander Dietrich;Alin Albu-Schäffer;Dominic Lakatos;Martin Görner;Florian Petit;Alexander Dietrich;Alin Albu-Schäffer;,German Aerospace Center;,Germany;,Poster,https://ieeexplore.ieee.org/document/6697136/,,,
44,A model-based approach to software deployment in robotics,,Nico Hochgeschwender;Luca Gherardi;Azamat Shakhirmardanov;Gerhard K. Kraetzschmar;Davide Brugali;Herman Bruyninckx;Nico Hochgeschwender;Luca Gherardi;Azamat Shakhirmardanov;Gerhard K. Kraetzschmar;Davide Brugali;Herman Bruyninckx;,Bonn-Rhine-Sieg University of Applied Sciences;University of Bergamo;Katholieke Universiteit;,Germany;Italy;Belgium;,Poster,https://ieeexplore.ieee.org/document/6696915/,,,
45,A modified impedance control for physical interaction of UAVs,,Matteo Fumagalli;Raffaella Carloni;Matteo Fumagalli;Raffaella Carloni;,University of Twente;,Netherlands;,Poster,https://ieeexplore.ieee.org/document/6696619/,,,
46,A modular actuator with translational motion along an arc,,Arthur E. Quaid;Arthur E. Quaid;,"Vivero One Research, LLC;",United States;,Poster,https://ieeexplore.ieee.org/document/6697065/,,,
47,A modular aerial vehicle with redundant actuation,,Roberto Naldi;Alessio Riccó;Andrea Serrani;Lorenzo Marconi;Roberto Naldi;Alessio Riccó;Andrea Serrani;Lorenzo Marconi;,Università di Bologna;Ohio State University;,Italy;United States;,Poster,https://ieeexplore.ieee.org/document/6696531/,,,
48,A multiple-camera system calibration toolbox using a feature descriptor-based calibration pattern,,Bo Li;Lionel Heng;Kevin Koser;Marc Pollefeys;Bo Li;Lionel Heng;Kevin Koser;Marc Pollefeys;,ETH Zurich;,Switzerland;,Poster,https://ieeexplore.ieee.org/document/6696517/,,,
49,A near-to-far non-parametric learning approach for estimating traversability in deformable terrain,,Ken Ho;Thierry Peynot;Salah Sukkarieh;Ken Ho;Thierry Peynot;Salah Sukkarieh;,University of Sydney;,Australia;,Poster,https://ieeexplore.ieee.org/document/6696756/,,,
50,A novel (3T-1R) redundant parallel mechanism with large operational workspace and rotational capability,,Samah Shayya;Sébastien Krut;Olivier Company;Cédric Baradat;François Pierrot;Samah Shayya;Sébastien Krut;Olivier Company;Cédric Baradat;François Pierrot;,"TECNALIA;Olivier Company;Montpellier Laboratory of Informatics, Robotics, and Microelectronics;",France;;,Poster,https://ieeexplore.ieee.org/document/6696388/,,,
51,A novel comanipulation device for assisting needle placement in ultrasound guided prostate biopsies,,C. Poquet;P. Mozer;G. Morel;M.-A. Vitrani;C. Poquet;P. Mozer;G. Morel;M.-A. Vitrani;,UPMC Univ. Paris 06;Institut des Sciences de l'Ingénierie de Robotique (ISIR);,France;,Poster,https://ieeexplore.ieee.org/document/6696941/,,,
52,A novel flexure-based dual-arm robotic system for high-throughput biomanipulations on micro-fluidic chip,,Hui Tang;Yangmin Li;Xiao Xiao;Hui Tang;Yangmin Li;Xiao Xiao;,University of Macau;,China;,Poster,https://ieeexplore.ieee.org/document/6696552/,,,
53,A novel hand posture recognition system based on sparse representation using color and depth images,,Dan Xu;Yen-Lun Chen;Xinyu Wu;Wei Feng;Huihuan Qian;Yangsheng Xu;Dan Xu;Yen-Lun Chen;Xinyu Wu;Wei Feng;Huihuan Qian;Yangsheng Xu;,Chinese Academy of Sciences;Chinese University of Hong Kong;,China;,Poster,https://ieeexplore.ieee.org/document/6696894/,,,
54,A novel method for capsule endoscopy video automatic segmentation,,Ran Zhou;Baopu Li;Hongmei Zhu;Max Q.-H Meng;Ran Zhou;Baopu Li;Hongmei Zhu;Max Q.-H Meng;,Chinese Academy of Sciences;Chinese University of Hong Kong;,China;,Poster,https://ieeexplore.ieee.org/document/6696795/,,,
55,A novel time optimal path following controller with bounded velocities for mobile robots with independently steerable wheels,,Reza Oftadeh;Reza Ghabcheloo;Jouni Mattila;Reza Oftadeh;Reza Ghabcheloo;Jouni Mattila;,Tampere University of Technology;,Finland;,Poster,https://ieeexplore.ieee.org/document/6697055/,,,
56,A novel underactuated wire-driven robot fish with vector propulsion,,Zheng Li;Yong Zhong;Ruxu Du;Zheng Li;Yong Zhong;Ruxu Du;,Chinese University of Hong Kong;Guangzhou Institute of Advanced Technology;,China;,Poster,https://ieeexplore.ieee.org/document/6696463/,,,
57,A particle filter for hybrid relational domains,,Davide Nitti;Tinne De Laet;Luc De Raedt;Davide Nitti;Tinne De Laet;Luc De Raedt;,Katholieke Universiteit Leuven;KU Leuven;,Belgium;,Poster,https://ieeexplore.ieee.org/document/6696747/,,,
58,A practical approach to generalized hierarchical task specification for indirect force controlled robots,,Ewald Lutscher;Gordon Cheng;Ewald Lutscher;Gordon Cheng;,Technische Universität München;,Germany;,Poster,https://ieeexplore.ieee.org/document/6696601/,,,
59,A pragmatic bio-inspired approach to the design of octopus-inspired arms,,Emanuele Guglielmino;Isuru Godage;Letizia Zullo;Darwin G. Caldwell;Emanuele Guglielmino;Isuru Godage;Letizia Zullo;Darwin G. Caldwell;,Istituto Italiano di Tecnologia;,Italy;,Poster,https://ieeexplore.ieee.org/document/6697014/,,,
60,A projection-based sensor system for safe physical human-robot collaboration,,Christian Vogel;Christoph Walter;Norbert Elkmann;Christian Vogel;Christoph Walter;Norbert Elkmann;,Fraunhofer Institute for Factory Operation and Automation IFF;,Germany;,Poster,https://ieeexplore.ieee.org/document/6697132/,,,
61,A real time and robust facial expression recognition and imitation approach for affective human-robot interaction using Gabor filtering,,Felipe Cid;José Augusto Prado;Pablo Bustos;Pedro Núñez;Felipe Cid;José Augusto Prado;Pablo Bustos;Pedro Núñez;,University of Extremadura;University of Coimbra;,Spain;Portugal;,Poster,https://ieeexplore.ieee.org/document/6696662/,,,
62,A roadwork scene signature based on the opponent colour model,,Bonolo Mathibela;Ingmar Posner;Paul Newman;Bonolo Mathibela;Ingmar Posner;Paul Newman;,University of West Bohemia;;,Czech Republic;;,Poster,https://ieeexplore.ieee.org/document/6696987/,,,
63,A robust and modular multi-sensor fusion approach applied to MAV navigation,,Simon Lynen;Markus W. Achtelik;Stephan Weiss;Margarita Chli;Roland Siegwart;Simon Lynen;Markus W. Achtelik;Stephan Weiss;Margarita Chli;Roland Siegwart;,ETH Zurich;NASA Jet Propulsion Laboratory;,Switzerland;United States;,Poster,https://ieeexplore.ieee.org/document/6696917/,,,
64,A robust model-based tracker combining geometrical and color edge information,,Antoine Petit;Eric Marchand;Keyvan Kanani;Antoine Petit;Eric Marchand;Keyvan Kanani;,INRIA Rennes-Bretagne Atlantique;IRISA;Astrium;,France;,Poster,https://ieeexplore.ieee.org/document/6696887/,,,
65,A robust sagittal plane hexapedal running model with serial elastic actuation and simple periodic feedforward control,,Martin Görner;Alin Albu-Schäffer;Martin Görner;Alin Albu-Schäffer;,German Aerospace Center;,Germany;,Poster,https://ieeexplore.ieee.org/document/6697166/,,,
66,A robust sonar servo control scheme for wall-following using an autonomous underwater vehicle,,George C. Karras;Charalampos P. Bechlioulis;Hashim Kemal Abdella;Tom Larkworthy;Kostas Kyriakopoulos;David Lane;George C. Karras;Charalampos P. Bechlioulis;Hashim Kemal Abdella;Tom Larkworthy;Kostas Kyriakopoulos;David Lane;,National Technical University of Athens;Heriot-Watt University;,Greece;United Kingdom;,Poster,https://ieeexplore.ieee.org/document/6696913/,,,
67,A robust visual servo control scheme with prescribed performance for an autonomous underwater vehicle,,Charalampos P. Bechlioulis;George C. Karras;Sharad Nagappa;Narc´is Palomeras;Kostas J. Kyriakopoulos;Marc Carreras;Charalampos P. Bechlioulis;George C. Karras;Sharad Nagappa;Narc´is Palomeras;Kostas J. Kyriakopoulos;Marc Carreras;,National Technical University of Athens;University of Girona;,Greece;Spain;,Poster,https://ieeexplore.ieee.org/document/6696911/,,,
68,A series elastic actuator as a new load-sensitive continuously variable transmission mechanism for control actuation systems,,Görkem Seçer;Efe Uzel;Görkem Seçer;Efe Uzel;,Middle East Technical University;Roketsan Roket Sanayii ve Ticaret AS;,Türkiye;,Poster,https://ieeexplore.ieee.org/document/6697206/,,,
69,A simulator environment for aerial service robot prototypes,,Roberto Naldi;Alessandro Macchelli;Dario Mengoli;Lorenzo Marconi;Roberto Naldi;Alessandro Macchelli;Dario Mengoli;Lorenzo Marconi;,University of Bologna;,Italy;,Poster,https://ieeexplore.ieee.org/document/6696607/,,,
70,A snake-like robot incorporating translational and rotation degrees of freedom,,Richard Primerano;Alexander Pietrocola;Marco Janko;Richard Primerano;Alexander Pietrocola;Marco Janko;,Federal University of Santa Maria;Michigan Technological University;,Brazil;United States;,Poster,https://ieeexplore.ieee.org/document/6696822/,,,
71,A spherical cross-channel algorithm for binaural sound localization,,Carlos Viña;Sylvain Argentieri;Marc Rébillat;Carlos Viña;Sylvain Argentieri;Marc Rébillat;,UPMC University Paris 06;,France;,Poster,https://ieeexplore.ieee.org/document/6696770/,,,
72,A static intrinsically passive controller to enhance grasp stability of object-based mapping between human and robotic hands,,G. Salvietti;T. Wimböck;D. Prattichizzo;G. Salvietti;T. Wimböck;D. Prattichizzo;,Istituto Italiano di Tecnologia;German Aerospace Center (DLR);,Italy;Germany;,Poster,https://ieeexplore.ieee.org/document/6696702/,,,
73,A study on the finite-time near-optimality properties of sampling-based motion planners,,Andrew Dobson;Kostas E. Bekris;Andrew Dobson;Kostas E. Bekris;,Rutgers University;,United States;,Poster,https://ieeexplore.ieee.org/document/6696508/,,,
74,A transfer learning approach for multi-cue semantic place recognition,,Gabriele Costante;Thomas A. Ciarfuglia;Paolo Valigi;Elisa Ricci;Gabriele Costante;Thomas A. Ciarfuglia;Paolo Valigi;Elisa Ricci;,University of Perugia;,Italy;,Poster,https://ieeexplore.ieee.org/document/6696653/,,,
75,A two party haptic guidance controller via a hard rein,,Anuradha Ranasinghe;Jacques Penders;Prokar Dasgupta;Kaspar Althoefer;Thrishantha Nanayakkara;Anuradha Ranasinghe;Jacques Penders;Prokar Dasgupta;Kaspar Althoefer;Thrishantha Nanayakkara;,Centre for Robotic Research;Sheffield Hallam University;King's College London;,United Kingdom;,Poster,https://ieeexplore.ieee.org/document/6696341/,,,
76,A unified visual graph-based approach to navigation for wheeled mobile robots,,Jan Hartmann;Jan Helge Klüssendorff;Erik Maehle;Jan Hartmann;Jan Helge Klüssendorff;Erik Maehle;,University of Lübeck;,Germany;,Poster,https://ieeexplore.ieee.org/document/6696610/,,,
77,A user interface for assistive grasping,,Jonathan Weisz;Carmine Elvezio;Peter K. Allen;Jonathan Weisz;Carmine Elvezio;Peter K. Allen;,Columbia University;,United States;,Poster,https://ieeexplore.ieee.org/document/6696813/,,,
78,A virtual reality system for robotic-assisted orthopedic rehabilitation of forearm and elbow fractures,,Miguel A. Padilla-Castañeda;Edoardo Sotgiu;Antonio Frisoli;Massimo Bergamasco;Piero Orsini;Alessandro Martiradonna;Samuele Olivieri;Gloria Mazzinghi;Cristina Laddaga;Miguel A. Padilla-Castañeda;Edoardo Sotgiu;Antonio Frisoli;Massimo Bergamasco;Piero Orsini;Alessandro Martiradonna;Samuele Olivieri;Gloria Mazzinghi;Cristina Laddaga;,Perceptual Robotics Laboratory (PERCRO);Adult Rehabilitation Centre “Luciana Segenni”;,Italy;,Poster,https://ieeexplore.ieee.org/document/6696548/,,,
79,A visibility information for multi-robot localization,,Rémy Guyonneau;Sébastien Lagrange;Laurent Hardouin;Rémy Guyonneau;Sébastien Lagrange;Laurent Hardouin;,Universite d'Angers;University of Angers;,France;,Poster,https://ieeexplore.ieee.org/document/6696536/,,,
80,"A waypoint-based framework in brain-controlled smart home environments: Brain interfaces, domotics, and robotics integration",,Atsunori Kanemura;Yoichi Morales;Motoaki Kawanabe;Hiroshi Morioka;Nagasrikanth Kallakuri;Tetsushi Ikeda;Takahiro Miyashita;Norihiro Hagita;Shin Ishii;Atsunori Kanemura;Yoichi Morales;Motoaki Kawanabe;Hiroshi Morioka;Nagasrikanth Kallakuri;Tetsushi Ikeda;Takahiro Miyashita;Norihiro Hagita;Shin Ishii;,Advanced Telecommunications Research Institute International;,Japan;,Poster,https://ieeexplore.ieee.org/document/6696452/,,,
81,A wing characterization method for flapping-wing robotic insects,,Alexis Lussier Desbiens;Yufeng Chen;Robert J. Wood;Alexis Lussier Desbiens;Yufeng Chen;Robert J. Wood;,Harvard University;,United States;,Poster,https://ieeexplore.ieee.org/document/6696527/,,,
