Index,Title,Session/Area,Authors,Affiliation,Country,Status,Proceeding URL,PDF URL,CVF URL,Arxiv URL
640,Online Active Safety for Robotic Manipulators,,Andrew Singletary;Petter Nilsson;Thomas Gurriet;Aaron D. Ames;Andrew Singletary;Petter Nilsson;Thomas Gurriet;Aaron D. Ames;,California Institute of Technology;,United States;,Poster,https://ieeexplore.ieee.org/document/8968231/,,,
641,Online and Consistent Occupancy Grid Mapping for Planning in Unknown Environments,,Paloma Sodhi;Bing-Jui Ho;Michael Kaess;Paloma Sodhi;Bing-Jui Ho;Michael Kaess;,Carnegie Mellon University;Aptiv;,United States;,Poster,https://ieeexplore.ieee.org/document/8967991/,,,
642,Online Motion Planning Over Multiple Homotopy Classes with Gaussian Process Inference,,Keshav Kolur;Sahit Chintalapudi;Byron Boots;Mustafa Mukadam;Keshav Kolur;Sahit Chintalapudi;Byron Boots;Mustafa Mukadam;,Georgia Institute of Technology;,United States;,Poster,https://ieeexplore.ieee.org/document/8967598/,,,
643,Online Optimal Impedance Planning for Legged Robots,,Franco Angelini;Guiyang Xin;Wouter J. Wolfslag;Carlo Tiseo;Michael Mistry;Manolo Garabini;Antonio Bicchi;Sethu Vijayakumar;Franco Angelini;Guiyang Xin;Wouter J. Wolfslag;Carlo Tiseo;Michael Mistry;Manolo Garabini;Antonio Bicchi;Sethu Vijayakumar;,Università di Pisa;University of Edinburgh;,Italy;United Kingdom;,Poster,https://ieeexplore.ieee.org/document/8967696/,,,
644,Online Performance Prediction and Profiling of Human Activities by Observation,,Emmanouil Hourdakis;Michail Maniadakis;Panos Trahanias;Emmanouil Hourdakis;Michail Maniadakis;Panos Trahanias;,Foundation for Research and Technology - Hellas;,Greece;,Poster,https://ieeexplore.ieee.org/document/8967707/,,,
645,Online Planning for Autonomous Underwater Vehicles Performing Information Gathering Tasks in Large Subsea Environments,,Harun Yetkin;James McMahon;Nicholay Topin;Artur Wolek;Zachary Waters;Daniel J. Stilwell;Harun Yetkin;James McMahon;Nicholay Topin;Artur Wolek;Zachary Waters;Daniel J. Stilwell;,Bartin University;US Naval Research Laboratory;University of Maryland;Virginia Tech;,Türkiye;United States;,Poster,https://ieeexplore.ieee.org/document/8967898/,,,
646,Online Relative Footstep Optimization for Legged Robots Dynamic Walking Using Discrete-Time Model Predictive Control,,Songyan Xin;Romeo Orsolino;Nikos Tsagarakis;Songyan Xin;Romeo Orsolino;Nikos Tsagarakis;,Istituto Italiano di Tecnologia;,Italy;,Poster,https://ieeexplore.ieee.org/document/8968028/,,,
647,Online System Identification Algorithm without Persistent Excitation for Robotic Systems: Application to Reconfigurable Autonomous Vessels,,Erkan Kayacan;Shinkyu Park;Carlo Ratti;Daniela Rus;Erkan Kayacan;Shinkyu Park;Carlo Ratti;Daniela Rus;,University of Queensland;Massachusetts Institute of Technology;,Australia;United States;,Poster,https://ieeexplore.ieee.org/document/8968461/,,,
648,Online Trajectory Generation of a MAV for Chasing a Moving Target in 3D Dense Environments,,Boseong Felipe Jeon;H. Jin Kim;Boseong Felipe Jeon;H. Jin Kim;,Seoul National University;,South Korea;,Poster,https://ieeexplore.ieee.org/document/8967840/,,,
649,Online Trajectory Generation: Reactive Control With Return Inside an Admissible Kinematic Domain,,Kevin Desormeaux;Daniel Sidobre;Kevin Desormeaux;Daniel Sidobre;,CNRS;,France;,Poster,https://ieeexplore.ieee.org/document/8968266/,,,
650,Operation of a pneumatic soft manipulator using a wearable interface with flexible strain sensors,,Hiroki Hagihara;Shuichi Wakimoto;Takefumi Kanda;Shota Furukawa;Hiroki Hagihara;Shuichi Wakimoto;Takefumi Kanda;Shota Furukawa;,Okayama University;,Japan;,Poster,https://ieeexplore.ieee.org/document/8967870/,,,
651,Operational Space Control Framework for Torque Controlled Humanoid Robots with Joint Elasticity,,Jaesug Jung;Donghyeon Kim;Jaeheung Park;Jaesug Jung;Donghyeon Kim;Jaeheung Park;,Seoul National University;,South Korea;,Poster,https://ieeexplore.ieee.org/document/8967613/,,,
652,Optical Coherence Tomography Guided Robotic Device for Autonomous Needle Insertion in Cornea Transplant Surgery,,S. Guo;N.R. Sarfaraz;W. Gensheimer;A. Krieger;J. U. Kang;S. Guo;N.R. Sarfaraz;W. Gensheimer;A. Krieger;J. U. Kang;,"Johns Hopkins University;University of Maryland, College Park;Malcolm Grow Medical Clinics and Surgery Center;",United States;,Poster,https://ieeexplore.ieee.org/document/8968193/,,,
653,Optimal Solving of Constrained Path-Planning Problems with Graph Convolutional Networks and Optimized Tree Search,,Kevin Osanlou;Andrei Bursuc;Christophe Guettier;Tristan Cazenave;Eric Jacopin;Kevin Osanlou;Andrei Bursuc;Christophe Guettier;Tristan Cazenave;Eric Jacopin;,Safran Electronics & Defense;Valeo;Paris-Dauphine University;CREC Saint-Cyr;,France;,Poster,https://ieeexplore.ieee.org/document/8968113/,,,
654,Optimal Temporal Logic Planning for Multi-Robot Systems in Uncertain Semantic Maps,,Yiannis Kantaros;George J. Pappas;Yiannis Kantaros;George J. Pappas;,University of Pennsylvania;,United States;,Poster,https://ieeexplore.ieee.org/document/8968547/,,,
655,Optimal temporal logic planning with cascading soft constraints,,Hazhar Rahmani;Jason M. O’Kane;Hazhar Rahmani;Jason M. O’Kane;,University of South Carolina;,United States;,Poster,https://ieeexplore.ieee.org/document/8968261/,,,
656,Optimization Based Motion Planning for Multi-Limbed Vertical Climbing Robots,,Xuan Lin;Jingwen Zhang;Junjie Shen;Gabriel Fernandez;Dennis W Hong;Xuan Lin;Jingwen Zhang;Junjie Shen;Gabriel Fernandez;Dennis W Hong;,"University of California, Los Angeles;",United States;,Poster,https://ieeexplore.ieee.org/document/8968032/,,,
657,Optimization based Trajectory Planning of Mobile Cable-Driven Parallel Robots,,Tahir Rasheed;Philip Long;Adolfo Suarez Roos;Stéphane Caro;Tahir Rasheed;Philip Long;Adolfo Suarez Roos;Stéphane Caro;,École Centrale de Nantes;Northeastern University;IRT Jules Verne;CNRS;,France;United States;,Poster,https://ieeexplore.ieee.org/document/8968133/,,,
658,optimization Model for Planning Precision Grasps with Multi-Fingered Hands,,Yongxiang Fan;Xinghao Zhu;Masayoshi Tomizuka;Yongxiang Fan;Xinghao Zhu;Masayoshi Tomizuka;,"University of California, Berkeley;",United States;,Poster,https://ieeexplore.ieee.org/document/8967560/,,,
659,optimizing Motion-Planning Problem Setup via Bounded Evaluation with Application to Following Surgical Trajectories,,Sherdil Niyaz;Alan Kuntz;Oren Salzman;Ron Alterovitz;Siddhartha S. Srinivasa;Sherdil Niyaz;Alan Kuntz;Oren Salzman;Ron Alterovitz;Siddhartha S. Srinivasa;,University of Washington;University of North Carolina;Carnegie Mellon University;,United States;,Poster,https://ieeexplore.ieee.org/document/8968575/,,,
660,"Orbit Characterization, Stabilization and Composition on 3D Underactuated Bipedal Walking via Hybrid Passive Linear Inverted Pendulum Model",,Xiaobin Xiong;Aaron D. Ames;Xiaobin Xiong;Aaron D. Ames;,California Institute of Technology;,United States;,Poster,https://ieeexplore.ieee.org/document/8968162/,,,
661,ORBSLAM-Atlas: a robust and accurate multi-map system,,Richard Elvira;Juan D. Tardós;J.M.M. Montiel;Richard Elvira;Juan D. Tardós;J.M.M. Montiel;,Universidad de Zaragoza;,Spain;,Poster,https://ieeexplore.ieee.org/document/8967572/,,,
662,OREOS: Oriented Recognition of 3D Point Clouds in Outdoor Scenarios,,Lukas Schaupp;Mathias Bürki;Renaud Dubé;Roland Siegwart;Cesar Cadena;Lukas Schaupp;Mathias Bürki;Renaud Dubé;Roland Siegwart;Cesar Cadena;,ETH Zurich;,Switzerland;,Poster,https://ieeexplore.ieee.org/document/8968094/,,,
663,Outlier-Robust Manifold Pre-Integration for INS/GPS Fusion,,Shin-Fang Ch’ng;Alireza Khosravian;Anh-Dzung Doan;Tat-Jun Chin;Shin-Fang Ch’ng;Alireza Khosravian;Anh-Dzung Doan;Tat-Jun Chin;,University of Adelaide;,Australia;,Poster,https://ieeexplore.ieee.org/document/8967643/,,,
664,"Outlier-Robust Spatial Perception: Hardness, General-Purpose Algorithms, and Guarantees",,Vasileios Tzoumas;Pasquale Antonante;Luca Carlone;Vasileios Tzoumas;Pasquale Antonante;Luca Carlone;,Massachusetts Institute of Technology;,United States;,Poster,https://ieeexplore.ieee.org/document/8968174/,,,
665,Outlier-Robust State Estimation for Humanoid Robots,,Stylianos Piperakis;Dimitrios Kanoulas;Nikos G. Tsagarakis;Panos Trahanias;Stylianos Piperakis;Dimitrios Kanoulas;Nikos G. Tsagarakis;Panos Trahanias;,Foundation for Research and Technology - Hellas;Istituto Italiano di Tecnologia;,Greece;Italy;,Poster,https://ieeexplore.ieee.org/document/8968152/,,,
666,PanopticFusion: Online Volumetric Semantic Mapping at the Level of Stuff and Things,,Gaku Narita;Takashi Seno;Tomoya Ishikawa;Yohsuke Kaji;Gaku Narita;Takashi Seno;Tomoya Ishikawa;Yohsuke Kaji;,Sony Corporation;,Japan;,Poster,https://ieeexplore.ieee.org/document/8967890/,,,
667,Paper-based modular origami gripper,,Ratchatida Phummapooti;Natthanicha Jamroonpan;Pongsakorn Polchankajorn;Eakkachai Pengwang;Thavida Maneewarn;Ratchatida Phummapooti;Natthanicha Jamroonpan;Pongsakorn Polchankajorn;Eakkachai Pengwang;Thavida Maneewarn;,King Mongkut’s University of Technology Thonburi;,Thailand;,Poster,https://ieeexplore.ieee.org/document/8967781/,,,
668,Partial Caging: A Clearance-Based Definition and Deep Learning,,Anastasiia Varava;Michael C. Welle;Jeffrey Mahler;Ken Goldberg;Danica Kragic;Florian T. Pokomy;Anastasiia Varava;Michael C. Welle;Jeffrey Mahler;Ken Goldberg;Danica Kragic;Florian T. Pokomy;,"KTH Royal Institute of Technology;University of California, Berkeley;",Sweden;United States;,Poster,https://ieeexplore.ieee.org/document/8967958/,,,
669,PASS3D: Precise and Accelerated Semantic Segmentation for 3D Point Cloud,,Xin Kong;Guangyao Zhai;Baoquan Zhong;Yong Liu;Xin Kong;Guangyao Zhai;Baoquan Zhong;Yong Liu;,Zhejiang University;,China;,Poster,https://ieeexplore.ieee.org/document/8968296/,,,
670,Passive Inverted Ultra-Short Baseline (piUSBL) Localization: An Experimental Evaluation of Accuracy,,Nicholas R. Rypkema;Henrik Schmidt;Nicholas R. Rypkema;Henrik Schmidt;,Massachusetts Institute of Technology;,United States;,Poster,https://ieeexplore.ieee.org/document/8967800/,,,
671,Passive Model Reduction and Switching for Fast Soft Object Simulation with Intermittent Contacts,,Jaemin Yoon;Ilkwon Hong;Dongjun Lee;Jaemin Yoon;Ilkwon Hong;Dongjun Lee;,Seoul National University;,South Korea;,Poster,https://ieeexplore.ieee.org/document/8968132/,,,
672,Path Planning for Surgery Robot with Bidirectional Continuous Tree Search and Neural Network,,Rui-Jian Huang;Gui-Bin Bian;Chen Xin;Zhen Li;Zeng-Guang Hou;Rui-Jian Huang;Gui-Bin Bian;Chen Xin;Zhen Li;Zeng-Guang Hou;,"Institute of Automation, Chinese Academy of Sciences;Beijing Tongren Hospital;",China;,Poster,https://ieeexplore.ieee.org/document/8968153/,,,
673,Path planning with Incremental Roadmap Update for Visibility-based Target Tracking,,Guillermo J. Laguna;Sourabh Bhattacharya;Guillermo J. Laguna;Sourabh Bhattacharya;,Iowa State University;,United States;,Poster,https://ieeexplore.ieee.org/document/8967602/,,,
674,PD based Robust Quadratic Programs for Robotic Systems,,Shishir Kolathaya;Sushant Veer;Shishir Kolathaya;Sushant Veer;,Indian Institute of Science;Princeton University;,India;United States;,Poster,https://ieeexplore.ieee.org/document/8968214/,,,
675,Pedestrian Density Prediction for Efficient Mobile Robot Exploration,,Marc Patrick Zapf;Motoaki Kawanabe;Luis Yoichi Morales Saiki;Marc Patrick Zapf;Motoaki Kawanabe;Luis Yoichi Morales Saiki;,Bosch (China) Investment Co. Ltd.;Advanced Telecommunications Research Institute International;Nagoya University;,China;Japan;,Poster,https://ieeexplore.ieee.org/document/8967763/,,,
676,People’s V-Formation and Side-by-Side Model Adapted to Accompany Groups of People by Social Robots,,Ely Repiso;Francesco Zanlungo;Takayuki Kanda;Anaís Garrell;Alberto Sanfeliu;Ely Repiso;Francesco Zanlungo;Takayuki Kanda;Anaís Garrell;Alberto Sanfeliu;,Robòtica i Informàtica Industrial;ATR Intelligent Robotics Laboratories;,Spain;Japan;,Poster,https://ieeexplore.ieee.org/document/8968601/,,,
677,Perception as prediction using general value functions in autonomous driving applications,,Daniel Graves;Kasra Rezaee;Sean Scheideman;Daniel Graves;Kasra Rezaee;Sean Scheideman;,Huawei;University of Alberta;,Canada;,Poster,https://ieeexplore.ieee.org/document/8968293/,,,
678,Perception of Pedestrian Avoidance Strategies of a Self-Balancing Mobile Robot,,Shih-Yun Lo;Katsu Yamane;Ken-ichiro Sugiyama;Shih-Yun Lo;Katsu Yamane;Ken-ichiro Sugiyama;,University of Texas at Austin;Honda Research Institute USA;Honda R&D Life Creation Center;,United States;Japan;,Poster,https://ieeexplore.ieee.org/document/8968191/,,,
679,"Perception System Design for Low-Cost Commercial Ground Robots: Sensor Configurations, Calibration, Localization and Mapping",,Yiming Chen;Mingming Zhang;Dongsheng Hong;Chengcheng Deng;Mingyang Li;Yiming Chen;Mingming Zhang;Dongsheng Hong;Chengcheng Deng;Mingyang Li;,Alibaba A.I. Labs;,China;,Poster,https://ieeexplore.ieee.org/document/8968078/,,,
680,Performance Guarantees for Receding Horizon Search with Terminal Cost,,Benjamin Biggs;Daniel J. Stilwell;Harun Yetkin;James McMahon;Benjamin Biggs;Daniel J. Stilwell;Harun Yetkin;James McMahon;,Virginia Tech;Bart?n University;US Naval Research Laboratory;,United States;Türkiye;,Poster,https://ieeexplore.ieee.org/document/8968202/,,,
681,Periodic Trajectory Planning and Robust Output Zeroing Control for Underactuated Bipedal Robots with Predicted Disturbances,,Rin Takano;Junho Chang;Masaki Yamakita;Rin Takano;Junho Chang;Masaki Yamakita;,Tokyo Institute of Technology;,Japan;,Poster,https://ieeexplore.ieee.org/document/8967765/,,,
682,Permanent Magnets based Actuator for Microrobots Navigation,,Manel Abbes;Karim Belharet;Hassen Mekki;Gerard Poisson;Manel Abbes;Karim Belharet;Hassen Mekki;Gerard Poisson;,University of Sousse;Hautes Etudes Études d’Ingénieur;University of Orléans;,Tunisia;France;,Poster,https://ieeexplore.ieee.org/document/8968558/,,,
683,Person-following for Telepresence Robots Using Web Cameras,,Xianda Cheng;Yunde Jia;Jingyu Su;Yuwei Wu;Xianda Cheng;Yunde Jia;Jingyu Su;Yuwei Wu;,Beijing Institute of Technology;,China;,Poster,https://ieeexplore.ieee.org/document/8967645/,,,
684,Physical Fatigue Analysis of Assistive Robot Teleoperation via Whole-body Motion Mapping,,Tsung-Chi Lin;Achyuthan Unni Krishnan;Zhi Li;Tsung-Chi Lin;Achyuthan Unni Krishnan;Zhi Li;,Worcester Polytechnic Institute;,United States;,Poster,https://ieeexplore.ieee.org/document/8968544/,,,
685,Piecewise Rigid Scene Flow with Implicit Motion Segmentation,,Andreas Görlitz;Jonas Geiping;Andreas Kolb;Andreas Görlitz;Jonas Geiping;Andreas Kolb;,University of Siegen;,Germany;,Poster,https://ieeexplore.ieee.org/document/8968018/,,,
686,Pixel-Attentive Policy Gradient for Multi-Fingered Grasping in Cluttered Scenes,,Bohan Wu;Iretiayo Akinola;Peter K. Allen;Bohan Wu;Iretiayo Akinola;Peter K. Allen;,Columbia University;,United States;,Poster,https://ieeexplore.ieee.org/document/8968263/,,,
687,Pixels to Plans: Learning Non-Prehensile Manipulation by Imitating a Planner,,Tarik Tosun;Eric Mitchell;Ben Eisner;Jinwook Huh;Bhoram Lee;Daewon Lee;Volkan Isler;H. Sebastian Seung;Daniel Lee;Tarik Tosun;Eric Mitchell;Ben Eisner;Jinwook Huh;Bhoram Lee;Daewon Lee;Volkan Isler;H. Sebastian Seung;Daniel Lee;,Samsung;,United States;,Poster,https://ieeexplore.ieee.org/document/8968224/,,,
688,Planning Beyond The Sensing Horizon Using a Learned Context,,Michael Everett;Justin Miller;Jonathan P. How;Michael Everett;Justin Miller;Jonathan P. How;,Massachusetts Institute of Technology;Ford Motor Company;,United States;,Poster,https://ieeexplore.ieee.org/document/8967550/,,,
689,Planning High-Quality Motions for Concentric Tube Robots in Point Clouds via Parallel Sampling and optimization,,Alan Kuntz;Mengyu Fu;Ron Alterovitz;Alan Kuntz;Mengyu Fu;Ron Alterovitz;,University of North Carolina at Chapel Hill;,United States;,Poster,https://ieeexplore.ieee.org/document/8968172/,,,
690,Planning in Stochastic Environments with Goal Uncertainty,,Sandhya Saisubramanian;Kyle Hollins Wray;Luis Pineda;Shlomo Zilberstein;Sandhya Saisubramanian;Kyle Hollins Wray;Luis Pineda;Shlomo Zilberstein;,University of Massachusetts Amherst;,United States;,Poster,https://ieeexplore.ieee.org/document/8967718/,,,
691,Planning Reactive Manipulation in Dynamic Environments,,Philipp S. Schmitt;Florian Wirnshofer;Kai M. Wurm;Georg v. Wichert;Wolfram Burgard;Philipp S. Schmitt;Florian Wirnshofer;Kai M. Wurm;Georg v. Wichert;Wolfram Burgard;,Siemens AG;University of Freiburg;,Germany;,Poster,https://ieeexplore.ieee.org/document/8968452/,,,
692,"Plasticity in Collective Decision-Making for Robots: Creating Global Reference Frames, Detecting Dynamic Environments, and Preventing Lock-ins",,Mohammad Divband Soorati;Maximilian Krome;Marco Mora-Mendoza;Javad Ghofrani;Heiko Hamann;Mohammad Divband Soorati;Maximilian Krome;Marco Mora-Mendoza;Javad Ghofrani;Heiko Hamann;,University of Southampton;University of Lübeck;Stanford University;Dresden University of Applied Sciences;,United Kingdom;Germany;United States;,Poster,https://ieeexplore.ieee.org/document/8967777/,,,
693,PnS: a Perspective-n-Spheres Algorithm for Laparoscope Calibration in Minimally Invasive Surgery,,Mario Aricò;Guillaume Morel;Mario Aricò;Guillaume Morel;,CNRS;,France;,Poster,https://ieeexplore.ieee.org/document/8968486/,,,
694,Policy Distillation and Value Matching in Multiagent Reinforcement Learning,,Samir Wadhwania;Dong-Ki Kim;Shayegan Omidshafiei;Jonathan P. How;Samir Wadhwania;Dong-Ki Kim;Shayegan Omidshafiei;Jonathan P. How;,Massachusetts Institute of Technology;,United States;,Poster,https://ieeexplore.ieee.org/document/8967849/,,,
695,Pose Estimation for Omni-directional Cameras using Sinusoid Fitting,,Haofei Kuang;Qingwen Xu;Xiaoling Long;Sören Schwertfeger;Haofei Kuang;Qingwen Xu;Xiaoling Long;Sören Schwertfeger;,ShanghaiTech University;,China;,Poster,https://ieeexplore.ieee.org/document/8968087/,,,
696,Pose-Aware Placement of Objects with Semantic Labels - Brandname-based Affordance Prediction and Cooperative Dual-Arm Active Manipulation,,Yung-Shan Su;Shao-Huang Lu;Po-Sheng Ser;Wei-Ting Hsu;Wei-Cheng Lai;Biao Xie;Hong-Ming Huang;Teng-Yok Lee;Hung-Wen Chen;Lap-Fai Yu;Hsueh-Cheng Wang;Yung-Shan Su;Shao-Huang Lu;Po-Sheng Ser;Wei-Ting Hsu;Wei-Cheng Lai;Biao Xie;Hong-Ming Huang;Teng-Yok Lee;Hung-Wen Chen;Lap-Fai Yu;Hsueh-Cheng Wang;,National Chiao Tung University;University of Massachusetts at Boston;Mitsubishi Electric Research Laboratories;Delta Research Center;George Mason University;,China;United States;,Poster,https://ieeexplore.ieee.org/document/8967755/,,,
697,Position-based monocular visual servoing of an unknown target using online self-supervised learning,,Chungkeun Lee;Hoseong Seo;H. Jin Kim;Chungkeun Lee;Hoseong Seo;H. Jin Kim;,Seoul National University;,South Korea;,Poster,https://ieeexplore.ieee.org/document/8968216/,,,
698,PPR-Net:Point-wise Pose Regression Network for Instance Segmentation and 6D Pose Estimation in Bin-picking Scenarios,,Zhikai Dong;Sicheng Liu;Tao Zhou;Hui Cheng;Long Zeng;Xingyao Yu;Houde Liu;Zhikai Dong;Sicheng Liu;Tao Zhou;Hui Cheng;Long Zeng;Xingyao Yu;Houde Liu;,Tsinghua University;SenseTime;Sun Yat-sen University;,China;,Poster,https://ieeexplore.ieee.org/document/8967895/,,,
699,Precise Correntropy-based 3D Object Modelling With Geometrical Traffic Prior,,Di Wang;Jianru Xue;Wei Zhan;Yinghan Jin;Nanning Zheng;Masayoshi Tomizuka;Di Wang;Jianru Xue;Wei Zhan;Yinghan Jin;Nanning Zheng;Masayoshi Tomizuka;,"Xi'an Jiao Tong University;University of California, Berkeley;Zhejiang University;",China;United States;,Poster,https://ieeexplore.ieee.org/document/8967589/,,,
700,Precision Modeling and Optimally-safe Design of Quadcopters for Controlled Crash Landing in Case of Rotor Failure,,Mojtaba Hedayatpour;Mehran Mehrandezh;Farrokh Janabi-Sharifi;Mojtaba Hedayatpour;Mehran Mehrandezh;Farrokh Janabi-Sharifi;,Ryerson University;,Canada;,Poster,https://ieeexplore.ieee.org/document/8968099/,,,
701,Precision Pouring into Unknown Containers by Service Robots,,Chenyu Dong;Masaru Takizawa;Shunsuke Kudoh;Takashi Suehiro;Chenyu Dong;Masaru Takizawa;Shunsuke Kudoh;Takashi Suehiro;,University of Electro-Communications;,Japan;,Poster,https://ieeexplore.ieee.org/document/8967911/,,,
702,Predicting Grasp Success with a Soft Sensing Skin and Shape-Memory Actuated Gripper,,Julian Zimmer;Tess Hellebrekers;Tamim Asfour;Carmel Majidi;Oliver Kroemer;Julian Zimmer;Tess Hellebrekers;Tamim Asfour;Carmel Majidi;Oliver Kroemer;,Karlsruhe Institute of Technology;Carnegie Mellon University;,Germany;United States;,Poster,https://ieeexplore.ieee.org/document/8967558/,,,
703,Prediction of Human Arm Target for Robot Reaching Movements,,Chiara Talignani Landi;Yujiao Cheng;Federica Ferraguti;Marcello Bonfè;Cristian Secchi;Masayoshi Tomizuka;Chiara Talignani Landi;Yujiao Cheng;Federica Ferraguti;Marcello Bonfè;Cristian Secchi;Masayoshi Tomizuka;,"University of Modena and Reggio Emilia;University of California, Berkeley;University of Ferrara;",Italy;United States;,Poster,https://ieeexplore.ieee.org/document/8968559/,,,
704,Predictive and adaptive maps for long-term visual navigation in changing environments,,Lucie Halodová;Eliška Dvořráková;Filip Majer;Tomáš Vintr;Oscar Martinez Mozos;Feras Dayoub;Tomáš Krajník;Lucie Halodová;Eliška Dvořráková;Filip Majer;Tomáš Vintr;Oscar Martinez Mozos;Feras Dayoub;Tomáš Krajník;,Czech Technical University;Technical University of Cartagena;Queensland University of Technology;,Czech Republic;Spain;Australia;,Poster,https://ieeexplore.ieee.org/document/8967994/,,,
705,Predictive Inverse Kinematics: optimizing Future Trajectory through Implicit Time Integration and Future Jacobian Estimation,,Ko Ayusawa;Wael Suleiman;Eiichi Yoshida;Ko Ayusawa;Wael Suleiman;Eiichi Yoshida;,National Institute of Advanced Industrial Science and Technology;University of Sherbrooke;,Japan;Canada;,Poster,https://ieeexplore.ieee.org/document/8968110/,,,
706,Preliminary Evaluation of an Orbital Camera for Teleoperation of Remote Manipulators,,Mohammed Talha;Rustam Stolkin;Mohammed Talha;Rustam Stolkin;,University of Birmingham;,United Kingdom;,Poster,https://ieeexplore.ieee.org/document/8968218/,,,
707,Printing-while-moving: a new paradigm for large-scale robotic 3D Printing,,Mehmet Efe Tiryaki;Xu Zhang;Quang-Cuong Pham;Mehmet Efe Tiryaki;Xu Zhang;Quang-Cuong Pham;,,,Poster,https://ieeexplore.ieee.org/document/8967524/,,,
708,Privacy-Preserving Robot Vision with Anonymized Faces by Extreme Low Resolution,,Myeung Un Kim;Harim Lee;Hyun Jong Yang;Michael S. Ryoo;Myeung Un Kim;Harim Lee;Hyun Jong Yang;Michael S. Ryoo;,Ulsan National Institute of Science and Technology;Egovid Inc.;,South Korea;,Poster,https://ieeexplore.ieee.org/document/8967681/,,,
709,Proposal of a Peristaltic Motion Type Duct Cleaning Robot for Traveling in a Flexible Pipe,,F. Ito;T. Kawaguchi;M. Kamata;Y. Yamada;T. Nakamura;F. Ito;T. Kawaguchi;M. Kamata;Y. Yamada;T. Nakamura;,Chuo University;Tokyo Denki University;,Japan;,Poster,https://ieeexplore.ieee.org/document/8967648/,,,
710,Proto-object based saliency for event-driven cameras,,Massimiliano Iacono;Giulia D’Angelo;Arren Glover;Vadim Tikhanoff;Ernst Niebur;Chiara Bartolozzi;Massimiliano Iacono;Giulia D’Angelo;Arren Glover;Vadim Tikhanoff;Ernst Niebur;Chiara Bartolozzi;,Istituto Italiano di Tecnologia;,Italy;,Poster,https://ieeexplore.ieee.org/document/8967943/,,,
711,Quickly Inserting Pegs into Uncertain Holes using Multi-view Images and Deep Network Trained on Synthetic Data,,Joshua C. Triyonoputro;Weiwei Wan;Kensuke Harada;Joshua C. Triyonoputro;Weiwei Wan;Kensuke Harada;,Osaka University;,Japan;,Poster,https://ieeexplore.ieee.org/document/8968072/,,,
712,Radar Localization and Mapping for Indoor Disaster Environments via Multi-modal Registration to Prior LiDAR Map,,Yeong Sang Park;Joowan Kim;Ayoung Kim;Yeong Sang Park;Joowan Kim;Ayoung Kim;,KAIST;,South Korea;,Poster,https://ieeexplore.ieee.org/document/8967633/,,,
713,"Range-limited, Distributed Algorithms on Higher-Order Voronoi Partitions in Multi-Robot Systems",,Lingxuan Kong;Qingchen Liu;Changbin Brad Yu;Lingxuan Kong;Qingchen Liu;Changbin Brad Yu;,Curtin University;Technical University of Munich;,Australia;Germany;,Poster,https://ieeexplore.ieee.org/document/8968501/,,,
714,RangeNet ++: Fast and Accurate LiDAR Semantic Segmentation,,Andres Milioto;Ignacio Vizzo;Jens Behley;Cyrill Stachniss;Andres Milioto;Ignacio Vizzo;Jens Behley;Cyrill Stachniss;,University of Bonn;,Germany;,Poster,https://ieeexplore.ieee.org/document/8967762/,,,
715,Rapid and Robust Monocular Visual-Inertial Initialization with Gravity Estimation via Vertical Edges,,Jinyu Li;Hujun Bao;Guofeng Zhang;Jinyu Li;Hujun Bao;Guofeng Zhang;,Zhejiang University;,China;,Poster,https://ieeexplore.ieee.org/document/8968456/,,,
716,Rapid Collision Detection for Multicopter Trajectories,,Nathan Bucki;Mark W. Mueller;Nathan Bucki;Mark W. Mueller;,"University of California, Berkeley;",United States;,Poster,https://ieeexplore.ieee.org/document/8968098/,,,
717,Rapid Design of Mechanical Logic Based on Quasi-Static Electromechanical Modeling,,Wenzhong Yan;Yunchen Yu;Ankur Mehta;Wenzhong Yan;Yunchen Yu;Ankur Mehta;,"University of California, Los Angeles;",United States;,Poster,https://ieeexplore.ieee.org/document/8967964/,,,
718,Rapid Estimation of Optical Properties for Simulation-Based Evaluation of Pose Estimation Performance,,Thorbjørn Mosekjær Iversen;Jakob Wilm;Dirk Kraft;Thorbjørn Mosekjær Iversen;Jakob Wilm;Dirk Kraft;,University of Southern Denmark;,Denmark;,Poster,https://ieeexplore.ieee.org/document/8967553/,,,
