Index,Title,Session/Area,Authors,Affiliation,Country,Status,Proceeding URL,PDF URL,CVF URL,Arxiv URL
1033,React to This! How Humans Challenge Interactive Agents using Nonverbal Behaviors,,Chuxuan Zhang;Bermet Burkanova;Lawrence H. Kim;Lauren Yip;Ugo Cupcic;Stéphane Lallée;Angelica Lim;Chuxuan Zhang;Bermet Burkanova;Lawrence H. Kim;Lauren Yip;Ugo Cupcic;Stéphane Lallée;Angelica Lim;,Simon Fraser University;Spoon AI;,Canada;France;,Poster,https://ieeexplore.ieee.org/document/10801673/,,,
1034,Reactive Temporal Logic-based Planning and Control for Interactive Robotic Tasks,,Farhad Nawaz;Shaoting Peng;Lars Lindemann;Nadia Figueroa;Nikolai Matni;Farhad Nawaz;Shaoting Peng;Lars Lindemann;Nadia Figueroa;Nikolai Matni;,University of Pennsylvania;University of Southern California;,United States;,Poster,https://ieeexplore.ieee.org/document/10802335/,,,
1035,Real-time Bandwidth-efficient Occupancy Grid Map Synchronization for Multi-Robot Systems,,Liuyu Shi;Longji Yin;Fanze Kong;Yunfan Ren;Fangcheng Zhu;Benxu Tang;Fu Zhang;Liuyu Shi;Longji Yin;Fanze Kong;Yunfan Ren;Fangcheng Zhu;Benxu Tang;Fu Zhang;,University of Hong Kong;,China;,Poster,https://ieeexplore.ieee.org/document/10802281/,,,
1036,Real-time Bird’s-Eye-View Panoptic Segmentation for Monocular-based Indoor Navigation,,Dawit Kim;Jungmo Koo;Jongseob Yun;Soonyong Park;Dawit Kim;Jungmo Koo;Jongseob Yun;Soonyong Park;,NAVER LABS;,South Korea;,Poster,https://ieeexplore.ieee.org/document/10802038/,,,
1037,Real-time Coordinated Motion Generation: A Hierarchical Deep Predictive Learning Model for Bimanual Tasks,,Genki Shikada;Simon Armleder;Hiroshi Ito;Gordon Cheng;Tetsuya Ogata;Genki Shikada;Simon Armleder;Hiroshi Ito;Gordon Cheng;Tetsuya Ogata;,Waseda University;Technical University of Munich;National Institute of Advanced Industrial Science and Technology;,Japan;Germany;,Poster,https://ieeexplore.ieee.org/document/10801317/,,,
1038,Real-time Coupled Centroidal Motion and Footstep Planning for Biped Robots,,Tara Bartlett;Ian R. Manchester;Tara Bartlett;Ian R. Manchester;,,,Poster,https://ieeexplore.ieee.org/document/10802557/,,,
1039,Real-time Dexterous Telemanipulation with an End-Effect-Oriented Learning-based Approach,,Haoyang Wang;He Bai;Xiaoli Zhang;Yunsik Jung;Michel Bowman;Lingfeng Tao;Haoyang Wang;He Bai;Xiaoli Zhang;Yunsik Jung;Michel Bowman;Lingfeng Tao;,Oklahoma State University;Colorado School of Mines;University of Pennsylvania;,United States;,Poster,https://ieeexplore.ieee.org/document/10801694/,,,
1040,Real-time Hazard Prediction in Connected Autonomous Vehicles: A Digital Twin Approach,,Sergio Barroso;Noé Zapata;Gerardo Pérez;Pablo Bustos;Pedro Núñez;Sergio Barroso;Noé Zapata;Gerardo Pérez;Pablo Bustos;Pedro Núñez;,University of Extremadura;,Spain;,Poster,https://ieeexplore.ieee.org/document/10802333/,,,
1041,Real-Time Horizon Locking on Unmanned Surface Vehicles,,Benjamin Kiefer;Andreas Zell;Benjamin Kiefer;Andreas Zell;,University of Tuebingen;,Germany;,Poster,https://ieeexplore.ieee.org/document/10801836/,,,
1042,Real-Time Path Generation and Alignment Control for Autonomous Curb Following,,Yuanzhe Wang;Yunxiang Dai;Danwei Wang;Yuanzhe Wang;Yunxiang Dai;Danwei Wang;,Nanyang Technological University;,Singapore;,Poster,https://ieeexplore.ieee.org/document/10801832/,,,
1043,Real-time Perceptive Motion Control using Control Barrier Functions with Analytical Smoothing for Six-Wheeled-Telescopic-Legged Robot Tachyon 3,,Noriaki Takasugi;Masaya Kinoshita;Yasuhisa Kamikawa;Ryoichi Tsuzaki;Atsushi Sakamoto;Toshimitsu Kai;Yasunori Kawanami;Noriaki Takasugi;Masaya Kinoshita;Yasuhisa Kamikawa;Ryoichi Tsuzaki;Atsushi Sakamoto;Toshimitsu Kai;Yasunori Kawanami;,Sony Group Corporation;,Japan;,Poster,https://ieeexplore.ieee.org/document/10802375/,,,
1044,Real-time Robotic Flexible Needle Insertion In Deformable Living Organs Using Isolated Objective Constraint,,Thuc Long Ha;Julien Bert;Hadrien Courtecuisse;Thuc Long Ha;Julien Bert;Hadrien Courtecuisse;,University of Strasbourg;Institut National de la Santé et de la Recherche Médicale (INSERM);,France;,Poster,https://ieeexplore.ieee.org/document/10802810/,,,
1045,Real-Time Semantic Segmentation in Natural Environments with SAM-assisted Sim-to-Real Domain Transfer,,Han Wang;Ruben Mascaro;Margarita Chli;Lucas Teixeira;Han Wang;Ruben Mascaro;Margarita Chli;Lucas Teixeira;,ETH Zurich;,Switzerland;,Poster,https://ieeexplore.ieee.org/document/10801798/,,,
1046,Real-time terrain assessment and Bayesian-based path planning for off-road navigation,,Tianwei Niu;Shuwei Yu;Liang Wang;Haoyu Yuan;Shoukun Wang;Junzheng Wang;Tianwei Niu;Shuwei Yu;Liang Wang;Haoyu Yuan;Shoukun Wang;Junzheng Wang;,Beijing Institute of Technology;;,China;;,Poster,https://ieeexplore.ieee.org/document/10802161/,,,
1047,Real-Time Truly-Coupled Lidar-Inertial Motion Correction and Spatiotemporal Dynamic Object Detection,,Cedric Le Gentil;Raphael Falque;Teresa Vidal-Calleja;Cedric Le Gentil;Raphael Falque;Teresa Vidal-Calleja;,University of Technology Sydney;,Australia;,Poster,https://ieeexplore.ieee.org/document/10802233/,,,
1048,Realistic Rainy Weather Simulation for LiDARs in CARLA Simulator,,Donglin Yang;Xinyu Cai;Zhenfeng Liu;Wentao Jiang;Bo Zhang;Guohang Yan;Xing Gao;Si Liu;Botian Shi;Donglin Yang;Xinyu Cai;Zhenfeng Liu;Wentao Jiang;Bo Zhang;Guohang Yan;Xing Gao;Si Liu;Botian Shi;,Shanghai Artificial Intelligence Laboratory;Nankai University;Beihang University;,China;,Poster,https://ieeexplore.ieee.org/document/10802036/,,,
1049,Reality Fusion: Robust Real-time Immersive Mobile Robot Teleoperation with Volumetric Visual Data Fusion,,Ke Li;Reinhard Bacher;Susanne Schmidt;Wim Leemans;Frank Steinicke;Ke Li;Reinhard Bacher;Susanne Schmidt;Wim Leemans;Frank Steinicke;,Hamburg University;Deutsche Elektronen Synchrotron DESY;,Germany;,Poster,https://ieeexplore.ieee.org/document/10802431/,,,
1050,Reconfigurable Multi-Rotor for High-Precision Physical Interaction,,Joshua Taylor;Nursultan Imanberdiyev;Meng Yee Michael Chuah;Wei-Yun Yau;Guillaume Sartoretti;Efe Camci;Joshua Taylor;Nursultan Imanberdiyev;Meng Yee Michael Chuah;Wei-Yun Yau;Guillaume Sartoretti;Efe Camci;,Institute for Infocomm Research;National University of Singapore;,Singapore;,Poster,https://ieeexplore.ieee.org/document/10802586/,,,
1051,Reconfigurable Soft Gripper Based on Eversion and Electroadhesion for Cluttered Environments,,Dana Ragab;Elizabeth Rendon-Morales;Kaspar Althoefer;Hareesh Godaba;Dana Ragab;Elizabeth Rendon-Morales;Kaspar Althoefer;Hareesh Godaba;,University of Sussex;Queen Mary University of London;,United Kingdom;,Poster,https://ieeexplore.ieee.org/document/10802690/,,,
1052,Recover: A Neuro-Symbolic Framework for Failure Detection and Recovery,,Cristina Cornelio;Mohammed Diab;Cristina Cornelio;Mohammed Diab;,Samsung;University of Plymouth;,United Kingdom;,Poster,https://ieeexplore.ieee.org/document/10801853/,,,
1053,Recurrent Non-Rigid Point Cloud Registration,,Yue Cao;Ziang Cheng;Hongdong Li;Yue Cao;Ziang Cheng;Hongdong Li;,Australian National University;,Australia;,Poster,https://ieeexplore.ieee.org/document/10801631/,,,
1054,Redefining Data Pairing for Motion Retargeting Leveraging a Human Body Prior,,Xiyana Figuera;Soogeun Park;Hyemin Ahn;Xiyana Figuera;Soogeun Park;Hyemin Ahn;,Ulsan National Institute of Science and Technology;,South Korea;,Poster,https://ieeexplore.ieee.org/document/10801789/,,,
1055,Reducing Cognitive Load in Teleoperating Swarms of Robots through a Data-Driven Shared Control Approach,,Enrico Turco;Chiara Castellani;Valerio Bo;Claudio Pacchierotti;Domenico Prattichizzo;Tommaso Lisini Baldi;Enrico Turco;Chiara Castellani;Valerio Bo;Claudio Pacchierotti;Domenico Prattichizzo;Tommaso Lisini Baldi;,Istituto Italiano di Tecnologia;CNRS;Università degli Studi di Siena;,Italy;France;,Poster,https://ieeexplore.ieee.org/document/10802645/,,,
1056,REF2-NeRF: Reflection and Refraction aware Neural Radiance Field,,Wooseok Kim;Taiki Fukiage;Takeshi Oishi;Wooseok Kim;Taiki Fukiage;Takeshi Oishi;,University of Tokyo;NTT Communication Science Laboratories;,Japan;,Poster,https://ieeexplore.ieee.org/document/10801830/,,,
1057,Refining Airway Segmentation Through Breakage Filling and Leakage Reduction Using Point Clouds,,Yan Hu;Erik Meijering;Yang Song;Yan Hu;Erik Meijering;Yang Song;,University of New South Wales;,Australia;,Poster,https://ieeexplore.ieee.org/document/10802488/,,,
1058,Refractive COLMAP: Refractive Structure-from-Motion Revisited,,Mengkun She;Felix Seegräber;David Nakath;Kevin Köser;Mengkun She;Felix Seegräber;David Nakath;Kevin Köser;,Christian-Albrechts-University of Kiel;,Germany;,Poster,https://ieeexplore.ieee.org/document/10802043/,,,
1059,Reinforcement Learning Control for Autonomous Hydraulic Material Handling Machines with Underactuated Tools,,Filippo A. Spinelli;Pascal Egli;Julian Nubert;Fang Nan;Thilo Bleumer;Patrick Goegler;Stephan Brockes;Ferdinand Hofmann;Marco Hutter;Filippo A. Spinelli;Pascal Egli;Julian Nubert;Fang Nan;Thilo Bleumer;Patrick Goegler;Stephan Brockes;Ferdinand Hofmann;Marco Hutter;,ETH Zurich;Max Planck Institute for Intelligent Systems;Liebherr-Hydraulikbagger GmbH;,Switzerland;Germany;,Poster,https://ieeexplore.ieee.org/document/10802199/,,,
1060,Reinforcement Learning for Active Search and Grasp in Clutter,,Thomas Pitcher;Julian Förster;Jen Jen Chung;Thomas Pitcher;Julian Förster;Jen Jen Chung;,University of Queensland;ETH Zurich;,Australia;Switzerland;,Poster,https://ieeexplore.ieee.org/document/10801366/,,,
1061,Reinforcement Learning of Dolly-In Filming Using a Ground-Based Robot,,Philip Lorimer;Jack Saunders;Alan Hunter;Wenbin Li;Philip Lorimer;Jack Saunders;Alan Hunter;Wenbin Li;,University of Bath;,United Kingdom;,Poster,https://ieeexplore.ieee.org/document/10802717/,,,
1062,Reinforcement Learning with Generalizable Gaussian Splatting,,Jiaxu Wang;Qiang Zhang;Jingkai Sun;Jiahang Cao;Gang Han;Wen Zhao;Weining Zhang;Yecheng Shao;Yijie Guo;Renjing Xu;Jiaxu Wang;Qiang Zhang;Jingkai Sun;Jiahang Cao;Gang Han;Wen Zhao;Weining Zhang;Yecheng Shao;Yijie Guo;Renjing Xu;,"Hong Kong University of Science and Technology;Humanoid Robotics Co., Ltd.;Zhejiang University;",China;,Poster,https://ieeexplore.ieee.org/document/10801348/,,,
1063,RelationGrasp: Object-Oriented Prompt Learning for Simultaneously Grasp Detection and Manipulation Relationship in Open Vocabulary,,Songting Liu;Tat Joo Teo;Zhiping Lin;Haiyue Zhu;Songting Liu;Tat Joo Teo;Zhiping Lin;Haiyue Zhu;,Nanyang Technological University;Home Team Science and Technology Agency;Singapore Institute of Manufacturing Technology;,Singapore;,Poster,https://ieeexplore.ieee.org/document/10802508/,,,
1064,ReLoc-Aligner : Orientation-aware Scene Descriptor for Re-Localization within a 3D Point Cloud Map,,SungJoon Cho;Jun-Sik Kim;SungJoon Cho;Jun-Sik Kim;,Korea University;Korea Institute of Science and Technology;,South Korea;,Poster,https://ieeexplore.ieee.org/document/10802124/,,,
1065,Renderable Street View Map-Based Localization: Leveraging 3D Gaussian Splatting for Street-Level Positioning,,Howoong Jun;Hyeonwoo Yu;Songhwai Oh;Howoong Jun;Hyeonwoo Yu;Songhwai Oh;,Seoul National University;Sungkyunkwan University;,South Korea;,Poster,https://ieeexplore.ieee.org/document/10802730/,,,
1066,Repairing Neural Networks for Safety in Robotic Systems using Predictive Models,,Keyvan Majd;Geoffrey Clark;Georgios Fainekos;Heni Ben Amor;Keyvan Majd;Geoffrey Clark;Georgios Fainekos;Heni Ben Amor;,Arizona State University;Toyota Research Institute North America;,United States;,Poster,https://ieeexplore.ieee.org/document/10802650/,,,
1067,REPeat: A Real2Sim2Real Approach for Pre-acquisition of Soft Food Items in Robot-assisted Feeding,,Nayoung Ha;Ruolin Ye;Ziang Liu;Shubhangi Sinha;Tapomayukh Bhattacharjee;Nayoung Ha;Ruolin Ye;Ziang Liu;Shubhangi Sinha;Tapomayukh Bhattacharjee;,Cornell University;,United States;,Poster,https://ieeexplore.ieee.org/document/10801368/,,,
1068,Representing 3D sparse map points and lines for camera relocalization,,Bach-Thuan Bui;Huy-Hoang Bui;Dinh-Tuan Tran;Joo-Ho Lee;Bach-Thuan Bui;Huy-Hoang Bui;Dinh-Tuan Tran;Joo-Ho Lee;,Ritsumeikan University;,Japan;,Poster,https://ieeexplore.ieee.org/document/10802402/,,,
1069,Research of calibration method for fusion of LDS sensor and ToF low-cost sensor,,Jiahui Zhu;Guitao Yu;Yang He;Kui Yang;Dongtai Liang;Jiahui Zhu;Guitao Yu;Yang He;Kui Yang;Dongtai Liang;,Ningbo University;Zhejiang Province Healthy & Intelligent Kitchen Engineering Research Center;,China;,Poster,https://ieeexplore.ieee.org/document/10801424/,,,
1070,Research on Autonomous Navigation of Dual-mode Wheel-legged Robot,,Wen Wang;Xiaobin Xu;ZiHeng Chen;Jian Yang;Yingying Ran;Zhiying Tan;Minzhou Luo;Wen Wang;Xiaobin Xu;ZiHeng Chen;Jian Yang;Yingying Ran;Zhiying Tan;Minzhou Luo;,Hohai University;Yangzhou University;,China;,Poster,https://ieeexplore.ieee.org/document/10801460/,,,
1071,Resource-Aware Collaborative Monte Carlo Localization with Distribution Compression,,Nicky Zimmerman;Alessandro Giusti;Jérôme Guzzi;Nicky Zimmerman;Alessandro Giusti;Jérôme Guzzi;,Università della Svizzera italiana (USI) and Scuola universitaria professionale della Svizzera italiana (SUPSI);,Switzerland;,Poster,https://ieeexplore.ieee.org/document/10801896/,,,
1072,Response Improvement of Hydraulic Robotic Joints via a Force Servo and Inverted Pendulum Demo,,Ryo Arai;Satoru Sakai;Kazuki Ono;Ryo Arai;Satoru Sakai;Kazuki Ono;,University of Shinshu;,Japan;,Poster,https://ieeexplore.ieee.org/document/10802664/,,,
1073,Retargeting Human Facial Expression to Human-like Robotic Face through Neural Network Surrogate-based Optimization,,Bowen Wu;Chaoran Liu;Carlos T. Ishi;Takashi Minato;Hiroshi Ishiguro;Bowen Wu;Chaoran Liu;Carlos T. Ishi;Takashi Minato;Hiroshi Ishiguro;,Osaka University;ATR Hiroshi Ishiguro Labs;,Japan;,Poster,https://ieeexplore.ieee.org/document/10801759/,,,
1074,Rethinking 3D Geometric Object Features for Enhancing Skeleton-based Action Recognition,,Yuankai Wu;Chi Wang;Driton Salihu;Constantin Patsch;Marsil Zakour;Eckehard Steinbach;Yuankai Wu;Chi Wang;Driton Salihu;Constantin Patsch;Marsil Zakour;Eckehard Steinbach;,Technical University of Munich;,Germany;,Poster,https://ieeexplore.ieee.org/document/10802032/,,,
1075,Revisiting Reward Design and Evaluation for Robust Humanoid Standing and Walking,,Bart van Marum;Aayam Shrestha;Helei Duan;Pranay Dugar;Jeremy Dao;Alan Fern;Bart van Marum;Aayam Shrestha;Helei Duan;Pranay Dugar;Jeremy Dao;Alan Fern;,Oregon State University;,United States;,Poster,https://ieeexplore.ieee.org/document/10802680/,,,
1076,Revolutionizing Battery Disassembly: The Design and Implementation of a Battery Disassembly Autonomous Mobile Manipulator Robot(BEAM-1),,Yanlong Peng;Zhigang Wang;Yisheng Zhang;Shengmin Zhang;Nan Cai;Fan Wu;Ming Chen;Yanlong Peng;Zhigang Wang;Yisheng Zhang;Shengmin Zhang;Nan Cai;Fan Wu;Ming Chen;,Shanghai Jiao Tong University;Intel;Kunming University of Science and Technology;Beijing University of Technology;,China;,Poster,https://ieeexplore.ieee.org/document/10802225/,,,
1077,Reward-Driven Automated Curriculum Learning for Interaction-Aware Self-Driving at Unsignalized Intersections,,Zengqi Peng;Xiao Zhou;Lei Zheng;Yubin Wang;Jun Ma;Zengqi Peng;Xiao Zhou;Lei Zheng;Yubin Wang;Jun Ma;,Hong Kong University of Science and Technology;,China;,Poster,https://ieeexplore.ieee.org/document/10801582/,,,
1078,Reward-field Guided Motion Planner for Navigation with Limited Sensing Range,,Jan Bayer;Jan Faigl;Jan Bayer;Jan Faigl;,Czech Technical University;,Czechia;,Poster,https://ieeexplore.ieee.org/document/10801843/,,,
1079,Riemannian Flow Matching Policy for Robot Motion Learning,,Max Braun;Noémie Jaquier;Leonel Rozo;Tamim Asfour;Max Braun;Noémie Jaquier;Leonel Rozo;Tamim Asfour;,Karlsruhe Institute of Technology;Bosch Center for Artificial Intelligence;,Germany;,Poster,https://ieeexplore.ieee.org/document/10801521/,,,
1080,RISE: 3D Perception Makes Real-World Robot Imitation Simple and Effective,,Chenxi Wang;Hongjie Fang;Hao-Shu Fang;Cewu Lu;Chenxi Wang;Hongjie Fang;Hao-Shu Fang;Cewu Lu;,Noematrix Intelligence Technology;Shanghai Jiao Tong University;,China;,Poster,https://ieeexplore.ieee.org/document/10801678/,,,
1081,Risk-Averse Planning and Plan Assessment for Marine Robots*,,Mahya Mohammadi Kashani;Tobias John;Jeremy P. Coffelt;Einar Broch Johnsen;Andrzej Wąsowski;Mahya Mohammadi Kashani;Tobias John;Jeremy P. Coffelt;Einar Broch Johnsen;Andrzej Wąsowski;,IT University of Copenhagen;University of Oslo;Rosenxt;,Denmark;Norway;Germany;,Poster,https://ieeexplore.ieee.org/document/10802496/,,,
1082,Risk-Aware Non-Myopic Motion Planner for Large-Scale Robotic Swarm Using CVaR Constraints,,Xuru Yang;Yunze Hu;Han Gao;Kang Ding;Zhaoyang Li;Pingping Zhu;Ying Sun;Chang Liu;Xuru Yang;Yunze Hu;Han Gao;Kang Ding;Zhaoyang Li;Pingping Zhu;Ying Sun;Chang Liu;,Peking University;Tsinghua University;Marshall University;Pennsylvania State University;,China;United States;,Poster,https://ieeexplore.ieee.org/document/10802191/,,,
1083,RMap: Millimeter-Wave Radar Mapping Through Volumetric Upsampling,,Ajay Narasimha Mopidevi;Kyle Harlow;Christoffer Heckman;Ajay Narasimha Mopidevi;Kyle Harlow;Christoffer Heckman;,University of Colorado Boulder;,United States;,Poster,https://ieeexplore.ieee.org/document/10801827/,,,
1084,Roadmaps with Gaps over Controllers: Achieving Efficiency in Planning under Dynamics,,Aravind Sivaramakrishnan;Sumanth Tangirala;Edgar Granados;Noah R. Carver;Kostas E. Bekris;Aravind Sivaramakrishnan;Sumanth Tangirala;Edgar Granados;Noah R. Carver;Kostas E. Bekris;,Rutgers University;,United States;,Poster,https://ieeexplore.ieee.org/document/10802619/,,,
1085,Roaming with Robots: Utilizing Artificial Curiosity in Global Path Planning for Autonomous Mobile Robots,,Niklas Spielbauer;Till Laube;David Oberacker;Arne Roennau;Rüdiger Dillmann;Niklas Spielbauer;Till Laube;David Oberacker;Arne Roennau;Rüdiger Dillmann;,FZI Research Center for Information Technology;,Germany;,Poster,https://ieeexplore.ieee.org/document/10802471/,,,
1086,RoboCop: A Robust Zero-Day Cyber-Physical Attack Detection Framework for Robots,,Upinder Kaur;Z. Berkay Celik;Richard M. Voyles;Upinder Kaur;Z. Berkay Celik;Richard M. Voyles;,Purdue University;,United States;,Poster,https://ieeexplore.ieee.org/document/10802522/,,,
1087,RoboGuardZ: A Scalable Zero-Shot Framework for Detecting Zero-Day Malware in Robots,,Upinder Kaur;Z. Berkay Celik;Richard M. Voyles;Upinder Kaur;Z. Berkay Celik;Richard M. Voyles;,Purdue University;,United States;,Poster,https://ieeexplore.ieee.org/document/10801765/,,,
1088,Robot Active Vision-Based Path Planning for Localization Improvement in Indoor Environments,,Sotirios Barlakas;Dimitrios Alexiou;Kosmas Tsiakas;Dimitrios Katsatos;Ioannis Kostavelis;Dimitrios Giakoumis;Antonios Gasteratos;Dimitrios Tzovaras;Sotirios Barlakas;Dimitrios Alexiou;Kosmas Tsiakas;Dimitrios Katsatos;Ioannis Kostavelis;Dimitrios Giakoumis;Antonios Gasteratos;Dimitrios Tzovaras;,Centre for Research and Technology Hellas;Democritus University of Thrace;International Hellenic University;,Greece;,Poster,https://ieeexplore.ieee.org/document/10802041/,,,
1089,Robot Design Optimization with Rotational and Prismatic Joints using Black-Box Multi-Objective Optimization,,Kento Kawaharazuka;Kei Okada;Masayuki Inaba;Kento Kawaharazuka;Kei Okada;Masayuki Inaba;,University of Tokyo;,Japan;,Poster,https://ieeexplore.ieee.org/document/10802642/,,,
1090,Robot Generating Data for Learning Generalizable Visual Robotic Manipulation,,Yunfei Li;Ying Yuan;Jingzhi Cui;Haoran Huan;Wei Fu;Jiaxuan Gao;Zekai Xu;Yi Wu;Yunfei Li;Ying Yuan;Jingzhi Cui;Haoran Huan;Wei Fu;Jiaxuan Gao;Zekai Xu;Yi Wu;,Shanghai Qi Zhi Institute;Tsinghua University;Shanghai Jiao Tong University;,China;,Poster,https://ieeexplore.ieee.org/document/10801742/,,,
1091,Robot Guided Evacuation with Viewpoint Constraints,,Gong Chen;Malika Meghjani;Marcel Bartholomeus Prasetyo;Gong Chen;Malika Meghjani;Marcel Bartholomeus Prasetyo;,Singapore University of Technology and Design;,Singapore;,Poster,https://ieeexplore.ieee.org/document/10802741/,,,
1092,Robot Shape and Location Retention in Video Generation Using Diffusion Models,,Peng Wang;Zhihao Guo;Abdul Latheef Sait;Minh Huy Pham;Peng Wang;Zhihao Guo;Abdul Latheef Sait;Minh Huy Pham;,,,Poster,https://ieeexplore.ieee.org/document/10802156/,,,
1093,Robot Swarm Control Based on Smoothed Particle Hydrodynamics for Obstacle-Unaware Navigation,,Michikuni Eguchi;Mai Nishimura;Shigeo Yoshida;Takefumi Hiraki;Michikuni Eguchi;Mai Nishimura;Shigeo Yoshida;Takefumi Hiraki;,University of Tsukuba;OMRON SINIC X Corporation;Meta;,Japan;,Poster,https://ieeexplore.ieee.org/document/10801800/,,,
1094,Robot Synesthesia: A Sound and Emotion Guided Robot Painter,,Vihaan Misra;Peter Schaldenbrand;Jean Oh;Vihaan Misra;Peter Schaldenbrand;Jean Oh;,Carnegie Mellon University;,United States;,Poster,https://ieeexplore.ieee.org/document/10802780/,,,
1095,Robot Traversability Prediction: Towards Third-Person-View Extension of Walk2Map with Photometric and Physical Constraints,,Jonathan Tay Yu Liang;Kanji Tanaka;Jonathan Tay Yu Liang;Kanji Tanaka;,University of Fukui;,Japan;,Poster,https://ieeexplore.ieee.org/document/10802356/,,,
1096,Robot-Enabled Machine Learning-Based Diagnosis of Gastric Cancer Polyps Using Partial Surface Tactile Imaging,,Siddhartha Kapuria;Jeff Bonyun;Yash Kulkarni;Naruhiko Ikoma;Sandeep Chinchali;Farshid Alambeigi;Siddhartha Kapuria;Jeff Bonyun;Yash Kulkarni;Naruhiko Ikoma;Sandeep Chinchali;Farshid Alambeigi;,University of Texas at Austin;University of Texas MD Anderson Cancer Center;,United States;,Poster,https://ieeexplore.ieee.org/document/10802585/,,,
1097,RobotGraffiti: An AR tool for semi-automated construction of workcell models to optimize robot deployment,,Krzysztof Zieliński;Ryan Penning;Bruce Blumberg;Christian Schlette;Mikkel Baun Kjærgaard;Krzysztof Zieliński;Ryan Penning;Bruce Blumberg;Christian Schlette;Mikkel Baun Kjærgaard;,Universal Robots;University of Southern Denmark;,Denmark;,Poster,https://ieeexplore.ieee.org/document/10801402/,,,
1098,Robotic Measurement for Electrical Property of Polymers by Force-Sensing Robot toward Materials Lab-Automation,,Yuki Asano;Kei Okada;Junichiro Shiomi;Yuki Asano;Kei Okada;Junichiro Shiomi;,University of Tokyo;,Japan;,Poster,https://ieeexplore.ieee.org/document/10802186/,,,
1099,Robotic Object Insertion with a Soft Wrist through Sim-to-Real Privileged Training,,Yuni Fuchioka;Cristian C. Beltran-Hernandez;Hai Nguyen;Masashi Hamaya;Yuni Fuchioka;Cristian C. Beltran-Hernandez;Hai Nguyen;Masashi Hamaya;,OMRON SINIC X Corporation;,Japan;,Poster,https://ieeexplore.ieee.org/document/10801575/,,,
1100,Robotic valve turning: axial misalignment estimation from reaction torques,,Gautami Golani;Sri Harsha Turlapati;Lin Yang;Mohammad Zaidi Bin Ariffin;Domenico Campolo;Gautami Golani;Sri Harsha Turlapati;Lin Yang;Mohammad Zaidi Bin Ariffin;Domenico Campolo;,Nanyang Technological University;,Singapore;,Poster,https://ieeexplore.ieee.org/document/10801385/,,,
1101,ROBOVERINE: A human-inspired neural robotic process model of active visual search and scene grammar in naturalistic environments,,Raul Grieben;Stephan Sehring;Jan Tekülve;John P. Spencer;Gregor Schöner;Raul Grieben;Stephan Sehring;Jan Tekülve;John P. Spencer;Gregor Schöner;,,,Poster,https://ieeexplore.ieee.org/document/10801621/,,,
1102,Robust Agility via Learned Zero Dynamics Policies,,Noel Csomay-Shanklin;William D. Compton;Ivan Dario Jimenez Rodriguez;Eric R. Ambrose;Yisong Yue;Aaron D. Ames;Noel Csomay-Shanklin;William D. Compton;Ivan Dario Jimenez Rodriguez;Eric R. Ambrose;Yisong Yue;Aaron D. Ames;,California Institute of Technology;NASA Jet Propulsion Laboratory;,United States;,Poster,https://ieeexplore.ieee.org/document/10801322/,,,
1103,Robust and Safe Task-Driven Planning and Navigation for Heterogeneous Multi-Robot Teams with Uncertain Dynamics,,Tianyang Pan;Christos K. Verginis;Lydia E. Kavraki;Tianyang Pan;Christos K. Verginis;Lydia E. Kavraki;,Rice University;Uppsala University;,United States;Sweden;,Poster,https://ieeexplore.ieee.org/document/10802695/,,,
1104,Robust Backstepping Controller with Adaptive Sliding Mode Observer for a Tilt-Augmented Quadrotor With Uncertainty Using SO(3),,Sathyanarayanan Seshasayanan;Soumya Ranjan Sahoo;Sathyanarayanan Seshasayanan;Soumya Ranjan Sahoo;,Indian Institute of Technology Kanpur;,India;,Poster,https://ieeexplore.ieee.org/document/10801541/,,,
1105,Robust Imitation Learning for Mobile Manipulator Focusing on Task-Related Viewpoints and Regions,,Yutaro Ishida;Yuki Noguchi;Takayuki Kanai;Kazuhiro Shintani;Hiroshi Bito;Yutaro Ishida;Yuki Noguchi;Takayuki Kanai;Kazuhiro Shintani;Hiroshi Bito;,Toyota Motor Corporation;,Japan;,Poster,https://ieeexplore.ieee.org/document/10802396/,,,
1106,Robust Multi-Camera BEV Perception: An Image-Perceptive Approach to Counter Imprecise Camera Calibration,,Rundong Sun;Mengyin Fu;Hao Liang;Chunhui Zhu;Zhipeng Dong;Yi Yang;Rundong Sun;Mengyin Fu;Hao Liang;Chunhui Zhu;Zhipeng Dong;Yi Yang;,Beijing Institute of Technology;Nanjing University of Science and Technology;,China;,Poster,https://ieeexplore.ieee.org/document/10802840/,,,
1107,Robust Partitioned Visual Servoing for Aerial Manipulation Utilizing Controllable-space Image Planning and Adaptive Image Representation,,Mohammad Soltanshah;Abolfazl Eskandarpour;Mehran Mehrandezh;Kamal Gupta;Mohammad Soltanshah;Abolfazl Eskandarpour;Mehran Mehrandezh;Kamal Gupta;,Simon Fraser University;University of Regina;,Canada;,Poster,https://ieeexplore.ieee.org/document/10802700/,,,
