Index,Title,Session/Area,Authors,Affiliation,Status,OpenReview URL,PDF URL
252,Stable Coactive Learning via Perturbation,,Karthik Raman;Thorsten Joachims;Pannaga Shivaswamy;Tobias Schnabel;,Cornell University;AT&T Research;Universitaet Stuttgart;,Poster,,http://proceedings.mlr.press/v28/raman13.pdf
253,Stochastic Alternating Direction Method of Multipliers,,Hua Ouyang;Niao He;Long Tran;Alexander Gray;,Georgia Institute of Technology;,Poster,,http://proceedings.mlr.press/v28/ouyang13.pdf
254,Stochastic Gradient Descent for Non-smooth Optimization: Convergence Results and Optimal Averaging Schemes,,Ohad Shamir;Tong Zhang;,Microsoft;Rutgers University;,Poster,,http://proceedings.mlr.press/v28/shamir13.pdf
255,Stochastic k-Neighborhood Selection for Supervised and Unsupervised Learning,,Daniel Tarlow;Kevin Swersky;Laurent Charlin;Ilya Sutskever;Rich Zemel;,Microsoft;University of Toronto;Google;,Poster,,http://proceedings.mlr.press/v28/tarlow13.pdf
256,Stochastic Simultaneous Optimistic Optimization,,Michal Valko;Alexandra Carpentier;Rémi Munos;,INRIA Lille - Nord Europe;University of Cambridge;,Poster,,http://proceedings.mlr.press/v28/valko13.pdf
257,Strict Monotonicity of Sum of Squares Error  and Normalized Cut in the Lattice of Clusterings,,Nicola Rebagliati;,VTT Technical Research Centre of Finland;,Poster,,http://proceedings.mlr.press/v28/rebagliati13.pdf
258,Structure Discovery in Nonparametric Regression through Compositional Kernel Search,,David Duvenaud;James Lloyd;Roger Grosse;Joshua Tenenbaum;Ghahramani Zoubin;,University of Cambridge;Massachusetts Institute of Technology;,Poster,,http://proceedings.mlr.press/v28/duvenaud13.pdf
259,Subproblem-Tree Calibration: A Unified Approach to Max-Product Message Passing,,Huayan Wang;Koller Daphne;,Stanford University;,Poster,,http://proceedings.mlr.press/v28/wang13b.pdf
260,Subtle Topic Models and Discovering Subtly Manifested Software Concerns Automatically,,Mrinal Das;Suparna Bhattacharya;Chiranjib Bhattacharyya;Gopinath Kanchi;,Indian Institute of Science;IBM;,Poster,,http://proceedings.mlr.press/v28/das13.pdf
261,Taming the Curse of Dimensionality: Discrete Integration by Hashing and Optimization,,Stefano Ermon;Carla Gomes;Ashish Sabharwal;Bart Selman;,Cornell University;IBM;,Poster,,http://proceedings.mlr.press/v28/ermon13.pdf
262,Temporal Difference Methods for the Variance of the Reward To Go,,Aviv Tamar;Dotan Di Castro;Shie Mannor;,Technion - Israel Institute of Technology;,Poster,,http://proceedings.mlr.press/v28/tamar13.pdf
263,Tensor Analyzers,,Yichuan Tang;Ruslan Salakhutdinov;Geoffrey Hinton;,University of Toronto;,Poster,,http://proceedings.mlr.press/v28/tang13.pdf
264,That was fast! Speeding up NN search of high dimensional distributions.,,Emanuele Coviello;Adeel Mumtaz;Antoni Chan;Gert Lanckriet;,"University of California, San Diego;City University of Hong Kong;",Poster,,http://proceedings.mlr.press/v28/coviello13.pdf
265,The Bigraphical Lasso,,Alfredo Kalaitzis;John Lafferty;Neil D. Lawrence;Shuheng Zhou;,University College London;University of Chicago;University of Sheffield;University of Michigan;,Poster,,http://proceedings.mlr.press/v28/kalaitzis13.pdf
266,The Cross-Entropy Method Optimizes for Quantiles,,Sergiu Goschin;Ari Weinstein;Michael Littman;,Rutgers University;Brown University;,Poster,,http://proceedings.mlr.press/v28/goschin13.pdf
267,The Extended Parameter Filter,,Yusuf Bugra Erol;Lei Li;Bharath Ramsundar;Russell Stuart;,"University of California, Berkeley;Stanford University;",Poster,,http://proceedings.mlr.press/v28/bugraerol13.pdf
268,"The lasso, persistence, and cross-validation",,Darren Homrighausen;Daniel McDonald;,Colorado State University;Indiana University;,Poster,,http://proceedings.mlr.press/v28/homrighausen13.pdf
269,The Most Generative Maximum Margin Bayesian Networks,,Robert Peharz;Sebastian Tschiatschek;Franz Pernkopf;,Graz University of Technology;,Poster,,http://proceedings.mlr.press/v28/peharz13.pdf
270,The Pairwise Piecewise-Linear Embedding for Efficient Non-Linear Classification,,Ofir Pele;Ben Taskar;Amir Globerson;Michael Werman;,University of Pennsylvania;Hebrew University of Jerusalem;,Poster,,http://proceedings.mlr.press/v28/pele13.pdf
271,The Sample-Complexity of General Reinforcement Learning,,Tor Lattimore;Marcus Hutter;Peter Sunehag;,Australian National University;,Poster,,http://proceedings.mlr.press/v28/lattimore13.pdf
272,Thompson Sampling for Contextual Bandits with Linear Payoffs,,Shipra Agrawal;Navin Goyal;,Microsoft;,Poster,,http://proceedings.mlr.press/v28/agrawal13.pdf
273,Thurstonian Boltzmann Machines: Learning from Multiple Inequalities,,Truyen Tran;Dinh Phung;Svetha Venkatesh;,Deakin University;Curtin University;,Poster,,http://proceedings.mlr.press/v28/tran13.pdf
274,Top-down particle filtering for Bayesian decision trees,,Balaji Lakshminarayanan;Daniel Roy;Yee Whye Teh;,University College London;University of Cambridge;University of Oxford;,Poster,,http://proceedings.mlr.press/v28/lakshminarayanan13.pdf
275,Top-k Selection based on Adaptive Sampling of Noisy Preferences,,Robert Busa-Fekete;Balazs Szorenyi;Weiwei Cheng;Paul Weng;Eyke Huellermeier;,,Poster,,http://proceedings.mlr.press/v28/busa-fekete13.pdf
276,Topic Discovery through Data Dependent and Random Projections,,Weicong Ding;Mohammad Hossein Rohban;Prakash Ishwar;Venkatesh Saligrama;,Boston University;,Poster,,http://proceedings.mlr.press/v28/ding13.pdf
277,Topic Model Diagnostics: Assessing Domain Relevance via Topical Alignment,,Jason Chuang;Sonal Gupta;Christopher Manning;Jeffrey Heer;,Stanford University;,Poster,,http://proceedings.mlr.press/v28/chuang13.pdf
278,Toward Optimal Stratification for Stratified Monte-Carlo Integration,,Alexandra Carpentier;Rémi Munos;,University of Cambridge;INRIA Lille - Nord Europe;,Poster,,http://proceedings.mlr.press/v28/carpentier13.pdf
279,Transition Matrix Estimation in High Dimensional Time Series,,Fang Han;Han Liu;,Johns Hopkins University;Princeton University;,Poster,,http://proceedings.mlr.press/v28/han13a.pdf
280,Tree-Independent Dual-Tree Algorithms,,Ryan Curtin;William March;Parikshit Ram;David Anderson;Alexander Gray;Charles Isbell;,Georgia Institute of Technology;,Poster,,http://proceedings.mlr.press/v28/curtin13.pdf
281,Two-Sided Exponential Concentration Bounds for Bayes Error Rate and Shannon Entropy,,Jean Honorio;Jaakkola Tommi;,Massachusetts Institute of Technology;,Poster,,http://proceedings.mlr.press/v28/honorio13.pdf
282,Unfolding Latent Tree Structures using 4th Order Tensors,,Mariya Ishteva;Haesun Park;Le Song;,Vrije Universiteit Brussel;Georgia Institute of Technology;,Poster,,http://proceedings.mlr.press/v28/ishteva13.pdf
283,Vanishing Component Analysis,,Roi Livni;David Lehavi;Sagi Schein;Hila Nachliely;Shai Shalev-Shwartz;Amir Globerson;,,Poster,,http://proceedings.mlr.press/v28/livni13.pdf
