Index,Title,Session/Area,Authors,Affiliation,Country,Status,Proceeding URL,PDF URL,CVF URL,Arxiv URL
997,Improving Bias Mitigation through Bias Experts in Natural Language Understanding,,Eojin Jeon;Mingyu Lee;Juhyeong Park;Yeachan Kim;Wing-Lam Mok;SangKeun Lee;,Korea University;,South Korea;,Long Main,https://openreview.net/forum?id=K6KcA4ODql,,,
998,Improving Dialogue Discourse Parsing via Reply-to Structures of Addressee Recognition,,Yaxin FAN;Feng Jiang;PEIFENG LI;Fang Kong;Qiaoming Zhu;,Soochow University;Chinese University of Hong Kong;,China;,Long Main,https://openreview.net/forum?id=U8PL5FzvrV,,,
999,Improving Sequential Model Editing with Fact Retrieval,,XiaoQi Han;Ru Li;Hongye Tan;Wang Yuanlong;Qinghua Chai;Jeff Z. Pan;,Shanxi University;University of Edinburgh;,China;United Kingdom;,Long Findings,https://openreview.net/forum?id=JIrP8CIvx6,,,
1000,In-Context Demonstration Selection with Cross Entropy Difference,,Dan Iter;Reid Pryzant;Ruochen Xu;Shuohang Wang;Yang Liu;Yichong Xu;Chenguang Zhu;,Microsoft;Zoom Video Communications Inc.;,United States;,Long Findings,https://openreview.net/forum?id=x3e1zQ1ub1,,,
1001,Instructed Language Models with Retrievers Are Powerful Entity Linkers,,Zilin Xiao;MING GONG;Jie Wu;Xingyao Zhang;Linjun Shou;Daxin Jiang;,Microsoft;,United States;,Long Main,https://openreview.net/forum?id=qnO9IRNA9d,,,
1002,Integrating Language Models into Direct Speech Translation: An Inference-Time Solution to Control Gender Inflection,,Dennis Fucci;Marco Gaido;Sara Papi;Mauro Cettolo;Matteo Negri;Luisa Bentivogli;,University of Trento;Fondazione Bruno Kessler;Microsoft;,Italy;United States;,Short Main,https://openreview.net/forum?id=Ie040B4nFm,,,
1003,Intuitive Multilingual Audio-Visual Speech Recognition with a Single-Trained Model,,Joanna Hong;Se Jin Park;Yong Man Ro;,Korea Advanced Institute of Science and Technology;,South Korea;,Short Findings,https://openreview.net/forum?id=iRIj0OvFG1,,,
1004,Language Representation Projection: Can We Transfer Factual Knowledge across Languages in Multilingual Language Models?,,Shaoyang Xu;Junzhuo Li;Deyi Xiong;,Tianjin University;,China;,Short Main,https://openreview.net/forum?id=lVat423gKI,,,
1005,Large Language Models are biased to overestimate profoundness,,Eugenio Herrera-Berg;Tomás Vergara Browne;Pablo León-Villagrá;Marc-Lluís Vives;Cristian Buc Calderon;,Centro Nacional de Inteligencia Artificial;Pontificia Universidad Catolica de Chile;Brown University;Leiden University;,Spain;Chile;United States;Netherlands;,Short Main,https://openreview.net/forum?id=PT63nNpyKg,,,
1006,Large Language Models are Temporal and Causal Reasoners for Video Question Answering,,Dohwan Ko;Ji Soo Lee;Woo-Young Kang;Byungseok Roh;Hyunwoo J. Kim;,Korea University;Kakao Brain;,South Korea;,Long Main,https://openreview.net/forum?id=jhdVt7rC8k,,,
1007,Learning Language-guided Adaptive Hyper-modality Representation for Multimodal Sentiment Analysis,,Haoyu Zhang;Yu Wang;Guanghao Yin;Kejun Liu;Yuanyuan Liu;Tianshu Yu;,China University of Geosciences;Chinese University of Hong Kong;,China;,Long Main,https://openreview.net/forum?id=w8LoOWsbU7,,,
1008,Learning Retrieval Augmentation for Personalized Dialogue Generation,,Qiushi Huang;Shuai Fu;Xubo Liu;Wenwu Wang;Tom Ko;Yu Zhang;Lilian Tang;,University of Surrey;Southern University of Science and Technology;ByteDance;,United Kingdom;China;,Long Main,https://openreview.net/forum?id=ppb7gyhc7k,,,
1009,Learning under Label Proportions for Text Classification,,Jatin Chauhan;Xiaoxuan Wang;Wei Wang;,"University of California, Los Angeles;",United States;,Long Findings,https://openreview.net/forum?id=EtNebdSBpe,,,
1010,Let's Think Frame by Frame with VIP: A Video Infilling and Prediction Dataset for Evaluating Video Chain-of-Thought,,Vaishnavi Himakunthala;Andy Ouyang;Daniel Philip Rose;Ryan He;Alex Mei;Yujie Lu;Chinmay Sonar;Michael Saxon;William Yang Wang;,"University of California, Santa Barbara;",United States;,Long Main,https://openreview.net/forum?id=y6Ej5BZkrR,,,
1011,Leveraging Structured Information for Explainable Multi-hop Question Answering and Reasoning,,Ruosen Li;Xinya Du;,University of Texas at Dallas;,United States;,Long Findings,https://openreview.net/forum?id=ajzFrKT3U7,,,
1012,"Licon: A Diverse, Controllable and Challenging Linguistic Concept Learning Benchmark",,Shenglong Yu;Ying Zhang;wenya guo;Zhengkun Zhang;Ru Zhou;Xiaojie Yuan;,Nankai University;Baidu;,China;,Long Findings,https://openreview.net/forum?id=goH9e5Vd44,,,
1013,Linking Surface Facts to Large-Scale Knowledge Graphs,,Gorjan Radevski;Kiril Gashteovski;Chia-Chien Hung;Carolin Lawrence;Goran Glavaš;,KU Leuven;NEC Laboratories Europe;Julius-Maximilians-Universität Würzburg;,Belgium;Unknown;Germany;,Long Main,https://openreview.net/forum?id=ZVy8L79f5f,,,
1014,Make Every Example Count: On the Stability and Utility of Self-Influence for Learning from Noisy NLP Datasets,,Irina Bejan;Artem Sokolov;Katja Filippova;,EPFL;Google;,Switzerland;United States;,Long Main,https://openreview.net/forum?id=NnVIFpsMAy,,,
1015,MeaeQ: Mount Model Extraction Attacks with Efficient Queries,,Chengwei Dai;Minxuan Lv;Kun Li;Wei Zhou;,University of Chinese Academy of Sciences;Chinese Academy of Sciences;,China;,Long Main,https://openreview.net/forum?id=D97Zfgv4em,,,
1016,Measure Children's Mindreading Ability with Machine Reading,,Yuliang Yan;Xiaohua Wang;Xiang Zhou;Xiaoqing Zheng;Xuanjing Huang;,Fudan University;,China;,Long Findings,https://openreview.net/forum?id=ToGkF2nCNG,,,
1017,Measuring Faithful and Plausible Visual Grounding in VQA,,Daniel Reich;Felix Putze;Tanja Schultz;,University of Bremen;,Germany;,Long Findings,https://openreview.net/forum?id=pvEkYbUPVW,,,
1018,Measuring Pointwise $\mathcal{V}$-Usable Information In-Context-ly,,Sheng Lu;Shan Chen;Yingya Li;Danielle Bitterman;Guergana K Savova;Iryna Gurevych;,Technische Universität Darmstadt;Maastricht University;Harvard University;,Germany;Netherlands;United States;,Long Findings,https://openreview.net/forum?id=0ODPaEbHxG,,,
1019,Measuring the Knowledge Acquisition-Utilization Gap in Pretrained Language Models,,Amirhossein Kazemnejad;Mehdi Rezagholizadeh;Prasanna Parthasarathi;Sarath Chandar;,Huawei;École Polytechnique de Montréal;,China;Canada;,Long Findings,https://openreview.net/forum?id=kuwz9k061u,,,
1020,Mirages. On Anthropomorphism in Dialogue Systems,,Gavin Abercrombie;Amanda Cercas Curry;Tanvi Dinkar;Verena Rieser;Zeerak Talat;,Heriot-Watt University;Bocconi University;,United Kingdom;Italy;,Long Main,https://openreview.net/forum?id=i65hZUPwuQ,,,
1021,MM-Reasoner: A Multi-Modal Knowledge-Aware Framework for Knowledge-Based Visual Question Answering,,MAHMOUD KHADEMI;Ziyi Yang;Felipe Vieira Frujeri;Chenguang Zhu;,University of British Columbia;Microsoft;Zoom Video Communications Inc.;,Canada;United States;,Long Findings,https://openreview.net/forum?id=c27QqxALfo,,,
1022,Modeling Conceptual Attribute Likeness and Domain Inconsistency for Metaphor Detection,,Yuan Tian;Nan Xu;Wenji Mao;Daniel Dajun Zeng;,Chinese Academy of Sciences;,China;,Long Main,https://openreview.net/forum?id=XclSRY9Wp8,,,
1023,Monte Carlo Thought Search: Large Language Model Querying for Complex Scientific Reasoning in Catalyst Design,,Henry W. Sprueill;Carl Edwards;Mariefel V Olarte;Udishnu Sanyal;Heng Ji;Sutanay Choudhury;,University of Illinois Urbana-Champaign;Pacific Northwest National Laboratory;University of Illinois;,United States;,Short Findings,https://openreview.net/forum?id=ToMdTqVIb5,,,
1024,mRedditSum: A Multimodal Abstractive Summarization Dataset of Reddit Threads with Images,,Keighley Overbay;Jaewoo Ahn;Fatemeh Pesaran zadeh;Joonsuk Park;Gunhee Kim;,Seoul National University;University of Richmond;,South Korea;United States;,Long Main,https://openreview.net/forum?id=k3i6PKlKY8,,,
1025,"MuG: A Multimodal Classification Benchmark on Game Data with Tabular, Textual, and Visual Fields",,Jiaying Lu;Yongchen Qian;Shifan Zhao;Yuanzhe Xi;Carl Yang;,Emory University;,United States;,Long Findings,https://openreview.net/forum?id=hCsppacsqS,,,
1026,MultiCMET: A Novel Chinese Benchmark for Understanding Multimodal Metaphor,,Dongyu Zhang;Jingwei Yu;Senyuan Jin;Liang Yang;Hongfei Lin;,Dalian University of Technology;,China;,Long Findings,https://openreview.net/forum?id=dnQI76LKQy,,,
1027,Multilingual Pixel Representations for Translation and Effective Cross-lingual Transfer,,Elizabeth Salesky;Neha Verma;Philipp Koehn;Matt Post;,Johns Hopkins University;Meta;,United States;,Long Main,https://openreview.net/forum?id=87WEkTIVSh,,,
1028,Multilingual Simplification of Medical Texts,,Sebastian Antony Joseph;Kathryn Kazanas;Keziah Reina;Vishnesh J Ramanathan;Wei Xu;Byron C Wallace;Junyi Jessy Li;,University of Texas at Austin;Georgia Institute of Technology;Northeastern University;,United States;,Long Main,https://openreview.net/forum?id=gccSE5vDZ7,,,
1029,Multitask Multimodal Prompted Training for Interactive Embodied Task Completion,,Georgios Pantazopoulos;Malvina Nikandrou;Amit Parekh;Bhathiya Hemanthage;Arash Eshghi;Ioannis Konstas;Verena Rieser;Oliver Lemon;Alessandro Suglia;,Heriot-Watt University;University of Edinburgh;,United Kingdom;,Long Main,https://openreview.net/forum?id=w4FwmICSHZ,,,
1030,Nearest Neighbor Machine Translation is Meta-Optimizer on Output Projection Layer,,Ruize Gao;Zhirui Zhang;Yichao Du;Lemao Liu;Rui Wang;,Shanghai Jiao Tong University;Tencent;University of Science and Technology of China;,China;,Long Main,https://openreview.net/forum?id=18skb5S2Gv,,,
1031,NEWTON: Are Large Language Models Capable of Physical Reasoning?,,Yi Ru Wang;Jiafei Duan;Dieter Fox;Siddhartha Srinivasa;,University of Washington;Unknown Institution;,United States;;,Long Findings,https://openreview.net/forum?id=OhZLO1yunf,,,
1032,NLP Evaluation in trouble: On the Need to Measure LLM Data Contamination for each Benchmark,,Oscar Sainz;Jon Ander Campos;Iker García-Ferrero;Julen Etxaniz;Oier Lopez de Lacalle;Eneko Agirre;,University of the Basque Country;University of Pennsylvania;Universidad del País Vasco;,Spain;United States;,Short Findings,https://openreview.net/forum?id=KivNpBsfAS,,,
1033,NormDial: A Comparable Bilingual Synthetic Dialog Dataset for Modeling Social Norm Adherence and Violation,,Oliver Li;Mallika Subramanian;Arkadiy Saakyan;Sky CH-Wang;Smaranda Muresan;,Columbia University;Amazon;,United States;,Short Main,https://openreview.net/forum?id=0VQImEvjPJ,,,
1034,On the Impact of Cross-Domain Data on German Language Models,,Amin Dada;Aokun Chen;Cheng Peng;Kaleb E Smith;Ahmad Idrissi-Yaghir;Constantin Marc Seibold;Jianning Li;Lars Heiliger;Christoph M. Friedrich;Daniel Truhn;Jan Egger;Jiang Bian;Jens Kleesiek;Yonghui Wu;,Essen University Hospital;University of Florida;NVIDIA;Fachhochschule Dortmund;University of Duisburg-Essen;Institute for Artificial Intelligence in Medicine;RWTH Aachen University Hospital;Institute of Knowledge Engineering and Management;University Medicine Essen;,Germany;United States;Malaysia;,Long Findings,https://openreview.net/forum?id=8B9mL26NDT,,,
1035,Once Upon a ${\it Time}$ in ${\it Graph}$: Relative-Time Pretraining for Complex Temporal Reasoning,,Sen Yang;Xin Li;Lidong Bing;Wai Lam;,Alibaba Group;Chinese University of Hong Kong;,China;,Long Main,https://openreview.net/forum?id=HR90GXVHUn,,,
1036,PaRaDe: Passage Ranking using Demonstrations with LLMs,,Andrew Drozdov;Honglei Zhuang;Zhuyun Dai;Zhen Qin;Razieh Rahimi;Xuanhui Wang;Dana Alon;Mohit Iyyer;Andrew McCallum;Donald Metzler;Kai Hui;,University of Massachusetts Amherst;Google;DeepMind;,United States;United Kingdom;,Short Findings,https://openreview.net/forum?id=6ne78DBkxl,,,
1037,Parameter-efficient Tuning for Large Language Model without Calculating Its Gradients,,Feihu Jin;Jiajun Zhang;Chengqing Zong;,University of Chinese Academy of Sciences;Chinese Academy of Sciences;,China;,Long Main,https://openreview.net/forum?id=xfTQmGPPtQ,,,
1038,ParroT: Translating during Chat using Large Language Models tuned with Human Translation and Feedback,,Wenxiang Jiao;Jen-tse Huang;Wenxuan Wang;Zhiwei He;Tian Liang;Xing Wang;Shuming Shi;Zhaopeng Tu;,Tencent;Chinese University of Hong Kong;Shanghai Jiao Tong University;Tsinghua University;,China;,Long Findings,https://openreview.net/forum?id=3k5GFJEGem,,,
1039,People Make Better Edits: Measuring the Efficacy of LLM-Generated Counterfactually Augmented Data for Harmful Language Detection,,Indira Sen;Dennis Assenmacher;Mattia Samory;Isabelle Augenstein;Wil Aalst;Claudia Wagner;,RWTH Aachen University;Leibniz Institute for the Social Sciences;University of Copenhagen;Eindhoven University of Technology;,Germany;Denmark;Netherlands;,Long Main,https://openreview.net/forum?id=MhbiD5FVPF,,,
1040,Predictive Chemistry Augmented with Text Retrieval,,Yujie Qian;Zhening Li;Zhengkai Tu;Connor W. Coley;Regina Barzilay;,Massachusetts Institute of Technology;,United States;,Long Main,https://openreview.net/forum?id=D4Cb4gAWro,,,
1041,Prompting Large Language Models with Chain-of-Thought for Few-Shot Knowledge Base Question Generation,,Yuanyuan Liang;Jianing Wang;Hanlun Zhu;Lei Wang;Weining Qian;Yunshi Lan;,East China Normal University;Singapore Management University;,China;Singapore;,Long Main,https://openreview.net/forum?id=jfaJdk29k4,,,
1042,QUADRo: Dataset and Models for QUestion-Answer Database Retrieval,,Stefano Campese;Ivano Lauriola;Alessandro Moschitti;,University of Trento;Amazon;,Italy;United States;,Long Findings,https://openreview.net/forum?id=0sDieI5GJh,,,
1043,Quantifying Character Similarity with Vision Transformers,,Xinmei Yang;Abhishek Arora;Shao-Yu Jheng;Melissa Dell;,Renmin University of China;Harvard University;,China;United States;,Long Main,https://openreview.net/forum?id=7LBhEJ1DII,,,
1044,Re-Examining Summarization Evaluation across Multiple Quality Criteria,,Ori Ernst;Ori Shapira;Ido Dagan;Ran Levy;,Bar-Ilan University;Amazon;,Israel;United States;,Short Findings,https://openreview.net/forum?id=83m634EuTW,,,
1045,RegaVAE: A Retrieval-Augmented Gaussian Mixture Variational Auto-Encoder for Language Modeling,,Jingcheng Deng;Liang Pang;Huawei Shen;Xueqi Cheng;,Chinese Academy of Sciences;,China;,Long Findings,https://openreview.net/forum?id=sJb43ykK3o,,,
1046,Regulation and NLP (RegNLP): Taming Large Language Models,,Catalina Goanta;Nikolaos Aletras;Ilias Chalkidis;Sofia Ranchordás;Gerasimos Spanakis;,Utrecht University;Amazon;University of Copenhagen;Luiss Guido Carli University;Maastricht University;,Netherlands;United States;Denmark;Italy;,Long Main,https://openreview.net/forum?id=TdrI4F7wS8,,,
1047,Reinforcement Replaces Supervision: Query focused Summarization using Deep Reinforcement Learning,,Swaroop Nath;Pushpak Bhattacharyya;Harshad Khadilkar;,"Indian Institute of Technology Bombay;Indian Institute of Technology, Bombay;Tata Consultancy Services Limited;",India;,Long Main,https://openreview.net/forum?id=0OtGfwj8eB,,,
1048,Retrieval-Augmented Parsing for Complex Graphs by Exploiting Structure and Uncertainty,,Zi Lin;Quan Yuan;Panupong Pasupat;Jeremiah Zhe Liu;Jingbo Shang;,"University of California, San Diego;Google;",United States;United Kingdom;,Long Findings,https://openreview.net/forum?id=dFvwxdSj0B,,,
1049,Retrieval-based Knowledge Transfer: An Effective Approach for Extreme Large Language Model Compression,,Jiduan Liu;Jiahao Liu;Qifan Wang;Jingang Wang;Xunliang Cai;Dongyan Zhao;Ran Lucien Wang;Rui Yan;,Peking University;Meituan;Meta;Renmin University of China;,China;United States;,Long Findings,https://openreview.net/forum?id=SwphsE7hYO,,,
1050,Retrieving Multimodal Information for Augmented Generation: A Survey,,Ruochen Zhao;Hailin Chen;Weishi Wang;Fangkai Jiao;Do Xuan Long;Chengwei Qin;Bosheng Ding;Xiaobao Guo;Minzhi Li;Xingxuan Li;Shafiq Joty;,"Nanyang Technological University;National Technological University;Agency for Science, Technology and Research;Alibaba Group;A*STAR;Salesforce;",Singapore;United States;China;,Long Findings,https://openreview.net/forum?id=jLEnVo0RW3,,,
1051,Revisiting De-Identification of Electronic Medical Records: Evaluation of Within- and Cross-Hospital Generalization,,Yiyang Liu;Jinpeng Li;Enwei Zhu;,University of Chinese Academy of Sciences;,China;,Short Main,https://openreview.net/forum?id=lbtVebcVny,,,
1052,Revisiting Machine Translation for Cross-lingual Classification,,Mikel Artetxe;Vedanuj Goswami;Shruti Bhosale;Angela Fan;Luke Zettlemoyer;,Meta;,United States;,Long Main,https://openreview.net/forum?id=bqaW5sGZOq,,,
1053,Revisiting Sparse Retrieval for Few-shot Entity Linking,,Yulin Chen;Zhenran Xu;Baotian Hu;Min Zhang;,Harbin Institute of Technology;,China;,Short Main,https://openreview.net/forum?id=Coh1A4iSsl,,,
1054,Reward-Augmented Decoding: Efficient Controlled Text Generation With a Unidirectional Reward Model,,Haikang Deng;Colin Raffel;,University of North Carolina at Chapel Hill;University of North Carolina;,United States;,Short Main,https://openreview.net/forum?id=I13VHLJjLO,,,
1055,Scaling Law for Document Neural Machine Translation,,Zhang Zhuocheng;Shuhao Gu;Min zhang;Yang Feng;,Chinese Academy of Sciences;Harbin Institute of Technology;,China;,Long Findings,https://openreview.net/forum?id=UEx5dZqXvr,,,
1056,Scaling Vision-Language Models with Sparse Mixture of Experts,,Sheng Shen;Zhewei Yao;Chunyuan Li;Trevor Darrell;Kurt Keutzer;Yuxiong He;,"University of California, Berkeley;Microsoft;Electrical Engineering & Computer Science Department;",United States;;,Long Findings,https://openreview.net/forum?id=IpJ5rAFLv7,,,
1057,Segmented Recurrent Transformer: An Efficient Sequence-to-Sequence Model,,Yinghan Long;Sayeed Shafayet Chowdhury;Kaushik Roy;,Purdue University;,United States;,Long Findings,https://openreview.net/forum?id=TvTwz12BZN,,,
1058,Selecting Key Views for Zero-Shot Entity Linking,,Xuhui Sui;Ying Zhang;Kehui Song;Baohang Zhou;Xiaojie Yuan;Wensheng Zhang;,Nankai University;Chinese Academy of Sciences;,China;,Long Findings,https://openreview.net/forum?id=w4YwLzuD29,,,
1059,Selective Demonstrations for Cross-domain Text-to-SQL,,Shuaichen Chang;Eric Fosler-Lussier;,Ohio State University;,United States;,Long Findings,https://openreview.net/forum?id=7D4TPisEBk,,,
1060,Self-Detoxifying Language Models via Toxification Reversal,,Chak Tou Leong;Yi Cheng;Jiashuo WANG;Jian Wang;Wenjie Li;,Hong Kong Polytechnic University;,China;,Long Main,https://openreview.net/forum?id=jImeNRfAy2,,,
1061,Self-Improvement of Non-autoregressive Model via Sequence-Level Distillation,,Yusheng Liao;Shuyang Jiang;Yiqi Li;Yu Wang;Yanfeng Wang;,Shanghai Jiao Tong University;,China;,Long Main,https://openreview.net/forum?id=6i98agKoZ1,,,
1062,Semantic Similarity Covariance Matrix Shrinkage,,Guillaume Becquin;Saher Esmeir;,Bloomberg;,United States;,Long Findings,https://openreview.net/forum?id=NwJVbDxfTd,,,
1063,SLOG: A Structural Generalization Benchmark for Semantic Parsing,,Bingzhi Li;Lucia Donatelli;Alexander Koller;Tal Linzen;Yuekun Yao;Najoung Kim;,Université de Paris;New York University;Google;,France;United States;,Long Main,https://openreview.net/forum?id=nSPsxWVe4k,,,
1064,SpeechGPT: Empowering Large Language Models with Intrinsic Cross-Modal Conversational Abilities,,Dong Zhang;Shimin Li;Xin Zhang;Jun Zhan;Pengyu Wang;Yaqian Zhou;Xipeng Qiu;,Fudan University;,China;,Long Findings,https://openreview.net/forum?id=0LXEvcD3dB,,,
1065,SpEL: Structured Prediction for Entity Linking,,Hassan Shavarani;Anoop Sarkar;,Simon Fraser University;,Canada;,Long Main,https://openreview.net/forum?id=Jo9P7hrDdy,,,
1066,Sub-network Discovery and Soft-masking for Continual Learning of Mixed Tasks,,Zixuan Ke;Bing Liu;Wenhan Xiong;Asli Celikyilmaz;Haoran Li;,University of Illinois at Chicago;Meta;,United States;,Long Findings,https://openreview.net/forum?id=3JBKnkUACW,,,
1067,Survival of the Most Influential Prompts: Efficient Black-Box Prompt Search via Clustering and Pruning,,Han Zhou;Xingchen Wan;Ivan Vulić;Anna Korhonen;,Google;University of Oxford;PolyAI Limited;University of Cambridge;,United States;United Kingdom;,Long Findings,https://openreview.net/forum?id=BB1qrcPgRu,,,
1068,Symbolic Planning and Code Generation for Grounded Dialogue,,Justin T Chiu;Wenting Zhao;Derek Chen;Saujas Vaduguru;Alexander M Rush;Daniel Fried;,Cornell University;Columbia University;Carnegie Mellon University;Harvard University;,United States;,Long Main,https://openreview.net/forum?id=Ynxo6lene2,,,
1069,TalkUp: Paving the Way for Understanding Empowering Language,,Lucille Njoo;Chan Young Park;Octavia Stappart;Marvin Thielk;Yi Chu;Yulia Tsvetkov;,University of Washington;Carnegie Mellon University;Unknown Institution;,United States;;,Long Findings,https://openreview.net/forum?id=QYSPlIZ6bV,,,
1070,Target-oriented Proactive Dialogue Systems with Personalization: Problem Formulation and Dataset Curation,,Jian Wang;Yi Cheng;Dongding Lin;Chak Tou Leong;Wenjie Li;,Hong Kong Polytechnic University;,China;,Short Main,https://openreview.net/forum?id=ufu4C0bTwB,,,
1071,Task-Attentive Transformer Architecture for Continual Learning of Vision-and-Language Tasks Using Knowledge Distillation,,Yuliang Cai;Jesse Thomason;Mohammad Rostami;,University of Southern California;Amazon;,United States;,Long Findings,https://openreview.net/forum?id=ZQrRDCxfhW,,,
1072,Task-Level Thinking Steps Help Large Language Models for Challenging Classification Task,,chunhui du;Jidong Tian;Haoran Liao;Jindou Chen;Hao HE;Yaohui Jin;,Shanghai Jiao Tong University;,China;,Long Main,https://openreview.net/forum?id=q4oWkMHkQx,,,
1073,Teacher Perception of Automatically Extracted Grammar Concepts for L2 Language Learning,,Aditi Chaudhary;Arun Sampath;Ashwin Sheshadri;Antonios Anastasopoulos;Graham Neubig;,Google;Kannada Academy;George Mason University;Carnegie Mellon University;,United States;India;,Long Findings,https://openreview.net/forum?id=newk6aDMRi,,,
1074,Text Rendering Strategies for Pixel Language Models,,Jonas F. Lotz;Elizabeth Salesky;Phillip Rust;Desmond Elliott;,University of Copenhagen;Johns Hopkins University;,Denmark;United States;,Long Main,https://openreview.net/forum?id=NiEYKbNnQO,,,
1075,Text-guided 3D Human Generation from 2D Collections,,Tsu-Jui Fu;Wenhan Xiong;Yixin Nie;Jingyu Liu;Barlas Oguz;William Yang Wang;,"University of California, Santa Barbara;Meta;",United States;,Long Findings,https://openreview.net/forum?id=jvTV8vSa3X,,,
1076,The Curious Case of Hallucinatory (Un)answerability: Finding Truths in the Hidden States of Over-Confident Large Language Models,,Aviv Slobodkin;Omer Goldman;Avi Caciularu;Ido Dagan;Shauli Ravfogel;,Bar-Ilan University;Google;,Israel;United States;,Long Main,https://openreview.net/forum?id=mCnBRLJuhY,,,
1077,TheoremQA: A Theorem-driven Question Answering Dataset,,Wenhu Chen;Ming Yin;Max Ku;Pan Lu;Yixin Wan;Xueguang Ma;Jianyu Xu;Xinyi Wang;Tony Xia;,"University of California, Santa Barbara;Caritas Institute of Higher Education;University of California, Los Angeles;University of Waterloo;Microsoft;",United States;China;Canada;,Long Main,https://openreview.net/forum?id=Wom397PB55,,,
1078,Three Questions Concerning the Use of Large Language Models to Facilitate Mathematics Learning,,An-Zi Yen;Wei-Ling Hsu;,National Yang Ming Chiao Tung University;,China;,Short Findings,https://openreview.net/forum?id=qDspFDJEHP,,,
1079,TOD-Flow: Modeling the Structure of Task-Oriented Dialogues,,Sungryull Sohn;Yiwei Lyu;Anthony Zhe Liu;Lajanugen Logeswaran;Dong-Ki Kim;Dongsub Shim;Honglak Lee;,LG;University of Michigan;Massachusetts Institute of Technology;,South Korea;United States;,Long Main,https://openreview.net/forum?id=n1Sx9ZjJRs,,,
1080,Towards Example-Based NMT with Multi-Levenshtein Transformers,,Maxime Bouthors;Josep Crego;François Yvon;,SYSTRAN;Université Paris Saclay;,France;,Long Main,https://openreview.net/forum?id=sFtyaTTtap,,,
1081,Towards Multilingual Interlinear Morphological Glossing,,Shu Okabe;François Yvon;,Université Paris Saclay;,France;,Long Findings,https://openreview.net/forum?id=eBUgomB8uo,,,
1082,TRAVEL: Tag-Aware Conversational FAQ Retrieval via Reinforcement Learning,,Yue Chen;Dingnan Jin;Chen Huang;Jia Liu;Wenqiang Lei;,Sichuan University;Alibaba Group;Ant Group;,China;,Long Main,https://openreview.net/forum?id=kdjSXbypKX,,,
1083,Tree Prompting: Efficient Task Adaptation without Fine-Tuning,,Chandan Singh;John Xavier Morris;Alexander M Rush;Jianfeng Gao;Yuntian Deng;,Microsoft;Cornell University;Harvard University;,United States;,Long Main,https://openreview.net/forum?id=d0zla3M3LI,,,
1084,TrueTeacher: Learning Factual Consistency Evaluation with Large Language Models,,Zorik Gekhman;Jonathan Herzig;Roee Aharoni;Chen Elkind;Idan Szpektor;,Technion - Israel Institute of Technology;Google;,Israel;United States;,Long Main,https://openreview.net/forum?id=rRwPzcSFeL,,,
1085,Unsupervised Candidate Answer Extraction through Differentiable Masker-Reconstructor Model,,Zhuoer Wang;Yicheng Wang;Ziwei Zhu;James Caverlee;,Texas A&M University;George Mason University;Google;,United States;,Long Findings,https://openreview.net/forum?id=fXyoHAVffT,,,
1086,UReader: Universal OCR-free Visually-situated Language Understanding with Multimodal Large Language Model,,Jiabo Ye;Anwen Hu;Haiyang Xu;Qinghao Ye;Ming Yan;Guohai Xu;Chenliang Li;Junfeng Tian;Qi Qian;Ji Zhang;Qin Jin;Liang He;Xin Alex Lin;Fei Huang;,East China Normal University;Renmin University of China;Alibaba Group;,China;,Long Findings,https://openreview.net/forum?id=qtZI5YDe5d,,,
1087,ViSoBERT: A Pre-Trained Language Model for Vietnamese Social Media Text Processing,,Nam Quoc Nguyen;Thang Chau Phan;Duc-Vu Nguyen;Kiet Van Nguyen;,University of Information Technology;,;Vietnam;,Long Main,https://openreview.net/forum?id=gqkg54QNDY,,,
1088,VivesDebate-Speech: A Corpus of Spoken Argumentation to Leverage Audio Features for Argument Mining,,Ramon Ruiz-Dolz;Javier Iranzo Sanchez;,Universidad Politécnica de Valencia;,Spain;,Short Main,https://openreview.net/forum?id=rLx2eDYcMK,,,
