Index,Title,Session/Area,Authors,Affiliation,Country,Status,Proceeding URL,PDF URL,CVF URL,Arxiv URL
545,ClimateBERT-NetZero: Detecting and Assessing Net Zero and Reduction Targets,,Tobias Schimanski;Julia Bingler;Mathias Kraus;Camilla Hyslop;Markus Leippold;,University of Zurich;University of Oxford;Friedrich-Alexander-Universität Erlangen-Nürnberg;,Switzerland;United Kingdom;Germany;,Short Main,https://openreview.net/forum?id=0ULLuIRdcu,,,
546,ClozEx: A Task toward Generation of English Cloze Explanation,,Zizheng Zhang;Masato Mita;Mamoru Komachi;,Tokyo Metropolitan University;CyberAgent Inc.;,Japan;,Long Findings,https://openreview.net/forum?id=hTLIAYTi5w,,,
547,Co-training and Co-distillation for Quality Improvement and Compression of Language Models,,Hayeon Lee;Rui Hou;Jongpil Kim;Davis Liang;Hongbo Zhang;Sung Ju Hwang;Alexander Min;,Korea Advanced Institute of Science and Technology;Meta;,South Korea;United States;,Long Findings,https://openreview.net/forum?id=XX73vFMemG,,,
548,CodeTransOcean: A Comprehensive Multilingual Benchmark for Code Translation,,Weixiang Yan;Yuchen Tian;Yunzhe Li;Qian Chen;Wen Wang;,"University of California, Santa Barbara;University of Hong Kong;University of Illinois;Alibaba Group;",United States;China;,Long Findings,https://openreview.net/forum?id=hv3VpXDIh8,,,
549,Collaborative Generative AI: Integrating GPT-k for Efficient Editing in Text-to-Image Generation,,Wanrong Zhu;Xinyi Wang;Yujie Lu;Tsu-Jui Fu;Xin Eric Wang;Miguel Eckstein;William Yang Wang;,"Microsoft;University of California, Santa Barbara;University of California, Santa Cruz;",United States;,Short Main,https://openreview.net/forum?id=JotVdrvFtJ,,,
550,Comparing Biases and the Impact of Multilingual Training across Multiple Languages,,Sharon Levy;Neha Anna John;Ling Liu;Yogarshi Vyas;Jie Ma;Yoshinari Fujinuma;Miguel Ballesteros;Vittorio Castelli;Dan Roth;,"University of California, Santa Barbara;Amazon;",United States;,Long Main,https://openreview.net/forum?id=NYlL3oACU2,,,
551,CompoundPiece: Evaluating and Improving Decompounding Performance of Language Models,,Benjamin Minixhofer;Jonas Pfeiffer;Ivan Vulić;,Johannes Kepler University;Google;PolyAI Limited;,Austria;United Kingdom;,Long Main,https://openreview.net/forum?id=xapBkUt0yf,,,
552,Compressing Context to Enhance Inference Efficiency of Large Language Models,,YUCHENG LI;BO DONG;Frank Guerin;Chenghua Lin;,University of Surrey;,United Kingdom;,Long Main,https://openreview.net/forum?id=cjbdRN8Yxy,,,
553,Confidence-based Ensembling of Perspective-aware Models,,Silvia Casola;Soda Marem Lo;Valerio Basile;Simona Frenda;Alessandra Teresa Cignarella;Viviana Patti;Cristina Bosco;,Fondazione Bruno Kessler;University of Turin;,Italy;,Long Main,https://openreview.net/forum?id=mW5M8qkAxt,,,
554,Conic10K: A Challenging Math Problem Understanding and Reasoning Dataset,,Haoyi Wu;Wenyang Hui;Yezeng Chen;Weiqi Wu;Kewei Tu;Yi Zhou;,ShanghaiTech University;University of Science and Technology of China;,China;,Long Findings,https://openreview.net/forum?id=ckKuQDW2RZ,,,
555,Construction Artifacts in Metaphor Identification Datasets,,Joanne Boisson;Luis Espinosa-Anke;Jose Camacho-Collados;,Cardiff University;AMPLYFI;,United Kingdom;;,Short Main,https://openreview.net/forum?id=bQLMv4v0Gc,,,
556,Continual Named Entity Recognition without Catastrophic Forgetting,,Duzhen Zhang;Wei Cong;Jiahua Dong;Yahan Yu;Xiuyi Chen;Yonggang Zhang;Zhen Fang;,Chinese Academy of Sciences;Baidu;Hong Kong Baptist University;University of Technology Sydney;,China;Australia;,Long Main,https://openreview.net/forum?id=VLrtaSXOWP,,,
557,CONTRASTE: Supervised Contrastive Pre-training With Aspect-based Prompts For Aspect Sentiment Triplet Extraction,,Rajdeep Mukherjee;Nithish Kannen;Saurabh Kumar Pandey;Pawan Goyal;,Indian Institute of Technology Kharagpur;Indian Institute of Technology;,India;,Long Findings,https://openreview.net/forum?id=FMwflM9yVJ,,,
558,COUNT: COntrastive UNlikelihood Text Style Transfer for Text Detoxification,,Mohammad Mahdi Abdollah Pour;Parsa Farinneya;Manasa Bharadwaj;Nikhil Verma;Ali Pesaranghader;Scott Sanner;,University of Toronto;LG;Unknown Institution;,Canada;South Korea;;,Short Findings,https://openreview.net/forum?id=SvmlxXMLYr,,,
559,"Cross-Cultural Analysis of Human Values, Morals, and Biases in Folk Tales",,Winston Wu;Lu Wang;Rada Mihalcea;,University of Michigan;,United States;,Long Main,https://openreview.net/forum?id=h1nUUpmvpf,,,
560,Cross-Lingual Cross-Target Stance Detection with Dual Knowledge Distillation Framework,,Ruike Zhang;Hanxuan Yang;Wenji Mao;,Chinese Academy of Sciences;,China;,Long Main,https://openreview.net/forum?id=LZq3crn3Bv,,,
561,Cross-lingual Open-Retrieval Question Answering for African Languages,,Odunayo Ogundepo;Tajuddeen Gwadabe;Clara E. Rivera;Jonathan H. Clark;Sebastian Ruder;David Ifeoluwa Adelani;Bonaventure F. P. Dossou;Abdou Aziz DIOP;Claytone Sikasote;Gilles HACHEME;Happy Buzaaba;Ignatius Ezeani;Rooweither Mabuya;Salomey Osei;Chris Chinenye Emezue;Albert Kahira;Shamsuddeen Hassan Muhammad;Akintunde Oladipo;Abraham Toluwase Owodunni;Atnafu Lambebo Tonja;Iyanuoluwa Shode;Akari Asai;Anuoluwapo Aremu;Ayodele Awokoya;Bernard Opoku;Chiamaka Ijeoma Chukwuneke;Christine Mwase;Clemencia Siro;Stephen Arthur;Tunde Oluwaseyi Ajayi;Verrah Akinyi Otiende;Andre Niyongabo Rubungo;Boyd Sinkala;Daniel Ajisafe;Emeka Felix Onwuegbuzia;Falalu Ibrahim Lawan;Ibrahim Said Ahmad;Jesujoba Oluwadara Alabi;CHINEDU EMMANUEL MBONU;Mofetoluwa Adeyemi;Mofya Phiri;Orevaoghene Ahia;Ruqayya Nasir Iro;Sonia Adhiambo;,"University of Waterloo;Masakhane Research Foundation;Google;University College London;McGill University;Masakhane;RIKEN;Lancaster University;North-West University;Universidad de Deusto;Julich Supercomputing Center;Instituto Politécnico Nacional;Bloomberg;University of Washington;University of Ibadan;Accra Institute of Technology;National University of Ireland, Galway;Tom Mboya University;Princeton University;University of Zambia;University of British Columbia;Kaduna State University;Bayero University;Universität des Saarlandes;Nnamdi Azikiwe University;National Open University of Nigeria;",Canada;South Africa;United States;United Kingdom;Japan;Spain;Germany;Mexico;Nigeria;Ghana;Ireland;Kenya;Zambia;,Long Findings,https://openreview.net/forum?id=3ymHqvobHJ,,,
562,Debias NLU Datasets via Training-free Perturbations,,Qi Guo;yuanhang tang;Yawen Ouyang;Zhen Wu;Xinyu Dai;,Nanjing University;,China;,Long Findings,https://openreview.net/forum?id=KOxEqQzvOZ,,,
563,DecoMT: Decomposed Prompting for Machine Translation Between Related Languages using Large Language Models,,Ratish Puduppully;Anoop Kunchukuttan;Raj Dabre;AiTi Aw;Nancy F. Chen;,"Agency for Science, Technology and Research;Microsoft;National Institute of Information and Communications Technology;A*STAR;",Singapore;United States;Japan;,Long Main,https://openreview.net/forum?id=ii9ZoryPH2,,,
564,Democratizing Reasoning Ability: Tailored Learning from Large Language Model,,Zhaoyang Wang;Shaohan Huang;Yuxuan Liu;Jiahai Wang;Minghui Song;Zihan Zhang;Haizhen Huang;Furu Wei;Weiwei Deng;Feng Sun;Qi Zhang;,Microsoft;Peking University;Sun Yat-sen University;,United States;China;,Long Main,https://openreview.net/forum?id=rq4UfmpRA9,,,
565,Describe Me an Auklet: Generating Grounded Perceptual Category Descriptions,,Bill Noble;Nikolai Ilinykh;,University of Gothenburg;,Sweden;,Long Main,https://openreview.net/forum?id=QoiOmXy3A7,,,
566,Descriptive Prompt Paraphrasing for Target-Oriented Multimodal Sentiment Classification,,Dan Liu;Lin Li;Xiaohui Tao;Jian Cui;Qing Xie;,Wuhan University of Technology;University of Southern Queensland;,China;Australia;,Long Findings,https://openreview.net/forum?id=ljjy0Sw5sx,,,
567,Detecting Propaganda Techniques in Code-Switched Social Media Text,,Muhammad Umar Salman;Asif Hanif;Shady Shehata;Preslav Nakov;,Mohamed bin Zayed University of Artificial Intelligence;,United Arab Emirates;,Long Main,https://openreview.net/forum?id=SoypWgmvqP,,,
568,DetGPT: Detect What You Need via Reasoning,,Renjie Pi;Jiahui Gao;Shizhe Diao;Rui Pan;Hanze Dong;Jipeng Zhang;Lewei Yao;Jianhua Han;Hang Xu;Lingpeng Kong;Tong Zhang;,Hong Kong University of Science and Technology;Huawei;University of Hong Kong;,China;,Long Main,https://openreview.net/forum?id=6lXuQBMsyM,,,
569,Dialect Transfer for Swiss German Speech Translation,,Claudio Paonessa;Yanick Schraner;Jan Milan Deriu;Manuela Hürlimann;Manfred Vogel;Mark Cieliebak;,Fachhochschule Nordwestschweiz;Zürcher Hochschule für Angewandte Wissenschaften;Zurich University of Applied Sciences;,Switzerland;,Long Findings,https://openreview.net/forum?id=2X5RXTOsLU,,,
570,DiFair: A Benchmark for Disentangled Assessment of Gender Knowledge and Bias,,Mahdi Zakizadeh;Kaveh Eskandari Miandoab;Mohammad Taher Pilehvar;,Tehran Institute for Advanced Studies;Worcester Polytechnic Institute;TeIAS;,Iran;United States;;,Long Findings,https://openreview.net/forum?id=udl5f2seyU,,,
571,DiffusionRet: Diffusion-Enhanced Generative Retriever using Constrained Decoding,,Shanbao Qiao;Xuebing Liu;Seung-Hoon Na;,Chonbuk National University;,South Korea;,Long Findings,https://openreview.net/forum?id=Pw9vYSPJKk,,,
572,DiNeR: A Large Realistic Dataset for Evaluating Compositional Generalization,,Chengang Hu;Xiao Liu;Yansong Feng;,"University of California, Los Angeles;Peking University;",United States;China;,Long Main,https://openreview.net/forum?id=3Nq9KRcvx5,,,
573,Discourse Structures Guided Fine-grained Propaganda Identification,,Yuanyuan Lei;Ruihong Huang;,Texas A&M University;,United States;,Long Main,https://openreview.net/forum?id=xbnNgqGefc,,,
574,Drilling Down into the Discourse Structure with LLMs for Long Document Question Answering,,Inderjeet Jayakumar Nair;Shwetha S;Apoorv Saxena;Koustava Goswami;,Adobe;Insight Centre for Data Analytics;,United States;Ireland;,Long Findings,https://openreview.net/forum?id=5DUhBxRqKR,,,
575,E-CORE: Emotion Correlation Enhanced Empathetic Dialogue Generation,,Fengyi Fu;Lei Zhang;Quan Wang;Zhendong Mao;,Beijing University of Posts and Telecommunications;,China;,Long Main,https://openreview.net/forum?id=MbKRJUowYX,,,
576,e-THERAPIST: I suggest you to cultivate a mindset of positivity and nurture uplifting thoughts,,Kshitij Mishra;Priyanshu Priya;Manisha Burja;Asif Ekbal;,Indian Institute of Technology Patna;,India;,Long Main,https://openreview.net/forum?id=7UVOFuNk27,,,
577,Empirical Study of Zero-Shot NER with ChatGPT,,Tingyu Xie;Qi Li;Jian Zhang;Yan Zhang;Zuozhu Liu;Hongwei Wang;,Zhejiang University;National University of Singapore;,China;Singapore;,Long Main,https://openreview.net/forum?id=WVs1qhIUms,,,
578,"End-to-end Task-oriented Dialogue: A Survey of Tasks, Methods, and Future Directions",,Libo Qin;Wenbo Pan;Qiguang Chen;Lizi Liao;Zhou Yu;Yue Zhang;Wanxiang Che;Min Li;,Harbin Institute of Technology;Singapore Management University;Columbia University;Westlake University;Central South University;,China;Singapore;United States;,Long Main,https://openreview.net/forum?id=edwSiVzFpU,,,
579,Enhancing Abstractiveness of Summarization Models through Calibrated Distillation,,Hwanjun Song;Igor Shalyminov;Hang Su;Siffi Singh;Kaisheng Yao;Saab Mansour;,Amazon;,United States;,Long Findings,https://openreview.net/forum?id=ZNQh02cCxt,,,
580,Enhancing Task-oriented Dialogue Systems with Generative Post-processing Networks,,Atsumoto Ohashi;Ryuichiro Higashinaka;,Nagoya University;NTT Corporation;,Japan;,Long Main,https://openreview.net/forum?id=kspXkK9PtA,,,
581,Evaluating Cross-Domain Text-to-SQL Models and Benchmarks,,Mohammadreza Pourreza;Davood Rafiei;,University of Alberta;,Canada;,Long Main,https://openreview.net/forum?id=sbuO0s1r71,,,
582,Evaluation of African American Language Bias in Natural Language Generation,,Nicholas Deas;Jessica A Grieser;Shana Kleiner;Desmond U. Patton;Elsbeth Turcan;Kathleen McKeown;,Columbia University;University of Michigan;University of Pennsylvania;,United States;,Long Main,https://openreview.net/forum?id=adjZtG9bDM,,,
583,Examining Inter-Consistency of Large Language Models Collaboration: An In-depth Analysis via Debate,,Kai Xiong;Xiao Ding;Yixin Cao;Ting Liu;Bing Qin;,Singapore Management University;Harbin Institute of Technology;,Singapore;China;,Long Findings,https://openreview.net/forum?id=XEwQ1fDbDN,,,
584,Exploring Graph Pre-training for Aspect-based Sentiment Analysis,,Xiaoyi Bao;Zhongqing Wang;Guodong Zhou;,Soochow University;,China;,Long Findings,https://openreview.net/forum?id=o6D5yTpK8w,,,
585,Exploring the Effectiveness of Multi-Lingual Commonsense Knowledge-Aware Open-Domain Dialogue Response Generation,,Sixing Wu;Jiong Yu;Tianshi Che;Yang Zhou;Wei Zhou;,Yunnan University;Auburn University;,China;United States;,Long Findings,https://openreview.net/forum?id=4IubiozIFH,,,
586,EZ-STANCE: A Large Dataset for Zero-Shot Stance Detection,,Chenye Zhao;Cornelia Caragea;,University of Illinois at Chicago;,United States;,Long Findings,https://openreview.net/forum?id=yB8cQIICqe,,,
587,FinEntity: Entity-level Sentiment Classification for Financial Texts,,Yixuan Tang;Yi Yang;Allen H Huang;Andy Tam;Justin Z. Tang;,Hong Kong University of Science and Technology;,China;,Short Main,https://openreview.net/forum?id=1WJoJPXwiG,,,
588,From Parse-Execute to Parse-Execute-Refine: Improving Semantic Parser for Complex Question Answering over Knowledge Base,,Wangzhen Guo;Linyin Luo;Hanjiang Lai;Jian Yin;,Sun Yat-sen University;,China;,Long Main,https://openreview.net/forum?id=I5BnQIgQIM,,,
589,From Relevance to Utility: Evidence Retrieval with Feedback for Fact Verification,,Hengran Zhang;Ruqing Zhang;Jiafeng Guo;Maarten de Rijke;Yixing Fan;Xueqi Cheng;,Chinese Academy of Sciences;University of Amsterdam;,China;Netherlands;,Short Findings,https://openreview.net/forum?id=d0qmGnKfXa,,,
590,Fusing Temporal Graphs into Transformers for Time-Sensitive Question Answering,,Xin Su;Phillip Howard;Nagib Hakim;Steven Bethard;,University of Arizona;Intel;,United States;,Long Findings,https://openreview.net/forum?id=y34lg6q50A,,,
591,G-Eval: NLG Evaluation using Gpt-4 with Better Human Alignment,,Yang Liu;Dan Iter;Yichong Xu;Shuohang Wang;Ruochen Xu;Chenguang Zhu;,Microsoft;Zoom Video Communications Inc.;,United States;,Long Main,https://openreview.net/forum?id=puMfaHb1hY,,,
592,GazeVQA: A Video Question Answering Dataset for Multiview Eye-Gaze Task-Oriented Collaborations,,Muhammet Furkan ILASLAN;Chenan Song;Joya Chen;Difei Gao;Weixian Lei;Qianli Xu;Joo Hwee Lim;Mike Zheng Shou;,"National University of Singapore;Institute for Infocomm Research;Agency for Science, Technology and Research;",Singapore;,Long Main,https://openreview.net/forum?id=MkD0VGShAq,,,
593,GEMINI: Controlling The Sentence-Level Summary Style in Abstractive Text Summarization,,Guangsheng Bao;Zebin Ou;Yue Zhang;,Westlake University;,China;,Long Main,https://openreview.net/forum?id=vscmppXqXE,,,
594,Generating Data for Symbolic Language with Large Language Models,,Jiacheng Ye;Chengzu Li;Lingpeng Kong;Tao Yu;,University of Hong Kong;University of Cambridge;,China;United Kingdom;,Long Main,https://openreview.net/forum?id=UQpbq4v8Xi,,,
595,GRACE: Discriminator-Guided Chain-of-Thought Reasoning,,Muhammad Khalifa;Lajanugen Logeswaran;Moontae Lee;Honglak Lee;Lu Wang;,University of Michigan;LG;University of Illinois at Chicago;,United States;South Korea;,Long Findings,https://openreview.net/forum?id=2MiTZxLFA9,,,
596,GradSim: Gradient-Based Language Grouping for Effective Multilingual Training,,Mingyang Wang;Heike Adel;Lukas Lange;Jannik Strötgen;Hinrich Schuetze;,Ludwig Maximilian University of Munich;Robert Bosch GmbH;Center for Information and Language Processing;,Germany;;,Long Main,https://openreview.net/forum?id=iVINvItqhb,,,
597,Gradually Excavating External Knowledge for Implicit Complex Question Answering,,Chang Liu;Xiaoguang Li;Lifeng Shang;Xin Jiang;Qun Liu;Edmund Y. Lam;Ngai Wong;,Huawei;University of Hong Kong;,China;,Long Findings,https://openreview.net/forum?id=6DKS4tb387,,,
598,Graph vs. Sequence: An Empirical Study on Knowledge Forms for Knowledge-Grounded Dialogue,,Yizhe Yang;Heyan Huang;Yuhang Liu;Yang Gao;,Beijing Institute of Technology;,China;,Long Main,https://openreview.net/forum?id=06oozRd4jU,,,
599,Guideline Learning for In-Context Information Extraction,,Chaoxu Pang;Yixuan Cao;Qiang Ding;Ping Luo;,Chinese Academy of Sciences;,China;,Long Main,https://openreview.net/forum?id=2KTvN4Edvl,,,
600,Guiding LLM to Fool Itself: Automatically Manipulating Machine Reading Comprehension Shortcut Triggers,,Mosh Levy;Shauli Ravfogel;Yoav Goldberg;,Bar-Ilan University;Allen Institute for Artificial Intelligence;,Israel;United States;,Short Findings,https://openreview.net/forum?id=TKzERU0kq1,,,
601,HalOmi: A Manually Annotated Benchmark for Multilingual Hallucination and Omission Detection in Machine Translation,,David Dale;Elena Voita;Janice Lam;Prangthip Hansanti;Christophe Ropers;Elahe Kalbassi;Cynthia Gao;Loic Barrault;Marta R. Costa-jussà;,Meta;University of Edinburgh;Syntexys Inc;,United States;United Kingdom;;,Long Main,https://openreview.net/forum?id=wYdA8CF94e,,,
602,Holistic Inter-Annotator Agreement and Corpus Coherence Estimation in a Large-scale Multilingual Annotation Campaign,,Nicolas Stefanovitch;Jakub Piskorski;,Polish Academy of Sciences;,Poland;,Long Main,https://openreview.net/forum?id=zIgc1Qeceh,,,
603,How Well Do Text Embedding Models Understand Syntax?,,Yan Zhang;Zhaopeng Feng;Zhiyang Teng;Zuozhu Liu;Haizhou Li;,National University of Singapore;Harbin Institute of Technology;Nanyang Technological University;Zhejiang University;,Singapore;China;,Long Findings,https://openreview.net/forum?id=Ox0OoyLass,,,
604,IAG: Induction-Augmented Generation Framework for Answering Reasoning Questions,,Zhebin Zhang;Xinyu Zhang;Yuanhang Ren;Saijiang Shi;Meng Han;Yongkang Wu;Ruofei Lai;Zhao Cao;,Huawei;,China;,Long Main,https://openreview.net/forum?id=zwqDROxClj,,,
605,Improving Neural Machine Translation by Multi-Knowledge Integration with Prompting,,Ke Wang;Jun Xie;Yuqi Zhang;Yu Zhao;,Alibaba Group;,China;,Long Findings,https://openreview.net/forum?id=i7ifZu49kW,,,
606,Indicative Summarization of Long Discussions,,Shahbaz Syed;Dominik Schwabe;Khalid Al Khatib;Martin Potthast;,University of Leipzig;University of Groningen;Leipzig University;,Germany;Netherlands;,Long Main,https://openreview.net/forum?id=pFTBsdZ1UM,,,
607,INFORM : Information eNtropy based multi-step reasoning FOR large language Models,,Chuyue Zhou;WangJie You;Juntao Li;Jing Ye;Kehai Chen;Min Zhang;,Suzhou University;Soochow University;Harbin Institute of Technology;,China;,Long Main,https://openreview.net/forum?id=mLJOMUwQyz,,,
608,Interventional Rationalization,,Linan Yue;Qi Liu;Li Wang;Yanqing An;Yichao Du;Zhenya Huang;,University of Science and Technology of China;,China;,Long Main,https://openreview.net/forum?id=IpzCUvade7,,,
609,JointMatch: A Unified Approach for Diverse and Collaborative Pseudo-Labeling to Semi-Supervised Text Classification,,Henry Peng Zou;Cornelia Caragea;,University of Illinois at Chicago;,United States;,Long Main,https://openreview.net/forum?id=ZAHyZ3CBds,,,
610,K-HATERS: A Hate Speech Detection Corpus in Korean with Target-Specific Ratings,,Chaewon Park;Soohwan Kim;Kyubyong Park;Kunwoo Park;,Soongsil University;,South Korea;,Long Findings,https://openreview.net/forum?id=6mZIF4OxSq,,,
611,KRLS: Improving End-to-End Response Generation in Task Oriented Dialog with Reinforced Keywords Learning,,Xiao Yu;Qingyang Wu;Kun Qian;Zhou Yu;,Columbia University;Amazon;,United States;,Long Main,https://openreview.net/forum?id=EY9k2x5qWB,,,
612,LACMA: Language-Aligning Contrastive Learning with Meta-Actions for Embodied Instruction Following,,Cheng-Fu Yang;Yen-Chun Chen;Jianwei Yang;Xiyang Dai;Lu Yuan;Yu-Chiang Frank Wang;Kai-Wei Chang;,"University of California, Los Angeles;Microsoft;National Taiwan University;Amazon;",United States;China;,Long Main,https://openreview.net/forum?id=uRIFDS3gtG,,,
613,Large Language Models Meet Open-World Intent Discovery and Recognition: An Evaluation of ChatGPT,,Xiaoshuai Song;Keqing He;Pei Wang;Guanting Dong;Yutao Mou;Jingang Wang;Yunsen Xian;Xunliang Cai;Weiran Xu;,Beijing University of Posts and Telecommunications;Meituan Group;Meituan;,China;,Long Main,https://openreview.net/forum?id=NT4ehxCifo,,,
614,Learning to Describe for Predicting Zero-shot Drug-Drug Interactions,,Fangqi Zhu;Yongqi Zhang;Lei Chen;Bing Qin;Ruifeng Xu;,Harbin Institute of Technology;4Paradigm;Hong Kong University of Science and Technology;,China;,Long Main,https://openreview.net/forum?id=3dNeNpmyiO,,,
615,LEXTREME: A Multi-Lingual and Multi-Task Benchmark for the Legal Domain,,Joel Niklaus;Veton Matoshi;Pooja Rani;Andrea Galassi;Matthias Stürmer;Ilias Chalkidis;,Stanford University;Bern University of Applied Sciences;University of Bologna;University of Bern;University of Copenhagen;,United States;Switzerland;Italy;Denmark;,Long Findings,https://openreview.net/forum?id=qE5vtBMbCJ,,,
616,Localizing Active Objects from Egocentric Vision with Symbolic World Knowledge,,Te-Lin Wu;Yu Zhou;Nanyun Peng;,"University of California, Los Angeles;",United States;,Long Main,https://openreview.net/forum?id=hWNsvpWfhy,,,
617,Locally Differentially Private Document Generation Using Zero Shot Prompting,,Saiteja Utpala;Sara Hooker;Pin-Yu Chen;,Microsoft;International Business Machines Corporation;Cohere;,United States;,Long Findings,https://openreview.net/forum?id=TZW4nzgtQ8,,,
618,Logic-LM: Empowering Large Language Models with Symbolic Solvers for Faithful Logical Reasoning,,Liangming Pan;Alon Albalak;Xinyi Wang;William Yang Wang;,"University of California, Santa Barbara;Microsoft;",United States;,Long Findings,https://openreview.net/forum?id=nWXMv949ZH,,,
619,Longtriever: a Pre-trained Long Text Encoder for Dense Document Retrieval,,Junhan Yang;Zheng Liu;Chaozhuo Li;Guangzhong Sun;Xing Xie;,University of Science and Technology of China;Microsoft;Beijing University of Posts and Telecommunications;,China;United States;,Long Main,https://openreview.net/forum?id=ljsGKc8cVR,,,
620,M2C: Towards Automatic Multimodal Manga Complement,,Hongcheng Guo;Boyang Wang;Jiaqi Bai;Jiaheng Liu;Jian Yang;Zhoujun Li;,Beihang University;,China;,Short Findings,https://openreview.net/forum?id=ODeHH5FBwx,,,
621,M2DF: Multi-grained Multi-curriculum Denoising Framework for Multimodal Aspect-based Sentiment Analysis,,Fei Zhao;Chunhui Li;Zhen Wu;Yawen Ouyang;Jianbing Zhang;Xinyu Dai;,Nanjing University;,China;,Long Main,https://openreview.net/forum?id=RgA1tcrxan,,,
622,MAF: Multi-Aspect Feedback for Improving Reasoning in Large Language Models,,Deepak Nathani;David Wang;Liangming Pan;William Yang Wang;,"Amazon;University of California, Santa Barbara;",United States;,Long Main,https://openreview.net/forum?id=bNeDLx5O6w,,,
623,mAggretriever: A Simple yet Effective Approach to Zero-Shot Multilingual Dense Retrieval,,Sheng-Chieh Lin;Amin Ahmad;Jimmy Lin;,Meta;Vectara;University of Waterloo;,United States;;Canada;,Short Main,https://openreview.net/forum?id=IEH9YsR5Ty,,,
624,MailEx: Email Event and Argument Extraction,,Saurabh Srivastava;Gaurav Singh;Shou Matsumoto;Ali K Raz;Paulo Costa;Joshua Campbell Poore;Ziyu Yao;,George Mason University;University of Maryland;,United States;,Long Main,https://openreview.net/forum?id=BdpoEj33DZ,,,
625,Making Body Movement in Sign Language Corpus Accessible for Linguists and Machines with Three-Dimensional Normalization of MediaPipe,,Victor Skobov;Mayumi Bono;,Tokyo Institute of Technology;,Japan;,Long Findings,https://openreview.net/forum?id=unKIy4mpnn,,,
626,MemeCap: A Dataset for Captioning and Interpreting Memes,,EunJeong Hwang;Vered Shwartz;,University of British Columbia;,Canada;,Long Main,https://openreview.net/forum?id=te3pXuiVk3,,,
627,Merging Generated and Retrieved Knowledge for Open-Domain QA,,Yunxiang Zhang;Muhammad Khalifa;Lajanugen Logeswaran;Moontae Lee;Honglak Lee;Lu Wang;,University of Michigan;LG;University of Illinois at Chicago;,United States;South Korea;,Long Main,https://openreview.net/forum?id=iEACF99lQz,,,
628,Mixture of Soft Prompts for Controllable Data Generation,,Derek Chen;Celine Lee;Yunan Lu;Domenic Rosati;Zhou Yu;,Columbia University;Cornell University;scite.ai;,United States;,Long Findings,https://openreview.net/forum?id=4FDx4KMZnu,,,
629,Mixture-of-Linguistic-Experts Adapters for Improving and Interpreting Pre-trained Language Models,,Raymond Li;Gabriel Murray;Giuseppe Carenini;,University of British Columbia;University of the Fraser Valley;,Canada;,Long Findings,https://openreview.net/forum?id=Q9BLbN1p6h,,,
630,Model-tuning Via Prompts Makes NLP Models Adversarially Robust,,Mrigank Raman;Pratyush Maini;J Zico Kolter;Zachary Chase Lipton;Danish Pruthi;,Carnegie Mellon University;Indian Institute of Science;,United States;India;,Long Main,https://openreview.net/forum?id=R4yb4m7Nus,,,
631,NLI4CT: Multi-Evidence Natural Language Inference for Clinical Trial Reports,,Mael Jullien;Marco Valentino;Hannah Ruth Frost;Paul O'Regan;Dónal Landers;Andre Freitas;,University of Manchester;Idiap Research Institute;,United Kingdom;Switzerland;,Long Main,https://openreview.net/forum?id=Zlm7F7g9FK,,,
632,Non-Autoregressive Math Word Problem Solver with Unified Tree Structure,,Yi Bin;Mengqun Han;WENHAO SHI;Lei Wang;Yang Yang;See-Kiong Ng;Heng Tao Shen;,National University of Singapore;University of Electronic Science and Technology of China;Singapore Management University;,Singapore;China;,Long Main,https://openreview.net/forum?id=nGFQ7IqOyg,,,
633,NORMSAGE: Multi-Lingual Multi-Cultural Norm Discovery from Conversations On-the-Fly,,Yi Fung;Tuhin Chakrabarty;Hao Guo;Owen Rambow;Smaranda Muresan;Heng Ji;,University of Illinois Urbana-Champaign;Columbia University;Tsinghua University;Stony Brook University;University of Illinois;,United States;China;,Long Main,https://openreview.net/forum?id=2kSufHoYEi,,,
