Index,Title,Session/Area,Authors,Affiliation,Country,Status,Proceeding URL,PDF URL,CVF URL,Arxiv URL
660,Physics-based hand interaction with virtual objects,,Jun-Sik Kim;Jung-Min Park;Jun-Sik Kim;Jung-Min Park;,Korea Institute of Science and Technology;,South Korea;,Poster,https://ieeexplore.ieee.org/document/7139730/,,,
661,Physics-based trajectory optimization for grasping in cluttered environments,,Nikita Kitaev;Igor Mordatch;Sachin Patil;Pieter Abbeel;Nikita Kitaev;Igor Mordatch;Sachin Patil;Pieter Abbeel;,"University of California, Berkeley;University of Washington;",United States;,Poster,https://ieeexplore.ieee.org/document/7139625/,,,
662,Plan execution monitoring through detection of unmet expectations about action outcomes,,Juan Pablo Mendoza;Manuela Veloso;Reid Simmons;Juan Pablo Mendoza;Manuela Veloso;Reid Simmons;,Carnegie Mellon University;,United States;,Poster,https://ieeexplore.ieee.org/document/7139646/,,,
663,Plan folding motion for rigid self-folding machine via discrete domain sampling,,Zhonghua Xi;Jyh-Ming Lien;Zhonghua Xi;Jyh-Ming Lien;,George Mason University;,United States;,Poster,https://ieeexplore.ieee.org/document/7139601/,,,
664,Plane estimation by active vision from point features and image moments,,Riccardo Spica;Paolo Robuffo Giordano;François Chaumette;Riccardo Spica;Paolo Robuffo Giordano;François Chaumette;,University of Rennes 1;CNRS;INRIA Rennes Bretagne Atlantique;,France;,Poster,https://ieeexplore.ieee.org/document/7140041/,,,
665,PlanIt: A crowdsourcing approach for learning to plan paths from large scale preference feedback,,Ashesh Jain;Debarghya Das;Jayesh K. Gupta;Ashutosh Saxena;Ashesh Jain;Debarghya Das;Jayesh K. Gupta;Ashutosh Saxena;,Cornell University;,United States;,Poster,https://ieeexplore.ieee.org/document/7139281/,,,
666,Planning and execution of dynamic whole-body locomotion for a hydraulic quadruped on challenging terrain,,Alexander W. Winkler;Carlos Mastalli;Ioannis Havoutis;Michele Focchi;Darwin G. Caldwell;Claudio Semini;Alexander W. Winkler;Carlos Mastalli;Ioannis Havoutis;Michele Focchi;Darwin G. Caldwell;Claudio Semini;,ETH Zurich;,Switzerland;,Poster,https://ieeexplore.ieee.org/document/7139916/,,,
667,Planning COM trajectory with variable height and foot position with reactive stepping for humanoid robots,,Kirill Van Heerden;Kirill Van Heerden;,Ritsumeikan University;,Japan;,Poster,https://ieeexplore.ieee.org/document/7140080/,,,
668,Planning finger movements to lift up deformable 2D objects,,Feng Guo;Yan-Bin Jia;Feng Guo;Yan-Bin Jia;,Meta;Department of Computer Science;,United States;,Poster,https://ieeexplore.ieee.org/document/7139712/,,,
669,Planning for decentralized control of multiple robots under uncertainty,,Christopher Amato;George Konidaris;Gabriel Cruz;Christopher A. Maynor;Jonathan P. How;Leslie P. Kaelbling;Christopher Amato;George Konidaris;Gabriel Cruz;Christopher A. Maynor;Jonathan P. How;Leslie P. Kaelbling;,University of New Hampshire;Duke University;Massachusetts Institute of Technology;,United States;,Poster,https://ieeexplore.ieee.org/document/7139350/,,,
670,Planning for multi-agent teams with leader switching,,Siddharth Swaminathan;Mike Phillips;Maxim Likhachev;Siddharth Swaminathan;Mike Phillips;Maxim Likhachev;,Carnegie Mellon University;,United States;,Poster,https://ieeexplore.ieee.org/document/7139954/,,,
671,Planning grasp strategies That Exploit Environmental Constraints,,Clemens Eppner;Oliver Brock;Clemens Eppner;Oliver Brock;,Technische Universität Berlin;,Germany;,Poster,https://ieeexplore.ieee.org/document/7139886/,,,
672,Planning on searching occluded target object with a mobile robot manipulator,,Yu-Chi Lin;Shao-Ting Wei;Shih-An Yang;Li-Chen Fu;Yu-Chi Lin;Shao-Ting Wei;Shih-An Yang;Li-Chen Fu;,National Taiwan University;,China;,Poster,https://ieeexplore.ieee.org/document/7139626/,,,
673,Planning routes of continuous illumination and traversable slope using connected component analysis,,Nathan D. Otten;Heather L. Jones;David S. Wettergreen;William L. Whittaker;Nathan D. Otten;Heather L. Jones;David S. Wettergreen;William L. Whittaker;,Carnegie Mellon University;,United States;,Poster,https://ieeexplore.ieee.org/document/7139751/,,,
674,Planning the motion of a sliding and rolling sphere,,Yan-Bin Jia;Yan-Bin Jia;,Iowa State University;,United States;,Poster,https://ieeexplore.ieee.org/document/7139518/,,,
675,Platform design and tethered flight of a motor-driven flapping-wing system,,Lindsey Hines;David Colmenares;Metin Sitti;Lindsey Hines;David Colmenares;Metin Sitti;,Max Planck Institute for Intelligent Systems;Carnegie Mellon University;,Germany;United States;,Poster,https://ieeexplore.ieee.org/document/7140016/,,,
676,Pneumatically driven handheld forceps with force display operated by motion sensor,,Ryoken Miyazaki;Takahiro Kanno;Gen Endo;Kenji Kawashima;Ryoken Miyazaki;Takahiro Kanno;Gen Endo;Kenji Kawashima;,Tokyo Medical and Dental University;,Japan;,Poster,https://ieeexplore.ieee.org/document/7139241/,,,
677,"Point-to-point motion control of a unicycle robot: Design, implementation, and validation",,Yusie Rizal;Chun-Ting Ke;Ming-Tzu Ho;Yusie Rizal;Chun-Ting Ke;Ming-Tzu Ho;,National Cheng Kung University;,China;,Poster,https://ieeexplore.ieee.org/document/7139804/,,,
678,Pole-like object detection and classification from urban point clouds,,Jing Huang;Suya You;Jing Huang;Suya You;,University of Southern California;,United States;,Poster,https://ieeexplore.ieee.org/document/7139615/,,,
679,Power analysis of a series elastic actuator for ankle joint gait rehabilitation,,Oussama Ben Farah;Zhao Guo;Chen Gong;Chi Zhu;Haoyong Yu;Oussama Ben Farah;Zhao Guo;Chen Gong;Chi Zhu;Haoyong Yu;,University of Stuttgart;National University of Singapore;Maebashi Institute of Technology;,Germany;Singapore;Japan;,Poster,https://ieeexplore.ieee.org/document/7139573/,,,
680,"Practical, stretchable smart skin sensors for contact-aware robots in safe and collaborative interactions",,John O'Neill;Jason Lu;Rodney Dockter;Timothy Kowalewski;John O'Neill;Jason Lu;Rodney Dockter;Timothy Kowalewski;,University of Minnesota;,United States;,Poster,https://ieeexplore.ieee.org/document/7139244/,,,
681,Precise quadrotor autonomous landing with SRUKF vision perception,,Shuo Yang;Jiahang Ying;Yang Lu;Zexiang Li;Shuo Yang;Jiahang Ying;Yang Lu;Zexiang Li;,Hong Kong University of Science & Technology;Shandong University;Hong Kong University of Science and Technology;,China;,Poster,https://ieeexplore.ieee.org/document/7139489/,,,
682,Predicting human reaching motion in collaborative tasks using Inverse Optimal Control and iterative re-planning,,Jim Mainprice;Rafi Hayne;Dmitry Berenson;Jim Mainprice;Rafi Hayne;Dmitry Berenson;,Max-Planck-Institute for Intelligent Systems;Worcester Polytechnic Institute;,Germany;United States;,Poster,https://ieeexplore.ieee.org/document/7139282/,,,
683,Predictive exploration considering previously mapped environments,,Daniel Perea Ström;Fabrizio Nenci;Cyrill Stachniss;Daniel Perea Ström;Fabrizio Nenci;Cyrill Stachniss;,Universidad de La Laguna;University of Bonn;,Spain;Germany;,Poster,https://ieeexplore.ieee.org/document/7139574/,,,
684,Predictive motion planning for AUVs subject to strong time-varying currents and forecasting uncertainties,,Van T. Huynh;Matthew Dunbabin;Ryan N. Smith;Van T. Huynh;Matthew Dunbabin;Ryan N. Smith;,Queensland University of Technology;Fort Lewis College;,Australia;United States;,Poster,https://ieeexplore.ieee.org/document/7139335/,,,
685,Preference-balancing motion planning under stochastic disturbances,,Aleksandra Faust;Nick Malone;Lydia Tapia;Aleksandra Faust;Nick Malone;Lydia Tapia;,Sandia National Laboratories;University of New Mexico;,United States;,Poster,https://ieeexplore.ieee.org/document/7139692/,,,
686,Printable monolithic hexapod robot driven by soft actuator,,Canh Toan Nguyen;Hoa Phung;Hosang Jung;Uikyum Kim;Tien Dat Nguyen;Junwoo Park;Hyungpil Moon;Ja Choon Koo;Hyouk Ryeol Choi;Canh Toan Nguyen;Hoa Phung;Hosang Jung;Uikyum Kim;Tien Dat Nguyen;Junwoo Park;Hyungpil Moon;Ja Choon Koo;Hyouk Ryeol Choi;,Sungkyunkwan University;,South Korea;,Poster,https://ieeexplore.ieee.org/document/7139820/,,,
687,Prioritized group navigation with Formation Velocity Obstacles,,Ioannis Karamouzas;Stephen J. Guy;Ioannis Karamouzas;Stephen J. Guy;,University of Minnesota;,United States;,Poster,https://ieeexplore.ieee.org/document/7140038/,,,
688,Prioritized Inverse Kinematics with Multiple Task Definitions,,Sang-ik An;Dongheui Lee;Sang-ik An;Dongheui Lee;,Technical University of Munich;,Germany;,Poster,https://ieeexplore.ieee.org/document/7139376/,,,
689,Prioritized optimal control: A hierarchical differential dynamic programming approach,,Francesco Romano;Andrea Del Prete;Nicolas Mansard;Francesco Nori;Francesco Romano;Andrea Del Prete;Nicolas Mansard;Francesco Nori;,Istituto Italiano di Tecnologia;CNRS;,Italy;France;,Poster,https://ieeexplore.ieee.org/document/7139697/,,,
690,Probabilistic road context inference for autonomous vehicles,,Wei Liu;Seong-Woo Kim;Marcelo H. Ang;Wei Liu;Seong-Woo Kim;Marcelo H. Ang;,National University of Singapore;Singapore-MIT Alliance for Research and Technology;,Singapore;,Poster,https://ieeexplore.ieee.org/document/7139408/,,,
691,Propositional Temporal Logic for planning in an embedded Concurrent Autonomous Agent,,Diego Stéfano;F. Ferreira;Priscila S. Martins;André Gustavo S. Conceição;Augusto Loureiro da Costa;Diego Stéfano;F. Ferreira;Priscila S. Martins;André Gustavo S. Conceição;Augusto Loureiro da Costa;,Universidade Federal da Bahia;Federal University of Bahia;,Brazil;,Poster,https://ieeexplore.ieee.org/document/7139868/,,,
692,"Propulsive force of a magnetic, MRI - based swimmer",,Avi Friedman;Alex Liberzon;Gabor Kósa;Avi Friedman;Alex Liberzon;Gabor Kósa;,Tel Aviv University;,Israel;,Poster,https://ieeexplore.ieee.org/document/7139857/,,,
693,Protection of wide-range QCR load sensor using robust outer case for stable detection of biosignals,,Yuichi Murozaki;Shinya Sakuma;Fumihito Arai;Yuichi Murozaki;Shinya Sakuma;Fumihito Arai;,Nagoya University;,Japan;,Poster,https://ieeexplore.ieee.org/document/7139746/,,,
694,Prototype design of medical round supporting robot “Terapio”,,R. Tasaki;M. Kitazaki;J. Miura;K. Terashima;R. Tasaki;M. Kitazaki;J. Miura;K. Terashima;,Toyohashi University of Technology;,Japan;,Poster,https://ieeexplore.ieee.org/document/7139274/,,,
695,Pseudo-rigid-body model and kinematic analysis of MRI-actuated catheters,,Tipakorn Greigarn;M. Cenk Çavuşoğlu;Tipakorn Greigarn;M. Cenk Çavuşoğlu;,Case Western Reserve University;,United States;,Poster,https://ieeexplore.ieee.org/document/7139495/,,,
696,Pulley friction compensation for winch-integrated cable force measurement and verification on a cable-driven parallel robot,,Werner Kraus;Michael Kessler;Andreas Pott;Werner Kraus;Michael Kessler;Andreas Pott;,Fraunhofer Institute for Manufacturing Engineering and Automation IPA;,Germany;,Poster,https://ieeexplore.ieee.org/document/7139406/,,,
697,Pushbroom stereo for high-speed navigation in cluttered environments,,Andrew J. Barry;Russ Tedrake;Andrew J. Barry;Russ Tedrake;,Massachusetts Institute of Technology;,United States;,Poster,https://ieeexplore.ieee.org/document/7139617/,,,
698,PX4: A node-based multithreaded open source robotics framework for deeply embedded platforms,,Lorenz Meier;Dominik Honegger;Marc Pollefeys;Lorenz Meier;Dominik Honegger;Marc Pollefeys;,Institute for Visual Computing;,Switzerland;,Poster,https://ieeexplore.ieee.org/document/7140074/,,,
699,Quadrotor landing on an inclined platform of a moving ground vehicle,,Panagiotis Vlantis;Panos Marantos;Charalampos P. Bechlioulis;Kostas J. Kyriakopoulos;Panagiotis Vlantis;Panos Marantos;Charalampos P. Bechlioulis;Kostas J. Kyriakopoulos;,National Technical University of Athens;,Greece;,Poster,https://ieeexplore.ieee.org/document/7139490/,,,
700,Qualitative analysis of POMDPs with temporal logic specifications for robotics applications,,Krishnendu Chatterjee;Martin Chmelík;Raghav Gupta;Ayush Kanodia;Krishnendu Chatterjee;Martin Chmelík;Raghav Gupta;Ayush Kanodia;,Institute of Science and Technology Austria;Indian Institute of Technology Bombay;Indian Institute of Technology Delhi;,Austria;India;,Poster,https://ieeexplore.ieee.org/document/7139019/,,,
701,Quasi-direct nonprehensile catching with uncertain object states,,Markus M. Schill;Felix Gruber;Martin Buss;Markus M. Schill;Felix Gruber;Martin Buss;,Technische Universität München;,Germany;,Poster,https://ieeexplore.ieee.org/document/7139529/,,,
702,Quiet (nearly collisionless) robotic walking,,Mario W. Gomes;Konrad Ahlin;Mario W. Gomes;Konrad Ahlin;,Rochester Institute of Technology;Georgia Institute of Technology;,United States;,Poster,https://ieeexplore.ieee.org/document/7140006/,,,
703,Radar and vision sensors calibration for outdoor 3D reconstruction,,Ghina El Natour;Omar Ait Aider;Raphael Rouveure;François Berry;Patrice Faure;Ghina El Natour;Omar Ait Aider;Raphael Rouveure;François Berry;Patrice Faure;,Université Blaise Pascal;Institut national de Recherche en Sciences et Technologies pour l'Environnement et l’Agriculture;,France;,Poster,https://ieeexplore.ieee.org/document/7139473/,,,
704,Range sensor and silhouette fusion for high-quality 3D Scanning,,Karthik S. Narayan;James Sha;Arjun Singh;Pieter Abbeel;Karthik S. Narayan;James Sha;Arjun Singh;Pieter Abbeel;,"University of California, Berkeley;",United States;,Poster,https://ieeexplore.ieee.org/document/7139701/,,,
705,REACH - Realtime crowd tracking using a hybrid motion model,,Aniket Bera;Dinesh Manocha;Aniket Bera;Dinesh Manocha;,University of North Carolina;,United States;,Poster,https://ieeexplore.ieee.org/document/7139261/,,,
706,Reachable volume RRT,,Troy McMahon;Shawna Thomas;Nancy M. Amato;Troy McMahon;Shawna Thomas;Nancy M. Amato;,United States Department of Energy;,United States;,Poster,https://ieeexplore.ieee.org/document/7139607/,,,
707,Reactive avoidance using embedded stereo vision for MAV flight,,Helen Oleynikova;Dominik Honegger;Marc Pollefeys;Helen Oleynikova;Dominik Honegger;Marc Pollefeys;,ETH Zurich;Eidgenossische Technische Hochschule Zurich;,Switzerland;,Poster,https://ieeexplore.ieee.org/document/7138979/,,,
708,Reactive motion planning and control for compliant and constraint-based task execution,,Andrea Maria Zanchettin;Paolo Rocco;Andrea Maria Zanchettin;Paolo Rocco;,Politecnico di Milano;,Italy;,Poster,https://ieeexplore.ieee.org/document/7139572/,,,
709,Real-time control of soft-robots using asynchronous finite element modeling,,Frederick Largilliere;Valerian Verona;Eulalie Coevoet;Mario Sanz-Lopez;Jeremie Dequidt;Christian Duriez;Frederick Largilliere;Valerian Verona;Eulalie Coevoet;Mario Sanz-Lopez;Jeremie Dequidt;Christian Duriez;,INRIA;,France;,Poster,https://ieeexplore.ieee.org/document/7139541/,,,
710,Real-time distributed configuration discovery of modular self-reconfigurable robots,,José Baca;Bradley Woosley;Prithviraj Dasgupta;Carl Nelson;José Baca;Bradley Woosley;Prithviraj Dasgupta;Carl Nelson;,University of Nebraska at Omaha;University of Nebraska - Lincoln;,United States;,Poster,https://ieeexplore.ieee.org/document/7139449/,,,
711,Real-time full-body human gender recognition in (RGB)-D data,,Timm Linder;Sven Wehner;Kai O. Arras;Timm Linder;Sven Wehner;Kai O. Arras;,University of Freiburg;,Germany;,Poster,https://ieeexplore.ieee.org/document/7139616/,,,
712,Real-time grasp detection using convolutional neural networks,,Joseph Redmon;Anelia Angelova;Joseph Redmon;Anelia Angelova;,University of Washington;Google;,United States;,Poster,https://ieeexplore.ieee.org/document/7139361/,,,
713,Real-time image de-blurring and image processing for a robotic vision system,,Michael D. Kim;Jun Ueda;Michael D. Kim;Jun Ueda;,Georgia Institute of Technology;,United States;,Poster,https://ieeexplore.ieee.org/document/7139446/,,,
714,Real-time onboard 6DoF localization of an indoor MAV in degraded visual environments using a RGB-D camera,,Zheng Fang;Sebastian Scherer;Zheng Fang;Sebastian Scherer;,Northeastern University;Carnegie Mellon University;,China;United States;,Poster,https://ieeexplore.ieee.org/document/7139931/,,,
715,Real-time tracking of deformable target in 3D ultrasound images,,Lucas Royer;Maud Marchal;Anthony Le Bras;Guillaume Dardenne;Alexandre Krupa;Lucas Royer;Maud Marchal;Anthony Le Bras;Guillaume Dardenne;Alexandre Krupa;,INRIA;Institut de Recherche Technologique b-com;CHU de Rennes;,France;,Poster,https://ieeexplore.ieee.org/document/7139523/,,,
716,Realizing underactuated bipedal walking with torque controllers via the ideal model resolved motion method,,Eric Cousineau;Aaron D. Ames;Eric Cousineau;Aaron D. Ames;,Texas A&M University;,United States;,Poster,https://ieeexplore.ieee.org/document/7140004/,,,
717,Reconfiguration planning for pivoting cube modular robots,,Cynthia Sung;James Bern;John Romanishin;Daniela Rus;Cynthia Sung;James Bern;John Romanishin;Daniela Rus;,Massachusetts Institute of Technology;California Institute of Technology;,United States;,Poster,https://ieeexplore.ieee.org/document/7139451/,,,
718,Reducing FPGA algorithm area by avoiding redundant computation,,Brian Axelrod;Michel Laverne;Brian Axelrod;Michel Laverne;,Massachusetts Institute of Technology;National Robotics Engineering Center;,United States;,Poster,https://ieeexplore.ieee.org/document/7139226/,,,
719,Reducing hardware experiments for model learning and policy optimization,,Sehoon Ha;Katsu Yamane;Sehoon Ha;Katsu Yamane;,Georgia Institute of Technology;Disney Research;,United States;,Poster,https://ieeexplore.ieee.org/document/7139552/,,,
720,Reduction of off-tracking effects in an n-trailer emulated through a multi-agent robot mobile system,,Jaime González-Sierra;Eduardo Aranda-Bricaire;Jaime González-Sierra;Eduardo Aranda-Bricaire;,"Mexico, DF;",Mexico;,Poster,https://ieeexplore.ieee.org/document/7140031/,,,
721,Redundancy resolution for dual-arm robots inspired by human asymmetric bimanual action: Formulation and experiments,,Jinoh Lee;Pyung Hun Chang;Jinoh Lee;Pyung Hun Chang;,Istituto Italiano di Tecnologia;Daegu Gyeongbuk Institute of Science & Technology;,Italy;South Korea;,Poster,https://ieeexplore.ieee.org/document/7140049/,,,
722,Registration of planar virtual fixtures by using augmented reality with dynamic textures,,Simon Leonard;Simon Leonard;,Johns Hopkins University;,United States;,Poster,https://ieeexplore.ieee.org/document/7139810/,,,
723,Regrasping and unfolding of garments using predictive thin shell modeling,,Yinxiao Li;Danfei Xu;Yonghao Yue;Yan Wang;Shih-Fu Chang;Eitan Grinspun;Peter K. Allen;Yinxiao Li;Danfei Xu;Yonghao Yue;Yan Wang;Shih-Fu Chang;Eitan Grinspun;Peter K. Allen;,Columbia University;,United States;,Poster,https://ieeexplore.ieee.org/document/7139370/,,,
724,Reliable and lightweight primary flight control actuation using magneto-rheological clutches in slippage,,P. Chouinard;M. Denninger;J-S. Plante;P. Chouinard;M. Denninger;J-S. Plante;,Université de Sherbrooke;,Canada;,Poster,https://ieeexplore.ieee.org/document/7139002/,,,
725,Reliable kinect-based navigation in large indoor environments,,Mihai Jalobeanu;Greg Shirakyan;Gershon Parent;Harsha Kikkeri;Brian Peasley;Ashley Feniello;Mihai Jalobeanu;Greg Shirakyan;Gershon Parent;Harsha Kikkeri;Brian Peasley;Ashley Feniello;,Microsoft;,United States;,Poster,https://ieeexplore.ieee.org/document/7139225/,,,
726,Remote electromagnetic vibration of steerable needles for imaging in power Doppler ultrasound,,Sarah S. Cabreros;Nina M. Jimenez;Joseph D. Greer;Troy K. Adebar;Allison M. Okamura;Sarah S. Cabreros;Nina M. Jimenez;Joseph D. Greer;Troy K. Adebar;Allison M. Okamura;,Stanford University;,United States;,Poster,https://ieeexplore.ieee.org/document/7139496/,,,
727,Rendezvous with bearing-only information and limited sensing range,,Maximilian Kriegleder;Sundara Tejaswi Digumarti;Raymond Oung;Raffaello D'Andrea;Maximilian Kriegleder;Sundara Tejaswi Digumarti;Raymond Oung;Raffaello D'Andrea;,ETH Zurich;;,Switzerland;;,Poster,https://ieeexplore.ieee.org/document/7140032/,,,
728,Retrieving experience: Interactive instance-based learning methods for building robot companions,,Hae Won Park;Ayanna M. Howard;Hae Won Park;Ayanna M. Howard;,Georgia Institute of Technology;,United States;,Poster,https://ieeexplore.ieee.org/document/7140061/,,,
729,RGB-D object recognition and pose estimation based on pre-trained convolutional neural network features,,Max Schwarz;Hannes Schulz;Sven Behnke;Max Schwarz;Hannes Schulz;Sven Behnke;,University of Bonn;,Germany;,Poster,https://ieeexplore.ieee.org/document/7139363/,,,
730,RGBD relocalisation using pairwise geometry and concise key point sets,,Shuda Li;Andrew Calway;Shuda Li;Andrew Calway;,University of Bristol;,United Kingdom;,Poster,https://ieeexplore.ieee.org/document/7140094/,,,
731,RoboFlow: A flow-based visual programming language for mobile manipulation tasks,,Sonya Alexandrova;Zachary Tatlock;Maya Cakmak;Sonya Alexandrova;Zachary Tatlock;Maya Cakmak;,University of Washington;,United States;,Poster,https://ieeexplore.ieee.org/document/7139973/,,,
732,RoboSherlock: Unstructured information processing for robot perception,,Michael Beetz;Ferenc Bálint-Benczédi;Nico Blodow;Daniel Nyga;Thiemo Wiedemeyer;Zoltán-Csaba Márton;Michael Beetz;Ferenc Bálint-Benczédi;Nico Blodow;Daniel Nyga;Thiemo Wiedemeyer;Zoltán-Csaba Márton;,University of Bremen;Technische Universitat Munchen;German Aerospace Center;,Germany;,Poster,https://ieeexplore.ieee.org/document/7139395/,,,
733,Robot navigation using human cues: A robot navigation system for symbolic goal-directed exploration,,Ruth Schulz;Ben Talbot;Obadiah Lam;Feras Dayoub;Peter Corke;Ben Upcroft;Gordon Wyeth;Ruth Schulz;Ben Talbot;Obadiah Lam;Feras Dayoub;Peter Corke;Ben Upcroft;Gordon Wyeth;,Queensland University of Technology;,Australia;,Poster,https://ieeexplore.ieee.org/document/7139313/,,,
734,Robot Programming by Demonstration with situated spatial language understanding,,Maxwell Forbes;Rajesh P. N. Rao;Luke Zettlemoyer;Maya Cakmak;Maxwell Forbes;Rajesh P. N. Rao;Luke Zettlemoyer;Maya Cakmak;,University of Washington;,United States;,Poster,https://ieeexplore.ieee.org/document/7139462/,,,
735,Robot-inspired biology: The compound-wave control template,,Jin Dai;Matthew Travers;Tony Dear;Chaohui Gong;Henry C. Astley;Daniel I Goldman;Howie Choset;Jin Dai;Matthew Travers;Tony Dear;Chaohui Gong;Henry C. Astley;Daniel I Goldman;Howie Choset;,Carnegie Mellon University;Georgia Institute of Technology;,United States;,Poster,https://ieeexplore.ieee.org/document/7140022/,,,
736,"Robot, organize my shelves! Tidying up objects by predicting user preferences",,Nichola Abdo;Cyrill Stachniss;Luciano Spinello;Wolfram Burgard;Nichola Abdo;Cyrill Stachniss;Luciano Spinello;Wolfram Burgard;,University of Freiburg;University of Bonn;,Germany;,Poster,https://ieeexplore.ieee.org/document/7139396/,,,
737,Robotic agent programming in TeleoR,,Keith L. Clark;Peter J. Robinson;Keith L. Clark;Peter J. Robinson;,University of Queensland;,Australia;,Poster,https://ieeexplore.ieee.org/document/7139900/,,,
738,Robotic cognitive behavior control based on biology-inspired Episodic memory,,Dong Liu;Ming Cong;Yu Du;Xiaodong Han;Dong Liu;Ming Cong;Yu Du;Xiaodong Han;,Harbin Institute of Technology;University of British Columbia;,China;Canada;,Poster,https://ieeexplore.ieee.org/document/7139902/,,,
739,Robotic force estimation using dithering to decrease the low velocity friction uncertainties,,Andreas Stolt;Anders Robertsson;Rolf Johansson;Andreas Stolt;Anders Robertsson;Rolf Johansson;,Lund University;,Sweden;,Poster,https://ieeexplore.ieee.org/document/7139742/,,,
740,Robotic manipulation of a biological cell using multiple optical traps,,Chien Chern Cheah;Quang Minh Ta;Reza Haghighi;Chien Chern Cheah;Quang Minh Ta;Reza Haghighi;,Nanyang Technological University;,Singapore;,Poster,https://ieeexplore.ieee.org/document/7139270/,,,
741,Robotic manipulation of micro/nanoparticles using optical tweezers with velocity constraints and stochastic perturbations,,Xiao Yan;Chien Chern Cheah;Quang-Cuong Pham;Jean-Jacques E. Slotine;Xiao Yan;Chien Chern Cheah;Quang-Cuong Pham;Jean-Jacques E. Slotine;,Nanyang Technological University;Massachusetts Institute of Technology;,Singapore;United States;,Poster,https://ieeexplore.ieee.org/document/7139269/,,,
742,Robotic simulation of dynamic plume tracking by Unmanned Surface Vessels,,Muhammad Fahad;Nathaniel Saul;Yi Guo;Brian Bingham;Muhammad Fahad;Nathaniel Saul;Yi Guo;Brian Bingham;,Stevens Institute of Technology;University of Hawaii at Manoa;,United States;,Poster,https://ieeexplore.ieee.org/document/7139557/,,,
743,Robotic wheelchair using a high accuracy visual marker LentiBar and its application to door crossing navigation,,Bong Keun Kim;Hideyuki Tanaka;Yasushi Sumi;Bong Keun Kim;Hideyuki Tanaka;Yasushi Sumi;,National Institute of Advanced Industrial Science and Technology;Sangyo Gijutsu Sogo Kenkyujo;,Japan;,Poster,https://ieeexplore.ieee.org/document/7139819/,,,
744,Robust 3D tracking of unknown objects,,Alessandro Pieropan;Niklas Bergström;Masatoshi Ishikawa;Hedvig Kjellström;Alessandro Pieropan;Niklas Bergström;Masatoshi Ishikawa;Hedvig Kjellström;,KTH Royal Institute of Technology;University of Tokyo;,Sweden;Japan;,Poster,https://ieeexplore.ieee.org/document/7139520/,,,
745,Robust adaptive control of quadrotor unmanned aerial vehicle with uncertainty,,S. Islam;M. Faraz;R. K. Ashour;J. Dias;L. D. Seneviratne;S. Islam;M. Faraz;R. K. Ashour;J. Dias;L. D. Seneviratne;,University of Ottawa;Khalifa University of Science and Technology;University of Coimbra;King's College London;,Canada;United Arab Emirates;Portugal;United Kingdom;,Poster,https://ieeexplore.ieee.org/document/7139417/,,,
