Index,Title,Session/Area,Authors,Affiliation,Country,Status,Proceeding URL,PDF URL,CVF URL,Arxiv URL
989,Real-Time Generative Grasping with Spatio-temporal Sparse Convolution,,Timothy R. Player;Dongsik Chang;Li Fuxin;Geoffrey A. Hollinger;Timothy R. Player;Dongsik Chang;Li Fuxin;Geoffrey A. Hollinger;,Oregon State University;,United States;,Poster,https://ieeexplore.ieee.org/document/10161529/,,,
990,Real-Time Model Predictive Control for Industrial Manipulators with Singularity-Tolerant Hierarchical Task Control,,Jaemin Lee;Mingyo Seo;Andrew Bylard;Robert Sun;Luis Sentis;Jaemin Lee;Mingyo Seo;Andrew Bylard;Robert Sun;Luis Sentis;,California Institute of Technology;University of Texas at Austin;Dexterity Inc;,United States;,Poster,https://ieeexplore.ieee.org/document/10161138/,,,
991,Real-Time Navigation for Autonomous Surface Vehicles In Ice-Covered Waters,,Rodrigue de Schaetzen;Alexander Botros;Robert Gash;Kevin Murrant;Stephen L. Smith;Rodrigue de Schaetzen;Alexander Botros;Robert Gash;Kevin Murrant;Stephen L. Smith;,University of Waterloo;National Research Council;,Canada;,Poster,https://ieeexplore.ieee.org/document/10161044/,,,
992,Real-Time Reinforcement Learning for Vision-Based Robotics Utilizing Local and Remote Computers,,Yan Wang;Gautham Vasan;A. Rupam Mahmood;Yan Wang;Gautham Vasan;A. Rupam Mahmood;,University of Alberta;Alberta Machine Intelligence Institute;,Canada;,Poster,https://ieeexplore.ieee.org/document/10160684/,,,
993,Real-Time Simultaneous Localization and Mapping with LiDAR Intensity,,Wenqiang Du;Giovanni Beltrame;Wenqiang Du;Giovanni Beltrame;,Polytechnique Montreal;,Canada;,Poster,https://ieeexplore.ieee.org/document/10160713/,,,
994,Real-Time Unified Trajectory Planning and Optimal Control for Urban Autonomous Driving Under Static and Dynamic Obstacle Constraints,,Rowan Dempster;Mohammad Al-Sharman;Derek Rayside;William Melek;Rowan Dempster;Mohammad Al-Sharman;Derek Rayside;William Melek;,University of Waterloo;,Canada;,Poster,https://ieeexplore.ieee.org/document/10160577/,,,
995,Rearrange Indoor Scenes for Human-Robot Co-Activity,,Weiqi Wang;Zihang Zhao;Ziyuan Jiao;Yixin Zhu;Song-Chun Zhu;Hangxin Liu;Weiqi Wang;Zihang Zhao;Ziyuan Jiao;Yixin Zhu;Song-Chun Zhu;Hangxin Liu;,"University of California, Los Angeles;Peking University;Beijing Institute for General Artificial Intelligence;",United States;China;,Poster,https://ieeexplore.ieee.org/document/10160303/,,,
996,Receding Horizon Planning with Rule Hierarchies for Autonomous Vehicles,,Sushant Veer;Karen Leung;Ryan K. Cosner;Yuxiao Chen;Peter Karkus;Marco Pavone;Sushant Veer;Karen Leung;Ryan K. Cosner;Yuxiao Chen;Peter Karkus;Marco Pavone;,NVIDIA;University of Washington;California Institute of Technology;Stanford University;,United States;,Poster,https://ieeexplore.ieee.org/document/10160622/,,,
997,Reconfigurable Inflated Soft Arms,,Nam Gyun Kim;Jee-Hwan Ryu;Nam Gyun Kim;Jee-Hwan Ryu;,Korea Advanced Institute of Science and Technology;,South Korea;,Poster,https://ieeexplore.ieee.org/document/10160569/,,,
998,Reconstructing Objects in-the-wild for Realistic Sensor Simulation,,Ze Yang;Sivabalan Manivasagam;Yun Chen;Jingkang Wang;Rui Hu;Raquel Urtasun;Ze Yang;Sivabalan Manivasagam;Yun Chen;Jingkang Wang;Rui Hu;Raquel Urtasun;,University of Toronto;Waabi;,Canada;;,Poster,https://ieeexplore.ieee.org/document/10160535/,,,
999,Reinforced Learning for Label-Efficient 3D Face Reconstruction,,Hoda Mohaghegh;Hossein Rahmani;Hamid Laga;Farid Boussaid;Mohammed Bennamoun;Hoda Mohaghegh;Hossein Rahmani;Hamid Laga;Farid Boussaid;Mohammed Bennamoun;,University of Western Australia;Lancaster University;Murdoch University;,Australia;United Kingdom;,Poster,https://ieeexplore.ieee.org/document/10161362/,,,
1000,Reinforcement Learning Based Pushing and Grasping Objects from Ungraspable Poses,,Hao Zhang;Hongzhuo Liang;Lin Cong;Jianzhi Lyu;Long Zeng;Pingfa Feng;Jianwei Zhang;Hao Zhang;Hongzhuo Liang;Lin Cong;Jianzhi Lyu;Long Zeng;Pingfa Feng;Jianwei Zhang;,Universität Hamburg;Tsinghua University;,Germany;China;,Poster,https://ieeexplore.ieee.org/document/10160491/,,,
1001,Reinforcement Learning Control of a Reconfigurable Planar Cable Driven Parallel Manipulator,,Adhiti Raman;Ameya Salvi;Matthias Schmid;Venkat Krovi;Adhiti Raman;Ameya Salvi;Matthias Schmid;Venkat Krovi;,Clemson University;,United States;,Poster,https://ieeexplore.ieee.org/document/10160498/,,,
1002,Reinforcement Learning for Laser Welding Speed Control Minimizing Bead Width Error,,Toshimitsu Kaneko;Gaku Minamoto;Yusuke Hirose;Tetsuo Sakai;Toshimitsu Kaneko;Gaku Minamoto;Yusuke Hirose;Tetsuo Sakai;,Toshiba Corporation;,Japan;,Poster,https://ieeexplore.ieee.org/document/10161334/,,,
1003,Reinforcement Learning for Safe Robot Control using Control Lyapunov Barrier Functions,,Desong Du;Shaohang Han;Naiming Qi;Haitham Bou Ammar;Jun Wang;Wei Pan;Desong Du;Shaohang Han;Naiming Qi;Haitham Bou Ammar;Jun Wang;Wei Pan;,Delft University of Technology;Harbin Institute of Technology;University College London;,Netherlands;China;United Kingdom;,Poster,https://ieeexplore.ieee.org/document/10160991/,,,
1004,Reinforcement Learning with Probabilistically Safe Control Barrier Functions for Ramp Merging,,Soumith Udatha;Yiwei Lyu;John Dolan;Soumith Udatha;Yiwei Lyu;John Dolan;,Carnegie Mellon University;,United States;,Poster,https://ieeexplore.ieee.org/document/10161418/,,,
1005,Reinforcement Learning-Based Optimal Multiple Waypoint Navigation,,Christos Vlachos;Panagiotis Rousseas;Charalampos P. Bechlioulis;Kostas J. Kyriakopoulos;Christos Vlachos;Panagiotis Rousseas;Charalampos P. Bechlioulis;Kostas J. Kyriakopoulos;,University of Patras;National Technical University of Athens;New York University;,Greece;United Arab Emirates;,Poster,https://ieeexplore.ieee.org/document/10160725/,,,
1006,Relay Pursuit for Multirobot Target Tracking on Tile Graphs,,Shashwata Mandal;Sourabh Bhattacharya;Shashwata Mandal;Sourabh Bhattacharya;,Iowa State University;,United States;,Poster,https://ieeexplore.ieee.org/document/10161532/,,,
1007,Rendezvous and Docking of Magnetic Helical Microrobots Along Arc Orbits for Field-directed Assembly and Disassembly,,Shuideng Wang;Zejie Yu;Chaojian Hou;Kun Wang;Lixin Dong;Shuideng Wang;Zejie Yu;Chaojian Hou;Kun Wang;Lixin Dong;,City University of Hong Kong;,China;,Poster,https://ieeexplore.ieee.org/document/10160397/,,,
1008,Repetitive Twisting Durability of Synthetic Fiber Ropes,,Shinya Sadachika;Masahito Kanekiyo;Hiroyuki Nabae;Gen Endo;Shinya Sadachika;Masahito Kanekiyo;Hiroyuki Nabae;Gen Endo;,Tokyo Institute of Technology;,Japan;,Poster,https://ieeexplore.ieee.org/document/10160745/,,,
1009,Resilient Terrain Navigation with a 5 DOF Metal Detector Drone,,Patrick Pfreundschuh;Rik Bähnemann;Tim Kazik;Thomas Mantel;Roland Siegwart;Olov Andersson;Patrick Pfreundschuh;Rik Bähnemann;Tim Kazik;Thomas Mantel;Roland Siegwart;Olov Andersson;,ETH Zurich;,Switzerland;,Poster,https://ieeexplore.ieee.org/document/10161253/,,,
1010,ResiPlan: Closing the Planning-Acting Loop for Safe Underwater Navigation,,Marios Xanthidis;Eleni Kelasidi;Kostas Alexis;Marios Xanthidis;Eleni Kelasidi;Kostas Alexis;,SINTEF Ocean AS;Norwegian University of Science and Technology;,Norway;,Poster,https://ieeexplore.ieee.org/document/10160801/,,,
1011,Reslicing Ultrasound Images for Data Augmentation and Vessel Reconstruction,,Cecilia G. Morales;Jason Yao;Tejas Rane;Robert Edman;Howie Choset;Artur Dubrawski;Cecilia G. Morales;Jason Yao;Tejas Rane;Robert Edman;Howie Choset;Artur Dubrawski;,Carnegie Mellon University;,United States;,Poster,https://ieeexplore.ieee.org/document/10160651/,,,
1012,Resolution Complete In-Place Object Retrieval given Known Object Models,,Daniel Nakhimovich;Yinglong Miao;Kostas E. Bekris;Daniel Nakhimovich;Yinglong Miao;Kostas E. Bekris;,Rutgers University;,United States;,Poster,https://ieeexplore.ieee.org/document/10160406/,,,
1013,Reuse your features: unifying retrieval and feature-metric alignment,,Javier Morlana;J.M.M. Montiel;Javier Morlana;J.M.M. Montiel;,Universidad de Zaragoza;,Spain;,Poster,https://ieeexplore.ieee.org/document/10160501/,,,
1014,RFFCE: Residual Feature Fusion and Confidence Evaluation Network for 6DoF Pose Estimation,,Qiwei Meng;Shanshan Ji;Shiqiang Zhu;Tianlei Jin;Te Li;Jason Gu;Wei Song;Qiwei Meng;Shanshan Ji;Shiqiang Zhu;Tianlei Jin;Te Li;Jason Gu;Wei Song;,Zhejiang Engineering Research Center for Intelligent Robotics;Dalhousie University;,China;Canada;,Poster,https://ieeexplore.ieee.org/document/10160448/,,,
1015,RGB-D Grasp Detection via Depth Guided Learning with Cross-modal Attention,,Ran Qin;Haoxiang Ma;Boyang Gao;Di Huang;Ran Qin;Haoxiang Ma;Boyang Gao;Di Huang;,Beihang University;Harbin Institute of Technology;,China;,Poster,https://ieeexplore.ieee.org/document/10161319/,,,
1016,RGB-Event Fusion for Moving Object Detection in Autonomous Driving,,Zhuyun Zhou;Zongwei Wu;Rémi Boutteau;Fan Yang;Cédric Demonceaux;Dominique Ginhac;Zhuyun Zhou;Zongwei Wu;Rémi Boutteau;Fan Yang;Cédric Demonceaux;Dominique Ginhac;,University of Burgundy;ETH Zurich;University of Rouen Normandy;CNRS;,France;Switzerland;,Poster,https://ieeexplore.ieee.org/document/10161563/,,,
1017,RGB-Only Reconstruction of Tabletop Scenes for Collision-Free Manipulator Control,,Zhenggang Tang;Balakumar Sundaralingam;Jonathan Tremblay;Bowen Wen;Ye Yuan;Stephen Tyree;Charles Loop;Alexander Schwing;Stan Birchfield;Zhenggang Tang;Balakumar Sundaralingam;Jonathan Tremblay;Bowen Wen;Ye Yuan;Stephen Tyree;Charles Loop;Alexander Schwing;Stan Birchfield;,University of Illinois Urbana-Champaign;NVIDIA;,United States;,Poster,https://ieeexplore.ieee.org/document/10160247/,,,
1018,Risk-Aware Model Predictive Path Integral Control Using Conditional Value-at-Risk,,Ji Yin;Zhiyuan Zhang;Panagiotis Tsiotras;Ji Yin;Zhiyuan Zhang;Panagiotis Tsiotras;,Georgia Institute of Technology;,United States;,Poster,https://ieeexplore.ieee.org/document/10161100/,,,
1019,Risk-Aware Neural Navigation From BEV Input for Interactive Driving,,Suzanna Jiwani;Xiao Li;Sertac Karaman;Daniela Rus;Suzanna Jiwani;Xiao Li;Sertac Karaman;Daniela Rus;,Massachusetts Institute of Technology;,United States;,Poster,https://ieeexplore.ieee.org/document/10161473/,,,
1020,Risk-aware Path Planning via Probabilistic Fusion of Traversability Prediction for Planetary Rovers on Heterogeneous Terrains,,Masafumi Endo;Tatsunori Taniai;Ryo Yonetani;Genya Ishigami;Masafumi Endo;Tatsunori Taniai;Ryo Yonetani;Genya Ishigami;,Keio University;OMRON SINIC X Corporation;,Japan;,Poster,https://ieeexplore.ieee.org/document/10161466/,,,
1021,Risk-aware Recharging Rendezvous for a Collaborative Team of UAVs and UGVs,,Ahmad Bilal Asghar;Guangyao Shi;Nare Karapetyan;James Humann;Jean-Paul Reddinger;James Dotterweich;Pratap Tokekar;Ahmad Bilal Asghar;Guangyao Shi;Nare Karapetyan;James Humann;Jean-Paul Reddinger;James Dotterweich;Pratap Tokekar;,University of Maryland;DEVCOM Army Research Laboratory;,United States;,Poster,https://ieeexplore.ieee.org/document/10161446/,,,
1022,Risk-aware Spatio-temporal Logic Planning in Gaussian Belief Spaces,,Matti Vahs;Christian Pek;Jana Tumova;Matti Vahs;Christian Pek;Jana Tumova;,KTH Royal Institute of Technology;,Sweden;,Poster,https://ieeexplore.ieee.org/document/10160973/,,,
1023,RLAfford: End-to-End Affordance Learning for Robotic Manipulation,,Yiran Geng;Boshi An;Haoran Geng;Yuanpei Chen;Yaodong Yang;Hao Dong;Yiran Geng;Boshi An;Haoran Geng;Yuanpei Chen;Yaodong Yang;Hao Dong;,Peking University;,China;,Poster,https://ieeexplore.ieee.org/document/10161571/,,,
1024,Rmagine: 3D Range Sensor Simulation in Polygonal Maps via Ray Tracing for Embedded Hardware on Mobile Robots,,Alexander Mock;Thomas Wiemann;Joachim Hertzberg;Alexander Mock;Thomas Wiemann;Joachim Hertzberg;,Osnabrück University;German Research Center for Artificial Intelligence (DFKI);,Germany;,Poster,https://ieeexplore.ieee.org/document/10161388/,,,
1025,Road Anomaly Segmentation Based on Pixel-wise Logit Variance with Iterative Background Highlighting,,Dongkun Lee;Han-Gyu Kim;Ho-Jin Choi;Dongkun Lee;Han-Gyu Kim;Ho-Jin Choi;,Korea Advanced Institute of Science and Technology;NAVER Cloud;,South Korea;,Poster,https://ieeexplore.ieee.org/document/10161159/,,,
1026,RoboSC: a domain-specific language for supervisory controller synthesis of ROS applications,,Bart Wesselink;Koen de Vos;Ivan Kuertev;Michel Reniers;Elena Torta;Bart Wesselink;Koen de Vos;Ivan Kuertev;Michel Reniers;Elena Torta;,Eindhoven University of Technology;,Netherlands;,Poster,https://ieeexplore.ieee.org/document/10161436/,,,
1027,Robot explanatory narratives of collaborative and adaptive experiences,,Alberto Olivares-Alarcos;Antonio Andriella;Sergi Foix;Guillem Alenyà;Alberto Olivares-Alarcos;Antonio Andriella;Sergi Foix;Guillem Alenyà;,Institut de Robòtica i Informàtica Industrial;PAL Robotics;,Spain;,Poster,https://ieeexplore.ieee.org/document/10161359/,,,
1028,Robot Mimicry Attack on Keystroke-Dynamics User Identification and Authentication System,,Rongyu Yu;Burak Kizilkaya;Zhen Meng;Emma Li;Guodong Zhao;Muhammad Imran;Rongyu Yu;Burak Kizilkaya;Zhen Meng;Emma Li;Guodong Zhao;Muhammad Imran;,University of Glasgow;,United Kingdom;,Poster,https://ieeexplore.ieee.org/document/10161423/,,,
1029,Robot Person Following Under Partial Occlusion,,Hanjing Ye;Jieting Zhao;Yaling Pan;Weinan Cherr;Li He;Hong Zhang;Hanjing Ye;Jieting Zhao;Yaling Pan;Weinan Cherr;Li He;Hong Zhang;,Southern University of Science and Technology;Guangdong University of Technology;,China;,Poster,https://ieeexplore.ieee.org/document/10160738/,,,
1030,Robot Trust and Self-Confidence Based Role Arbitration Method for Physical Human-Robot Collaboration,,Qiao Wang;Dikai Liu;Marc G. Carmichael;Chin-Teng Lin;Qiao Wang;Dikai Liu;Marc G. Carmichael;Chin-Teng Lin;,University of Technology Sydney;,Australia;,Poster,https://ieeexplore.ieee.org/document/10160711/,,,
1031,Robot-Assisted Eye-Hand Coordination Training System by Estimating Motion Direction Using Smooth-Pursuit Eye Movements,,Xiao Li;Hong Zeng;Chenhua Yang;Aiguo Song;Xiao Li;Hong Zeng;Chenhua Yang;Aiguo Song;,Southeast University;,China;,Poster,https://ieeexplore.ieee.org/document/10160956/,,,
1032,Robotic Control Using Model Based Meta Adaption,,Karam Daaboul;Joel Ikels;J. Marius Zöllner;Karam Daaboul;Joel Ikels;J. Marius Zöllner;,Karlsruhe Institute of Technology;,Germany;,Poster,https://ieeexplore.ieee.org/document/10160425/,,,
1033,Robotic Fastening with a Manual Screwdriver,,Ling Tang;Yan-Bin Jia;Ling Tang;Yan-Bin Jia;,Iowa State University;,United States;,Poster,https://ieeexplore.ieee.org/document/10161139/,,,
1034,Robotic Method and Instrument to Efficiently Synthesize Faulty Conditions and Mass-Produce Faulty-Conditioned Data for Rotary Machines,,Yip Fun Yeung;Fangzhou Xia;Juliana Covarrubias;Mikio Furokawa;Takayuki Hirano;Kamal Youcef-Toumi;Yip Fun Yeung;Fangzhou Xia;Juliana Covarrubias;Mikio Furokawa;Takayuki Hirano;Kamal Youcef-Toumi;,"Massachusetts Institute of Technology;Japan Steel Works, LTD.;",United States;Japan;,Poster,https://ieeexplore.ieee.org/document/10161055/,,,
1035,Robotic Navigation Autonomy for Subretinal Injection via Intelligent Real-Time Virtual iOCT Volume Slicing,,Shervin Dehghani;Michael Sommersperger;Peiyao Zhang;Alejandro Martin-Gomez;Benjamin Busam;Peter Gehlbach;Nassir Navab;M. Ali Nasseri;Iulian Iordachita;Shervin Dehghani;Michael Sommersperger;Peiyao Zhang;Alejandro Martin-Gomez;Benjamin Busam;Peter Gehlbach;Nassir Navab;M. Ali Nasseri;Iulian Iordachita;,Johns Hopkins University;Technische Universität München;Johns Hopkins Hospital;,United States;Germany;,Poster,https://ieeexplore.ieee.org/document/10160372/,,,
1036,Robotic Sonographer: Autonomous Robotic Ultrasound using Domain Expertise in Bayesian Optimization,,Deepak Raina;SH Chandrashekhara;Richard Voyles;Juan Wachs;Subir Kumar Saha;Deepak Raina;SH Chandrashekhara;Richard Voyles;Juan Wachs;Subir Kumar Saha;,Purdue University;All India Institute of Medical Sciences;Indian Institute of Technology Delhi;,United States;India;,Poster,https://ieeexplore.ieee.org/document/10161542/,,,
1037,Robotic Table Wiping via Reinforcement Learning and Whole-body Trajectory Optimization,,Thomas Lew;Sumeet Singh;Mario Prats;Jeffrey Bingham;Jonathan Weisz;Benjie Holson;Xiaohan Zhang;Vikas Sindhwani;Yao Lu;Fei Xia;Peng Xu;Tingnan Zhang;Jie Tan;Montserrat Gonzalez;Thomas Lew;Sumeet Singh;Mario Prats;Jeffrey Bingham;Jonathan Weisz;Benjie Holson;Xiaohan Zhang;Vikas Sindhwani;Yao Lu;Fei Xia;Peng Xu;Tingnan Zhang;Jie Tan;Montserrat Gonzalez;,Stanford University;Google;Everyday Robots;State University of New York at Binghamton;,United States;,Poster,https://ieeexplore.ieee.org/document/10161283/,,,
1038,"RobotSweater: Scalable, Generalizable, and Customizable Machine-Knitted Tactile Skins for Robots",,Zilin Si;Tianhong Catherine Yu;Katrene Morozov;James McCann;Wenzhen Yuan;Zilin Si;Tianhong Catherine Yu;Katrene Morozov;James McCann;Wenzhen Yuan;,"Carnegie Mellon University;University of California, Santa Barbara;",United States;,Poster,https://ieeexplore.ieee.org/document/10161321/,,,
1039,Robust Bipedal Locomotion: Leveraging Saltation Matrices for Gait Optimization,,Maegan Tucker;Noel Csomay-Shanklin;Aaron D. Ames;Maegan Tucker;Noel Csomay-Shanklin;Aaron D. Ames;,California Institute of Technology;,United States;,Poster,https://ieeexplore.ieee.org/document/10161309/,,,
1040,Robust co-design of robots via cascaded optimisation,,Akhil Sathuluri;Anand Vazhapilli Sureshbabu;Markus Zimmermann;Akhil Sathuluri;Anand Vazhapilli Sureshbabu;Markus Zimmermann;,Technical University of Munich;,Germany;,Poster,https://ieeexplore.ieee.org/document/10161134/,,,
1041,Robust Collaborative 3D Object Detection in Presence of Pose Errors,,Yifan Lu;Quanhao Li;Baoan Liu;Mehrdad Dianati;Chen Feng;Siheng Chen;Yanfeng Wang;Yifan Lu;Quanhao Li;Baoan Liu;Mehrdad Dianati;Chen Feng;Siheng Chen;Yanfeng Wang;,Shanghai Jiao Tong University;Nanjing University;Meta;University of Warwick;New York University;Shanghai AI Laboratory;,China;United States;United Kingdom;,Poster,https://ieeexplore.ieee.org/document/10160546/,,,
1042,Robust Double-Encoder Network for RGB-D Panoptic Segmentation,,Matteo Sodano;Federico Magistri;Tiziano Guadagnino;Jens Behley;Cyrill Stachniss;Matteo Sodano;Federico Magistri;Tiziano Guadagnino;Jens Behley;Cyrill Stachniss;,University of Bonn;Lamarr Institute for Machine Learning and Artificial Intelligence;,Germany;,Poster,https://ieeexplore.ieee.org/document/10160315/,,,
1043,Robust Forecasting for Robotic Control: A Game-Theoretic Approach,,Shubhankar Agarwal;David Fridovich-Keil;Sandeep P. Chinchali;Shubhankar Agarwal;David Fridovich-Keil;Sandeep P. Chinchali;,University of Texas at Austin;,United States;,Poster,https://ieeexplore.ieee.org/document/10160721/,,,
1044,Robust Human Pose Estimation under Gaussian Noise,,Patrick Schlosser;Christoph Ledermann;Patrick Schlosser;Christoph Ledermann;,Karlsruhe Institute of Technology;,Germany;,Poster,https://ieeexplore.ieee.org/document/10160453/,,,
1045,Robust Imaging Sonar-based Place Recognition and Localization in Underwater Environments,,Hogyun Kim;Gilhwan Kang;Seokhwan Jeong;Seungjun Ma;Younggun Cho;Hogyun Kim;Gilhwan Kang;Seokhwan Jeong;Seungjun Ma;Younggun Cho;,Inha University;,South Korea;,Poster,https://ieeexplore.ieee.org/document/10161518/,,,
1046,Robust Incremental Smoothing and Mapping (riSAM),,Daniel McGann;John G. Rogers;Michael Kaess;Daniel McGann;John G. Rogers;Michael Kaess;,Carnegie Mellon University;DEVCOM Army Research Laboratory;,United States;,Poster,https://ieeexplore.ieee.org/document/10161438/,,,
1047,Robust Locomotion on Legged Robots through Planning on Motion Primitive Graphs,,Wyatt Ubellacker;Aaron D. Ames;Wyatt Ubellacker;Aaron D. Ames;,California Institute of Technology;,United States;,Poster,https://ieeexplore.ieee.org/document/10160672/,,,
1048,Robust MADER: Decentralized and Asynchronous Multiagent Trajectory Planner Robust to Communication Delay,,Kota Kondo;Jesus Tordesillas;Reinaldo Figueroa;Juan Rached;Joseph Merkel;Parker C. Lusk;Jonathan P. How;Kota Kondo;Jesus Tordesillas;Reinaldo Figueroa;Juan Rached;Joseph Merkel;Parker C. Lusk;Jonathan P. How;,Massachusetts Institute of Technology;,United States;,Poster,https://ieeexplore.ieee.org/document/10161244/,,,
1049,Robust Map Fusion with Visual Attention Utilizing Multi-agent Rendezvous,,Jaein Kim;Dong-Sig Han;Byoung-Tak Zhang;Jaein Kim;Dong-Sig Han;Byoung-Tak Zhang;,Seoul National University;,South Korea;,Poster,https://ieeexplore.ieee.org/document/10161072/,,,
1050,Robust Navigation with Cross-Modal Fusion and Knowledge Transfer,,Wenzhe Cai;Guangran Cheng;Lingyue Kong;Lu Dong;Changyin Sun;Wenzhe Cai;Guangran Cheng;Lingyue Kong;Lu Dong;Changyin Sun;,Southeast University;,China;,Poster,https://ieeexplore.ieee.org/document/10161405/,,,
1051,Robust Output Feedback controller for a Serial Robotic Manipulator with Unknown Nonlinearities and External Disturbances,,Mohammad Al Saaideh;Almuatazbellah M. Boker;Mohammad Al Janaideh;Mohammad Al Saaideh;Almuatazbellah M. Boker;Mohammad Al Janaideh;,Memorial University;Virginia Tech;University of Guelph;,Canada;United States;,Poster,https://ieeexplore.ieee.org/document/10160921/,,,
1052,Robust Plant Localization and Phenotyping in Dense 3D Point Clouds for Precision Agriculture,,Henry J. Nelson;Christopher E. Smith;Athanasios Bacharis;Nikolaos P. Papanikolopoulos;Henry J. Nelson;Christopher E. Smith;Athanasios Bacharis;Nikolaos P. Papanikolopoulos;,University of Minnesota;Lake Superior State University;,United States;,Poster,https://ieeexplore.ieee.org/document/10161078/,,,
1053,Robust Robot Planning for Human-Robot Collaboration,,Yang You;Vincent Thomas;Francis Colas;Rachid Alami;Olivier Buffet;Yang You;Vincent Thomas;Francis Colas;Rachid Alami;Olivier Buffet;,Université de Lorraine;LAAS-CNRS;,France;,Poster,https://ieeexplore.ieee.org/document/10161406/,,,
1054,Robust Uncertainty Estimation for Classification of Maritime Objects,,Jonathan Becktor;Frederik Schöller;Evangelos Boukas;Lazaros Nalpantidis;Jonathan Becktor;Frederik Schöller;Evangelos Boukas;Lazaros Nalpantidis;,Technical University of Denmark;,Denmark;,Poster,https://ieeexplore.ieee.org/document/10161452/,,,
1055,"Robust, High-Rate Trajectory Tracking on Insect-Scale Soft-Actuated Aerial Robots with Deep-Learned Tube MPC",,Andrea Tagliabue;Yi-Hsuan Hsiao;Urban Fasel;J. Nathan Kutz;Steven L. Brunton;YuFeng Chen;Jonathan P. How;Andrea Tagliabue;Yi-Hsuan Hsiao;Urban Fasel;J. Nathan Kutz;Steven L. Brunton;YuFeng Chen;Jonathan P. How;,Massachusetts Institute of Technology;Imperial College London;University of Washington;,United States;United Kingdom;,Poster,https://ieeexplore.ieee.org/document/10161510/,,,
1056,RoLM: Radar on LiDAR Map Localization,,Yukai Ma;Xiangrui Zhao;Han Li;Yaqing Gu;Xiaolei Lang;Yong Liu;Yukai Ma;Xiangrui Zhao;Han Li;Yaqing Gu;Xiaolei Lang;Yong Liu;,Zhejiang University;,China;,Poster,https://ieeexplore.ieee.org/document/10161203/,,,
1057,ROSMC: A High-Level Mission Operation Framework for Heterogeneous Robotic Teams,,Ryo Sakagami;Sebastian G. Brunner;Andreas Dömel;Armin Wedler;Freek Stulp;Ryo Sakagami;Sebastian G. Brunner;Andreas Dömel;Armin Wedler;Freek Stulp;,German Aerospace Center;Deutsches Zentrum für Luft- und Raumfahrt (DLR);,Germany;,Poster,https://ieeexplore.ieee.org/document/10161133/,,,
1058,RoSS: Rotation-induced Aliasing for Audio Source Separation,,Hyungjoo Seo;Sahil Bhandary Karnoor;Romit Roy Choudhury;Hyungjoo Seo;Sahil Bhandary Karnoor;Romit Roy Choudhury;,University of Illinois Urbana-Champaign;,United States;,Poster,https://ieeexplore.ieee.org/document/10161106/,,,
1059,Rotation Synchronization via Deep Matrix Factorization,,GK Tejus;Giacomo Zara;Paolo Rota;Andrea Fusiello;Elisa Ricci;Federica Arrigoni;GK Tejus;Giacomo Zara;Paolo Rota;Andrea Fusiello;Elisa Ricci;Federica Arrigoni;,Indian Institute of Technology (ISM);University of Trento;University of Udine;Politecnico di Milano;,India;Italy;,Poster,https://ieeexplore.ieee.org/document/10160548/,,,
1060,RPGD: A Small-Batch Parallel Gradient Descent Optimizer with Explorative Resampling for Nonlinear Model Predictive Control,,Frederik Heetmeyer;Marcin Paluch;Diego Bolliger;Florian Bolli;Xiang Deng;Ennio Filicicchia;Tobi Delbruck;Frederik Heetmeyer;Marcin Paluch;Diego Bolliger;Florian Bolli;Xiang Deng;Ennio Filicicchia;Tobi Delbruck;,University of Zurich;,Switzerland;,Poster,https://ieeexplore.ieee.org/document/10161233/,,,
1061,RTAW: An Attention Inspired Reinforcement Learning Method for Multi-Robot Task Allocation in Warehouse Environments,,Aakriti Agrawal;Amrit Singh Bedi;Dinesh Manocha;Aakriti Agrawal;Amrit Singh Bedi;Dinesh Manocha;,"University of Maryland, College Park;",United States;,Poster,https://ieeexplore.ieee.org/document/10161310/,,,
1062,S*: On Safe and Time Efficient Robot Motion Planning,,Riddhiman Laha;Wenxi Wu;Ruiai Sun;Nico Mansfeld;Luis F.C. Figueredo;Sami Haddadin;Riddhiman Laha;Wenxi Wu;Ruiai Sun;Nico Mansfeld;Luis F.C. Figueredo;Sami Haddadin;,Technical University of Munich;King's College London;,Germany;United Kingdom;,Poster,https://ieeexplore.ieee.org/document/10161248/,,,
1063,SACPlanner: Real-World Collision Avoidance with a Soft Actor Critic Local Planner and Polar State Representations,,Khaled Nakhleh;Minahil Raza;Mack Tang;Matthew Andrews;Rinu Boney;Ilija Hadžić;Jeongran Lee;Atefeh Mohajeri;Karina Palyutina;Khaled Nakhleh;Minahil Raza;Mack Tang;Matthew Andrews;Rinu Boney;Ilija Hadžić;Jeongran Lee;Atefeh Mohajeri;Karina Palyutina;,Nokia Bell Labs;CONACYT–IER–UNAM;,United States;Mexico;,Poster,https://ieeexplore.ieee.org/document/10161129/,,,
1064,Safe and Distributed Multi-Agent Motion Planning under Minimum Speed Constraints,,Inkyu Jang;Jungwon Park;H. Jin Kim;Inkyu Jang;Jungwon Park;H. Jin Kim;,Seoul National University;,South Korea;,Poster,https://ieeexplore.ieee.org/document/10160280/,,,
