Index,Title,Session/Area,Authors,Affiliation,Country,Status,Proceeding URL,PDF URL,CVF URL,Arxiv URL
250,Design analysis of a passive weight-support lower-extremity-exoskeleton with compliant knee-joint,,Kok-Meng Lee;Donghai Wang;Kok-Meng Lee;Donghai Wang;,Georgia Institute of Technology;,United States;,Poster,https://ieeexplore.ieee.org/document/7139978/,,,
251,Design and analysis of a novel quadrotor system - VOOPS,,Ganeshram Nandakumar;Thiyagarajan Ranganathan;Arjun B.J.;Asokan Thondiyath;Ganeshram Nandakumar;Thiyagarajan Ranganathan;Arjun B.J.;Asokan Thondiyath;,Indian Institute of Technology Madras;,India;,Poster,https://ieeexplore.ieee.org/document/7139415/,,,
252,Design and analysis of an optimal hopper for use in resonance-based locomotion,,Ivor Wanders;Gerrit A. Folkertsma;Stefano Stramigioli;Ivor Wanders;Gerrit A. Folkertsma;Stefano Stramigioli;,University of Twente;,Netherlands;,Poster,https://ieeexplore.ieee.org/document/7139923/,,,
253,Design and control of a novel multi-state compliant safe joint for robotic surgery,,Zerui Wang;Peng Li;David Navarro-Alarcon;Hiu Man Yip;Yun-hui Liu;Weiyang Lin;Luyang Li;Zerui Wang;Peng Li;David Navarro-Alarcon;Hiu Man Yip;Yun-hui Liu;Weiyang Lin;Luyang Li;,Chinese University of Hong Kong;,China;,Poster,https://ieeexplore.ieee.org/document/7139302/,,,
254,Design and control of a wearable hand exoskeleton with force-controllable and compact actuator modules,,Inseong Jo;Joonbum Bae;Inseong Jo;Joonbum Bae;,Ulsan National Institute of Science and Technology;,South Korea;,Poster,https://ieeexplore.ieee.org/document/7139982/,,,
255,Design and control of Supernumerary Robotic Limbs for balance augmentation,,Federico Parietti;Kameron C. Chan;Banks Hunter;H. Harry Asada;Federico Parietti;Kameron C. Chan;Banks Hunter;H. Harry Asada;,Massachusetts Institute of Technology;,United States;,Poster,https://ieeexplore.ieee.org/document/7139896/,,,
256,Design and evaluation of a bio-inspired robotic hand for percutaneous coronary intervention,,Zhen-Qiu Feng;Gui-Bin Bian;Xiao-Liang Xie;Zeng-Guang Hou;Jian-Long Hao;Zhen-Qiu Feng;Gui-Bin Bian;Xiao-Liang Xie;Zeng-Guang Hou;Jian-Long Hao;,Chinese Academy of Sciences;,China;,Poster,https://ieeexplore.ieee.org/document/7139944/,,,
257,Design and evaluation of the Bi-directional Clutched Parallel Elastic Actuator (BIC-PEA),,Michiel Plooij;Marvin van Nunspeet;Martijn Wisse;Heike Vallery;Michiel Plooij;Marvin van Nunspeet;Martijn Wisse;Heike Vallery;,Delft University of Technology;,Netherlands;,Poster,https://ieeexplore.ieee.org/document/7139299/,,,
258,Design and experimental evaluation of a skin-stretch haptic device for improved control of brain-computer interfaces,,Sean M. Sketch;Darrel R. Deo;Jayant P. Menon;Allison M. Okamura;Sean M. Sketch;Darrel R. Deo;Jayant P. Menon;Allison M. Okamura;,Stanford University;,United States;,Poster,https://ieeexplore.ieee.org/document/7139011/,,,
259,Design and implementation of an instrumented cane for gait recognition,,Joshua Wade;Marco Beccani;Alec Myszka;Esubalew Bekele;Pietro Valdastri;Patricia Flemming;Michael de Riesthal;Thomas Withrow;Nilanjan Sarkar;Joshua Wade;Marco Beccani;Alec Myszka;Esubalew Bekele;Pietro Valdastri;Patricia Flemming;Michael de Riesthal;Thomas Withrow;Nilanjan Sarkar;,Vanderbilt University;,United States;,Poster,https://ieeexplore.ieee.org/document/7140026/,,,
260,Design investigation of a coreless tubular linear generator for a Moball: A spherical exploration robot with wind-energy harvesting capability,,Junichi Asama;Matthew R. Burkhardt;Faranak Davoodi;Joel W. Burdick;Junichi Asama;Matthew R. Burkhardt;Faranak Davoodi;Joel W. Burdick;,Shizuoka University;California Institute of Technology;University of Southern California;,Japan;United States;,Poster,https://ieeexplore.ieee.org/document/7139007/,,,
261,Design method for an anthropomorphic hand able to gesture and grasp,,Giulio Cerruti;Damien Chablat;David Gouaillier;Sophie Sakka;Giulio Cerruti;Damien Chablat;David Gouaillier;Sophie Sakka;,Institut de Recherche en Communications et Cybernétique de Nantes;LUNAM University;Aldebaran;University of Poitiers;,France;,Poster,https://ieeexplore.ieee.org/document/7139707/,,,
262,Design of a cable-driven active leg exoskeleton (C-ALEX) and gait training experiments with human subjects,,Xin Jin;Xiang Cui;Sunil K. Agrawal;Xin Jin;Xiang Cui;Sunil K. Agrawal;,Columbia University;Beihang University;,United States;China;,Poster,https://ieeexplore.ieee.org/document/7139979/,,,
263,Design of a locomotion interface for gait simulation based on belt-driven parallel mechanisms,,Dinh-Son Vu;Simon Foucault;Clément Gosselin;Jozsef Kövecses;Dinh-Son Vu;Simon Foucault;Clément Gosselin;Jozsef Kövecses;,Université Laval;McGill University;,Canada;,Poster,https://ieeexplore.ieee.org/document/7139399/,,,
264,Design of robotic fingers with human-like passive parallel compliance,,Pei-Hsin Kuo;James DeBacker;Ashish D. Deshpande;Pei-Hsin Kuo;James DeBacker;Ashish D. Deshpande;,University of Texas at Austin;,United States;,Poster,https://ieeexplore.ieee.org/document/7139543/,,,
265,"Design of small, safe and robust quadrotor swarms",,Yash Mulgaonkar;Gareth Cross;Vijay Kumar;Yash Mulgaonkar;Gareth Cross;Vijay Kumar;,University of Pennsylvania;,United States;,Poster,https://ieeexplore.ieee.org/document/7139491/,,,
266,Design of tendon-driven mechanisms for fault tolerance from tendon-breaking by using centroid vectors,,Ryuta Ozawa;Hiroaki Kobayashi;Kazuhito Hyodo;Ryuta Ozawa;Hiroaki Kobayashi;Kazuhito Hyodo;,Ritsumeikan University;Meiji University;Kanagawa Institute of Technology;,Japan;,Poster,https://ieeexplore.ieee.org/document/7139570/,,,
267,"Design of two lightweight, high-bandwidth torque-controlled ankle exoskeletons",,Kirby Ann Witte;Juanjuan Zhang;Rachel W. Jackson;Steven H. Collins;Kirby Ann Witte;Juanjuan Zhang;Rachel W. Jackson;Steven H. Collins;,Carnegie Mellon University;Nanyang Technological University;University of Pittsburgh;,United States;Singapore;,Poster,https://ieeexplore.ieee.org/document/7139347/,,,
268,Design principle of wing rotational hinge stiffness,,Fan Fei;Jesse A. Roll;Xinyan Deng;Fan Fei;Jesse A. Roll;Xinyan Deng;,Purdue University;,United States;,Poster,https://ieeexplore.ieee.org/document/7139306/,,,
269,"Design, identification and experimental testing of a light-weight flexible-joint arm for aerial physical interaction",,Burak Yüksel;Saber Mahboubi;Cristian Secchi;Heinrich H. Bülthoff;Antonio Franchi;Burak Yüksel;Saber Mahboubi;Cristian Secchi;Heinrich H. Bülthoff;Antonio Franchi;,Max Planck Institute for Biological Cybernetics;University of Modena and Reggio Emilia;University of Toulouse;,Germany;Italy;France;,Poster,https://ieeexplore.ieee.org/document/7139280/,,,
270,"Design, modeling and control of a modular contactless wafer handling system",,Bassem Dahroug;Guillaume J. Laurent;Valérian Guelpa;Nadine Le Fort-Piat;Bassem Dahroug;Guillaume J. Laurent;Valérian Guelpa;Nadine Le Fort-Piat;,Université de Franche-Comté;,France;,Poster,https://ieeexplore.ieee.org/document/7139295/,,,
271,Designing snap-free concentric tube robots: A local bifurcation approach,,Richard J. Hendrick;Hunter B. Gilbert;Robert J. Webster;Richard J. Hendrick;Hunter B. Gilbert;Robert J. Webster;,Vanderbilt University;,United States;,Poster,https://ieeexplore.ieee.org/document/7139498/,,,
272,Detection and species classification of young trees using machine perception for a semi-autonomous forest machine,,Mikko Vihlman;Heikki Hyyti;Jouko Kalmari;Arto Visala;Mikko Vihlman;Heikki Hyyti;Jouko Kalmari;Arto Visala;,Aalto University;,Finland;,Poster,https://ieeexplore.ieee.org/document/7139394/,,,
273,Detection of contact force transients in robotic assembly,,Andreas Stolt;Magnus Linderoth;Anders Robertsson;Rolf Johansson;Andreas Stolt;Magnus Linderoth;Anders Robertsson;Rolf Johansson;,Lund University;,Sweden;,Poster,https://ieeexplore.ieee.org/document/7139293/,,,
274,Determining independent contacts regions to immobilize 2D articulated objects,,Noé Alvarado;Raúl Suárez;Máximo A. Roa;Noé Alvarado;Raúl Suárez;Máximo A. Roa;,Universitat Politècnica de Catalunya;German Aerospace Center;,Spain;Germany;,Poster,https://ieeexplore.ieee.org/document/7139791/,,,
275,Developing and benchmarking show & tell robotic puppet for preschool education,,Albert Causo;Giang Truong Vo;Emily Toh;I-Ming Chen;Song Huat Yeo;Pei Wen Tzuo;Albert Causo;Giang Truong Vo;Emily Toh;I-Ming Chen;Song Huat Yeo;Pei Wen Tzuo;,Nanyang Technological University;National Institute of Education;,Singapore;,Poster,https://ieeexplore.ieee.org/document/7140057/,,,
276,Development and characterization of a dynamic smart structure providing multi-axis force sensing for robotic applications,,Davinson Castaño-Cano;Mathieu Grossard;Arnaud Hubert;Davinson Castaño-Cano;Mathieu Grossard;Arnaud Hubert;,ENSMM-UTBM-CNRS;CEA;Sorbonne Universités;,France;,Poster,https://ieeexplore.ieee.org/document/7139739/,,,
277,Development and experimental validation of a force sensing needle for robotically assisted retinal vein cannulations,,A. Gijbels;E.B. Vander Poorten;P. Stalmans;D. Reynaerts;A. Gijbels;E.B. Vander Poorten;P. Stalmans;D. Reynaerts;,University of Leuven;,Belgium;,Poster,https://ieeexplore.ieee.org/document/7139500/,,,
278,Development of a bipedal robot that walks like an animation character,,Seungmoon Song;Joohyung Kim;Katsu Yamane;Seungmoon Song;Joohyung Kim;Katsu Yamane;,Carnegie Mellon University;Disney Research;,United States;,Poster,https://ieeexplore.ieee.org/document/7139698/,,,
279,Development of a real-time local environment stimulation system with visual feedback control,,Takahiro Motoyoshi;Masaru Kojima;Kenichi Ohara;Mitsuhiro Horade;Kazuto Kamiyama;Yasushi Mae;Tatsuo Arai;Takahiro Motoyoshi;Masaru Kojima;Kenichi Ohara;Mitsuhiro Horade;Kazuto Kamiyama;Yasushi Mae;Tatsuo Arai;,Osaka University;Meijo University;,Japan;,Poster,https://ieeexplore.ieee.org/document/7139763/,,,
280,Development of an active haptic cane for gait rehabilitation,,Sang-Hun Pyo;Min-Gyun Oh;Jung-Won Yoon;Sang-Hun Pyo;Min-Gyun Oh;Jung-Won Yoon;,National Institute of Standards and Technology;Colorado State University;Meta;,United States;Japan;,Poster,https://ieeexplore.ieee.org/document/7139817/,,,
281,Development of an unmanned helicopter automatic barrels transportation system,,Chong Wu;Juntong Qi;Dalei Song;Xin Qi;Tianyu Lin;Jianda Han;Chong Wu;Juntong Qi;Dalei Song;Xin Qi;Tianyu Lin;Jianda Han;,University of Chinese Academy of Sciences;Chinese Academy of Sciences;,China;,Poster,https://ieeexplore.ieee.org/document/7139849/,,,
282,Differential dynamic programming for optimal estimation,,Marin Kobilarov;Duy-Nguyen Ta;Frank Dellaert;Marin Kobilarov;Duy-Nguyen Ta;Frank Dellaert;,Johns Hopkins University;Georgia Institute of Technology;,United States;,Poster,https://ieeexplore.ieee.org/document/7139279/,,,
283,Direct visual servoing based on multiple intensity histograms,,Quentin Bateux;Eric Marchand;Quentin Bateux;Eric Marchand;,Université de Rennes 1;,France;,Poster,https://ieeexplore.ieee.org/document/7140043/,,,
284,Directional efficiency in geared transmissions: Characterization of backdrivability towards improved proprioceptive control,,Albert Wang;Sangbae Kim;Albert Wang;Sangbae Kim;,Massachusetts Institute of Technology;,United States;,Poster,https://ieeexplore.ieee.org/document/7139307/,,,
285,Discovery of topical object in image collections,,Huaping Liu;Yunhui Liu;Liming Huang;Fuchun Sun;Di Guo;Huaping Liu;Yunhui Liu;Liming Huang;Fuchun Sun;Di Guo;,TNLIST;,China;,Poster,https://ieeexplore.ieee.org/document/7139444/,,,
286,Distance Bound Smoothing under orientation constraints,,Aleix Rull;Josep M. Porta;Federico Thomas;Aleix Rull;Josep M. Porta;Federico Thomas;,CSIC-UPC;,Spain;,Poster,https://ieeexplore.ieee.org/document/7139377/,,,
287,Distance metric learning for RRT-based motion planning with constant-time inference,,Luigi Palmieri;Kai O. Arras;Luigi Palmieri;Kai O. Arras;,University of Freiburg;,Germany;,Poster,https://ieeexplore.ieee.org/document/7139246/,,,
288,Distortion invariant joint-feature for visual tracking in catadioptric omnidirectional vision,,Yazhe Tang;Y.F. Li;Shuzhi Sam Ge;Jun Luo;Hongliang Ren;Yazhe Tang;Y.F. Li;Shuzhi Sam Ge;Jun Luo;Hongliang Ren;,National University of Singapore;Shanghai University;City University of Hong Kong;,Singapore;China;,Poster,https://ieeexplore.ieee.org/document/7139521/,,,
289,Distributed centroid estimation and motion controllers for collective transport by multi-robot systems,,Golnaz Habibi;Zachary Kingston;William Xie;Mathew Jellins;James McLurkin;Golnaz Habibi;Zachary Kingston;William Xie;Mathew Jellins;James McLurkin;,Rice University;University of Texas at Austin;Purdue University;,United States;,Poster,https://ieeexplore.ieee.org/document/7139356/,,,
290,Distributed map fusion with sporadic updates for large domains,,Peter C. Niedfeldt;Alberto Speranzon;Amit Surana;Peter C. Niedfeldt;Alberto Speranzon;Amit Surana;,Brigham Young University;United Technologies Research Center;,United States;,Poster,https://ieeexplore.ieee.org/document/7139581/,,,
291,Distributed real-time cooperative localization and mapping using an uncertainty-aware expectation maximization approach,,Jing Dong;Erik Nelson;Vadim Indelman;Nathan Michael;Frank Dellaert;Jing Dong;Erik Nelson;Vadim Indelman;Nathan Michael;Frank Dellaert;,Georgia Institute of Technology;Carnegie Mellon University;Technion - Israel Institute of Technology;,United States;Israel;,Poster,https://ieeexplore.ieee.org/document/7140012/,,,
292,Do limit cycles matter in the long run? Stable orbits and sliding-mass dynamics emerge in task-optimal locomotion,,Christian Hubicki;Mikhail Jones;Monica Daley;Jonathan Hurst;Christian Hubicki;Mikhail Jones;Monica Daley;Jonathan Hurst;,Oregon State University;Royal Veterinary College;,United States;United Kingdom;,Poster,https://ieeexplore.ieee.org/document/7139911/,,,
293,Domain decomposition approach for FEM quasistatic modeling and control of Continuum Robots with rigid vertebras,,Julien Bosman;Thor Morales Bieze;Othman Lakhal;Mario Sanz;Rochdi Merzouki;Christian Duriez;Julien Bosman;Thor Morales Bieze;Othman Lakhal;Mario Sanz;Rochdi Merzouki;Christian Duriez;,INRIA;,France;,Poster,https://ieeexplore.ieee.org/document/7139803/,,,
294,Dual Quaternion based modal kinematics for multisection continuum arms,,Isuru S. Godage;Ian D. Walker;Isuru S. Godage;Ian D. Walker;,Vanderbilt University;Clemson University;,United States;,Poster,https://ieeexplore.ieee.org/document/7139375/,,,
295,Duality-based verification techniques for 2D SLAM,,Luca Carlone;Frank Dellaert;Luca Carlone;Frank Dellaert;,Georgia Institute of Technology;,United States;,Poster,https://ieeexplore.ieee.org/document/7139835/,,,
296,Dynamic analysis of a hybrid cable-suspended planar manipulator,,Mahdi Bamdad;Farzin Taheri;Niloofar Abtahi;Mahdi Bamdad;Farzin Taheri;Niloofar Abtahi;,Shahrood University;,Iran;,Poster,https://ieeexplore.ieee.org/document/7139405/,,,
297,Dynamic brace for correction of abnormal postures of the human spine,,Joon-Hyuk Park;Paul Stegall;Sunil K. Agrawal;Joon-Hyuk Park;Paul Stegall;Sunil K. Agrawal;,Columbia University;,United States;,Poster,https://ieeexplore.ieee.org/document/7140029/,,,
298,Dynamic ISD scheme for the AVM system - a preliminary study,,Yao-Sheng Hsieh;Fan-Tien Cheng;Chun-Fang Chen;Jhao-Rong Lyu;Ting-Yu Lin;Yao-Sheng Hsieh;Fan-Tien Cheng;Chun-Fang Chen;Jhao-Rong Lyu;Ting-Yu Lin;,National Chung Cheng University;National Cheng Kung University;,China;,Poster,https://ieeexplore.ieee.org/document/7139469/,,,
299,Dynamic model and motion planning for a pendulum-actuated spherical rolling robot,,Mikhail Svinin;Yang Bai;Motoji Yamamoto;Mikhail Svinin;Yang Bai;Motoji Yamamoto;,Kyushu University;,Japan;,Poster,https://ieeexplore.ieee.org/document/7139249/,,,
300,Dynamic motion phase segmentation using sEMG during countermovement jump based on hidden semi-Markov model,,Seongsik Park;Il Hong Suh;Wan Kyun Chung;Seongsik Park;Il Hong Suh;Wan Kyun Chung;,Pohang University of Science and Technology;Hanyang University;,South Korea;,Poster,https://ieeexplore.ieee.org/document/7139382/,,,
301,Dynamic Multi-Heuristic A*,,Fahad Islam;Venkatraman Narayanan;Maxim Likhachev;Fahad Islam;Venkatraman Narayanan;Maxim Likhachev;,Carnegie Mellon University;,United States;,Poster,https://ieeexplore.ieee.org/document/7139515/,,,
302,Dynamic nonprehensile manipulation by using active-passive hybrid joint with nonparallel axes,,Hiroya Natsuhara;Mitsuru Higashimori;Hiroya Natsuhara;Mitsuru Higashimori;,Osaka University;,Japan;,Poster,https://ieeexplore.ieee.org/document/7139534/,,,
303,Dynamic programming guided exploration for sampling-based motion planning algorithms,,Oktay Arslan;Panagiotis Tsiotras;Oktay Arslan;Panagiotis Tsiotras;,Georgia Institute of Technology;,United States;,Poster,https://ieeexplore.ieee.org/document/7139869/,,,
304,Dynamic walking in a humanoid robot based on a 3D Actuated Dual-SLIP model,,Yiping Liu;Patrick M. Wensing;David E. Orin;Yuan F. Zheng;Yiping Liu;Patrick M. Wensing;David E. Orin;Yuan F. Zheng;,Ohio State University;Massachusetts Institute of Technology;,United States;,Poster,https://ieeexplore.ieee.org/document/7139999/,,,
305,Dynamics and trajectory optimization for a soft spatial fluidic elastomer manipulator,,Andrew D. Marchese;Russ Tedrake;Daniela Rus;Andrew D. Marchese;Russ Tedrake;Daniela Rus;,Massachusetts Institute of Technology;,United States;,Poster,https://ieeexplore.ieee.org/document/7139538/,,,
306,Dynamics morphing between standing and repetitive hopping of biped robots,,Hiroshi Atsuta;Tomomichi Sugihara;Hiroshi Atsuta;Tomomichi Sugihara;,Osaka University;,Japan;,Poster,https://ieeexplore.ieee.org/document/7139998/,,,
307,Dynamics-driven adaptive abstraction for reactive high-level mission and motion planning,,Jonathan A. DeCastro;Vasumathi Raman;Hadas Kress-Gazit;Jonathan A. DeCastro;Vasumathi Raman;Hadas Kress-Gazit;,Cornell University;California Institute of Technology;,United States;,Poster,https://ieeexplore.ieee.org/document/7139025/,,,
308,Effects of exoskeletal stiffness in parallel with the knee on the motion of the human body center of mass during walking,,Kamran Shamaei;Massimo Cenciarini;Albert A. Adams;Karen N. Gregorczyk;Jeffrey M. Schiffman;Aaron M. Dollar;Kamran Shamaei;Massimo Cenciarini;Albert A. Adams;Karen N. Gregorczyk;Jeffrey M. Schiffman;Aaron M. Dollar;,"Yale University;Albert-Ludwigs-Universität Freiburg;US Army Natick Soldier Research, Development and Engineering Center;",United States;Germany;,Poster,https://ieeexplore.ieee.org/document/7139976/,,,
309,Effects of master-slave tool misalignment in a teleoperated surgical robot,,Lawrence H. Kim;Clifford Bargar;Yuhang Che;Allison M. Okamura;Lawrence H. Kim;Clifford Bargar;Yuhang Che;Allison M. Okamura;,Stanford University;,United States;,Poster,https://ieeexplore.ieee.org/document/7139948/,,,
310,Efficiency of speech and iconic gesture integration for robotic and human communicators - a direct comparison,,Paul Bremner;Ute Leonards;Paul Bremner;Ute Leonards;,University of the West of England;University of Bristol;,United Kingdom;,Poster,https://ieeexplore.ieee.org/document/7139460/,,,
311,Efficient and effective matching of image sequences under substantial appearance changes exploiting GPS priors,,Olga Vysotska;Tayyab Naseer;Luciano Spinello;Wolfram Burgard;Cyrill Stachniss;Olga Vysotska;Tayyab Naseer;Luciano Spinello;Wolfram Burgard;Cyrill Stachniss;,University of Bonn;University of Freiburg;,Germany;,Poster,https://ieeexplore.ieee.org/document/7139576/,,,
312,Efficient computation of multiple coupled Cosserat rod models for real-time simulation and control of parallel continuum manipulators,,John Till;Caroline E. Bryson;Scotty Chung;Andrew Orekhov;D. Caleb Rucker;John Till;Caroline E. Bryson;Scotty Chung;Andrew Orekhov;D. Caleb Rucker;,University of Tennessee;,United States;,Poster,https://ieeexplore.ieee.org/document/7139904/,,,
313,Efficient distributed multi-robot localization: A target tracking inspired design,,Oscar De Silva;George K. I. Mann;Raymond G. Gosine;Oscar De Silva;George K. I. Mann;Raymond G. Gosine;,Memorial University of Newfoundland;,Canada;,Poster,https://ieeexplore.ieee.org/document/7139035/,,,
314,Efficient high-quality motion planning by fast all-pairs r-nearest-neighbors,,Michal Kleinbort;Oren Salzman;Dan Halperin;Michal Kleinbort;Oren Salzman;Dan Halperin;,Tel-Aviv University;,Israel;,Poster,https://ieeexplore.ieee.org/document/7139608/,,,
315,Efficient leader selection for translation and scale of a bearing-compass formation,,Eric Schoof;Airlie Chapman;Mehran Mesbahi;Eric Schoof;Airlie Chapman;Mehran Mesbahi;,University of Washington;,United States;,Poster,https://ieeexplore.ieee.org/document/7139434/,,,
316,Efficient measurement planning for remote gas sensing with mobile robots,,Muhammad Asif Arain;Marcello Cirillo;Victor Hernandez Bennetts;Erik Schaffernicht;Marco Trincavelli;Achim J. Lilienthal;Muhammad Asif Arain;Marcello Cirillo;Victor Hernandez Bennetts;Erik Schaffernicht;Marco Trincavelli;Achim J. Lilienthal;,Orebro University;Scania AB;,Sweden;,Poster,https://ieeexplore.ieee.org/document/7139673/,,,
317,Efficient mixed-integer planning for UAVs in cluttered environments,,Robin Deits;Russ Tedrake;Robin Deits;Russ Tedrake;,Massachusetts Institute of Technology;,United States;,Poster,https://ieeexplore.ieee.org/document/7138978/,,,
318,Efficient monocular pose estimation for complex 3D models,,A. Rubio;M. Villamizar;L. Ferraz;A. Penate-Sanchez;A. Ramisa;E. Simo-Serra;A. Sanfeliu;F. Moreno-Noguer;A. Rubio;M. Villamizar;L. Ferraz;A. Penate-Sanchez;A. Ramisa;E. Simo-Serra;A. Sanfeliu;F. Moreno-Noguer;,Institut de Robòtica i Informàtica Industrial;,Spain;,Poster,https://ieeexplore.ieee.org/document/7139372/,,,
319,Efficient path planning for high-DOF articulated robots with adaptive dimensionality,,Dong-Hyung Kim;Youn-Sung Choi;Taejoon Park;Ji Yeong Lee;Chang-Soo Han;Dong-Hyung Kim;Youn-Sung Choi;Taejoon Park;Ji Yeong Lee;Chang-Soo Han;,Hanyang University;,South Korea;,Poster,https://ieeexplore.ieee.org/document/7139512/,,,
320,Efficient radius neighbor search in three-dimensional point clouds,,Jens Behley;Volker Steinhage;Armin B. Cremers;Jens Behley;Volker Steinhage;Armin B. Cremers;,University of Bonn;Rheinische Friedrich-Wilhelms-Universität Bonn;,Germany;,Poster,https://ieeexplore.ieee.org/document/7139702/,,,
321,Efficient reinforcement learning for robots using informative simulated priors,,Mark Cutler;Jonathan P. How;Mark Cutler;Jonathan P. How;,Massachusetts Institute of Technology;,United States;,Poster,https://ieeexplore.ieee.org/document/7139550/,,,
322,Efficient RGB-D object categorization using cascaded ensembles of randomized decision trees,,Umar Asif;Mohammed Bennamoun;Ferdous Sohel;Umar Asif;Mohammed Bennamoun;Ferdous Sohel;,University of Western Australia;,Australia;,Poster,https://ieeexplore.ieee.org/document/7139358/,,,
323,Efficient visual exploration and coverage with a micro aerial vehicle in unknown environments,,Lionel Heng;Alkis Gotovos;Andreas Krause;Marc Pollefeys;Lionel Heng;Alkis Gotovos;Andreas Krause;Marc Pollefeys;,DSO National Laboratories;ETH Zurich;,Singapore;Switzerland;,Poster,https://ieeexplore.ieee.org/document/7139309/,,,
324,Elbow joint motion support for C4 level cervical cord injury patient using an exoskeleton robot,,Shogo Tominaga;Hiroyuki Nakamura;Naoto Mizutani;Ryota Sakamoto;Ken'ichi Yano;Takaaki Aoki;Yutaka Nishimoto;Shogo Tominaga;Hiroyuki Nakamura;Naoto Mizutani;Ryota Sakamoto;Ken'ichi Yano;Takaaki Aoki;Yutaka Nishimoto;,Mie University;Mie University Hospital;Gifu University Hospital;Gifu University;,Japan;,Poster,https://ieeexplore.ieee.org/document/7139891/,,,
325,Electroplated nickel microspring and low-friction precision linear slider: A novel micro-force sensing tool,,Pooya Saketi;Peihua Wangyang;Haihua Li;Qingkang Wang;Pasi Kallio;Pooya Saketi;Peihua Wangyang;Haihua Li;Qingkang Wang;Pasi Kallio;,,,Poster,https://ieeexplore.ieee.org/document/7139561/,,,
326,Emergency maneuver library - ensuring safe navigation in partially known environments,,Sankalp Arora;Sanjiban Choudhury;Daniel Althoff;Sebastian Scherer;Sankalp Arora;Sanjiban Choudhury;Daniel Althoff;Sebastian Scherer;,Carnegie Mellon University;,United States;,Poster,https://ieeexplore.ieee.org/document/7140102/,,,
327,Encoderless position control of a two-link robot manipulator,,Petar Kormushev;Yiannis Demiris;Darwin G. Caldwell;Petar Kormushev;Yiannis Demiris;Darwin G. Caldwell;,Istituto Italiano di Tecnologia;Imperial College London;,Italy;United Kingdom;,Poster,https://ieeexplore.ieee.org/document/7139290/,,,
328,End-tip speed maximization for noncyclic swing motion based on time reversal integral in multiple-joint robots,,Takatoshi Hondo;Ikuo Mizuuchi;Takatoshi Hondo;Ikuo Mizuuchi;,Orebro University;,Japan;,Poster,https://ieeexplore.ieee.org/document/7139263/,,,
329,Energetics-informed hexapod gait transitions across terrains,,Navinda Kottege;Callum Parkinson;Peyman Moghadam;Alberto Elfes;Surya P. N. Singh;Navinda Kottege;Callum Parkinson;Peyman Moghadam;Alberto Elfes;Surya P. N. Singh;,CSIRO;Commonwealth Scientific and Industrial Research Organisation;University of Queensland;,Australia;,Poster,https://ieeexplore.ieee.org/document/7139915/,,,
330,Energy control for complex pendulums based on tracking of online computed force trajectories,,Franz Christange;Philine Donner;Martin Buss;Franz Christange;Philine Donner;Martin Buss;,Technische Universität München;,Germany;,Poster,https://ieeexplore.ieee.org/document/7140047/,,,
