Index,Title,Session/Area,Authors,Affiliation,Country,Status,Proceeding URL,PDF URL,CVF URL,Arxiv URL
305,D2CoPlan: A Differentiable Decentralized Planner for Multi-Robot Coverage,,Vishnu Dutt Sharma;Lifeng Zhou;Pratap Tokekar;Vishnu Dutt Sharma;Lifeng Zhou;Pratap Tokekar;,University of Maryland;Drexel University;,United States;,Poster,https://ieeexplore.ieee.org/document/10160341/,,,
306,D2NT: A High-Performing Depth-to-Normal Translator,,Yi Feng;Bohuan Xue;Ming Liu;Qijun Chen;Rui Fan;Yi Feng;Bohuan Xue;Ming Liu;Qijun Chen;Rui Fan;,Tongji University;Hong Kong University of Science and Technology;,China;,Poster,https://ieeexplore.ieee.org/document/10161000/,,,
307,DAMS-LIO: A Degeneration-Aware and Modular Sensor-Fusion LiDAR-inertial Odometry,,Fuzhang Han;Han Zheng;Wenjun Huang;Rong Xiong;Yue Wang;Yanmei Jiao;Fuzhang Han;Han Zheng;Wenjun Huang;Rong Xiong;Yue Wang;Yanmei Jiao;,Zhejiang University;Hangzhou Normal University;,China;,Poster,https://ieeexplore.ieee.org/document/10160971/,,,
308,Data-Association-Free Landmark-based SLAM,,Yihao Zhang;Odin A. Severinsen;John J. Leonard;Luca Carlone;Kasra Khosoussi;Yihao Zhang;Odin A. Severinsen;John J. Leonard;Luca Carlone;Kasra Khosoussi;,Massachusetts Institute of Technology;Commonwealth Scientific and Industrial Research Organisation;,United States;Australia;,Poster,https://ieeexplore.ieee.org/document/10160719/,,,
309,Data-Driven Estimation of Forces Along the Backbone of Concentric Tube Continuum Robots,,Heiko Donat;Pouya Mohammadi;Jochen Steil;Heiko Donat;Pouya Mohammadi;Jochen Steil;,Technische Universität Braunschweig;,Germany;,Poster,https://ieeexplore.ieee.org/document/10161391/,,,
310,Data-driven Loop Closure Detection in Bathymetric Point Clouds for Underwater SLAM,,Jiarui Tan;Ignacio Torroba;Yiping Xie;John Folkesson;Jiarui Tan;Ignacio Torroba;Yiping Xie;John Folkesson;,KTH Royal Institute of Technology;,Sweden;,Poster,https://ieeexplore.ieee.org/document/10160783/,,,
311,Data-driven optimal control under safety constraints using sparse Koopman approximation,,Hongzhe Yu;Joseph Moyalan;Umesh Vaidya;Yongxin Chen;Hongzhe Yu;Joseph Moyalan;Umesh Vaidya;Yongxin Chen;,Georgia Institute of Technology;Clemson University;,United States;,Poster,https://ieeexplore.ieee.org/document/10160641/,,,
312,Data-Driven Risk-sensitive Model Predictive Control for Safe Navigation in Multi-Robot Systems,,Atharva Navsalkar;Ashish R. Hota;Atharva Navsalkar;Ashish R. Hota;,Indian Institute of Technology Kharagpur;Indian Institute of Technology;,India;,Poster,https://ieeexplore.ieee.org/document/10161002/,,,
313,Data-Driven Spectral Submanifold Reduction for Nonlinear Optimal Control of High-Dimensional Robots,,John Irvin Alora;Mattia Cenedese;Edward Schmerling;George Haller;Marco Pavone;John Irvin Alora;Mattia Cenedese;Edward Schmerling;George Haller;Marco Pavone;,Stanford University;ETH Zurich;,United States;Switzerland;,Poster,https://ieeexplore.ieee.org/document/10160418/,,,
314,Data-Driven Stochastic Motion Evaluation and Optimization with Image by Spatially-Aligned Temporal Encoding,,Takeru Oba;Norimichi Ukita;Takeru Oba;Norimichi Ukita;,Toyota Technological Institute;,Japan;,Poster,https://ieeexplore.ieee.org/document/10161262/,,,
315,Data-Efficient Characterization of the Global Dynamics of Robot Controllers with Confidence Guarantees,,Ewerton R. Vieira;Aravind Sivaramakrishnan;Yao Song;Edgar Granados;Marcio Gameiro;Konstantin Mischaikow;Ying Hung;Kostas E. Bekris;Ewerton R. Vieira;Aravind Sivaramakrishnan;Yao Song;Edgar Granados;Marcio Gameiro;Konstantin Mischaikow;Ying Hung;Kostas E. Bekris;,Universidade Federal de Goiás;Universidade de São Paulo;Rutgers University;,Brazil;United States;,Poster,https://ieeexplore.ieee.org/document/10160428/,,,
316,Data-Efficient Learning of Natural Language to Linear Temporal Logic Translators for Robot Task Specification,,Jiayi Pan;Glen Chou;Dmitry Berenson;Jiayi Pan;Glen Chou;Dmitry Berenson;,University of Michigan;,United States;,Poster,https://ieeexplore.ieee.org/document/10161125/,,,
317,Data-efficient Non-parametric Modelling and Control of an Extensible Soft Manipulator,,Mohammadreza Kasaei;Keyhan Kouhkiloui Babarahmati;Zhibin Li;Mohsen Khadem;Mohammadreza Kasaei;Keyhan Kouhkiloui Babarahmati;Zhibin Li;Mohsen Khadem;,University of Edinburgh;University College London;,United Kingdom;,Poster,https://ieeexplore.ieee.org/document/10161275/,,,
318,DC-MOT: Motion Deblurring and Compensation for Multi-Object Tracking in UAV Videos,,Song Cheng;Meibao Yao;Xueming Xiao;Song Cheng;Meibao Yao;Xueming Xiao;,Engineering Research Center of Knowledge-Driven Human-Machine Intelligence;Ministry of Education;,China;,Poster,https://ieeexplore.ieee.org/document/10160931/,,,
319,DDK: A Deep Koopman Approach for Longitudinal and Lateral Control of Autonomous Ground Vehicles,,Yongqian Xiao;Xinglong Zhang;Xin Xu;Yang Lu;Junxiang Lil;Yongqian Xiao;Xinglong Zhang;Xin Xu;Yang Lu;Junxiang Lil;,National University of Defense Technology;,China;,Poster,https://ieeexplore.ieee.org/document/10161104/,,,
320,DDS3D: Dense Pseudo-Labels with Dynamic Threshold for Semi-Supervised 3D Object Detection,,Jingyu Li;Zhe Liu;Jinghua Hou;Dingkang Liang;Jingyu Li;Zhe Liu;Jinghua Hou;Dingkang Liang;,Huazhong University of Science and Technology;,China;,Poster,https://ieeexplore.ieee.org/document/10160489/,,,
321,Dealing with Sparse Rewards in Continuous Control Robotics via Heavy-Tailed Policy Optimization,,Souradip Chakraborty;Amrit Singh Bedi;Kasun Weerakoon;Prithvi Poddar;Alec Koppel;Pratap Tokekar;Dinesh Manocha;Souradip Chakraborty;Amrit Singh Bedi;Kasun Weerakoon;Prithvi Poddar;Alec Koppel;Pratap Tokekar;Dinesh Manocha;,University of Maryland;Indian Institutes of Science Education and Research;JP Morgan AI Research;,United States;India;,Poster,https://ieeexplore.ieee.org/document/10161186/,,,
322,Decentralised Active Perception in Continuous Action Spaces for the Coordinated Escort Problem,,Rhett Hull;Ki Myung Brian Lee;Jennifer Wakulicz;Chanyeol Yoo;James McMahon;Bryan Clarke;Stuart Anstee;Jijoong Kim;Robert Fitch;Rhett Hull;Ki Myung Brian Lee;Jennifer Wakulicz;Chanyeol Yoo;James McMahon;Bryan Clarke;Stuart Anstee;Jijoong Kim;Robert Fitch;,Defence Science and Technology Group;University of Technology Sydney;US Naval Research Laboratory;,Australia;United States;,Poster,https://ieeexplore.ieee.org/document/10161026/,,,
323,Decentralized Deadlock-free Trajectory Planning for Quadrotor Swarm in Obstacle-rich Environments,,Jungwon Park;Inkyu Jang;H. Jin Kim;Jungwon Park;Inkyu Jang;H. Jin Kim;,Seoul National University;,South Korea;,Poster,https://ieeexplore.ieee.org/document/10160847/,,,
324,Decentralized Multi-agent Exploration with Limited Inter-agent Communications,,Hans J. He;Alec Koppel;Amrit Singh Bedi;Daniel J. Stilwell;Mazen Farhood;Benjamin Biggs;Hans J. He;Alec Koppel;Amrit Singh Bedi;Daniel J. Stilwell;Mazen Farhood;Benjamin Biggs;,Virginia Tech;JP Morgan;University of Maryland;,United States;,Poster,https://ieeexplore.ieee.org/document/10160599/,,,
325,Decision diagrams as plans: Answering observation-grounded queries,,Dylan A. Shell;Jason M. O'Kane;Dylan A. Shell;Jason M. O'Kane;,Texas A&M University;,United States;,Poster,https://ieeexplore.ieee.org/document/10161530/,,,
326,Decoupling Skill Learning from Robotic Control for Generalizable Object Manipulation,,Kai Lu;Bo Yang;Bing Wang;Andrew Markham;Kai Lu;Bo Yang;Bing Wang;Andrew Markham;,University of Oxford;Hong Kong Polytechnic University;,United Kingdom;China;,Poster,https://ieeexplore.ieee.org/document/10160332/,,,
327,DEdgeNet: Extrinsic Calibration of Camera and LiDAR with Depth-discontinuous Edges,,Yiyang Hu;Hui Ma;Leiping Jie;Hui Zhang;Yiyang Hu;Hui Ma;Leiping Jie;Hui Zhang;,United International College;,China;,Poster,https://ieeexplore.ieee.org/document/10160910/,,,
328,Deep Interactive Full Transformer Framework for Point Cloud Registration,,Guangyan Chen;Meiling Wang;Qingxiang Zhang;Li Yuan;Tong Liu;Yufeng Yue;Guangyan Chen;Meiling Wang;Qingxiang Zhang;Li Yuan;Tong Liu;Yufeng Yue;,Beijing Institute of Technology;Peking University;,China;,Poster,https://ieeexplore.ieee.org/document/10160863/,,,
329,Deep Learning on Home Drone: Searching for the Optimal Architecture,,Alaa Maalouf;Yotam Gurfinkel;Barak Diker;Oren Gal;Daniela Rus;Dan Feldman;Alaa Maalouf;Yotam Gurfinkel;Barak Diker;Oren Gal;Daniela Rus;Dan Feldman;,Massachusetts Institute of Technology;University of Haifa;,United States;Israel;,Poster,https://ieeexplore.ieee.org/document/10160827/,,,
330,Deep Masked Graph Matching for Correspondence Identification in Collaborative Perception,,Peng Gao;Qingzhao Zhu;Hongsheng Lu;Chuang Gan;Hao Zhang;Peng Gao;Qingzhao Zhu;Hongsheng Lu;Chuang Gan;Hao Zhang;,University of Maryland;Colorado School of Mines;Toyota Motor North America;IBM;University of Massachusetts Amherst;,United States;,Poster,https://ieeexplore.ieee.org/document/10161231/,,,
331,Deep metric learning for visual servoing: when pose and image meet in latent space,,Samuel Felton;Elisa Fromont;Eric Marchand;Samuel Felton;Elisa Fromont;Eric Marchand;,CNRS;,France;,Poster,https://ieeexplore.ieee.org/document/10160963/,,,
332,Deep Neural Network Architecture Search for Accurate Visual Pose Estimation aboard Nano-UAVs,,E. Cereda;L. Crupi;M. Risso;A. Burrello;L. Benini;A. Giusti;D. Jahier Pagliari;D. Palossi;E. Cereda;L. Crupi;M. Risso;A. Burrello;L. Benini;A. Giusti;D. Jahier Pagliari;D. Palossi;,Dalle Molle Institute for Artificial Intelligence;Politecnico di Torino;University of Bologna;ETH Zurich;,Switzerland;Italy;,Poster,https://ieeexplore.ieee.org/document/10160369/,,,
333,Deep Occupancy-Predictive Representations for Autonomous Driving,,Eivind Meyer;Lars Frederik Peiss;Matthias Althoff;Eivind Meyer;Lars Frederik Peiss;Matthias Althoff;,Technical University of Munich;,Germany;,Poster,https://ieeexplore.ieee.org/document/10160559/,,,
334,Deep Reinforcement Learning based Personalized Locomotion Planning for Lower-Limb Exoskeletons,,Javad K. Mehr;Eddie Guo;Mojtaba Akbari;Vivian K. Mushahwar;Mahdi Tavakoli;Javad K. Mehr;Eddie Guo;Mojtaba Akbari;Vivian K. Mushahwar;Mahdi Tavakoli;,University of Alberta;,Canada;,Poster,https://ieeexplore.ieee.org/document/10161559/,,,
335,Deep Reinforcement Learning Based Tracking Control of an Autonomous Surface Vessel in Natural Waters,,Wei Wang;Xiaojing Cao;Alejandro Gonzalez-Garcia;Lianhao Yin;Niklas Hagemann;Yuanyuan Qiao;Carlo Ratti;Daniela Rus;Wei Wang;Xiaojing Cao;Alejandro Gonzalez-Garcia;Lianhao Yin;Niklas Hagemann;Yuanyuan Qiao;Carlo Ratti;Daniela Rus;,Massachusetts Institute of Technology;Beijing University of Posts and Telecommunications;KU Leuven;,United States;China;Belgium;,Poster,https://ieeexplore.ieee.org/document/10160858/,,,
336,Deep Reinforcement Learning for Autonomous Driving using High-Level Heterogeneous Graph Representations,,Maximilian Schier;Christoph Reinders;Bodo Rosenhahn;Maximilian Schier;Christoph Reinders;Bodo Rosenhahn;,Leibniz University Hannover;,Germany;,Poster,https://ieeexplore.ieee.org/document/10160762/,,,
337,Deep Underwater Monocular Depth Estimation with Single-Beam Echosounder,,Haowen Liu;Monika Roznere;Alberto Quattrini Li;Haowen Liu;Monika Roznere;Alberto Quattrini Li;,Dartmouth College;,United States;,Poster,https://ieeexplore.ieee.org/document/10161439/,,,
338,Deep Unsupervised Visual Odometry Via Bundle Adjusted Pose Graph Optimization,,Guoyu Lu;Guoyu Lu;,University of Georgia;,United States;,Poster,https://ieeexplore.ieee.org/document/10160703/,,,
339,DeepRING: Learning Roto-translation Invariant Representation for LiDAR based Place Recognition,,Sha Lu;Xuecheng Xu;Li Tang;Rong Xiong;Yue Wang;Sha Lu;Xuecheng Xu;Li Tang;Rong Xiong;Yue Wang;,Zhejiang University;Alibaba Group;,China;,Poster,https://ieeexplore.ieee.org/document/10161435/,,,
340,DeepSeeColor: Realtime Adaptive Color Correction for Autonomous Underwater Vehicles via Deep Learning Methods,,Stewart Jamieson;Jonathan P. How;Yogesh Girdhar;Stewart Jamieson;Jonathan P. How;Yogesh Girdhar;,Massachusetts Institute of Technology;Woods Hole Oceanographic Institution;,United States;,Poster,https://ieeexplore.ieee.org/document/10160477/,,,
341,DefGraspNets: Grasp Planning on 3D Fields with Graph Neural Nets,,Isabella Huang;Yashraj Narang;Ruzena Bajcsy;Fabio Ramos;Tucker Hermans;Dieter Fox;Isabella Huang;Yashraj Narang;Ruzena Bajcsy;Fabio Ramos;Tucker Hermans;Dieter Fox;,"University of California, Berkeley;NVIDIA;University of Sydney;University of Utah;University of Washington;",United States;Australia;,Poster,https://ieeexplore.ieee.org/document/10160986/,,,
342,Demonstration-Bootstrapped Autonomous Practicing via Multi-Task Reinforcement Learning,,Abhishek Gupta;Corey Lynch;Brandon Kinman;Garrett Peake;Sergey Levine;Karol Hausman;Abhishek Gupta;Corey Lynch;Brandon Kinman;Garrett Peake;Sergey Levine;Karol Hausman;,"University of California, Berkeley;Google;",United States;,Poster,https://ieeexplore.ieee.org/document/10161447/,,,
343,Demonstration-guided Optimal Control for Long-term Non-prehensile Planar Manipulation,,Teng Xue;Hakan Girgin;Teguh Santoso Lembono;Sylvain Calinon;Teng Xue;Hakan Girgin;Teguh Santoso Lembono;Sylvain Calinon;,EPFL;,Switzerland;,Poster,https://ieeexplore.ieee.org/document/10161496/,,,
344,Demonstration-Guided Reinforcement Learning with Efficient Exploration for Task Automation of Surgical Robot,,Tao Huang;Kai Chen;Bin Li;Yun-Hui Liu;Qi Dou;Tao Huang;Kai Chen;Bin Li;Yun-Hui Liu;Qi Dou;,Chinese University of Hong Kong;,China;,Poster,https://ieeexplore.ieee.org/document/10160327/,,,
345,Dense Depth Completion Based on Multi-Scale Confidence and Self-Attention Mechanism for Intestinal Endoscopy,,Ruyu Liu;Zhengzhe Liu;Haoyu Zhang;Guodao Zhang;Zhigui Zuo;Weiguo Sheng;Ruyu Liu;Zhengzhe Liu;Haoyu Zhang;Guodao Zhang;Zhigui Zuo;Weiguo Sheng;,Chinese Academy of Sciences;Hangzhou Normal University;Hangzhou Dianzi University;First Affiliated Hospital of Wenzhou Medical University;,China;,Poster,https://ieeexplore.ieee.org/document/10161549/,,,
346,DenseTact 2.0: Optical Tactile Sensor for Shape and Force Reconstruction,,Won Kyung Do;Bianca Jurewicz;Monroe Kennedy;Won Kyung Do;Bianca Jurewicz;Monroe Kennedy;,Stanford University;,United States;,Poster,https://ieeexplore.ieee.org/document/10161150/,,,
347,Density Planner: Minimizing Collision Risk in Motion Planning with Dynamic Obstacles using Density-based Reachability,,Laura Lützow;Yue Meng;Andres Chavez Armijos;Chuchu Fan;Laura Lützow;Yue Meng;Andres Chavez Armijos;Chuchu Fan;,Massachusetts Institute of Technology;Boston University;,United States;,Poster,https://ieeexplore.ieee.org/document/10161378/,,,
348,Density-aware NeRF Ensembles: Quantifying Predictive Uncertainty in Neural Radiance Fields,,Niko Sünderhauf;Jad Abou-Chakra;Dimity Miller;Niko Sünderhauf;Jad Abou-Chakra;Dimity Miller;,Queensland University of Technology;,Australia;,Poster,https://ieeexplore.ieee.org/document/10161012/,,,
349,Depth Estimation for Oral Cavity by Shape from Shading with Endoscope,,Xi Wu;Gangtie Zheng;Xi Wu;Gangtie Zheng;,Tsinghua University;,China;,Poster,https://ieeexplore.ieee.org/document/10160925/,,,
350,Depth Is All You Need for Monocular 3D Detection,,Dennis Park;Jie Li;Dian Chen;Vitor Guizilini;Adrien Gaidon;Dennis Park;Jie Li;Dian Chen;Vitor Guizilini;Adrien Gaidon;,Toyota Research Institute;;,United States;;,Poster,https://ieeexplore.ieee.org/document/10160483/,,,
351,Descriptor Distillation for Efficient Multi-Robot SLAM,,Xiyue Guo;Junjie Hu;Hujun Bao;Guofeng Zhang;Xiyue Guo;Junjie Hu;Hujun Bao;Guofeng Zhang;,Zhejiang University;Chinese University of Hong Kong;,China;,Poster,https://ieeexplore.ieee.org/document/10160541/,,,
352,"Design and characterization of a low mechanical loss, high-resolution wearable strain gauge",,Addison Liu;Seun Araromi;Conor J. Walsh;Robert J. Wood;Addison Liu;Seun Araromi;Conor J. Walsh;Robert J. Wood;,Harvard University;,United States;,Poster,https://ieeexplore.ieee.org/document/10161524/,,,
353,Design and Control of a Micro Overactuated Aerial Robot with an Origami Delta Manipulator,,Eugenio Cuniato;Christian Geckeler;Maximilian Brunner;Dario Strübin;Elia Bähler;Fabian Ospelt;Marco Tognon;Stefano Mintchev;Roland Siegwart;Eugenio Cuniato;Christian Geckeler;Maximilian Brunner;Dario Strübin;Elia Bähler;Fabian Ospelt;Marco Tognon;Stefano Mintchev;Roland Siegwart;,ETH Zurich;,Switzerland;,Poster,https://ieeexplore.ieee.org/document/10161060/,,,
354,Design and Control of a Tunable-Stiffness Coiled-Spring Actuator,,Shivangi Misra;Mason Mitchell;Rongqian Chen;Cynthia Sung;Shivangi Misra;Mason Mitchell;Rongqian Chen;Cynthia Sung;,University of Pennsylvania;Worcester Polytechnic Institute;,United States;,Poster,https://ieeexplore.ieee.org/document/10161218/,,,
355,Design and Development of a Hydrogel-based Soft Sensor for Multi-Axis Force Control,,Yichen Cai;David Hardman;Fumiya Iida;Thomas George Thuruthel;Yichen Cai;David Hardman;Fumiya Iida;Thomas George Thuruthel;,University of Cambridge;,United Kingdom;,Poster,https://ieeexplore.ieee.org/document/10160807/,,,
356,Design and Development of a Novel Force-Sensing Robotic System for the Transseptal Puncture in Left Atrial Catheter Ablation,,Aya Mutaz Zeidan;Zhouyang Xu;Christopher E. Mower;Honglei Wu;Quentin Walker;Oyinkansola Ayoade;Natalia Cotic;Jonathan Behar;Steven Williams;Aruna Arujuna;Yohan Noh;Richard Housden;Kawal Rhode;Aya Mutaz Zeidan;Zhouyang Xu;Christopher E. Mower;Honglei Wu;Quentin Walker;Oyinkansola Ayoade;Natalia Cotic;Jonathan Behar;Steven Williams;Aruna Arujuna;Yohan Noh;Richard Housden;Kawal Rhode;,King's College London;Brunel University;,United Kingdom;,Poster,https://ieeexplore.ieee.org/document/10160254/,,,
357,Design and Evaluation of an Augmented Reality Head-Mounted Display User Interface for Controlling Legged Manipulators,,Rodrigo Chacón Quesada;Yiannis Demiris;Rodrigo Chacón Quesada;Yiannis Demiris;,Imperial College London;,United Kingdom;,Poster,https://ieeexplore.ieee.org/document/10161278/,,,
358,Design and Mechanics of Cable-Driven Rolling Diaphragm Transmission for High-Transparency Robotic Motion,,Hoi Man Lam;W. Jared Walker;Lucas Jonasch;Dimitri Schreiber;Michael C. Yip;Hoi Man Lam;W. Jared Walker;Lucas Jonasch;Dimitri Schreiber;Michael C. Yip;,"University of California, San Diego;",United States;,Poster,https://ieeexplore.ieee.org/document/10160832/,,,
359,Design and Validation of a Multi-Arm Relocatable Manipulator for Space Applications,,Enrico Mingo Hoffman;Arturo Laurenzi;Francesco Ruscelli;Luca Rossini;Lorenzo Baccelliere;Davide Antonucci;Alessio Margan;Paolo Guria;Marco Migliorini;Stefano Cordasco;Gennaro Raiola;Luca Muratore;Joaquín Estremera Rodrigo;Andrea Rusconi;Guido Sangiovanni;Nikos G. Tsagarakis;Enrico Mingo Hoffman;Arturo Laurenzi;Francesco Ruscelli;Luca Rossini;Lorenzo Baccelliere;Davide Antonucci;Alessio Margan;Paolo Guria;Marco Migliorini;Stefano Cordasco;Gennaro Raiola;Luca Muratore;Joaquín Estremera Rodrigo;Andrea Rusconi;Guido Sangiovanni;Nikos G. Tsagarakis;,Leonardo S.p.A.;Istituto Italiano di Tecnologia;GMV;,Italy;Spain;,Poster,https://ieeexplore.ieee.org/document/10160389/,,,
360,Design of a Multimodal Fingertip Sensor for Dynamic Manipulation,,Andrew SaLoutos;Elijah Stanger-Jones;Menglong Guo;Hongmin Kim;Sangbae Kim;Andrew SaLoutos;Elijah Stanger-Jones;Menglong Guo;Hongmin Kim;Sangbae Kim;,Massachusetts Institute of Technology;,United States;,Poster,https://ieeexplore.ieee.org/document/10160256/,,,
361,Design of a Variable Stiffness Spring with Human-Selectable Stiffness,,Chase W. Mathews;David J. Braun;Chase W. Mathews;David J. Braun;,Vanderbilt University;,United States;,Poster,https://ieeexplore.ieee.org/document/10161305/,,,
362,Design of an Energy-Aware Cartesian Impedance Controller for Collaborative Disassembly,,Sebastian Hjorth;Edoardo Lamon;Dimitrios Chrysostomou;Arash Ajoudani;Sebastian Hjorth;Edoardo Lamon;Dimitrios Chrysostomou;Arash Ajoudani;,Aalborg University;Istituto Italiano di Tecnologia;,Denmark;Italy;,Poster,https://ieeexplore.ieee.org/document/10160993/,,,
363,Design Optimization and Data-driven Shallow Learning for Dynamic Modeling of a Smart Segmented Electroadhesive Clutch,,Navid Feizi;Zahra Bahrami;S. Farokh Atashzar;Mehrdad R. Kermani;Rajni V. Patel;Navid Feizi;Zahra Bahrami;S. Farokh Atashzar;Mehrdad R. Kermani;Rajni V. Patel;,Western University;University of Erlangen-Nuremberg;New York University;,Canada;Germany;United States;,Poster,https://ieeexplore.ieee.org/document/10161225/,,,
364,Detecting spatio-temporal Relations by Combining a Semantic Map with a Stream Processing Engine,,Lennart Niecksch;Henning Deeken;Thomas Wiemann;Lennart Niecksch;Henning Deeken;Thomas Wiemann;,German Research Center for Artificial Intelligence;Osnabrück University;,Germany;,Poster,https://ieeexplore.ieee.org/document/10160656/,,,
365,Development and Evaluation of a Robotic Vessel Positioning System for Semi-Automatic Microvascular Anastomosis,,Jesse Haworth;Justin Opfermann;Michael Kam;Yaning Wang;Robin Yang;Jin U. Kang;Axel Krieger;Jesse Haworth;Justin Opfermann;Michael Kam;Yaning Wang;Robin Yang;Jin U. Kang;Axel Krieger;,Johns Hopkins University;Johns Hopkins Medicine;,United States;,Poster,https://ieeexplore.ieee.org/document/10161296/,,,
366,Development and Experimental Verification of a 3D Dynamic Absolute Nodal Coordinate Formulation Model of Flexible Prostate Biopsy/Brachytherapy Needles,,Athanasios Martsopoulos;Thomas L. Hill;Rajendra Persad;Stefanos Bolomytis;Antonia Tzemanaki;Athanasios Martsopoulos;Thomas L. Hill;Rajendra Persad;Stefanos Bolomytis;Antonia Tzemanaki;,University of the West of England;University of Bristol;Southmead Hospital;Bristol Robotics Laboratory;,United Kingdom;,Poster,https://ieeexplore.ieee.org/document/10161254/,,,
367,Development of Hydraulically-driven Soft Hand for Handling Heavy Vegetables and its Experimental Evaluation,,Osamu Azami;Kyosuke Ishibashi;Mitsuo Komagata;Ko Yamamoto;Osamu Azami;Kyosuke Ishibashi;Mitsuo Komagata;Ko Yamamoto;,University of Tokyo;,Japan;,Poster,https://ieeexplore.ieee.org/document/10160629/,,,
368,DexGraspNet: A Large-Scale Robotic Dexterous Grasp Dataset for General Objects Based on Simulation,,Ruicheng Wang;Jialiang Zhang;Jiayi Chen;Yinzhen Xu;Puhao Li;Tengyu Liu;He Wang;Ruicheng Wang;Jialiang Zhang;Jiayi Chen;Yinzhen Xu;Puhao Li;Tengyu Liu;He Wang;,Peking University;Beijing Institute for General Artificial Intelligence;Tsinghua University;,China;,Poster,https://ieeexplore.ieee.org/document/10160982/,,,
369,Dexterous Imitation Made Easy: A Learning-Based Framework for Efficient Dexterous Manipulation,,Sridhar Pandian Arunachalam;Sneha Silwal;Ben Evans;Lerrel Pinto;Sridhar Pandian Arunachalam;Sneha Silwal;Ben Evans;Lerrel Pinto;,New York University;,United States;,Poster,https://ieeexplore.ieee.org/document/10160275/,,,
370,Dexterous Manipulation from Images: Autonomous Real-World RL via Substep Guidance,,Kelvin Xu;Zheyuan Hu;Ria Doshi;Aaron Rovinsky;Vikash Kumar;Abhishek Gupta;Sergey Levine;Kelvin Xu;Zheyuan Hu;Ria Doshi;Aaron Rovinsky;Vikash Kumar;Abhishek Gupta;Sergey Levine;,"University of California, Berkeley;Meta;University of Washington;",United States;,Poster,https://ieeexplore.ieee.org/document/10161493/,,,
371,DeXtreme: Transfer of Agile In-hand Manipulation from Simulation to Reality,,Ankur Handa;Arthur Allshire;Viktor Makoviychuk;Aleksei Petrenko;Ritvik Singh;Jingzhou Liu;Denys Makoviichuk;Karl Van Wyk;Alexander Zhurkevich;Balakumar Sundaralingam;Yashraj Narang;Ankur Handa;Arthur Allshire;Viktor Makoviychuk;Aleksei Petrenko;Ritvik Singh;Jingzhou Liu;Denys Makoviichuk;Karl Van Wyk;Alexander Zhurkevich;Balakumar Sundaralingam;Yashraj Narang;,,,Poster,https://ieeexplore.ieee.org/document/10160216/,,,
372,Dextrous Tactile In-Hand Manipulation Using a Modular Reinforcement Learning Architecture,,Johannes Pitz;Lennart Röstel;Leon Sievers;Berthold Bäuml;Johannes Pitz;Lennart Röstel;Leon Sievers;Berthold Bäuml;,Deggendorf Institute of Technology;,Germany;,Poster,https://ieeexplore.ieee.org/document/10160756/,,,
373,DFR-FastMOT: Detection Failure Resistant Tracker for Fast Multi-Object Tracking Based on Sensor Fusion,,Mohamed Nagy;Majid Khonji;Jorge Dias;Sajid Javed;Mohamed Nagy;Majid Khonji;Jorge Dias;Sajid Javed;,Khalifa University;,United Arab Emirates;,Poster,https://ieeexplore.ieee.org/document/10160328/,,,
374,DifFAR: Differentiable Frequency-based Disentanglement for Aerial Video Action Recognition,,Divya Kothandaraman;Ming Lin;Dinesh Manocha;Divya Kothandaraman;Ming Lin;Dinesh Manocha;,University of Maryland;,United States;,Poster,https://ieeexplore.ieee.org/document/10160271/,,,
375,Differentiable Collision Detection for a Set of Convex Primitives,,Kevin Tracy;Taylor A. Howell;Zachary Manchester;Kevin Tracy;Taylor A. Howell;Zachary Manchester;,Carnegie Mellon University;Stanford University;,United States;,Poster,https://ieeexplore.ieee.org/document/10160716/,,,
376,Differentiable Collision Detection: a Randomized Smoothing Approach,,Louis Montaut;Quentin Le Lidec;Antoine Bambade;Vladimir Petrik;Josef Sivic;Justin Carpentier;Louis Montaut;Quentin Le Lidec;Antoine Bambade;Vladimir Petrik;Josef Sivic;Justin Carpentier;,Czech Technical University;INRIA;,Czech Republic;France;,Poster,https://ieeexplore.ieee.org/document/10160251/,,,
377,Differentiable Dynamics Simulation Using Invariant Contact Mapping and Damped Contact Force,,Minji Lee;Jeongmin Lee;Dongjun Lee;Minji Lee;Jeongmin Lee;Dongjun Lee;,Seoul National University;,South Korea;,Poster,https://ieeexplore.ieee.org/document/10161519/,,,
378,Differentiable Parsing and Visual Grounding of Natural Language Instructions for Object Placement,,Zirui Zhao;Wee Sun Lee;David Hsu;Zirui Zhao;Wee Sun Lee;David Hsu;,National University of Singapore;,Singapore;,Poster,https://ieeexplore.ieee.org/document/10160640/,,,
