Index,Title,Session/Area,Authors,Affiliation,Country,Status,Proceeding URL,PDF URL
1221,Task Cooperation for Semi-Supervised Few-Shot Learning,Machine Learning V,Han-Jia Ye;Xin-Chun Li;De-Chuan Zhan;,Nanjing University;,China;,Technical,https://aaai.org/papers/10682-task-cooperation-for-semi-supervised-few-shot-learning/,https://cdn.aaai.org/ojs/17277/17277-13-20771-1-2-20210518.pdf
1222,Temporal-Coded Deep Spiking Neural Network with Easy Training and Robust Performance,Machine Learning V,Shibo Zhou;Xiaohua Li;Ying Chen;Sanjeev T. Chandrasekaran;Arindam Sanyal;,Binghamton University;Harbin Institute of Technology;University at Buffalo;,United States;China;,Technical,https://aaai.org/papers/11143-temporal-coded-deep-spiking-neural-network-with-easy-training-and-robust-performance/,https://cdn.aaai.org/ojs/17329/17329-13-20823-1-2-20210518.pdf
1223,The Sample Complexity of Teaching by Reinforcement on Q-Learning,Machine Learning V,Xuezhou Zhang;Shubham Bharti;Yuzhe Ma;Adish Singla;Xiaojin Zhu;,University of Wisconsin-Madison;Max Planck Institute for Software Systems;,United States;Germany;,Technical,https://aaai.org/papers/10939-the-sample-complexity-of-teaching-by-reinforcement-on-q-learning/,https://cdn.aaai.org/ojs/17306/17306-13-20800-1-2-20210518.pdf
1224,Toward Understanding the Influence of Individual Clients in Federated Learning,Machine Learning V,Yihao Xue;Chaoyue Niu;Zhenzhe Zheng;Shaojie Tang;Chengfei Lyu;Fan Wu;Guihai Chen;,Shanghai Jiao Tong University;University of Texas at Dallas;Alibaba Group;,China;United States;,Technical,https://aaai.org/papers/10560-toward-understanding-the-influence-of-individual-clients-in-federated-learning/,https://cdn.aaai.org/ojs/17263/17263-13-20757-1-2-20210518.pdf
1225,Towards Enabling Learnware to Handle Unseen Jobs,Machine Learning V,Yu-Jie Zhang;Yu-Hu Yan;Peng Zhao;Zhi-Hua Zhou;,Nanjing University;,China;,Technical,https://aaai.org/papers/10964-towards-enabling-learnware-to-handle-unseen-jobs/,https://cdn.aaai.org/ojs/17309/17309-13-20803-1-2-20210518.pdf
1226,Towards Feature Space Adversarial Attack by Style Perturbation,Machine Learning V,Qiuling Xu;Guanhong Tao;Siyuan Cheng;Xiangyu Zhang;,Purdue University;,United States;,Technical,https://aaai.org/papers/10523-towards-feature-space-adversarial-attack-by-style-perturbation/,https://cdn.aaai.org/ojs/17259/17259-13-20753-1-2-20210518.pdf
1227,Towards Generalized Implementation of Wasserstein Distance in GANs,Machine Learning V,Minkai Xu;,University of Montreal;Shanghai Jiao Tong University;,Canada;China;,Technical,https://aaai.org/papers/10514-towards-generalized-implementation-of-wasserstein-distance-in-gans/,https://cdn.aaai.org/ojs/17258/17258-13-20752-1-2-20210518.pdf
1228,Training Spiking Neural Networks with Accumulated Spiking Flow,Machine Learning V,Hao Wu;Yueyi Zhang;Wenming Weng;Yongting Zhang;Zhiwei Xiong;Zheng-Jun Zha;Xiaoyan Sun;Feng Wu;,University of Science and Technology of China;National Engineering Laboratory for Brain-inspired Intelligence Technology and Application;,China;,Technical,https://aaai.org/papers/10320-training-spiking-neural-networks-with-accumulated-spiking-flow/,https://cdn.aaai.org/ojs/17236/17236-13-20730-1-2-20210518.pdf
1229,Treatment Effect Estimation with Disentangled Latent Factors,Machine Learning V,Weijia Zhang;Lin Liu;Jiuyong Li;,University of South Australia;,Australia;,Technical,https://aaai.org/papers/10923-treatment-effect-estimation-with-disentangled-latent-factors/,https://cdn.aaai.org/ojs/17304/17304-13-20798-1-2-20210518.pdf
1230,Tri-level Robust Clustering Ensemble with Multiple Graph Learning,Machine Learning V,Peng Zhou;Liang Du;Yi-Dong Shen;Xuejun Li;,Anhui University;Chinese Academy of Sciences;Shanxi University;,China;,Technical,https://aaai.org/papers/11125-tri-level-robust-clustering-ensemble-with-multiple-graph-learning/,https://cdn.aaai.org/ojs/17327/17327-13-20821-1-2-20210518.pdf
1231,Variational Disentanglement for Rare Event Modeling,Machine Learning V,Zidi Xiu;Chenyang Tao;Michael Gao;Connor Davis;Benjamin A. Goldstein;Ricardo Henao;,Duke University;,United States;,Technical,https://aaai.org/papers/10469-variational-disentanglement-for-rare-event-modeling/,https://cdn.aaai.org/ojs/17253/17253-13-20747-1-2-20210518.pdf
1232,Variational Fair Clustering,Machine Learning V,Imtiaz Masud Ziko;Jing Yuan;Eric Granger;Ismail Ben Ayed;,École de technologie supérieure;Xidian University;,Canada;China;,Technical,https://aaai.org/papers/11202-variational-fair-clustering/,https://cdn.aaai.org/ojs/17336/17336-13-20830-1-2-20210518.pdf
1233,WCSAC: Worst-Case Soft Actor Critic for Safety-Constrained Reinforcement Learning,Machine Learning V,Qisong Yang;Thiago D. Simão;Simon H Tindemans;Matthijs  T. J. Spaan;,Delft University of Technology;,Netherlands;,Technical,https://aaai.org/papers/10639-wcsac-worst-case-soft-actor-critic-for-safety-constrained-reinforcement-learning/,https://cdn.aaai.org/ojs/17272/17272-13-20766-1-2-20210518.pdf
1234,Anytime Heuristic and Monte Carlo Methods for Large-Scale Simultaneous Coalition Structure Generation and Assignment,Multiagent Systems,Fredrik Präntare;Herman Appelgren;Fredrik Heintz;,Linköping University;,Sweden;,Technical,https://aaai.org/papers/11317-anytime-heuristic-and-monte-carlo-methods-for-large-scale-simultaneous-coalition-structure-generation-and-assignment/,https://cdn.aaai.org/ojs/17349/17349-13-20843-1-2-20210518.pdf
1235,Contract-based Inter-user Usage Coordination in Free-floating Car Sharing,Multiagent Systems,Kentaro Takahira;Shigeo Matsubara;,Kyoto University;Osaka University;,Japan;,Technical,https://aaai.org/papers/11361-contract-based-inter-user-usage-coordination-in-free-floating-car-sharing/,https://cdn.aaai.org/ojs/17354/17354-13-20848-1-2-20210518.pdf
1236,Coordination Between Individual Agents in Multi-Agent Reinforcement Learning,Multiagent Systems,Yang Zhang;Qingyu Yang;Dou An;Chengwei Zhang;,Xi'an Jiao Tong University;Dalian Maritime University;,China;,Technical,https://aaai.org/papers/11387-coordination-between-individual-agents-in-multi-agent-reinforcement-learning/,https://cdn.aaai.org/ojs/17357/17357-13-20851-1-2-20210518.pdf
1237,Dec-SGTS: Decentralized Sub-Goal Tree Search for Multi-Agent Coordination,Multiagent Systems,Minglong Li;Zhongxuan Cai;Wenjing Yang;Lixia Wu;Yinghui Xu;Ji Wang;,"National University of Defense Technology;Zhejiang Cainiao Supply Chain Management Co., Ltd.;",China;,Technical,https://aaai.org/papers/11282-dec-sgts-decentralized-sub-goal-tree-search-for-multi-agent-coordination/,https://cdn.aaai.org/ojs/17345/17345-13-20839-1-2-20210518.pdf
1238,Efficient Querying for Cooperative Probabilistic Commitments,Multiagent Systems,Qi Zhang;Edmund H. Durfee;Satinder Singh;,University of South Carolina;University of Michigan;,United States;,Technical,https://aaai.org/papers/11378-efficient-querying-for-cooperative-probabilistic-commitments/,https://cdn.aaai.org/ojs/17356/17356-13-20850-1-2-20210518.pdf
1239,Evolutionary Game Theory Squared: Evolving Agents in Endogenously Evolving Zero-Sum Games,Multiagent Systems,Stratis Skoulakis;Tanner Fiez;Ryann Sim;Georgios Piliouras;Lillian Ratliff;,Singapore University of Technology and Design;University of Washington;,Singapore;United States;,Technical,https://aaai.org/papers/11343-evolutionary-game-theory-squared-evolving-agents-in-endogenously-evolving-zero-sum-games/,https://cdn.aaai.org/ojs/17352/17352-13-20846-1-2-20210518.pdf
1240,Expected Value of Communication for Planning in Ad Hoc Teamwork,Multiagent Systems,William Macke;Reuth Mirsky;Peter Stone;,University of Texas at Austin;Sony;,United States;Japan;,Technical,https://aaai.org/papers/11290-expected-value-of-communication-for-planning-in-ad-hoc-teamwork/,https://cdn.aaai.org/ojs/17346/17346-13-20840-1-2-20210518.pdf
1241,Exploration-Exploitation in Multi-Agent Learning: Catastrophe Theory Meets Game Theory,Multiagent Systems,Stefanos Leonardos;Georgios Piliouras;,Singapore University of Technology and Design;,Singapore;,Technical,https://aaai.org/papers/11263-exploration-exploitation-in-multi-agent-learning-catastrophe-theory-meets-game-theory/,https://cdn.aaai.org/ojs/17343/17343-13-20837-1-2-20210518.pdf
1242,Improving Continuous-time Conflict Based Search,Multiagent Systems,Anton Andreychuk;Konstantin Yakovlev;Eli Boyarski;Roni Stern;,Peoples’ Friendship University of Russia;Russian Academy of Sciences;Higher School of Economics;Ben-Gurion University of the Negev;Palo Alto Research Center;,Russian Federation;Israel;United States;,Technical,https://aaai.org/papers/11220-improving-continuous-time-conflict-based-search/,https://cdn.aaai.org/ojs/17338/17338-13-20832-1-2-20210518.pdf
1243,Inference-Based Deterministic Messaging For Multi-Agent Communication,Multiagent Systems,Varun Bhatt;Michael Buro;,University of Alberta;,Canada;,Technical,https://aaai.org/papers/11228-inference-based-deterministic-messaging-for-multi-agent-communication/,https://cdn.aaai.org/ojs/17339/17339-13-20833-1-2-20210518.pdf
1244,Learning to Resolve Conflicts for Multi-Agent Path Finding with Conflict-Based Search,Multiagent Systems,Taoan Huang;Sven Koenig;Bistra Dilkina;,University of Southern California;,United States;,Technical,https://aaai.org/papers/11246-learning-to-resolve-conflicts-for-multi-agent-path-finding-with-conflict-based-search/,https://cdn.aaai.org/ojs/17341/17341-13-20835-1-2-20210518.pdf
1245,Lifelong Multi-Agent Path Finding in Large-Scale Warehouses,Multiagent Systems,Jiaoyang Li;Andrew Tinka;Scott Kiesel;Joseph W. Durham;T. K. Satish Kumar;Sven Koenig;,University of Southern California;Amazon;,United States;,Technical,https://aaai.org/papers/11272-lifelong-multi-agent-path-finding-in-large-scale-warehouses/,https://cdn.aaai.org/ojs/17344/17344-13-20838-1-2-20210518.pdf
1246,Maintenance of Social Commitments in Multiagent Systems,Multiagent Systems,Pankaj Telang;Munindar P. Singh;Neil Yorke-Smith;,SAS Institute;North Carolina State University;Delft University of Technology;,United States;Netherlands;,Technical,https://aaai.org/papers/11369-maintenance-of-social-commitments-in-multiagent-systems/,https://cdn.aaai.org/ojs/17355/17355-13-20849-1-2-20210518.pdf
1247,Newton Optimization on Helmholtz Decomposition for Continuous Games,Multiagent Systems,Giorgia Ramponi;Marcello Restelli;,Politecnico di Milano;,Italy;,Technical,https://aaai.org/papers/11325-newton-optimization-on-helmholtz-decomposition-for-continuous-games/,https://cdn.aaai.org/ojs/17350/17350-13-20844-1-2-20210518.pdf
1248,Resilient Multi-Agent Reinforcement Learning with Adversarial Value Decomposition,Multiagent Systems,Thomy Phan;Lenz Belzner;Thomas Gabor;Andreas Sedlmeier;Fabian Ritz;Claudia Linnhoff-Popien;,Ludwig Maximilian University of Munich;MaibornWolff;,Germany;,Technical,https://aaai.org/papers/11308-resilient-multi-agent-reinforcement-learning-with-adversarial-value-decomposition/,https://cdn.aaai.org/ojs/17348/17348-13-20842-1-2-20210518.pdf
1249,Scalable and Safe Multi-Agent Motion Planning with Nonlinear Dynamics and Bounded Disturbances,Multiagent Systems,Jingkai Chen;Jiaoyang Li;Chuchu Fan;Brian C. Williams;,Massachusetts Institute of Technology;University of Southern California;Monash University;,United States;Australia;,Technical,https://aaai.org/papers/11237-scalable-and-safe-multi-agent-motion-planning-with-nonlinear-dynamics-and-bounded-disturbances/,https://cdn.aaai.org/ojs/17340/17340-13-20834-1-2-20210518.pdf
1250,Synchronous Dynamical Systems on Directed Acyclic Graphs: Complexity and Algorithms,Multiagent Systems,Daniel J. Rosenkrantz;Madhav Marathe;S. S. Ravi;Richard E. Stearns;,University of Virginia;University at Albany – SUNY;,United States;,Technical,https://aaai.org/papers/11334-synchronous-dynamical-systems-on-directed-acyclic-graphs-complexity-and-algorithms/,https://cdn.aaai.org/ojs/17351/17351-13-20845-1-2-20210518.pdf
1251,The Influence of Memory in Multi-Agent Consensus,Multiagent Systems,David Kohan Marzagão;Luciana Basualdo Bonatto;Tiago Madeira;Marcelo Matheus Gauy;Peter McBurney;,King's College London;University of Oxford;University of São Paulo;,United Kingdom;Brazil;,Technical,https://aaai.org/papers/11254-the-influence-of-memory-in-multi-agent-consensus/,https://cdn.aaai.org/ojs/17342/17342-13-20836-1-2-20210518.pdf
1252,Time-Independent Planning for Multiple Moving Agents,Multiagent Systems,Keisuke Okumura;Yasumasa Tamura;Xavier Défago;,Tokyo Institute of Technology;,Japan;,Technical,https://aaai.org/papers/11299-time-independent-planning-for-multiple-moving-agents/,https://cdn.aaai.org/ojs/17347/17347-13-20841-1-2-20210518.pdf
1253,Value-Decomposition Multi-Agent Actor-Critics,Multiagent Systems,Jianyu Su;Stephen Adams;Peter Beling;,University of Virginia;,United States;,Technical,https://aaai.org/papers/11352-value-decomposition-multi-agent-actor-critics/,https://cdn.aaai.org/ojs/17353/17353-13-20847-1-2-20210518.pdf
1254,A Unified Taylor Framework for Revisiting Attribution Methods,Philosophy and Ethics of AI,Huiqi Deng;Na Zou;Mengnan Du;Weifu Chen;Guocan Feng;Xia Hu;,Sun Yat-sen University;Texas A&M University;,China;United States;,Technical,https://aaai.org/papers/11462-a-unified-taylor-framework-for-revisiting-attribution-methods/,https://cdn.aaai.org/ojs/17365/17365-13-20859-1-2-20210518.pdf
1255,Agent Incentives: A Causal Perspective,Philosophy and Ethics of AI,Tom Everitt;Ryan Carey;Eric D. Langlois;Pedro A. Ortega;Shane Legg;,DeepMind;University of Oxford;University of Toronto;Vector Institute;,United Kingdom;Canada;,Technical,https://aaai.org/papers/11487-agent-incentives-a-causal-perspective/,https://cdn.aaai.org/ojs/17368/17368-13-20862-1-2-20210518.pdf
1256,Amnesiac Machine Learning,Philosophy and Ethics of AI,Laura Graves;Vineel Nagisetty;Vijay Ganesh;,University of Waterloo;,Canada;,Technical,https://aaai.org/papers/11516-amnesiac-machine-learning/,https://cdn.aaai.org/ojs/17371/17371-13-20865-1-2-20210518.pdf
1257,Bayes-TrEx: a Bayesian Sampling Approach to Model Transparency by Example,Philosophy and Ethics of AI,Serena Booth;Yilun Zhou;Ankit Shah;Julie Shah;,Massachusetts Institute of Technology;,United States;,Technical,https://aaai.org/papers/11423-bayes-trex-a-bayesian-sampling-approach-to-model-transparency-by-example/,https://cdn.aaai.org/ojs/17361/17361-13-20855-1-2-20210518.pdf
1258,Beyond Class-Conditional Assumption: A Primary Attempt to Combat Instance-Dependent Label Noise,Philosophy and Ethics of AI,Pengfei Chen;Junjie Ye;Guangyong Chen;Jingwei Zhao;Pheng-Ann Heng;,Chinese University of Hong Kong;vivo AI Lab;Shenzhen Institute of Advanced Technology;,China;;,Technical,https://aaai.org/papers/11442-beyond-class-conditional-assumption-a-primary-attempt-to-combat-instance-dependent-label-noise/,https://cdn.aaai.org/ojs/17363/17363-13-20857-1-2-20210518.pdf
1259,Comprehension and Knowledge,Philosophy and Ethics of AI,Pavel Naumov;Kevin Ros;,King's College;University of Illinois Urbana-Champaign;,United Kingdom;United States;,Technical,https://aaai.org/papers/11622-comprehension-and-knowledge/,https://cdn.aaai.org/ojs/17382/17382-13-20876-1-2-20210518.pdf
1260,Decision-Guided Weighted Automata Extraction from Recurrent Neural Networks,Philosophy and Ethics of AI,Xiyue Zhang;Xiaoning Du;Xiaofei Xie;Lei Ma;Yang Liu;Meng Sun;,"Peking University;Monash University;Nanyang Technological University;Hangzhou Xinzhou Network Technology Co., Ltd.;Kyushu University;",China;Australia;Singapore;Japan;,Technical,https://aaai.org/papers/11699-decision-guided-weighted-automata-extraction-from-recurrent-neural-networks/,https://cdn.aaai.org/ojs/17391/17391-13-20885-1-2-20210518.pdf
1261,Differentially Private Clustering via Maximum Coverage,Philosophy and Ethics of AI,Matthew Jones;Huy L. Nguyen;Thy D Nguyen;,Northeastern University;,United States;,Technical,https://aaai.org/papers/11555-differentially-private-clustering-via-maximum-coverage/,https://cdn.aaai.org/ojs/17375/17375-13-20869-1-2-20210518.pdf
1262,Epistemic Logic of Know-Who,Philosophy and Ethics of AI,Sophia Epstein;Pavel Naumov;,Claremont McKenna College;King's College;,United States;United Kingdom;,Technical,https://aaai.org/papers/11479-epistemic-logic-of-know-who/,https://cdn.aaai.org/ojs/17367/17367-13-20861-1-2-20210518.pdf
1263,Ethical Dilemmas in Strategic Games,Philosophy and Ethics of AI,Pavel Naumov;Rui-Jie Yew;,King's College;Scripps College;,United States;,Technical,https://aaai.org/papers/11613-ethical-dilemmas-in-strategic-games/,https://cdn.aaai.org/ojs/17381/17381-13-20875-1-2-20210518.pdf
1264,Ethically Compliant Sequential Decision Making,Philosophy and Ethics of AI,Justin Svegliato;Samer B. Nashed;Shlomo Zilberstein;,University of Massachusetts Amherst;,United States;,Technical,https://aaai.org/papers/11657-ethically-compliant-sequential-decision-making/,https://cdn.aaai.org/ojs/17386/17386-13-20880-1-2-20210518.pdf
1265,Explaining A Black-box By Using A Deep Variational Information Bottleneck Approach,Philosophy and Ethics of AI,Seojin Bang;Pengtao Xie;Heewook Lee;Wei Wu;Eric Xing;,"Carnegie Mellon University;Petuum Inc.;University of California, San Diego;Arizona State University;",United States;,Technical,https://aaai.org/papers/11396-explaining-a-black-box-by-using-a-deep-variational-information-bottleneck-approach/,https://cdn.aaai.org/ojs/17358/17358-13-20852-1-2-20210518.pdf
1266,Explaining Convolutional Neural Networks through Attribution-Based Input Sampling and Block-Wise Feature Aggregation,Philosophy and Ethics of AI,Sam Sattarzadeh;Mahesh Sudhakar;Anthony Lem;Shervin Mehryar;Konstantinos N Plataniotis;Jongseong Jang;Hyunwoo Kim;Yeonjeong Jeong;Sangmin Lee;Kyunghoon Bae;,University of Toronto;LG;,Canada;South Korea;,Technical,https://aaai.org/papers/11639-explaining-convolutional-neural-networks-through-attribution-based-input-sampling-and-block-wise-feature-aggregation/,https://cdn.aaai.org/ojs/17384/17384-13-20878-1-2-20210518.pdf
1267,Exploring the Vulnerability of Deep Neural Networks: A Study of Parameter Corruption,Philosophy and Ethics of AI,Xu Sun;Zhiyuan Zhang;Xuancheng Ren;Ruixuan Luo;Liangyou Li;,Peking University;Huawei;,China;,Technical,https://aaai.org/papers/11648-exploring-the-vulnerability-of-deep-neural-networks-a-study-of-parameter-corruption/,https://cdn.aaai.org/ojs/17385/17385-13-20879-1-2-20210518.pdf
1268,Fair Influence Maximization: a Welfare Optimization Approach,Philosophy and Ethics of AI,Aida Rahmattalabi;Shahin Jabbari;Himabindu Lakkaraju;Phebe Vayanos;Max Izenberg;Ryan Brown;Eric Rice;Milind Tambe;,University of Southern California;Harvard University;RAND Corporation;,United States;,Technical,https://aaai.org/papers/11630-fair-influence-maximization-a-welfare-optimization-approach/,https://cdn.aaai.org/ojs/17383/17383-13-20877-1-2-20210518.pdf
1269,Fair Representations by Compression,Philosophy and Ethics of AI,Xavier Gitiaux;Huzefa Rangwala;,George Mason University;,United States;,Technical,https://aaai.org/papers/11506-fair-representations-by-compression/,https://cdn.aaai.org/ojs/17370/17370-13-20864-1-2-20210518.pdf
1270,FIMAP: Feature Importance by Minimal Adversarial Perturbation,Philosophy and Ethics of AI,Matt Chapman-Rounds;Umang Bhatt;Erik Pazos;Marc-Andre Schulz;Konstantinos Georgatzis;,University of Edinburgh;University of Cambridge;QuantumBlack;Charité–Universitätsmedizin Berlin;,United Kingdom;Germany;,Technical,https://aaai.org/papers/11433-fimap-feature-importance-by-minimal-adversarial-perturbation/,https://cdn.aaai.org/ojs/17362/17362-13-20856-1-2-20210518.pdf
1271,How RL Agents Behave When Their Actions Are Modified,Philosophy and Ethics of AI,Eric D. Langlois;Tom Everitt;,DeepMind;University of Toronto;Vector Institute;,United Kingdom;Canada;,Technical,https://aaai.org/papers/11586-how-rl-agents-behave-when-their-actions-are-modified/,https://cdn.aaai.org/ojs/17378/17378-13-20872-1-2-20210518.pdf
1272,i-Algebra: Towards Interactive Interpretability of Deep Neural Networks,Philosophy and Ethics of AI,Xinyang Zhang;Ren Pang;Shouling Ji;Fenglong Ma;Ting Wang;,Pennsylvania State University;Zhejiang University;,United States;China;,Technical,https://aaai.org/papers/11691-i-algebra-towards-interactive-interpretability-of-deep-neural-networks/,https://cdn.aaai.org/ojs/17390/17390-13-20884-1-2-20210518.pdf
1273,Improving Robustness to Model Inversion Attacks via Mutual Information Regularization,Philosophy and Ethics of AI,Tianhao Wang;Yuheng Zhang;Ruoxi Jia;,Harvard University;University of Illinois Urbana-Champaign;Virginia Tech;,United States;,Technical,https://aaai.org/papers/11666-improving-robustness-to-model-inversion-attacks-via-mutual-information-regularization/,https://cdn.aaai.org/ojs/17387/17387-13-20881-1-2-20210518.pdf
1274,Individual Fairness in Kidney Exchange Programs,Philosophy and Ethics of AI,Golnoosh Farnadi;William St-Arnaud;Behrouz Babaki;Margarida Carvalho;,Universit é de Montréal;HEC Montréal;Mila;Polytechnique Montréal;,Canada;,Technical,https://aaai.org/papers/11496-individual-fairness-in-kidney-exchange-programs/,https://cdn.aaai.org/ojs/17369/17369-13-20863-1-2-20210518.pdf
1275,Interpreting Deep Neural Networks with Relative Sectional Propagation by Analyzing Comparative Gradients and Hostile Activations,Philosophy and Ethics of AI,Woo-Jeoung Nam;Jaesik Choi;Seong-Whan Lee;,Korea University;KAIST;,South Korea;,Technical,https://aaai.org/papers/11604-interpreting-deep-neural-networks-with-relative-sectional-propagation-by-analyzing-comparative-gradients-and-hostile-activations/,https://cdn.aaai.org/ojs/17380/17380-13-20874-1-2-20210518.pdf
1276,Invertible Concept-based Explanations for CNN Models with Non-negative Concept Activation Vectors,Philosophy and Ethics of AI,Ruihan Zhang;Prashan Madumal;Tim Miller;Krista A. Ehinger;Benjamin I. P. Rubinstein;,University of Melbourne;,Australia;,Technical,https://aaai.org/papers/11682-invertible-concept-based-explanations-for-cnn-models-with-non-negative-concept-activation-vectors/,https://cdn.aaai.org/ojs/17389/17389-13-20883-1-2-20210518.pdf
1277,Is the Most Accurate AI the Best Teammate? Optimizing AI for Teamwork,Philosophy and Ethics of AI,Gagan Bansal;Besmira Nushi;Ece Kamar;Eric Horvitz;Daniel S. Weld;,University of Washington;Microsoft;Allen Institute for AI;,United States;,Technical,https://aaai.org/papers/11405-is-the-most-accurate-ai-the-best-teammate-optimizing-ai-for-teamwork/,https://cdn.aaai.org/ojs/17359/17359-13-20853-1-2-20210518.pdf
1278,On Generating Plausible Counterfactual and Semi-Factual Explanations for Deep Learning,Philosophy and Ethics of AI,Eoin M. Kenny;Mark T Keane;,University College Dublin;VistaMilk SFI Research Centre;,Ireland;,Technical,https://aaai.org/papers/11575-on-generating-plausible-counterfactual-and-semi-factual-explanations-for-deep-learning/,https://cdn.aaai.org/ojs/17377/17377-13-20871-1-2-20210518.pdf
1279,On the Verification of Neural ODEs with Stochastic Guarantees,Philosophy and Ethics of AI,Sophie Grunbacher;Ramin Hasani;Mathias Lechner;Jacek Cyranka;Scott A. Smolka;Radu Grosu;,Technische Universität Wien;Massachusetts Institute of Technology;Institute of Science and Technology Austria;University of Warsaw;Stony Brook University;,Austria;United States;Poland;,Technical,https://aaai.org/papers/11525-on-the-verification-of-neural-odes-with-stochastic-guarantees/,https://cdn.aaai.org/ojs/17372/17372-13-20866-1-2-20210518.pdf
1280,Ordered Counterfactual Explanation by Mixed-Integer Linear Optimization,Philosophy and Ethics of AI,Kentaro Kanamori;Takuya Takagi;Ken Kobayashi;Yuichi Ike;Kento Uemura;Hiroki Arimura;,Hokkaido University;Fujitsu Laboratories;Tokyo Institute of Technology;,Japan;,Technical,https://aaai.org/papers/11564-ordered-counterfactual-explanation-by-mixed-integer-linear-optimization/,https://cdn.aaai.org/ojs/17376/17376-13-20870-1-2-20210518.pdf
1281,Outlier Impact Characterization for Time Series Data,Philosophy and Ethics of AI,Jianbo Li;Lecheng Zheng;Yada Zhu;Jingrui He;,Three Bridges Capital;University of Illinois Urbana-Champaign;IBM;,United States;,Technical,https://aaai.org/papers/11595-outlier-impact-characterization-for-time-series-data/,https://cdn.aaai.org/ojs/17379/17379-13-20873-1-2-20210518.pdf
1282,PenDer: Incorporating Shape Constraints via Penalized Derivatives,Philosophy and Ethics of AI,Akhil Gupta;Lavanya Marla;Ruoyu Sun;Naman Shukla;Arinbjörn Kolbeinsson;,University of Illinois Urbana-Champaign;Deepair LLC;Imperial College London;,United States;United Kingdom;,Technical,https://aaai.org/papers/11536-pender-incorporating-shape-constraints-via-penalized-derivatives/,https://cdn.aaai.org/ojs/17373/17373-13-20867-1-2-20210518.pdf
1283,Robustness of Accuracy Metric and its Inspirations in Learning with Noisy Labels,Philosophy and Ethics of AI,Pengfei Chen;Junjie Ye;Guangyong Chen;Jingwei Zhao;Pheng-Ann Heng;,Chinese University of Hong Kong;vivo AI Lab;Shenzhen Institute of Advanced Technology;,China;;,Technical,https://aaai.org/papers/11451-robustness-of-accuracy-metric-and-its-inspirations-in-learning-with-noisy-labels/,https://cdn.aaai.org/ojs/17364/17364-13-20858-1-2-20210518.pdf
1284,Tightening Robustness Verification of Convolutional Neural Networks with Fine-Grained Linear Approximation,Philosophy and Ethics of AI,Yiting Wu;Min Zhang;,East China Normal University;Tongji University;,China;,Technical,https://aaai.org/papers/11674-tightening-robustness-verification-of-convolutional-neural-networks-with-fine-grained-linear-approximation/,https://cdn.aaai.org/ojs/17388/17388-13-20882-1-2-20210518.pdf
1285,TripleTree: A Versatile Interpretable Representation of Black Box Agents and their Environments,Philosophy and Ethics of AI,Tom Bewley;Jonathan Lawry;,University of Bristol;,United Kingdom;,Technical,https://aaai.org/papers/11415-tripletree-a-versatile-interpretable-representation-of-black-box-agents-and-their-environments/,https://cdn.aaai.org/ojs/17360/17360-13-20854-1-2-20210518.pdf
