Index,Title,Session/Area,Authors,Affiliation,Country,Status,Proceeding URL,PDF URL
758,High-Confidence Off-Policy (or Counterfactual) Variance Estimation,Machine Learning I,Yash Chandak;Shiv Shankar;Philip S. Thomas;,University of Massachusetts;,United States;,Technical,https://aaai.org/papers/06939-high-confidence-off-policy-or-counterfactual-variance-estimation/,https://cdn.aaai.org/ojs/16855/16855-13-20349-1-2-20210518.pdf
759,HyDRA: Hypergradient Data Relevance Analysis for Interpreting Deep Neural Networks,Machine Learning I,Yuanyuan Chen;Boyang Li;Han Yu;Pengcheng Wu;Chunyan Miao;,Nanyang Technological University;Alibaba-NTU Singapore Joint Research Institute;,Singapore;,Technical,https://aaai.org/papers/07081-hydra-hypergradient-data-relevance-analysis-for-interpreting-deep-neural-networks/,https://cdn.aaai.org/ojs/16871/16871-13-20365-1-2-20210518.pdf
760,Improved Worst-Case Regret Bounds for Randomized Least-Squares Value Iteration,Machine Learning I,Priyank Agrawal;Jinglin Chen;Nan Jiang;,University of Illinois Urbana-Champaign;,United States;,Technical,https://aaai.org/papers/06566-improved-worst-case-regret-bounds-for-randomized-least-squares-value-iteration/,https://cdn.aaai.org/ojs/16813/16813-13-20307-1-2-20210518.pdf
761,Improving Ensemble Robustness by Collaboratively Promoting and Demoting Adversarial Robustness,Machine Learning I,Anh Tuan Bui;Trung Le;He Zhao;Paul Montague;Olivier deVel;Tamas Abraham;Dinh Phung;,Monash University;Defence Science and Technology Group;,Australia;,Technical,https://aaai.org/papers/06831-improving-ensemble-robustness-by-collaboratively-promoting-and-demoting-adversarial-robustness/,https://cdn.aaai.org/ojs/16843/16843-13-20337-1-2-20210518.pdf
762,Knowledge Refactoring for Inductive Program Synthesis,Machine Learning I,Sebastijan Dumancic;Tias Guns;Andrew Cropper;,KU Leuven;Oxford University;,Belgium;United Kingdom;,Technical,https://aaai.org/papers/07271-knowledge-refactoring-for-inductive-program-synthesis/,https://cdn.aaai.org/ojs/16893/16893-13-20387-1-2-20210518.pdf
763,Knowledge Refinery: Learning from Decoupled Label,Machine Learning I,Qianggang Ding;Sifan Wu;Tao Dai;Hao Sun;Jiadong Guo;Zhang-Hua Fu;Shutao Xia;,Tsinghua University;Pengcheng Laboratory;Chinese University of Hong Kong;Hong Kong University of Science and Technology;International Digital Economy Academy;Shenzhen Institute of Artificial Intelligence and Robotics for Society;,China;;,Technical,https://aaai.org/papers/07228-knowledge-refinery-learning-from-decoupled-label/,https://cdn.aaai.org/ojs/16888/16888-13-20382-1-2-20210518.pdf
764,Learned Bi-Resolution Image Coding using Generalized Octave Convolutions,Machine Learning I,Mohammad Akbari;Jie Liang;Jingning Han;Chengjie Tu;,Simon Fraser University;Google;Tencent;,Canada;United States;China;,Technical,https://aaai.org/papers/06592-learned-bi-resolution-image-coding-using-generalized-octave-convolutions/,https://cdn.aaai.org/ojs/16816/16816-13-20310-1-2-20210518.pdf
765,Learning a Gradient-free Riemannian Optimizer on Tangent Spaces,Machine Learning I,Xiaomeng Fan;Zhi Gao;Yuwei Wu;Yunde Jia;Mehrtash Harandi;,Beijing Institute of Technology;Monash University;,China;Australia;,Technical,https://aaai.org/papers/07377-learning-a-gradient-free-riemannian-optimizer-on-tangent-spaces/,https://cdn.aaai.org/ojs/16905/16905-13-20399-1-2-20210518.pdf
766,Learning Invariant Representations using Inverse  Contrastive Loss,Machine Learning I,Aditya Kumar Akash;Vishnu  Suresh Lokhande;Sathya N. Ravi;Vikas Singh;,University of Wisconsin-Madison;University of Illinois at Chicago;,United States;,Technical,https://aaai.org/papers/06582-learning-invariant-representations-using-inverse-contrastive-loss/,https://cdn.aaai.org/ojs/16815/16815-13-20309-1-2-20210518.pdf
767,Learning Prediction Intervals for Model Performance,Machine Learning I,Benjamin Elder;Matthew Arnold;Anupama Murthi;Jiří Navrátil;,IBM;,United States;,Technical,https://aaai.org/papers/07305-learning-prediction-intervals-for-model-performance/,https://cdn.aaai.org/ojs/16897/16897-13-20391-1-2-20210518.pdf
768,Learning to Augment for Data-scarce Domain BERT Knowledge Distillation,Machine Learning I,Lingyun Feng;Minghui Qiu;Yaliang Li;Hai-Tao Zheng;Ying Shen;,Tsinghua University;Alibaba Group;Sun Yat-sen University;,China;,Technical,https://aaai.org/papers/07422-learning-to-augment-for-data-scarce-domain-bert-knowledge-distillation/,https://cdn.aaai.org/ojs/16910/16910-13-20404-1-2-20210518.pdf
769,Learning to Cascade: Confidence Calibration for Improving the Accuracy and Computational Cost of Cascade Inference Systems,Machine Learning I,Shohei Enomoro;Takeharu Eda;,NTT Software Innovation Center;,Japan;,Technical,https://aaai.org/papers/07331-learning-to-cascade-confidence-calibration-for-improving-the-accuracy-and-computational-cost-of-cascade-inference-systems/,https://cdn.aaai.org/ojs/16900/16900-13-20394-1-2-20210518.pdf
770,Learning to Reweight with Deep Interactions,Machine Learning I,Yang Fan;Yingce Xia;Lijun Wu;Shufang Xie;Weiqing Liu;Jiang Bian;Tao Qin;Xiang-Yang Li;,University of Science and Technology of China;Microsoft;,China;,Technical,https://aaai.org/papers/07385-learning-to-reweight-with-deep-interactions/,https://cdn.aaai.org/ojs/16906/16906-13-20400-1-2-20210518.pdf
771,Learning with Retrospection,Machine Learning I,Xiang Deng;Zhongfei Zhang;,State University of New York at Binghamton;,United States;,Technical,https://aaai.org/papers/07201-learning-with-retrospection/,https://cdn.aaai.org/ojs/16885/16885-13-20379-1-2-20210518.pdf
772,Loop Estimator for Discounted Values in Markov Reward Processes,Machine Learning I,Falcon Z. Dai;Matthew R. Walter;,Toyota Technological Institute at Chicago;,United States;,Technical,https://aaai.org/papers/07169-loop-estimator-for-discounted-values-in-markov-reward-processes/,https://cdn.aaai.org/ojs/16881/16881-13-20375-1-2-20210518.pdf
773,Mercer Features for Efficient Combinatorial Bayesian Optimization,Machine Learning I,Aryan Deshwal;Syrine Belakaria;Janardhan Rao Doppa;,Washington State University;,United States;,Technical,https://aaai.org/papers/07210-mercer-features-for-efficient-combinatorial-bayesian-optimization/,https://cdn.aaai.org/ojs/16886/16886-13-20380-1-2-20210518.pdf
774,NASGEM: Neural Architecture Search via Graph Embedding Method,Machine Learning I,Hsin-Pai Cheng;Tunhou Zhang;Yixing Zhang;Shiyu Li;Feng Liang;Feng Yan;Meng Li;Vikas Chandra;Hai Li;Yiran Chen;,Duke University;Tsinghua University;University of Nevada;Meta;,United States;China;,Technical,https://aaai.org/papers/07090-nasgem-neural-architecture-search-via-graph-embedding-method/,https://cdn.aaai.org/ojs/16872/16872-13-20366-1-2-20210518.pdf
775,Neighborhood Consensus Networks for Unsupervised Multi-view Outlier Detection,Machine Learning I,Li Cheng;Yijie Wang;Xinwang Liu;,National University of Defense Technology;,China;,Technical,https://aaai.org/papers/07099-neighborhood-consensus-networks-for-unsupervised-multi-view-outlier-detection/,https://cdn.aaai.org/ojs/16873/16873-13-20367-1-2-20210518.pdf
776,Neural Relational Inference with Efficient Message Passing Mechanisms,Machine Learning I,Siyuan Chen;Jiahai Wang;Guoqing Li;,Sun Yat-sen University;,China;,Technical,https://aaai.org/papers/07055-neural-relational-inference-with-efficient-message-passing-mechanisms/,https://cdn.aaai.org/ojs/16868/16868-13-20362-1-2-20210518.pdf
777,Noise Estimation Using Density Estimation for Self-Supervised Multimodal Learning,Machine Learning I,Elad Amrani;Rami Ben-Ari;Daniel Rotman;Alex Bronstein;,IBM;Technion - Israel Institute of Technology;,United States;Israel;,Technical,https://aaai.org/papers/06644-noise-estimation-using-density-estimation-for-self-supervised-multimodal-learning/,https://cdn.aaai.org/ojs/16822/16822-13-20316-1-2-20210518.pdf
778,On Lipschitz Regularization of Convolutional Layers using Toeplitz Matrix Theory,Machine Learning I,Alexandre Araujo;Benjamin Negrevergne;Yann Chevaleyre;Jamal Atif;,Université Paris-Dauphine;,France;,Technical,https://aaai.org/papers/06661-on-lipschitz-regularization-of-convolutional-layers-using-toeplitz-matrix-theory/,https://cdn.aaai.org/ojs/16824/16824-13-20318-1-2-20210518.pdf
779,On Online Optimization: Dynamic Regret Analysis of Strongly Convex and Smooth Problems,Machine Learning I,Ting-Jui Chang;Shahin Shahrampour;,Texas A&M University;,United States;,Technical,https://aaai.org/papers/06966-on-online-optimization-dynamic-regret-analysis-of-strongly-convex-and-smooth-problems/,https://cdn.aaai.org/ojs/16858/16858-13-20352-1-2-20210518.pdf
780,Open-Set Recognition with Gaussian Mixture Variational Autoencoders,Machine Learning I,Alexander Cao;Yuan Luo;Diego Klabjan;,Northwestern University;Department of Preventive Medicine;,United States;;,Technical,https://aaai.org/papers/06877-open-set-recognition-with-gaussian-mixture-variational-autoencoders/,https://cdn.aaai.org/ojs/16848/16848-13-20342-1-2-20210518.pdf
781,Ordinal Historical Dependence in Graphical Event Models with Tree Representations,Machine Learning I,Debarun Bhattacharjya;Tian Gao;Dharmashankar Subramanian;,IBM;,United States;,Technical,https://aaai.org/papers/06759-ordinal-historical-dependence-in-graphical-event-models-with-tree-representations/,https://cdn.aaai.org/ojs/16835/16835-13-20329-1-2-20210518.pdf
782,Practical and Rigorous Uncertainty Bounds for Gaussian Process Regression,Machine Learning I,Christian Fiedler;Carsten W. Scherer;Sebastian Trimpe;,Max Planck Institute for Intelligent Systems;University of Stuttgart;RWTH Aachen University;,Germany;,Technical,https://aaai.org/papers/07439-practical-and-rigorous-uncertainty-bounds-for-gaussian-process-regression/,https://cdn.aaai.org/ojs/16912/16912-13-20406-1-2-20210518.pdf
783,Projection-Free Bandit Optimization with Privacy Guarantees,Machine Learning I,Alina Ene;Huy L. Nguyen;Adrian Vladu;,Boston University;Northeastern University;Université de Paris;,United States;France;,Technical,https://aaai.org/papers/07322-projection-free-bandit-optimization-with-privacy-guarantees/,https://cdn.aaai.org/ojs/16899/16899-13-20393-1-2-20210518.pdf
784,Provable Benefits of Overparameterization in Model Compression: From Double Descent to Pruning Neural Networks,Machine Learning I,Xiangyu Chang;Yingcong Li;Samet Oymak;Christos Thrampoulidis;,"University of California, Riverside;University of British Columbia;",United States;Canada;,Technical,https://aaai.org/papers/06974-provable-benefits-of-overparameterization-in-model-compression-from-double-descent-to-pruning-neural-networks/,https://cdn.aaai.org/ojs/16859/16859-13-20353-1-2-20210518.pdf
785,Provably Secure Federated Learning against Malicious Clients,Machine Learning I,Xiaoyu Cao;Jinyuan Jia;Neil Zhenqiang Gong;,Duke University;,United States;,Technical,https://aaai.org/papers/06885-provably-secure-federated-learning-against-malicious-clients/,https://cdn.aaai.org/ojs/16849/16849-13-20343-1-2-20210518.pdf
786,Regret Bounds for Batched Bandits,Machine Learning I,Hossein Esfandiari;Amin Karbasi;Abbas Mehrabian;Vahab Mirrokni;,Google;Yale University;McGill University;,United States;Canada;,Technical,https://aaai.org/papers/07340-regret-bounds-for-batched-bandits/,https://cdn.aaai.org/ojs/16901/16901-13-20395-1-2-20210518.pdf
787,Reinforcement Learning with Trajectory Feedback,Machine Learning I,Yonathan Efroni;Nadav Merlis;Shie Mannor;,Israel Institute of Technology;NVIDIA;,Israel;,Technical,https://aaai.org/papers/07288-reinforcement-learning-with-trajectory-feedback/,https://cdn.aaai.org/ojs/16895/16895-13-20389-1-2-20210518.pdf
788,Relative Variational Intrinsic Control,Machine Learning I,Kate Baumli;David Warde-Farley;Steven Hansen;Volodymyr Mnih;,DeepMind;,United Kingdom;,Technical,https://aaai.org/papers/06732-relative-variational-intrinsic-control/,https://cdn.aaai.org/ojs/16832/16832-13-20326-1-2-20210518.pdf
789,Residual Shuffle-Exchange Networks for Fast Processing of Long Sequences,Machine Learning I,Andis Draguns;Emīls Ozoliņš;Agris Šostaks;Matīss Apinis;Karlis Freivalds;,University of Latvia;,Latvia;,Technical,https://aaai.org/papers/07245-residual-shuffle-exchange-networks-for-fast-processing-of-long-sequences/,https://cdn.aaai.org/ojs/16890/16890-13-20384-1-2-20210518.pdf
790,Robust Model Compression Using Deep Hypotheses,Machine Learning I,Omri Armstrong;Ran Gilad-Bachrach;,Tel Aviv University;,Israel;,Technical,https://aaai.org/papers/06688-robust-model-compression-using-deep-hypotheses/,https://cdn.aaai.org/ojs/16827/16827-13-20321-1-2-20210518.pdf
791,Sample-Efficient L0-L2 Constrained Structure Learning of Sparse Ising Models,Machine Learning I,Antoine Dedieu;Miguel Lázaro-Gredilla;Dileep George;,Vicarious AI;,United States;,Technical,https://aaai.org/papers/07193-sample-efficient-l0-l2-constrained-structure-learning-of-sparse-ising-models/,https://cdn.aaai.org/ojs/16884/16884-13-20378-1-2-20210518.pdf
792,Sample-Specific Output Constraints for Neural Networks,Machine Learning I,Mathis Brosowsky;Florian Keck;Olaf Dünkel;Marius Zöllner;,FZI Research Center for Information Technology;Karlsruhe Institute of Technology;,Germany;,Technical,https://aaai.org/papers/06812-sample-specific-output-constraints-for-neural-networks/,https://cdn.aaai.org/ojs/16841/16841-13-20335-1-2-20210518.pdf
793,Scalable and Explainable 1-Bit Matrix Completion via Graph Signal Learning,Machine Learning I,Chao Chen;Dongsheng Li;Junchi Yan;Hanchi Huang;Xiaokang Yang;,Shanghai Jiao Tong University;Fudan University;Microsoft;,China;,Technical,https://aaai.org/papers/07011-scalable-and-explainable-1-bit-matrix-completion-via-graph-signal-learning/,https://cdn.aaai.org/ojs/16863/16863-13-20357-1-2-20210518.pdf
794,Self-Progressing Robust Training,Machine Learning I,Minhao Cheng;Pin-Yu Chen;Sijia Liu;Shiyu Chang;Cho-Jui Hsieh;Payel Das;,"University of California, Los Angeles;IBM;Michigan State University;",United States;,Technical,https://aaai.org/papers/07107-self-progressing-robust-training/,https://cdn.aaai.org/ojs/16874/16874-13-20368-1-2-20210518.pdf
795,Semi-Supervised Learning with Variational Bayesian Inference and Maximum Uncertainty Regularization,Machine Learning I,Kien Do;Truyen Tran;Svetha Venkatesh;,Deakin University;,Australia;,Technical,https://aaai.org/papers/07236-semi-supervised-learning-with-variational-bayesian-inference-and-maximum-uncertainty-regularization/,https://cdn.aaai.org/ojs/16889/16889-13-20383-1-2-20210518.pdf
796,Semi-Supervised Metric Learning: A Deep Resurrection,Machine Learning I,Ujjal Kr Dutta;Mehrtash Harandi;C Chandra Shekhar;,Myntra;Indian Institute of Technology Madras;Monash University;,India;Australia;,Technical,https://aaai.org/papers/07279-semi-supervised-metric-learning-a-deep-resurrection/,https://cdn.aaai.org/ojs/16894/16894-13-20388-1-2-20210518.pdf
797,Semi-supervised Sequence Classification through Change Point Detection,Machine Learning I,Nauman Ahad;Mark A. Davenport;,Georgia Institute of Technology;,United States;,Technical,https://aaai.org/papers/06574-semi-supervised-sequence-classification-through-change-point-detection/,https://cdn.aaai.org/ojs/16814/16814-13-20308-1-2-20210518.pdf
798,SHOT-VAE: Semi-supervised Deep Generative Models With Label-aware ELBO Approximations,Machine Learning I,Hao-Zhe Feng;Kezhi Kong;Minghao Chen;Tianye Zhang;Minfeng Zhu;Wei Chen;,Zhejiang University;University of Maryland;,China;United States;,Technical,https://aaai.org/papers/07413-shot-vae-semi-supervised-deep-generative-models-with-label-aware-elbo-approximations/,https://cdn.aaai.org/ojs/16909/16909-13-20403-1-2-20210518.pdf
799,Stochastic Precision Ensemble: Self-Knowledge Distillation for Quantized Deep Neural Networks,Machine Learning I,Yoonho Boo;Sungho Shin;Jungwook Choi;Wonyong Sung;,Seoul National University;Hanyang University;,South Korea;,Technical,https://aaai.org/papers/06794-stochastic-precision-ensemble-self-knowledge-distillation-for-quantized-deep-neural-networks/,https://cdn.aaai.org/ojs/16839/16839-13-20333-1-2-20210518.pdf
800,SWIFT: Scalable Wasserstein Factorization for Sparse Nonnegative Tensors,Machine Learning I,Ardavan Afshar;Kejing Yin;Sherry Yan;Cheng Qian;Joyce Ho;Haesun Park;Jimeng Sun;,Georgia Institute of Technology;Hong Kong Baptist University;Sutter Health;IQVIA;Emory University;University of Illinois Urbana-Champaign;,United States;China;,Technical,https://aaai.org/papers/06548-swift-scalable-wasserstein-factorization-for-sparse-nonnegative-tensors/,https://cdn.aaai.org/ojs/16811/16811-13-20305-1-2-20210518.pdf
801,TabNet: Attentive Interpretable Tabular Learning,Machine Learning I,Sercan Ö. Arik;Tomas Pfister;,Google;,United States;,Technical,https://aaai.org/papers/06679-tabnet-attentive-interpretable-tabular-learning/,https://cdn.aaai.org/ojs/16826/16826-13-20320-1-2-20210518.pdf
802,The Parameterized Complexity of Clustering Incomplete Data,Machine Learning I,Eduard Eiben;Robert Ganian;Iyad Kanj;Sebastian Ordyniak;Stefan Szeider;,"Royal Holloway, University of London;TU Wien;DePaul University;University of Leeds;",United Kingdom;Austria;United States;,Technical,https://aaai.org/papers/07296-the-parameterized-complexity-of-clustering-incomplete-data/,https://cdn.aaai.org/ojs/16896/16896-13-20390-1-2-20210518.pdf
803,The Tractability of SHAP-Score-Based Explanations for Classification over Deterministic and Decomposable Boolean Circuits,Machine Learning I,Marcelo Arenas;Pablo Barceló;Leopoldo Bertossi;Mikaël Monet;,Universidad Católica de Chile;IMFD;Universidad Adolfo Ibáñez;University of Lille;,Chile;France;,Technical,https://aaai.org/papers/06670-the-tractability-of-shap-score-based-explanations-for-classification-over-deterministic-and-decomposable-boolean-circuits/,https://cdn.aaai.org/ojs/16825/16825-13-20319-1-2-20210518.pdf
804,The Value-Improvement Path: Towards Better Representations for Reinforcement Learning,Machine Learning I,Will Dabney;André Barreto;Mark Rowland;Robert Dadashi;John Quan;Marc G. Bellemare;David Silver;,DeepMind;Google;,United Kingdom;United States;,Technical,https://aaai.org/papers/07160-the-value-improvement-path-towards-better-representations-for-reinforcement-learning/,https://cdn.aaai.org/ojs/16880/16880-13-20374-1-2-20210518.pdf
805,"THOR, Trace-based Hardware-driven Layer-Oriented Natural Gradient Descent Computation",Machine Learning I,Mengyun Chen;Kaixin Gao;Xiaolei Liu;Zidong Wang;Ningxi Ni;Qian Zhang;Lei  Chen;Chao Ding;Zhenghai Huang;Min Wang;Shuangling Wang;Fan Yu;Xinyuan Zhao;Dachuan Xu;,Huawei;Tianjin University;Beijing University of Technology;Hong Kong University of Science and Technology;Chinese Academy of Sciences;,China;,Technical,https://aaai.org/papers/07046-thor-trace-based-hardware-driven-layer-oriented-natural-gradient-descent-computation/,https://cdn.aaai.org/ojs/16867/16867-13-20361-1-2-20210518.pdf
806,Time Series Domain Adaptation via Sparse Associative Structure Alignment,Machine Learning I,Ruichu Cai;Jiawei Chen;Zijian Li;Wei Chen;Keli Zhang;Junjian Ye;Zhuozhang Li;Xiaoyan Yang;Zhenjie Zhang;,Guangdong University of Technology;Huawei;,China;,Technical,https://aaai.org/papers/06859-time-series-domain-adaptation-via-sparse-associative-structure-alignment/,https://cdn.aaai.org/ojs/16846/16846-13-20340-1-2-20210518.pdf
807,Towards Effective Context for Meta-Reinforcement Learning: an Approach based on Contrastive Learning,Machine Learning I,Haotian Fu;Hongyao Tang;Jianye Hao;Chen Chen;Xidong Feng;Dong Li;Wulong Liu;,Tianjin University;Huawei;Tsinghua University;,China;,Technical,https://aaai.org/papers/07457-towards-effective-context-for-meta-reinforcement-learning-an-approach-based-on-contrastive-learning/,https://cdn.aaai.org/ojs/16914/16914-13-20408-1-2-20210518.pdf
808,Transfer Learning for Efficient Iterative Safety Validation,Machine Learning I,Anthony Corso;Mykel J. Kochenderfer;,Stanford University;,United States;,Technical,https://aaai.org/papers/07125-transfer-learning-for-efficient-iterative-safety-validation/,https://cdn.aaai.org/ojs/16876/16876-13-20370-1-2-20210518.pdf
809,Type-augmented Relation Prediction in Knowledge Graphs,Machine Learning I,Zijun Cui;Pavan Kapanipathi;Kartik Talamadupula;Tian Gao;Qiang Ji;,Rensselaer Polytechnic Institute;IBM;,United States;,Technical,https://aaai.org/papers/07151-type-augmented-relation-prediction-in-knowledge-graphs/,https://cdn.aaai.org/ojs/16879/16879-13-20373-1-2-20210518.pdf
810,UAG: Uncertainty-aware Attention Graph Neural Network for Defending Adversarial Attacks,Machine Learning I,Boyuan Feng;Yuke Wang;Yufei Ding;,"University of California, Santa Barbara;",United States;,Technical,https://aaai.org/papers/07404-uag-uncertainty-aware-attention-graph-neural-network-for-defending-adversarial-attacks/,https://cdn.aaai.org/ojs/16908/16908-13-20402-1-2-20210518.pdf
811,Understanding Decoupled and Early Weight Decay,Machine Learning I,Johan Bjorck;Kilian Q. Weinberger;Carla Gomes;,Cornell University;,United States;,Technical,https://aaai.org/papers/06777-understanding-decoupled-and-early-weight-decay/,https://cdn.aaai.org/ojs/16837/16837-13-20331-1-2-20210518.pdf
812,Using Hindsight to Anchor Past Knowledge in Continual Learning,Machine Learning I,Arslan Chaudhry;Albert Gordo;Puneet Dokania;Philip Torr;David Lopez-Paz;,University of Oxford;Meta;,United Kingdom;United States;,Technical,https://aaai.org/papers/06993-using-hindsight-to-anchor-past-knowledge-in-continual-learning/,https://cdn.aaai.org/ojs/16861/16861-13-20355-1-2-20210518.pdf
813,A Bayesian Approach for Subset Selection in Contextual Bandits,Machine Learning II,Jialian Li;Chao Du;Jun Zhu;,Tsinghua University;Alibaba Group;,China;,Technical,https://aaai.org/papers/08384-a-bayesian-approach-for-subset-selection-in-contextual-bandits/,https://cdn.aaai.org/ojs/17019/17019-13-20513-1-2-20210518.pdf
814,A Flexible Framework for Communication-Efficient Machine Learning,Machine Learning II,Sarit Khirirat;Sindri Magnússon;Arda Aytekin;Mikael Johansson;,KTH Royal Institute of Technology;Stockholm University;Ericsson;,Sweden;,Technical,https://aaai.org/papers/08101-a-flexible-framework-for-communication-efficient-machine-learning/,https://cdn.aaai.org/ojs/16987/16987-13-20481-1-2-20210518.pdf
815,A Recipe for Global Convergence Guarantee in Deep Neural Networks,Machine Learning II,Kenji Kawaguchi;Qingyun Sun;,Harvard University;Stanford University;,United States;,Technical,https://aaai.org/papers/08074-a-recipe-for-global-convergence-guarantee-in-deep-neural-networks/,https://cdn.aaai.org/ojs/16984/16984-13-20478-1-2-20210518.pdf
816,A Sample-Efficient Algorithm for Episodic Finite-Horizon MDP with Constraints,Machine Learning II,Krishna C. Kalagarla;Rahul Jain;Pierluigi Nuzzo;,University of Southern California;,United States;,Technical,https://aaai.org/papers/08030-a-sample-efficient-algorithm-for-episodic-finite-horizon-mdp-with-constraints/,https://cdn.aaai.org/ojs/16979/16979-13-20473-1-2-20210518.pdf
817,A Trace-restricted Kronecker-Factored Approximation to Natural Gradient,Machine Learning II,Kaixin Gao;Xiaolei Liu;Zhenghai Huang;Min Wang;Zidong Wang;Dachuan Xu;Fan Yu;,Tianjin University;Huawei;Beijing University of Technology;,China;,Technical,https://aaai.org/papers/07519-a-trace-restricted-kronecker-factored-approximation-to-natural-gradient/,https://cdn.aaai.org/ojs/16921/16921-13-20415-1-2-20210518.pdf
818,Accelerating Continuous Normalizing Flow with Trajectory Polynomial Regularization,Machine Learning II,Han-Hsien Huang;Mi-Yen Yeh;,Academia Sinica;Texas A&M University;,China;United States;,Technical,https://aaai.org/papers/07832-accelerating-continuous-normalizing-flow-with-trajectory-polynomial-regularization/,https://cdn.aaai.org/ojs/16956/16956-13-20450-1-2-20210518.pdf
819,Accurate and Robust Feature Importance Estimation under Distribution Shifts,Machine Learning II,Jayaraman J. Thiagarajan;Vivek Narayanaswamy;Rushil Anirudh;Peer-Timo Bremer;Andreas Spanias;,Lawrence Livermore National Laboratory;Arizona State University;,United States;,Technical,https://aaai.org/papers/07891-accurate-and-robust-feature-importance-estimation-under-distribution-shifts/,https://cdn.aaai.org/ojs/16963/16963-13-20457-1-2-20210518.pdf
820,ACMo: Angle-Calibrated Moment Methods for Stochastic Optimization,Machine Learning II,Xunpeng Huang;Runxin Xu;Hao Zhou;Zhe Wang;Zhengyang Liu;Lei Li;,ByteDance;Peking University;Ohio State University;Beijing Institute of Technology;,China;United States;,Technical,https://aaai.org/papers/07857-acmo-angle-calibrated-moment-methods-for-stochastic-optimization/,https://cdn.aaai.org/ojs/16959/16959-13-20453-1-2-20210518.pdf
821,Action Candidate Based Clipped Double Q-learning for Discrete and Continuous Action Tasks,Machine Learning II,Haobo Jiang;Jin Xie;Jian Yang;,PCA Lab;Jiangsu Key Lab of Image and Video Understanding for Social Security;Nanjing University of Science and Technology;,China;,Technical,https://aaai.org/papers/07979-action-candidate-based-clipped-double-q-learning-for-discrete-and-continuous-action-tasks/,https://cdn.aaai.org/ojs/16973/16973-13-20467-1-2-20210518.pdf
822,Active Bayesian Assessment of Black-Box Classifiers,Machine Learning II,Disi Ji;Robert L. Logan;Padhraic Smyth;Mark Steyvers;,"University of California, Irvine;",United States;,Technical,https://aaai.org/papers/07935-active-bayesian-assessment-of-black-box-classifiers/,https://cdn.aaai.org/ojs/16968/16968-13-20462-1-2-20210518.pdf
823,Addressing Domain Gap via Content Invariant Representation for Semantic Segmentation,Machine Learning II,Li Gao;Lefei Zhang;Qian Zhang;,"Wuhan University;Horizon Robotics, Inc.;",China;,Technical,https://aaai.org/papers/07528-addressing-domain-gap-via-content-invariant-representation-for-semantic-segmentation/,https://cdn.aaai.org/ojs/16922/16922-13-20416-1-2-20210518.pdf
