Index,Title,Session/Area,Authors,Affiliation,Country,Status,Proceeding URL,PDF URL
623,Equivalence in Argumentation Frameworks with a Claim-Centric View – Classical Results with Novel Ingredients,Knowledge Representation and Reasoning,Ringo Baumann;Anna Rapberger;Markus Ulbricht;,Leipzig University;TU Wien;,Germany;Austria;,Technical,https://aaai.org/papers/05479-equivalence-in-argumentation-frameworks-with-a-claim-centric-view-classical-results-with-novel-ingredients/,https://cdn.aaai.org/ojs/20486/20486-13-24499-1-2-20220628.pdf
624,ER: Equivariance Regularizer for Knowledge Graph Completion,Knowledge Representation and Reasoning,Zongsheng Cao;Qianqian Xu;Zhiyong Yang;Qingming Huang;,Chinese Academy of Sciences;University of Chinese Academy of Sciences;Pengcheng Laboratory;,China;,Technical,https://aaai.org/papers/05512-er-equivariance-regularizer-for-knowledge-graph-completion/,https://cdn.aaai.org/ojs/20490/20490-13-24503-1-2-20220628.pdf
625,Expressivity of Planning with Horn Description Logic Ontologies,Knowledge Representation and Reasoning,Stefan Borgwardt;Jörg Hoffmann;Alisa Kovtunova;Markus Krötzsch;Bernhard Nebel;Marcel Steinmetz;,Technische Universität Dresden;Saarland University;University of Freiburg;,Germany;,Technical,https://aaai.org/papers/05503-expressivity-of-planning-with-horn-description-logic-ontologies/,https://cdn.aaai.org/ojs/20489/20489-13-24502-1-2-20220628.pdf
626,Finite Entailment of Local Queries in the Z Family of Description Logics,Knowledge Representation and Reasoning,Bartosz Bednarczyk;Emanuel Kieroński;,Technische Universität Dresden;University of Wroc?aw;,Germany;Poland;,Technical,https://aaai.org/papers/05487-finite-entailment-of-local-queries-in-the-z-family-of-description-logics/,https://cdn.aaai.org/ojs/20487/20487-13-24500-1-2-20220628.pdf
627,First Order Rewritability in Ontology-Mediated Querying in Horn Description Logics,Knowledge Representation and Reasoning,David Toman;Grant Weddell;,University of Waterloo;,Canada;,Technical,https://aaai.org/papers/05897-first-order-rewritability-in-ontology-mediated-querying-in-horn-description-logics/,https://cdn.aaai.org/ojs/20534/20534-13-24547-1-2-20220628.pdf
628,From Actions to Programs as Abstract Actual Causes,Knowledge Representation and Reasoning,Bita Banihashemi;Shakil M. Khan;Mikhail Soutchanski;,York University;University of Regina;Ryerson University;,Canada;,Technical,https://aaai.org/papers/05470-from-actions-to-programs-as-abstract-actual-causes/,https://cdn.aaai.org/ojs/20485/20485-13-24498-1-2-20220628.pdf
629,Geometry Interaction Knowledge Graph Embeddings,Knowledge Representation and Reasoning,Zongsheng Cao;Qianqian Xu;Zhiyong Yang;Xiaochun Cao;Qingming Huang;,Chinese Academy of Sciences;University of Chinese Academy of Sciences;Pengcheng Laboratory;,China;,Technical,https://aaai.org/papers/05521-geometry-interaction-knowledge-graph-embeddings/,https://cdn.aaai.org/ojs/20491/20491-13-24504-1-2-20220628.pdf
630,How Does Knowledge Graph Embedding Extrapolate to Unseen Data: A Semantic Evidence View,Knowledge Representation and Reasoning,Ren Li;Yanan Cao;Qiannan Zhu;Guanqun Bi;Fang Fang;Yi Liu;Qian Li;,Chinese Academy of Sciences;University of Chinese Academy of Sciences;Renmin University of China;Beijing Key Laboratory of Big Data Management and Analysis Methods;National Computer Network Emergency Response Technical Team/Coordination Center;University of Technology Sydney;,China;Australia;,Technical,https://aaai.org/papers/05781-how-does-knowledge-graph-embedding-extrapolate-to-unseen-data-a-semantic-evidence-view/,https://cdn.aaai.org/ojs/20521/20521-13-24534-1-2-20220628.pdf
631,Incomplete Argumentation Frameworks: Properties and Complexity,Knowledge Representation and Reasoning,Gianvincenzo Alfano;Sergio Greco;Francesco Parisi;Irina Trubitsyna;,University of Calabria;,Italy;,Technical,https://aaai.org/papers/05451-incomplete-argumentation-frameworks-properties-and-complexity/,https://cdn.aaai.org/ojs/20483/20483-13-24496-1-2-20220628.pdf
632,Inductive Relation Prediction by BERT,Knowledge Representation and Reasoning,Hanwen Zha;Zhiyu Chen;Xifeng Yan;,"University of California, Santa Barbara;",United States;,Technical,https://aaai.org/papers/05923-inductive-relation-prediction-by-bert/,https://cdn.aaai.org/ojs/20537/20537-13-24550-1-2-20220628.pdf
633,Inferring Lexicographically-Ordered Rewards from Preferences,Knowledge Representation and Reasoning,Alihan Hüyük;William R. Zame;Mihaela van der Schaar;,"University of Cambridge;University of California, Los Angeles;Alan Turing Institute;",United Kingdom;United States;,Technical,https://aaai.org/papers/05737-inferring-lexicographically-ordered-rewards-from-preferences/,https://cdn.aaai.org/ojs/20516/20516-13-24529-1-2-20220628.pdf
634,Knowledge Compilation Meets Logical Separability,Knowledge Representation and Reasoning,Junming Qiu;Wenqing Li;Zhanhao Xiao;Quanlong Guan;Liangda Fang;Zhao-Rong Lai;Qian Dong;,Jinan University;Guangdong Institute of Smart Education;Sun Yat-sen University;Pazhou Lab;Guangxi Key Laboratory of Trusted Software;,China;;,Technical,https://aaai.org/papers/05851-knowledge-compilation-meets-logical-separability/,https://cdn.aaai.org/ojs/20529/20529-13-24542-1-2-20220628.pdf
635,Large-Neighbourhood Search for Optimisation in Answer-Set Solving,Knowledge Representation and Reasoning,Thomas Eiter;Tobias Geibinger;Nelson Higuera Ruiz;Nysret Musliu;Johannes Oetsch;Daria Stepanova;,TU Wien;Bosch Center for AI;,Austria;Germany;,Technical,https://aaai.org/papers/05616-large-neighbourhood-search-for-optimisation-in-answer-set-solving/,https://cdn.aaai.org/ojs/20502/20502-13-24515-1-2-20220628.pdf
636,Learning to Walk with Dual Agents for Knowledge Graph Reasoning,Knowledge Representation and Reasoning,Denghui Zhang;Zixuan Yuan;Hao Liu;Xiaodong lin;Hui Xiong;,Rutgers University;Hong Kong University of Science and Technology;,United States;China;,Technical,https://aaai.org/papers/05932-learning-to-walk-with-dual-agents-for-knowledge-graph-reasoning/,https://cdn.aaai.org/ojs/20538/20538-13-24551-1-2-20220628.pdf
637,Linear-Time Verification of Data-Aware Dynamic Systems with Arithmetic,Knowledge Representation and Reasoning,Paolo Felli;Marco Montali;Sarah Winkler;,Free University of Bozen-Bolzano;,Italy;,Technical,https://aaai.org/papers/05642-linear-time-verification-of-data-aware-dynamic-systems-with-arithmetic/,https://cdn.aaai.org/ojs/20505/20505-13-24518-1-2-20220628.pdf
638,Lower Bounds on Intermediate Results in Bottom-Up Knowledge Compilation,Knowledge Representation and Reasoning,Alexis de Colnet;Stefan Mengel;,University of Artois;,France;,Technical,https://aaai.org/papers/05564-lower-bounds-on-intermediate-results-in-bottom-up-knowledge-compilation/,https://cdn.aaai.org/ojs/20496/20496-13-24509-1-2-20220628.pdf
639,Machine Learning for Utility Prediction in Argument-Based Computational Persuasion,Knowledge Representation and Reasoning,Ivan Donadello;Anthony Hunter;Stefano Teso;Mauro Dragoni;,Free University of Bozen-Bolzano;University College London;University of Trento;Fondazione Bruno Kessler;,Italy;United Kingdom;,Technical,https://aaai.org/papers/05592-machine-learning-for-utility-prediction-in-argument-based-computational-persuasion/,https://cdn.aaai.org/ojs/20499/20499-13-24512-1-2-20220628.pdf
640,MeTeoR: Practical Reasoning in Datalog with Metric Temporal Operators,Knowledge Representation and Reasoning,Dingmin Wang;Pan Hu;Przemysław Andrzej Wałęga;Bernardo Cuenca Grau;,University of Oxford;Shanghai Jiao Tong University;,United Kingdom;China;,Technical,https://aaai.org/papers/05906-meteor-practical-reasoning-in-datalog-with-metric-temporal-operators/,https://cdn.aaai.org/ojs/20535/20535-13-24548-1-2-20220628.pdf
641,Monotone Abstractions in Ontology-Based Data Management,Knowledge Representation and Reasoning,Gianluca Cima;Marco Console;Maurizio Lenzerini;Antonella Poggi;,University of Bordeaux;Sapienza University of Rome;,France;Italy;,Technical,https://aaai.org/papers/05556-monotone-abstractions-in-ontology-based-data-management/,https://cdn.aaai.org/ojs/20495/20495-13-24508-1-2-20220628.pdf
642,Multi-Relational Graph Representation Learning with Bayesian Gaussian Process Network,Knowledge Representation and Reasoning,Guanzheng Chen;Jinyuan Fang;Zaiqiao Meng;Qiang Zhang;Shangsong Liang;,Sun Yat-sen University;Guangdong Key Laboratory of Big Data Analysis and Processing;University of Glasgow;Zhejiang University;Mohamed bin Zayed University of Artificial Intelligence;,China;United Kingdom;United Arab Emirates;,Technical,https://aaai.org/papers/05530-multi-relational-graph-representation-learning-with-bayesian-gaussian-process-network/,https://cdn.aaai.org/ojs/20492/20492-13-24505-1-2-20220628.pdf
643,Multi-View Graph Representation for Programming Language Processing: An Investigation into Algorithm Detection,Knowledge Representation and Reasoning,Ting Long;Yutong Xie;Xianyu Chen;Weinan Zhang;Qinxiang Cao;Yong Yu;,Shanghai Jiao Tong University;University of Michigan;,China;United States;,Technical,https://aaai.org/papers/05792-multi-view-graph-representation-for-programming-language-processing-an-investigation-into-algorithm-detection/,https://cdn.aaai.org/ojs/20522/20522-13-24535-1-2-20220628.pdf
644,MultiplexNet: Towards Fully Satisfied Logical Constraints in Neural Networks,Knowledge Representation and Reasoning,Nick Hoernle;Rafael Michael Karampatsis;Vaishak Belle;Kobi Gal;,University of Edinburgh;Alan Turing Institute;Ben-Gurion University of the Negev;,United Kingdom;Israel;,Technical,https://aaai.org/papers/05700-multiplexnet-towards-fully-satisfied-logical-constraints-in-neural-networks/,https://cdn.aaai.org/ojs/20512/20512-13-24525-1-2-20220628.pdf
645,On Paraconsistent Belief Revision in LP,Knowledge Representation and Reasoning,Nicolas Schwind;Sébastien Konieczny;Ramón Pino Pérez;,National Institute of Advanced Industrial Science and Technology;Université d’Artois;,Japan;France;,Technical,https://aaai.org/papers/05879-on-paraconsistent-belief-revision-in-lp/,https://cdn.aaai.org/ojs/20532/20532-13-24545-1-2-20220628.pdf
646,On Testing for Discrimination Using Causal Models,Knowledge Representation and Reasoning,Hana Chockler;Joseph Y. Halpern;,causaLens;King’s College London;Cornell University;,;United Kingdom;United States;,Technical,https://aaai.org/papers/05548-on-testing-for-discrimination-using-causal-models/,https://cdn.aaai.org/ojs/20494/20494-13-24507-1-2-20220628.pdf
647,On the Complexity of Inductively Learning Guarded Clauses,Knowledge Representation and Reasoning,Andrei Draghici;Georg Gottlob;Matthias Lanzinger;,University of Oxford;,United Kingdom;,Technical,https://aaai.org/papers/05600-on-the-complexity-of-inductively-learning-guarded-clauses/,https://cdn.aaai.org/ojs/20500/20500-13-24513-1-2-20220628.pdf
648,On the Computation of Necessary and Sufficient Explanations,Knowledge Representation and Reasoning,Adnan Darwiche;Chunxi Ji;,"University of California, Los Angeles;",United States;,Technical,https://aaai.org/papers/05582-on-the-computation-of-necessary-and-sufficient-explanations/,https://cdn.aaai.org/ojs/20498/20498-13-24511-1-2-20220628.pdf
649,Prevailing in the Dark: Information Walls in Strategic Games,Knowledge Representation and Reasoning,Pavel Naumov;Wenxuan Zhang;,University of Southampton;Scripps College;,United Kingdom;United States;,Technical,https://aaai.org/papers/05842-prevailing-in-the-dark-information-walls-in-strategic-games/,https://cdn.aaai.org/ojs/20528/20528-13-24541-1-2-20220628.pdf
650,Propositional Encodings of Acyclicity and Reachability by Using Vertex Elimination,Knowledge Representation and Reasoning,Masood Feyzbakhsh Rankooh;Jussi Rintanen;,Aalto University;,Finland;,Technical,https://aaai.org/papers/05861-propositional-encodings-of-acyclicity-and-reachability-by-using-vertex-elimination/,https://cdn.aaai.org/ojs/20530/20530-13-24543-1-2-20220628.pdf
651,Random vs. Best-First: Impact of Sampling Strategies on Decision Making in Model-Based Diagnosis,Knowledge Representation and Reasoning,Patrick Rodler;,University of Klagenfurt;,Austria;,Technical,https://aaai.org/papers/05869-random-vs-best-first-impact-of-sampling-strategies-on-decision-making-in-model-based-diagnosis/,https://cdn.aaai.org/ojs/20531/20531-13-24544-1-2-20220628.pdf
652,Reasoning about Causal Models with Infinitely Many Variables,Knowledge Representation and Reasoning,Joseph Y. Halpern;Spencer Peters;,Cornell University;,United States;,Technical,https://aaai.org/papers/05668-reasoning-about-causal-models-with-infinitely-many-variables/,https://cdn.aaai.org/ojs/20508/20508-13-24521-1-2-20220628.pdf
653,Residual Similarity Based Conditional Independence Test and Its Application in Causal Discovery,Knowledge Representation and Reasoning,Hao Zhang;Shuigeng Zhou;Kun Zhang;Jihong Guan;,Fudan University;Guangdong University of Petrochemical Technology;Carnegie Mellon University;Mohamed bin Zayed University of Artificial Intelligence;Tongji University;,China;United States;United Arab Emirates;,Technical,https://aaai.org/papers/05942-residual-similarity-based-conditional-independence-test-and-its-application-in-causal-discovery/,https://cdn.aaai.org/ojs/20539/20539-13-24552-1-2-20220628.pdf
654,Rushing and Strolling among Answer Sets – Navigation Made Easy,Knowledge Representation and Reasoning,Johannes Klaus Fichte;Sarah Alice Gaggl;Dominik Rusovac;,TU Wien;Technische Universität Dresden;,Austria;Germany;,Technical,https://aaai.org/papers/05651-rushing-and-strolling-among-answer-sets-navigation-made-easy/,https://cdn.aaai.org/ojs/20506/20506-13-24519-1-2-20220628.pdf
655,SGEITL: Scene Graph Enhanced Image-Text Learning for Visual Commonsense Reasoning,Knowledge Representation and Reasoning,Zhecan Wang;Haoxuan You;Liunian Harold Li;Alireza Zareian;Suji Park;Yiqing Liang;Kai-Wei Chang;Shih-Fu Chang;,"Columbia University;University of California, Los Angeles;",United States;,Technical,https://aaai.org/papers/05914-sgeitl-scene-graph-enhanced-image-text-learning-for-visual-commonsense-reasoning/,https://cdn.aaai.org/ojs/20536/20536-13-24549-1-2-20220628.pdf
656,Sufficient Reasons for Classifier Decisions in the Presence of Domain Constraints,Knowledge Representation and Reasoning,Niku Gorji;Sasha Rubin;,University of Sydney;,Australia;,Technical,https://aaai.org/papers/05660-sufficient-reasons-for-classifier-decisions-in-the-presence-of-domain-constraints/,https://cdn.aaai.org/ojs/20507/20507-13-24520-1-2-20220628.pdf
657,TempoQR: Temporal Question Reasoning over Knowledge Graphs,Knowledge Representation and Reasoning,Costas Mavromatis;Prasanna Lakkur Subramanyam;Vassilis N. Ioannidis;Adesoji Adeshina;Phillip R Howard;Tetiana Grinberg;Nagib Hakim;George Karypis;,University of Minnesota;University of Massachusetts Amherst;Amazon;Intel;,United States;,Technical,https://aaai.org/papers/05825-tempoqr-temporal-question-reasoning-over-knowledge-graphs/,https://cdn.aaai.org/ojs/20526/20526-13-24539-1-2-20220628.pdf
658,The Price of Selfishness: Conjunctive Query Entailment for ALCSelf Is 2EXPTIME-Hard,Knowledge Representation and Reasoning,Bartosz Bednarczyk;Sebastian Rudolph;,Technische Universität Dresden;University of Wroc?aw;,Germany;Poland;,Technical,https://aaai.org/papers/05495-the-price-of-selfishness-conjunctive-query-entailment-for-alcself-is-2exptime-hard/,https://cdn.aaai.org/ojs/20488/20488-13-24501-1-2-20220628.pdf
659,Towards Explainable Action Recognition by Salient Qualitative Spatial Object Relation Chains,Knowledge Representation and Reasoning,Hua Hua;Dongxu Li;Ruiqi Li;Peng Zhang;Jochen Renz;Anthony Cohn;,Australian National University;University of Leeds;,Australia;United Kingdom;,Technical,https://aaai.org/papers/05710-towards-explainable-action-recognition-by-salient-qualitative-spatial-object-relation-chains/,https://cdn.aaai.org/ojs/20513/20513-13-24526-1-2-20220628.pdf
660,Towards Fine-Grained Reasoning for Fake News Detection,Knowledge Representation and Reasoning,Yiqiao Jin;Xiting Wang;Ruichao Yang;Yizhou Sun;Wei Wang;Hao Liao;Xing Xie;,"University of California, Los Angeles;Microsoft;Hong Kong Baptist University;Shenzhen University;",United States;China;,Technical,https://aaai.org/papers/05746-towards-fine-grained-reasoning-for-fake-news-detection/,https://cdn.aaai.org/ojs/20517/20517-13-24530-1-2-20220628.pdf
661,Tractable Abstract Argumentation via Backdoor-Treewidth,Knowledge Representation and Reasoning,Wolfgang Dvořák;Markus Hecher;Matthias König;André Schidler;Stefan Szeider;Stefan Woltran;,TU Wien;,Austria;,Technical,https://aaai.org/papers/05608-tractable-abstract-argumentation-via-backdoor-treewidth/,https://cdn.aaai.org/ojs/20501/20501-13-24514-1-2-20220628.pdf
662,Tractable Explanations for d-DNNF Classifiers,Knowledge Representation and Reasoning,Xuanxiang Huang;Yacine Izza;Alexey Ignatiev;Martin Cooper;Nicholas Asher;Joao Marques-Silva;,University of Toulouse;Monash University;Institut de Recherche en Informatique de Toulouse;,France;Australia;,Technical,https://aaai.org/papers/05719-tractable-explanations-for-d-dnnf-classifiers/,https://cdn.aaai.org/ojs/20514/20514-13-24527-1-2-20220628.pdf
663,Trading Complexity for Sparsity in Random Forest Explanations,Knowledge Representation and Reasoning,Gilles Audemard;Steve Bellart;Louènas Bounia;Frédéric Koriche;Jean-Marie Lagniez;Pierre Marquis;,University of Artois;Institut Universitaire de France;,France;,Technical,https://aaai.org/papers/05461-trading-complexity-for-sparsity-in-random-forest-explanations/,https://cdn.aaai.org/ojs/20484/20484-13-24497-1-2-20220628.pdf
664,Understanding Enthymemes in Deductive Argumentation Using Semantic Distance Measures,Knowledge Representation and Reasoning,Anthony Hunter;,University College London;,United Kingdom;,Technical,https://aaai.org/papers/05729-understanding-enthymemes-in-deductive-argumentation-using-semantic-distance-measures/,https://cdn.aaai.org/ojs/20515/20515-13-24528-1-2-20220628.pdf
665,Unit Selection with Causal Diagram,Knowledge Representation and Reasoning,Ang Li;Judea Pearl;,"University of California, Los Angeles;",United States;,Technical,https://aaai.org/papers/05765-unit-selection-with-causal-diagram/,https://cdn.aaai.org/ojs/20519/20519-13-24532-1-2-20220628.pdf
666,Using Conditional Independence for Belief Revision,Knowledge Representation and Reasoning,Matthew James Lynn;James P. Delgrande;Pavlos Peppas;,Simon Fraser University;University of Patras;,Canada;Greece;,Technical,https://aaai.org/papers/05809-using-conditional-independence-for-belief-revision/,https://cdn.aaai.org/ojs/20524/20524-13-24537-1-2-20220628.pdf
667,Weakly Supervised Neural Symbolic Learning for Cognitive Tasks,Knowledge Representation and Reasoning,Jidong Tian;Yitian Li;Wenqing Chen;Liqiang Xiao;Hao He;Yaohui Jin;,Shanghai Jiao Tong University;,China;,Technical,https://aaai.org/papers/05888-weakly-supervised-neural-symbolic-learning-for-cognitive-tasks/,https://cdn.aaai.org/ojs/20533/20533-13-24546-1-2-20220628.pdf
668,Weighted Model Counting in FO2 with Cardinality Constraints and Counting Quantifiers: A Closed Form Formula,Knowledge Representation and Reasoning,Sagar Malhotra;Luciano Serafini;,Fondazione Bruno Kessler;University of Trento;,Italy;,Technical,https://aaai.org/papers/05817-weighted-model-counting-in-fo2-with-cardinality-constraints-and-counting-quantifiers-a-closed-form-formula/,https://cdn.aaai.org/ojs/20525/20525-13-24538-1-2-20220628.pdf
669,A Fast Algorithm for PAC Combinatorial Pure Exploration,Machine Learning I,Noa Ben-David;Sivan Sabato;,Ben-Gurion University of the Negev;,Israel;,Technical,https://aaai.org/papers/06064-a-fast-algorithm-for-pac-combinatorial-pure-exploration/,https://cdn.aaai.org/ojs/20553/20553-13-24566-1-2-20220628.pdf
670,"A Generalized Bootstrap Target for Value-Learning, Efficiently Combining Value and Feature Predictions",Machine Learning I,Anthony GX-Chen;Veronica Chelu;Blake A. Richards;Joelle Pineau;,Quebec AI Institute;McGill University;Canadian Institute for Advanced Research (CIFAR);Meta;,Canada;United States;,Technical,https://aaai.org/papers/06829-a-generalized-bootstrap-target-for-value-learning-efficiently-combining-value-and-feature-predictions/,https://cdn.aaai.org/ojs/20639/20639-13-24652-1-2-20220628.pdf
671,A Unifying Theory of Thompson Sampling for Continuous Risk-Averse Bandits,Machine Learning I,Joel Q. L. Chang;Vincent Y. F. Tan;,National University of Singapore;,Singapore;,Technical,https://aaai.org/papers/06159-a-unifying-theory-of-thompson-sampling-for-continuous-risk-averse-bandits/,https://cdn.aaai.org/ojs/20564/20564-13-24577-1-2-20220628.pdf
672,Achieving Counterfactual Fairness for Causal Bandit,Machine Learning I,Wen Huang;Lu Zhang;Xintao Wu;,University of Arkansas;,United States;,Technical,https://aaai.org/papers/06952-achieving-counterfactual-fairness-for-causal-bandit/,https://cdn.aaai.org/ojs/20653/20653-13-24666-1-2-20220628.pdf
673,Active Sampling for Text Classification with Subinstance Level Queries,Machine Learning I,Shayok Chakraborty;Ankita Singh;,Florida State University;,United States;,Technical,https://aaai.org/papers/06150-active-sampling-for-text-classification-with-subinstance-level-queries/,https://cdn.aaai.org/ojs/20563/20563-13-24576-1-2-20220628.pdf
674,Adaptive and Universal Algorithms for Variational Inequalities with Optimal Convergence,Machine Learning I,Alina Ene;Huy Lê Nguyễn;,Boston University;Northeastern University;,United States;,Technical,https://aaai.org/papers/06559-adaptive-and-universal-algorithms-for-variational-inequalities-with-optimal-convergence/,https://cdn.aaai.org/ojs/20609/20609-13-24622-1-2-20220628.pdf
675,Adaptive Kernel Graph Neural Network,Machine Learning I,Mingxuan Ju;Shifu Hou;Yujie Fan;Jianan Zhao;Yanfang Ye;Liang Zhao;,University of Notre Dame;Case Western Reserve University;Emory University;,United States;,Technical,https://aaai.org/papers/07051-adaptive-kernel-graph-neural-network/,https://cdn.aaai.org/ojs/20664/20664-13-24677-1-2-20220628.pdf
676,Adaptive Orthogonal Projection for Batch and Online Continual Learning,Machine Learning I,Yiduo Guo;Wenpeng Hu;Dongyan Zhao;Bing Liu;,Peking University;University of Illinois at Chicago;,China;United States;,Technical,https://aaai.org/papers/06783-adaptive-orthogonal-projection-for-batch-and-online-continual-learning/,https://cdn.aaai.org/ojs/20634/20634-13-24647-1-2-20220628.pdf
677,Admissible Policy Teaching through Reward Design,Machine Learning I,Kiarash Banihashem;Adish Singla;Jiarui Gan;Goran Radanovic;,Max Planck Institute for Software Systems;,Germany;,Technical,https://aaai.org/papers/06037-admissible-policy-teaching-through-reward-design/,https://cdn.aaai.org/ojs/20550/20550-13-24563-1-2-20220628.pdf
678,Adversarial Examples Can Be Effective Data Augmentation for Unsupervised Machine Learning,Machine Learning I,Chia-Yi Hsu;Pin-Yu Chen;Songtao Lu;Sijia Liu;Chia-Mu Yu;,National Yang Ming Chiao Tung University;IBM;Michigan State University;,China;United States;,Technical,https://aaai.org/papers/06926-adversarial-examples-can-be-effective-data-augmentation-for-unsupervised-machine-learning/,https://cdn.aaai.org/ojs/20650/20650-13-24663-1-2-20220628.pdf
679,Algorithmic Concept-Based Explainable Reasoning,Machine Learning I,Dobrik Georgiev;Pietro Barbiero;Dmitry Kazhdan;Petar Veličković;Pietro Lió;,University of Cambridge;DeepMind;,United Kingdom;,Technical,https://aaai.org/papers/06685-algorithmic-concept-based-explainable-reasoning/,https://cdn.aaai.org/ojs/20623/20623-13-24636-1-2-20220628.pdf
680,An Online Learning Approach to Sequential User-Centric Selection Problems,Machine Learning I,Junpu Chen;Hong Xie;,Chongqing University;,China;,Technical,https://aaai.org/papers/06231-an-online-learning-approach-to-sequential-user-centric-selection-problems/,https://cdn.aaai.org/ojs/20572/20572-13-24585-1-2-20220628.pdf
681,Anytime Guarantees under Heavy-Tailed Data,Machine Learning I,Matthew J. Holland;,Osaka University;,Japan;,Technical,https://aaai.org/papers/06918-anytime-guarantees-under-heavy-tailed-data/,https://cdn.aaai.org/ojs/20649/20649-13-24662-1-2-20220628.pdf
682,ASM2TV: An Adaptive Semi-supervised Multi-Task Multi-View Learning Framework for Human Activity Recognition,Machine Learning I,Zekai Chen;Xiao Zhang;Xiuzhen Cheng;,George Washington University;Shandong University;,United States;China;,Technical,https://aaai.org/papers/06342-asm2tv-an-adaptive-semi-supervised-multi-task-multi-view-learning-framework-for-human-activity-recognition/,https://cdn.aaai.org/ojs/20584/20584-13-24597-1-2-20220628.pdf
683,Balanced Self-Paced Learning for AUC Maximization,Machine Learning I,Bin Gu;Chenkang Zhang;Huan Xiong;Heng Huang;,Mohamed bin Zayed University of Artificial Intelligence;Nanjing University of Information Science & Technology;Harbin Institute of Technology;University of Pittsburgh;,United Arab Emirates;China;United States;,Technical,https://aaai.org/papers/06765-balanced-self-paced-learning-for-auc-maximization/,https://cdn.aaai.org/ojs/20632/20632-13-24645-1-2-20220628.pdf
684,Bayesian Optimization over Permutation Spaces,Machine Learning I,Aryan Deshwal;Syrine Belakaria;Janardhan Rao Doppa;Dae Hyun Kim;,Washington State University;,United States;,Technical,https://aaai.org/papers/06515-bayesian-optimization-over-permutation-spaces/,https://cdn.aaai.org/ojs/20604/20604-13-24617-1-2-20220628.pdf
685,Better Parameter-Free Stochastic Optimization with ODE Updates for Coin-Betting,Machine Learning I,Keyi Chen;John Langford;Francesco Orabona;,Boston University;Microsoft;,United States;,Technical,https://aaai.org/papers/06239-better-parameter-free-stochastic-optimization-with-ode-updates-for-coin-betting/,https://cdn.aaai.org/ojs/20573/20573-13-24586-1-2-20220628.pdf
