Index,Title,Session/Area,Authors,Affiliation,Country,Status,Proceeding URL,PDF URL
311,Dual Attention Networks for Few-Shot Fine-Grained Recognition,Computer Vision III,Shu-Lin Xu;Faen Zhang;Xiu-Shen Wei;Jianhua Wang;,Nanjing University of Science and Technology;Xidian University;Nanjing University;AInnovation Technology Group;,China;,Technical,https://aaai.org/papers/02911-dual-attention-networks-for-few-shot-fine-grained-recognition/,https://cdn.aaai.org/ojs/20196/20196-13-24209-1-2-20220628.pdf
312,Dual Decoupling Training for Semi-supervised Object Detection with Noise-Bypass Head,Computer Vision III,Shida Zheng;Chenshu Chen;Xiaowei Cai;Tingqun Ye;Wenming Tan;,Hikvision Research Institute;,China;,Technical,https://aaai.org/papers/03526-dual-decoupling-training-for-semi-supervised-object-detection-with-noise-bypass-head/,https://cdn.aaai.org/ojs/20264/20264-13-24277-1-2-20220628.pdf
313,Edge-Aware Guidance Fusion Network for RGB–Thermal Scene Parsing,Computer Vision III,Wujie Zhou;Shaohua Dong;Caie Xu;Yaguan Qian;,Zhejiang University of Science & Technology;,China;,Technical,https://aaai.org/papers/03571-edge-aware-guidance-fusion-network-for-rgb-thermal-scene-parsing/,https://cdn.aaai.org/ojs/20269/20269-13-24282-1-2-20220628.pdf
314,Efficient Compact Bilinear Pooling via Kronecker Product,Computer Vision III,Tan Yu;Yunfeng Cai;Ping Li;,Baidu;,United States;China;,Technical,https://aaai.org/papers/03170-efficient-compact-bilinear-pooling-via-kronecker-product/,https://cdn.aaai.org/ojs/20225/20225-13-24238-1-2-20220628.pdf
315,Efficient Model-Driven Network for Shadow Removal,Computer Vision III,Yurui Zhu;Zeyu Xiao;Yanchi Fang;Xueyang Fu;Zhiwei Xiong;Zheng-Jun Zha;,University of Science and Technology of China;University of Toronto;,China;Canada;,Technical,https://aaai.org/papers/03635-efficient-model-driven-network-for-shadow-removal/,https://cdn.aaai.org/ojs/20276/20276-13-24289-1-2-20220628.pdf
316,Efficient Non-local Contrastive Attention for Image Super-resolution,Computer Vision III,Bin Xia;Yucheng Hang;Yapeng Tian;Wenming Yang;Qingmin Liao;Jie Zhou;,Tsinghua University;University of Rochester;,China;United States;,Technical,https://aaai.org/papers/02759-efficient-non-local-contrastive-attention-for-image-super-resolution/,https://cdn.aaai.org/ojs/20179/20179-13-24192-1-2-20220628.pdf
317,End-to-End Learning the Partial Permutation Matrix for Robust 3D Point Cloud Registration,Computer Vision III,Zhiyuan Zhang;Jiadai Sun;Yuchao Dai;Dingfu Zhou;Xibin Song;Mingyi He;,Northwestern Polytechnical University;Baidu;,China;,Technical,https://aaai.org/papers/03399-end-to-end-learning-the-partial-permutation-matrix-for-robust-3d-point-cloud-registration/,https://cdn.aaai.org/ojs/20250/20250-13-24263-1-2-20220628.pdf
318,End-to-End Transformer Based Model for Image Captioning,Computer Vision III,Yiyu Wang;Jungang Xu;Yingfei Sun;,University of Chinese Academy of Sciences;,China;,Technical,https://aaai.org/papers/02585-end-to-end-transformer-based-model-for-image-captioning/,https://cdn.aaai.org/ojs/20160/20160-13-24173-1-2-20220628.pdf
319,Energy-Based Generative Cooperative Saliency Prediction,Computer Vision III,Jing Zhang;Jianwen Xie;Zilong Zheng;Nick Barnes;,"Australian National University;Baidu;University of California, Los Angeles;",Australia;China;United States;,Technical,https://aaai.org/papers/03280-energy-based-generative-cooperative-saliency-prediction/,https://cdn.aaai.org/ojs/20237/20237-13-24250-1-2-20220628.pdf
320,Enhancing Pseudo Label Quality for Semi-supervised Domain-Generalized Medical Image Segmentation,Computer Vision III,Huifeng Yao;Xiaowei Hu;Xiaomeng Li;,Hong Kong University of Science and Technology;Chinese University of Hong Kong;,China;,Technical,https://aaai.org/papers/03099-enhancing-pseudo-label-quality-for-semi-supervised-domain-generalized-medical-image-segmentation/,https://cdn.aaai.org/ojs/20217/20217-13-24230-1-2-20220628.pdf
321,Evo-ViT: Slow-Fast Token Evolution for Dynamic Vision Transformer,Computer Vision III,Yifan Xu;Zhijie Zhang;Mengdan Zhang;Kekai Sheng;Ke Li;Weiming Dong;Liqing Zhang;Changsheng Xu;Xing Sun;,Chinese Academy of Sciences;University of Chinese Academy of Sciences;Shanghai Jiao Tong University;Tencent;,China;,Technical,https://aaai.org/papers/02964-evo-vit-slow-fast-token-evolution-for-dynamic-vision-transformer/,https://cdn.aaai.org/ojs/20202/20202-13-24215-1-2-20220628.pdf
322,Exploring Visual Context for Weakly Supervised Person Search,Computer Vision III,Yichao Yan;Jinpeng Li;Shengcai Liao;Jie Qin;Bingbing Ni;Ke Lu;Xiaokang Yang;,Shanghai Jiao Tong University;Inception Institute of Artificial Intelligence;University of Chinese Academy of Sciences;,China;United Arab Emirates;,Technical,https://aaai.org/papers/03027-exploring-visual-context-for-weakly-supervised-person-search/,https://cdn.aaai.org/ojs/20209/20209-13-24222-1-2-20220628.pdf
323,FFNet: Frequency Fusion Network for Semantic Scene Completion,Computer Vision III,Xuzhi Wang;Di Lin;Liang Wan;,Tianjin University;,China;,Technical,https://aaai.org/papers/02550-ffnet-frequency-fusion-network-for-semantic-scene-completion/,https://cdn.aaai.org/ojs/20156/20156-13-24169-1-2-20220628.pdf
324,FINet: Dual Branches Feature Interaction for Partial-to-Partial Point Cloud Registration,Computer Vision III,Hao Xu;Nianjin Ye;Guanghui Liu;Bing Zeng;Shuaicheng Liu;,University of Electronic Science and Technology of China;Megvii Technology;,China;,Technical,https://aaai.org/papers/02848-finet-dual-branches-feature-interaction-for-partial-to-partial-point-cloud-registration/,https://cdn.aaai.org/ojs/20189/20189-13-24202-1-2-20220628.pdf
325,Handling Slice Permutations Variability in Tensor Recovery,Computer Vision III,Jingjing Zheng;Xiaoqin Zhang;Wenzhe Wang;Xianta Jiang;,Memorial University of Newfoundland;Wenzhou University;,Canada;China;,Technical,https://aaai.org/papers/03499-handling-slice-permutations-variability-in-tensor-recovery/,https://cdn.aaai.org/ojs/20261/20261-13-24274-1-2-20220628.pdf
326,Hierarchical Image Generation via Transformer-Based Sequential Patch Selection,Computer Vision III,Xiaogang Xu;Ning Xu;,Chinese University of Hong Kong;Adobe;,China;United States;,Technical,https://aaai.org/papers/02938-hierarchical-image-generation-via-transformer-based-sequential-patch-selection/,https://cdn.aaai.org/ojs/20199/20199-13-24212-1-2-20220628.pdf
327,Homography Decomposition Networks for Planar Object Tracking,Computer Vision III,Xinrui Zhan;Yueran Liu;Jianke Zhu;Yang Li;,Zhejiang University;East China Normal University;,China;,Technical,https://aaai.org/papers/03234-homography-decomposition-networks-for-planar-object-tracking/,https://cdn.aaai.org/ojs/20232/20232-13-24245-1-2-20220628.pdf
328,Hybrid Graph Neural Networks for Few-Shot Learning,Computer Vision III,Tianyuan Yu;Sen He;Yi-Zhe Song;Tao Xiang;,University of Surrey;National University of Defense Technology;Surrey Joint Research Centre on Artificial Intelligence;,United Kingdom;China;,Technical,https://aaai.org/papers/03179-hybrid-graph-neural-networks-for-few-shot-learning/,https://cdn.aaai.org/ojs/20226/20226-13-24239-1-2-20220628.pdf
329,I Can Find You! Boundary-Guided Separated Attention Network for Camouflaged Object Detection,Computer Vision III,Hongwei Zhu;Peng Li;Haoran Xie;Xuefeng Yan;Dong Liang;Dapeng Chen;Mingqiang Wei;Jing Qin;,Nanjing University of Aeronautics and Astronautics;MIIT;Lingnan University;Huawei;Hong Kong Polytechnic University;,China;,Technical,https://aaai.org/papers/03608-i-can-find-you-boundary-guided-separated-attention-network-for-camouflaged-object-detection/,https://cdn.aaai.org/ojs/20273/20273-13-24286-1-2-20220628.pdf
330,Image Difference Captioning with Pre-training and Contrastive Learning,Computer Vision III,Linli Yao;Weiying Wang;Qin Jin;,Renmin University of China;,China;,Technical,https://aaai.org/papers/03108-image-difference-captioning-with-pre-training-and-contrastive-learning/,https://cdn.aaai.org/ojs/20218/20218-13-24231-1-2-20220628.pdf
331,Improving 360 Monocular Depth Estimation via Non-local Dense Prediction Transformer and Joint Supervised and Self-Supervised Learning,Computer Vision III,Ilwi Yun;Hyuk-Jae Lee;Chae Eun Rhee;,Seoul National University;Inha University;,South Korea;,Technical,https://aaai.org/papers/03224-improving-360-monocular-depth-estimation-via-non-local-dense-prediction-transformer-and-joint-supervised-and-self-supervised-learning/,https://cdn.aaai.org/ojs/20231/20231-13-24244-1-2-20220628.pdf
332,Inferring Prototypes for Multi-Label Few-Shot Image Classification with Word Vector Guided Attention,Computer Vision III,Kun Yan;Chenbin Zhang;Jun Hou;Ping Wang;Zied Bouraoui;Shoaib Jameel;Steven Schockaert;,Peking University;SenseTime Group Limited;University of Artois;University of Essex;Cardiff University;,China;France;United Kingdom;,Technical,https://aaai.org/papers/02991-inferring-prototypes-for-multi-label-few-shot-image-classification-with-word-vector-guided-attention/,https://cdn.aaai.org/ojs/20205/20205-13-24218-1-2-20220628.pdf
333,"Interact, Embed, and EnlargE: Boosting Modality-Specific Representations for Multi-Modal Person Re-identification",Computer Vision III,Zi Wang;Chenglong Li;Aihua Zheng;Ran He;Jin Tang;,Anhui University;Anhui Province;Anhui Provincial Key Laboratory of Multimodal Cognitive Computation;Chinese Academy of Sciences;,China;,Technical,https://aaai.org/papers/02633-interact-embed-and-enlarge-boosting-modality-specific-representations-for-multi-modal-person-re-identification/,https://cdn.aaai.org/ojs/20165/20165-13-24178-1-2-20220628.pdf
334,Joint Deep Multi-Graph Matching and 3D Geometry Learning from Inhomogeneous 2D Image Collections,Computer Vision III,Zhenzhang Ye;Tarun Yenamandra;Florian Bernard;Daniel Cremers;,Technical University of Munich;University of Bonn;,Germany;,Technical,https://aaai.org/papers/03125-joint-deep-multi-graph-matching-and-3d-geometry-learning-from-inhomogeneous-2d-image-collections/,https://cdn.aaai.org/ojs/20220/20220-13-24233-1-2-20220628.pdf
335,L-CoDe:Language-Based Colorization Using Color-Object Decoupled Conditions,Computer Vision III,Shuchen Weng;Hao Wu;Zheng Chang;Jiajun Tang;Si Li;Boxin Shi;,Peking University;Beijing Academy of Artificial Intelligence;Pengcheng Laboratory;Beijing University of Posts and Telecommunications;,China;,Technical,https://aaai.org/papers/02677-l-codelanguage-based-colorization-using-color-object-decoupled-conditions/,https://cdn.aaai.org/ojs/20170/20170-13-24183-1-2-20220628.pdf
336,Learning Disentangled Classification and Localization Representations for Temporal Action Localization,Computer Vision III,Zixin Zhu;Le Wang;Wei Tang;Ziyi Liu;Nanning Zheng;Gang Hua;,Xi'an Jiao Tong University;University of Illinois at Chicago;Wormpex AI Research;,China;United States;,Technical,https://aaai.org/papers/03644-learning-disentangled-classification-and-localization-representations-for-temporal-action-localization/,https://cdn.aaai.org/ojs/20277/20277-13-24290-1-2-20220628.pdf
337,Learning from the Tangram to Solve Mini Visual Tasks,Computer Vision III,Yizhou Zhao;Liang Qiu;Pan Lu;Feng Shi;Tian Han;Song-Chun Zhu;,"University of California, Los Angeles;Stevens Institute of Technology;",United States;,Technical,https://aaai.org/papers/03490-learning-from-the-tangram-to-solve-mini-visual-tasks/,https://cdn.aaai.org/ojs/20260/20260-13-24273-1-2-20220628.pdf
338,Learning Network Architecture for Open-Set Recognition,Computer Vision III,Xuelin Zhang;Xuelian Cheng;Donghao Zhang;Paul Bonnington;Zongyuan Ge;,Monash University;,Australia;,Technical,https://aaai.org/papers/03362-learning-network-architecture-for-open-set-recognition/,https://cdn.aaai.org/ojs/20246/20246-13-24259-1-2-20220628.pdf
339,Learning Quality-Aware Representation for Multi-Person Pose Regression,Computer Vision III,Yabo Xiao;Dongdong Yu;Xiao Juan Wang;Lei Jin;Guoli Wang;Qian Zhang;,Beijing University of Posts and Telecommunications;ByteDance;Tsinghua University;Horizon Robotics;,China;,Technical,https://aaai.org/papers/02822-learning-quality-aware-representation-for-multi-person-pose-regression/,https://cdn.aaai.org/ojs/20186/20186-13-24199-1-2-20220628.pdf
340,Learning Temporally and Semantically Consistent Unpaired Video-to-Video Translation through Pseudo-Supervision from Synthetic Optical Flow,Computer Vision III,Kaihong Wang;Kumar Akash;Teruhisa Misu;,Boston University;Honda Research Institute USA;,United States;,Technical,https://aaai.org/papers/02477-learning-temporally-and-semantically-consistent-unpaired-video-to-video-translation-through-pseudo-supervision-from-synthetic-optical-flow/,https://cdn.aaai.org/ojs/20148/20148-13-24161-1-2-20220628.pdf
341,Learning to Detect 3D Facial Landmarks via Heatmap Regression with Graph Convolutional Network,Computer Vision III,Yuan Wang;Min Cao;Zhenfeng Fan;Silong Peng;,Chinese Academy of Sciences;Soochow University;University of Chinese Academy of Sciences;,China;,Technical,https://aaai.org/papers/02595-learning-to-detect-3d-facial-landmarks-via-heatmap-regression-with-graph-convolutional-network/,https://cdn.aaai.org/ojs/20161/20161-13-24174-1-2-20220628.pdf
342,Learning Token-Based Representation for Image Retrieval,Computer Vision III,Hui Wu;Min Wang;Wengang Zhou;Yang Hu;Houqiang Li;,University of Science and Technology of China;Hefei Comprehensive National Science Center;,China;,Technical,https://aaai.org/papers/02703-learning-token-based-representation-for-image-retrieval/,https://cdn.aaai.org/ojs/20173/20173-13-24186-1-2-20220628.pdf
343,LGD: Label-Guided Self-Distillation for Object Detection,Computer Vision III,Peizhen Zhang;Zijian Kang;Tong Yang;Xiangyu Zhang;Nanning Zheng;Jian Sun;,Megvii Technology;Xi'an Jiao Tong University;,China;,Technical,https://aaai.org/papers/03309-lgd-label-guided-self-distillation-for-object-detection/,https://cdn.aaai.org/ojs/20240/20240-13-24253-1-2-20220628.pdf
344,Local Surface Descriptor for Geometry and Feature Preserved Mesh Denoising,Computer Vision III,Wenbo Zhao;Xianming Liu;Junjun Jiang;Debin Zhao;Ge Li;Xiangyang Ji;,Harbin Institute of Technology;Pengcheng Laboratory;Peking University;Tsinghua University;,China;,Technical,https://aaai.org/papers/03446-local-surface-descriptor-for-geometry-and-feature-preserved-mesh-denoising/,https://cdn.aaai.org/ojs/20255/20255-13-24268-1-2-20220628.pdf
345,Low-Light Image Enhancement with Normalizing Flow,Computer Vision III,Yufei Wang;Renjie Wan;Wenhan Yang;Haoliang Li;Lap-Pui Chau;Alex Kot;,Nanyang Technological University;Hong Kong Baptist University;City University of Hong Kong;,Singapore;China;,Technical,https://aaai.org/papers/02604-low-light-image-enhancement-with-normalizing-flow/,https://cdn.aaai.org/ojs/20162/20162-13-24175-1-2-20220628.pdf
346,MAGIC: Multimodal relAtional Graph adversarIal inferenCe for Diverse and Unpaired Text-Based Image Captioning,Computer Vision III,Wenqiao Zhang;Haochen Shi;Jiannan Guo;Shengyu Zhang;Qingpeng Cai;Juncheng Li;Sihui Luo;Yueting Zhuang;,Zhejiang University;Université de Montréal;National University of Singapore;Ningbo University;,China;Canada;Singapore;,Technical,https://aaai.org/papers/03335-magic-multimodal-relational-graph-adversarial-inference-for-diverse-and-unpaired-text-based-image-captioning/,https://cdn.aaai.org/ojs/20243/20243-13-24256-1-2-20220628.pdf
347,Making Adversarial Examples More Transferable and Indistinguishable,Computer Vision III,Junhua Zou;Yexin Duan;Boyu Li;Wu Zhang;Yu Pan;Zhisong Pan;,Army Engineering University;Huazhong University of Science and Technology;,China;,Technical,https://aaai.org/papers/03662-making-adversarial-examples-more-transferable-and-indistinguishable/,https://cdn.aaai.org/ojs/20279/20279-13-24292-1-2-20220628.pdf
348,MobileFaceSwap: A Lightweight Framework for Video Face Swapping,Computer Vision III,Zhiliang Xu;Zhibin Hong;Changxing Ding;Zhen Zhu;Junyu Han;Jingtuo Liu;Errui Ding;,Baidu;South China University of Technology;University of Illinois Urbana-Champaign;,China;United States;,Technical,https://aaai.org/papers/02973-mobilefaceswap-a-lightweight-framework-for-video-face-swapping/,https://cdn.aaai.org/ojs/20203/20203-13-24216-1-2-20220628.pdf
349,MoCaNet: Motion Retargeting In-the-Wild via Canonicalization Networks,Computer Vision III,Wentao Zhu;Zhuoqian Yang;Ziang Di;Wayne Wu;Yizhou Wang;Chen Change Loy;,Peking University;Shanghai AI Laboratory;SenseTime;Southeast University;Nanyang Technological University;,China;Singapore;,Technical,https://aaai.org/papers/03617-mocanet-motion-retargeting-in-the-wild-via-canonicalization-networks/,https://cdn.aaai.org/ojs/20274/20274-13-24287-1-2-20220628.pdf
350,MSML: Enhancing Occlusion-Robustness by Multi-Scale Segmentation-Based Mask Learning for Face Recognition,Computer Vision III,Ge Yuan;Huicheng Zheng;Jiayu Dong;,Sun Yat-sen University;,China;,Technical,https://aaai.org/papers/03197-msml-enhancing-occlusion-robustness-by-multi-scale-segmentation-based-mask-learning-for-face-recognition/,https://cdn.aaai.org/ojs/20228/20228-13-24241-1-2-20220628.pdf
351,Multi-Centroid Representation Network for Domain Adaptive Person Re-ID,Computer Vision III,Yuhang Wu;Tengteng Huang;Haotian Yao;Chi Zhang;Yuanjie Shao;Chuchu Han;Changxin Gao;Nong Sang;,Huazhong University of Science and Technology;Megvii Technology;,China;,Technical,https://aaai.org/papers/02750-multi-centroid-representation-network-for-domain-adaptive-person-re-id/,https://cdn.aaai.org/ojs/20178/20178-13-24191-1-2-20220628.pdf
352,Multi-Modal Answer Validation for Knowledge-Based VQA,Computer Vision III,Jialin Wu;Jiasen Lu;Ashish Sabharwal;Roozbeh Mottaghi;,University of Texas at Austin;Allen Institute for AI;,United States;,Technical,https://aaai.org/papers/02712-multi-modal-answer-validation-for-knowledge-based-vqa/,https://cdn.aaai.org/ojs/20174/20174-13-24187-1-2-20220628.pdf
353,Mutual Contrastive Learning for Visual Representation Learning,Computer Vision III,Chuanguang Yang;Zhulin An;Linhang Cai;Yongjun Xu;,Chinese Academy of Sciences;University of Chinese Academy of Sciences;,China;,Technical,https://aaai.org/papers/03045-mutual-contrastive-learning-for-visual-representation-learning/,https://cdn.aaai.org/ojs/20211/20211-13-24224-1-2-20220628.pdf
354,Negative Sample Matters: A Renaissance of Metric Learning for Temporal Grounding,Computer Vision III,Zhenzhi Wang;Limin Wang;Tao Wu;Tianhao Li;Gangshan Wu;,Nanjing University;,China;,Technical,https://aaai.org/papers/02613-negative-sample-matters-a-renaissance-of-metric-learning-for-temporal-grounding/,https://cdn.aaai.org/ojs/20163/20163-13-24176-1-2-20220628.pdf
355,Neighborhood Consensus Contrastive Learning for Backward-Compatible Representation,Computer Vision III,Shengsen Wu;Liang Chen;Yihang Lou;Yan Bai;Tao Bai;Minghua Deng;Ling-Yu Duan;,Peking University;;Huawei;Pengcheng Laboratory;,China;;,Technical,https://aaai.org/papers/02722-neighborhood-consensus-contrastive-learning-for-backward-compatible-representation/,https://cdn.aaai.org/ojs/20175/20175-13-24188-1-2-20220628.pdf
356,"Nested Hierarchical Transformer: Towards Accurate, Data-Efficient and Interpretable Visual Understanding",Computer Vision III,Zizhao Zhang;Han Zhang;Long Zhao;Ting Chen;Sercan Ö. Arik;Tomas Pfister;,Google;,United States;,Technical,https://aaai.org/papers/03417-nested-hierarchical-transformer-towards-accurate-data-efficient-and-interpretable-visual-understanding/,https://cdn.aaai.org/ojs/20252/20252-13-24265-1-2-20220628.pdf
357,Neural Interferometry: Image Reconstruction from Astronomical Interferometers Using Transformer-Conditioned Neural Fields,Computer Vision III,Benjamin Wu;Chao Liu;Benjamin Eckart;Jan Kautz;,National Astronomical Observatory of Japan;NVIDIA;,Japan;United States;,Technical,https://aaai.org/papers/02685-neural-interferometry-image-reconstruction-from-astronomical-interferometers-using-transformer-conditioned-neural-fields/,https://cdn.aaai.org/ojs/20171/20171-13-24184-1-2-20220628.pdf
358,OA-FSUI2IT: A Novel Few-Shot Cross Domain Object Detection Framework with Object-Aware Few-Shot Unsupervised Image-to-Image Translation,Computer Vision III,Lifan Zhao;Yunlong Meng;Lin Xu;,"Shanghai Em-Data Technology Co., Ltd.;",China;,Technical,https://aaai.org/papers/03426-oa-fsui2it-a-novel-few-shot-cross-domain-object-detection-framework-with-object-aware-few-shot-unsupervised-image-to-image-translation/,https://cdn.aaai.org/ojs/20253/20253-13-24266-1-2-20220628.pdf
359,One-Shot Talking Face Generation from Single-Speaker Audio-Visual Correlation Learning,Computer Vision III,Suzhen Wang;Lincheng Li;Yu Ding;Xin Yu;,Netease Fuxi AI Lab;University of Technology Sydney;,China;Australia;,Technical,https://aaai.org/papers/02531-one-shot-talking-face-generation-from-single-speaker-audio-visual-correlation-learning/,https://cdn.aaai.org/ojs/20154/20154-13-24167-1-2-20220628.pdf
360,Pale Transformer: A General Vision Transformer Backbone with Pale-Shaped Attention,Computer Vision III,Sitong Wu;Tianyi Wu;Haoru Tan;Guodong Guo;,Baidu;National Engineering Laboratory for Deep Learning Technology and Application;University of Chinese Academy of Sciences;,China;,Technical,https://aaai.org/papers/02731-pale-transformer-a-general-vision-transformer-backbone-with-pale-shaped-attention/,https://cdn.aaai.org/ojs/20176/20176-13-24189-1-2-20220628.pdf
361,Pan-Sharpening with Customized Transformer and Invertible Neural Network,Computer Vision III,Man Zhou;Jie Huang;Yanchi Fang;Xueyang Fu;Aiping Liu;,Hefei Institute of Physical Science;University of Science and Technology of China;University of Toronto;,China;Canada;,Technical,https://aaai.org/papers/03553-pan-sharpening-with-customized-transformer-and-invertible-neural-network/,https://cdn.aaai.org/ojs/20267/20267-13-24280-1-2-20220628.pdf
362,Panini-Net: GAN Prior Based Degradation-Aware Feature Interpolation for Face Restoration,Computer Vision III,Yinhuai Wang;Yujie Hu;Jian Zhang;,Peking University;Pengcheng Laboratory;,China;,Technical,https://aaai.org/papers/02576-panini-net-gan-prior-based-degradation-aware-feature-interpolation-for-face-restoration/,https://cdn.aaai.org/ojs/20159/20159-13-24172-1-2-20220628.pdf
363,Patch Diffusion: A General Module for Face Manipulation Detection,Computer Vision III,Baogen Zhang;Sheng Li;Guorui Feng;Zhenxing Qian;Xinpeng Zhang;,Fudan University;Shanghai University;,China;,Technical,https://aaai.org/papers/03243-patch-diffusion-a-general-module-for-face-manipulation-detection/,https://cdn.aaai.org/ojs/20233/20233-13-24246-1-2-20220628.pdf
364,PetsGAN: Rethinking Priors for Single Image Generation,Computer Vision III,Zicheng Zhang;Yinglu Liu;Congying Han;Hailin Shi;Tiande Guo;Bowen Zhou;,University of Chinese Academy of Sciences;JD;,China;,Technical,https://aaai.org/papers/03408-petsgan-rethinking-priors-for-single-image-generation/,https://cdn.aaai.org/ojs/20251/20251-13-24264-1-2-20220628.pdf
365,Polygon-to-Polygon Distance Loss for Rotated Object Detection,Computer Vision III,Yang Yang;Jifeng Chen;Xiaopin Zhong;Yuanlong Deng;,Shenzhen University;,China;,Technical,https://aaai.org/papers/03072-polygon-to-polygon-distance-loss-for-rotated-object-detection/,https://cdn.aaai.org/ojs/20214/20214-13-24227-1-2-20220628.pdf
366,Pose-Guided Feature Disentangling for Occluded Person Re-identification Based on Transformer,Computer Vision III,Tao Wang;Hong Liu;Pinhao Song;Tianyu Guo;Wei Shi;,Peking University;,China;,Technical,https://aaai.org/papers/02540-pose-guided-feature-disentangling-for-occluded-person-re-identification-based-on-transformer/,https://cdn.aaai.org/ojs/20155/20155-13-24168-1-2-20220628.pdf
367,Pose-Invariant Face Recognition via Adaptive Angular Distillation,Computer Vision III,Zhenduo Zhang;Yongru Chen;Wenming Yang;Guijin Wang;Qingmin Liao;,Tsinghua University;,China;,Technical,https://aaai.org/papers/03390-pose-invariant-face-recognition-via-adaptive-angular-distillation/,https://cdn.aaai.org/ojs/20249/20249-13-24262-1-2-20220628.pdf
368,Privacy-Preserving Face Recognition in the Frequency Domain,Computer Vision III,Yinggui Wang;Jian Liu;Man Luo;Le Yang;Li Wang;,Ant Group;University of Canterbury;,China;New Zealand;,Technical,https://aaai.org/papers/02558-privacy-preserving-face-recognition-in-the-frequency-domain/,https://cdn.aaai.org/ojs/20157/20157-13-24170-1-2-20220628.pdf
369,Promoting Single-Modal Optical Flow Network for Diverse Cross-Modal Flow Estimation,Computer Vision III,Shili Zhou;Weimin Tan;Bo Yan;,Fudan University;,China;,Technical,https://aaai.org/papers/03562-promoting-single-modal-optical-flow-network-for-diverse-cross-modal-flow-estimation/,https://cdn.aaai.org/ojs/20268/20268-13-24281-1-2-20220628.pdf
370,Reliable Propagation-Correction Modulation for Video Object Segmentation,Computer Vision III,Xiaohao Xu;Jinglu Wang;Xiao Li;Yan Lu;,Huangzhong University of Science and Technology;Microsoft;,China;,Technical,https://aaai.org/papers/02946-reliable-propagation-correction-modulation-for-video-object-segmentation/,https://cdn.aaai.org/ojs/20200/20200-13-24213-1-2-20220628.pdf
371,ReMoNet: Recurrent Multi-Output Network for Efficient Video Denoising,Computer Vision III,Liuyu Xiang;Jundong Zhou;Jirui Liu;Zerun Wang;Haidong Huang;Jie Hu;Jungong Han;Yuchen Guo;Guiguang Ding;,Beijing National Research Center for Information Science and Technology;Tsinghua University;OPPO Inc;Aberystwyth University;,China;United Kingdom;,Technical,https://aaai.org/papers/02786-remonet-recurrent-multi-output-network-for-efficient-video-denoising/,https://cdn.aaai.org/ojs/20182/20182-13-24195-1-2-20220628.pdf
372,Rendering-Aware HDR Environment Map Prediction from a Single Image,Computer Vision III,Jun-Peng Xu;Chenyu Zuo;Fang-Lue Zhang;Miao Wang;,Beihang University;Xidian University;Victoria University of Wellington;Pengcheng Laboratory;,China;New Zealand;,Technical,https://aaai.org/papers/02857-rendering-aware-hdr-environment-map-prediction-from-a-single-image/,https://cdn.aaai.org/ojs/20190/20190-13-24203-1-2-20220628.pdf
