Index,Title,Session/Area,Authors,Affiliation,Country,Status,Proceeding URL,PDF URL
379,Proactive Privacy-preserving Learning for Retrieval,Computer Vision III,Peng-Fei Zhang;Zi Huang;Xin-Shun Xu;,University of Queensland;Shandong University;,Australia;China;,Technical,https://aaai.org/papers/03369-proactive-privacy-preserving-learning-for-retrieval/,https://cdn.aaai.org/ojs/16449/16449-13-19943-1-2-20210518.pdf
380,R3Det: Refined Single-Stage Detector with Feature Refinement for Rotating Object,Computer Vision III,Xue Yang;Junchi Yan;Ziming Feng;Tao He;,"Shanghai Jiao Tong University;China Merchants Bank;Anhui COWAROBOT CO., Ltd.;Anhui Provincial Key Laboratory of Multimodal Cognitive Computation;",China;,Technical,https://aaai.org/papers/03163-r3det-refined-single-stage-detector-with-feature-refinement-for-rotating-object/,https://cdn.aaai.org/ojs/16426/16426-13-19920-1-2-20210518.pdf
381,Region-aware Global Context Modeling for Automatic Nerve Segmentation from Ultrasound Images,Computer Vision III,Huisi Wu;Jiasheng Liu;Wei Wang;Zhenkun Wen;Jing Qin;,Shenzhen University;Hong Kong Polytechnic University;,China;,Technical,https://aaai.org/papers/02907-region-aware-global-context-modeling-for-automatic-nerve-segmentation-from-ultrasound-images/,https://cdn.aaai.org/ojs/16397/16397-13-19891-1-2-20210518.pdf
382,Regional Attention with Architecture-Rebuilt 3D Network for RGB-D  Gesture Recognition,Computer Vision III,Benjia Zhou;Yunan Li;Jun Wan;,Macau University of Science and Technology;Xidian University;Xi'an Key Laboratory of Big Data and Intelligent Vision;Chinese Academy of Sciences;University of Chinese Academy of Sciences;,China;,Technical,https://aaai.org/papers/03563-regional-attention-with-architecture-rebuilt-3d-network-for-rgb-d-gesture-recognition/,https://cdn.aaai.org/ojs/16471/16471-13-19965-1-2-20210518.pdf
383,RESA: Recurrent Feature-Shift Aggregator for Lane Detection,Computer Vision III,Tu Zheng;Hao Fang;Yi Zhang;Wenjian Tang;Zheng Yang;Haifeng Liu;Deng Cai;,Zhejiang University;Fabu Inc.;,China;,Technical,https://aaai.org/papers/03547-resa-recurrent-feature-shift-aggregator-for-lane-detection/,https://cdn.aaai.org/ojs/16469/16469-13-19963-1-2-20210518.pdf
384,Robust Lightweight Facial Expression Recognition Network with Label Distribution Training,Computer Vision III,Zengqun Zhao;Qingshan Liu;Feng Zhou;,Nanjing University of Information Science & Technology;,China;,Technical,https://aaai.org/papers/03510-robust-lightweight-facial-expression-recognition-network-with-label-distribution-training/,https://cdn.aaai.org/ojs/16465/16465-13-19959-1-2-20210518.pdf
385,Robust Multi-Modality Person Re-identification,Computer Vision III,Aihua Zheng;Zi Wang;Zihan Chen;Chenglong Li;Jin Tang;,Anhui University;,China;,Technical,https://aaai.org/papers/03529-robust-multi-modality-person-re-identification/,https://cdn.aaai.org/ojs/16467/16467-13-19961-1-2-20210518.pdf
386,Searching for Alignment in Face Recognition,Computer Vision III,Xiaqing Xu;Qiang Meng;Yunxiao Qin;Jianzhu Guo;Chenxu Zhao;Feng Zhou;Zhen Lei;,AIBEE;Northwestern Polytechnical University;Chinese Academy of Sciences;University of Chinese Academy of Sciences;Academy of Sciences;,China;,Technical,https://aaai.org/papers/03065-searching-for-alignment-in-face-recognition/,https://cdn.aaai.org/ojs/16415/16415-13-19909-1-2-20210518.pdf
387,Self-Domain Adaptation for Face Anti-Spoofing,Computer Vision III,Jingjing Wang;Jingyi Zhang;Ying Bian;Youyi Cai;Chunmao Wang;Shiliang Pu;,Hikvision Research Institute;,China;,Technical,https://aaai.org/papers/02746-self-domain-adaptation-for-face-anti-spoofing/,https://cdn.aaai.org/ojs/16379/16379-13-19873-1-2-20210518.pdf
388,Self-supervised Multi-view Stereo via Effective Co-Segmentation and Data-Augmentation,Computer Vision III,Hongbin Xu;Zhipeng Zhou;Yu Qiao;Wenxiong Kang;Qiuxia Wu;,Chinese Academy of Sciences;South China University of Technology;Shanghai AI Lab;,China;,Technical,https://aaai.org/papers/03030-self-supervised-multi-view-stereo-via-effective-co-segmentation-and-data-augmentation/,https://cdn.aaai.org/ojs/16411/16411-13-19905-1-2-20210518.pdf
389,Semantic Consistency Networks for 3D Object Detection,Computer Vision III,Wenwen Wei;Ping Wei;Nanning Zheng;,Xi'an Jiao Tong University;,China;,Technical,https://aaai.org/papers/02861-semantic-consistency-networks-for-3d-object-detection/,https://cdn.aaai.org/ojs/16392/16392-13-19886-1-2-20210518.pdf
390,Shape-Pose Ambiguity in Learning 3D Reconstruction from Images,Computer Vision III,Yunjie Wu;Zhengxing Sun;Youcheng Song;Yunhan Sun;YiJie Zhong;Jinlong Shi;,Nanjing University;Jiangsu University of Science and Technology;,China;,Technical,https://aaai.org/papers/02978-shape-pose-ambiguity-in-learning-3d-reconstruction-from-images/,https://cdn.aaai.org/ojs/16405/16405-13-19899-1-2-20210518.pdf
391,Simple and Effective Stochastic Neural Networks,Computer Vision III,Tianyuan Yu;Yongxin Yang;Da Li;Timothy Hospedales;Tao Xiang;,University of Surrey;University of Edinburgh;Samsung;,United Kingdom;,Technical,https://aaai.org/papers/03252-simple-and-effective-stochastic-neural-networks/,https://cdn.aaai.org/ojs/16436/16436-13-19930-1-2-20210518.pdf
392,Simple is not Easy: A Simple Strong Baseline for TextVQA and TextCaps,Computer Vision III,Qi Zhu;Chenyu Gao;Peng Wang;Qi Wu;,Northwestern Polytechnical University;University of Adelaide;,China;Australia;,Technical,https://aaai.org/papers/03608-simple-is-not-easy-a-simple-strong-baseline-for-textvqa-and-textcaps/,https://cdn.aaai.org/ojs/16476/16476-13-19970-1-2-20210518.pdf
393,SIMPLE: SIngle-network with Mimicking and Point Learning for Bottom-up Human Pose Estimation,Computer Vision III,Jiabin Zhang;Zheng Zhu;Jiwen Lu;Junjie Huang;Guan Huang;Jie Zhou;,"Chinese Academy of Sciences;Tsinghua University;XForwardAI Technology Co., Ltd;",China;,Technical,https://aaai.org/papers/03342-simple-single-network-with-mimicking-and-point-learning-for-bottom-up-human-pose-estimation/,https://cdn.aaai.org/ojs/16446/16446-13-19940-1-2-20210518.pdf
394,Sparse Single Sweep LiDAR Point Cloud Segmentation via Learning Contextual Shape Priors from Scene Completion,Computer Vision III,Xu Yan;Jiantao Gao;Jie Li;Ruimao Zhang;Zhen Li;Rui Huang;Shuguang Cui;,Chinese University of Hong Kong;Shenzhen Research Institute of Big Data;Shenzhen Institute of Artificial Intelligence and Robotics for Society;Shanghai University;,China;,Technical,https://aaai.org/papers/03101-sparse-single-sweep-lidar-point-cloud-segmentation-via-learning-contextual-shape-priors-from-scene-completion/,https://cdn.aaai.org/ojs/16419/16419-13-19913-1-2-20210518.pdf
395,SPIN: Structure-Preserving Inner Offset Network for Scene Text Recognition,Computer Vision III,Chengwei Zhang;Yunlu Xu;Zhanzhan Cheng;Shiliang Pu;Yi Niu;Fei Wu;Futai Zou;,Shanghai Jiao Tong University;Hikvision Research Institute;Zhejiang University;,China;,Technical,https://aaai.org/papers/03305-spin-structure-preserving-inner-offset-network-for-scene-text-recognition/,https://cdn.aaai.org/ojs/16442/16442-13-19936-1-2-20210518.pdf
396,Stereopagnosia: Fooling Stereo Networks with Adversarial Perturbations,Computer Vision III,Alex Wong;Mukund Mundhra;Stefano Soatto;,"University of California, Los Angeles;",United States;,Technical,https://aaai.org/papers/02879-stereopagnosia-fooling-stereo-networks-with-adversarial-perturbations/,https://cdn.aaai.org/ojs/16394/16394-13-19888-1-2-20210518.pdf
397,StrokeGAN: Reducing Mode Collapse in Chinese Font Generation via Stroke Encoding,Computer Vision III,Jinshan Zeng;Qi Chen;Yunxin Liu;Mingwen Wang;Yuan Yao;,Jiangxi Normal University;Hong Kong University of Science and Technology;,China;,Technical,https://aaai.org/papers/03270-strokegan-reducing-mode-collapse-in-chinese-font-generation-via-stroke-encoding/,https://cdn.aaai.org/ojs/16438/16438-13-19932-1-2-20210518.pdf
398,Structure-Consistent Weakly Supervised Salient Object Detection with Local Saliency Coherence,Computer Vision III,Siyue Yu;Bingfeng Zhang;Jimin Xiao;Eng Gee Lim;,Xi'an Jiao Tong-Liverpool University;,China;,Technical,https://aaai.org/papers/03234-structure-consistent-weakly-supervised-salient-object-detection-with-local-saliency-coherence/,https://cdn.aaai.org/ojs/16434/16434-13-19928-1-2-20210518.pdf
399,Teacher Guided Neural Architecture Search for Face Recognition,Computer Vision III,Xiaobo Wang;,Sangfor Technologies Inc.;Chinese Academy of Sciences;,China;,Technical,https://aaai.org/papers/02817-teacher-guided-neural-architecture-search-for-face-recognition/,https://cdn.aaai.org/ojs/16387/16387-13-19881-1-2-20210518.pdf
400,Temporal Relational Modeling with Self-Supervision for Action Segmentation,Computer Vision III,Dong Wang;Di Hu;Xingjian Li;Dejing Dou;,Northwestern Polytechnical University;Renmin University of China;Beijing Key Laboratory of Big Data Management and Analysis Methods;Baidu;,China;,Technical,https://aaai.org/papers/02729-temporal-relational-modeling-with-self-supervision-for-action-segmentation/,https://cdn.aaai.org/ojs/16377/16377-13-19871-1-2-20210518.pdf
401,Towards Robust Visual Information Extraction in Real World: New Dataset and Novel Solution,Computer Vision III,Jiapeng Wang;Chongyu Liu;Lianwen  Jin;Guozhi Tang;Jiaxin Zhang;Shuaitao Zhang;Qianying Wang;Yaqiang Wu;Mingxiang Cai;,South China University of Technology;Lenovo;Xi'an Jiao Tong University;,China;,Technical,https://aaai.org/papers/02738-towards-robust-visual-information-extraction-in-real-world-new-dataset-and-novel-solution/,https://cdn.aaai.org/ojs/16378/16378-13-19872-1-2-20210518.pdf
402,Universal Adversarial Perturbations Through the Lens of Deep Steganography: Towards a Fourier Perspective,Computer Vision III,Chaoning Zhang;Philipp Benz;Adil Karjauv;In So Kweon;,Korea Advanced Institute of Science and Technology;,South Korea;,Technical,https://aaai.org/papers/03296-universal-adversarial-perturbations-through-the-lens-of-deep-steganography-towards-a-fourier-perspective/,https://cdn.aaai.org/ojs/16441/16441-13-19935-1-2-20210518.pdf
403,Unsupervised 3D Learning for Shape Analysis via Multiresolution Instance Discrimination,Computer Vision III,Peng-Shuai Wang;Yu-Qi Yang;Qian-Fang Zou;Zhirong Wu;Yang Liu;Xin Tong;,Microsoft;Tsinghua University;University of Science and Technology of China;,China;,Technical,https://aaai.org/papers/02773-unsupervised-3d-learning-for-shape-analysis-via-multiresolution-instance-discrimination/,https://cdn.aaai.org/ojs/16382/16382-13-19876-1-2-20210518.pdf
404,Unsupervised Domain Adaptation for Person Re-identification via Heterogeneous Graph Alignment,Computer Vision III,Minying Zhang;Kai Liu;Yidong Li;Shihui Guo;Hongtao Duan;Yimin Long;Yi Jin;,Alibaba Group;Beijing Jiao Tong University;Xiamen University;,China;,Technical,https://aaai.org/papers/03360-unsupervised-domain-adaptation-for-person-re-identification-via-heterogeneous-graph-alignment/,https://cdn.aaai.org/ojs/16448/16448-13-19942-1-2-20210518.pdf
405,Very Important Person Localization in Unconstrained Conditions: A New Benchmark,Computer Vision III,Xiao Wang;Zheng Wang;Toshihiko Yamasaki;Wenjun Zeng;,Wuhan University of Science and Technology;University of Tokyo;Microsoft;,China;Japan;,Technical,https://aaai.org/papers/02809-very-important-person-localization-in-unconstrained-conditions-a-new-benchmark/,https://cdn.aaai.org/ojs/16386/16386-13-19880-1-2-20210518.pdf
406,Visual Tracking via Hierarchical Deep Reinforcement Learning,Computer Vision III,Dawei Zhang;Zhonglong Zheng;Riheng Jia;Minglu Li;,Zhejiang Normal University;Shanghai Jiao Tong University;,China;,Technical,https://aaai.org/papers/03315-visual-tracking-via-hierarchical-deep-reinforcement-learning/,https://cdn.aaai.org/ojs/16443/16443-13-19937-1-2-20210518.pdf
407,Weakly Supervised Deep Hyperspherical Quantization for Image Retrieval,Computer Vision III,Jinpeng Wang;Bin Chen;Qiang Zhang;Zaiqiao Meng;Shangsong Liang;Shutao Xia;,Tsinghua University;Sun Yat-sen University;University College London;University of Cambridge;,China;United Kingdom;,Technical,https://aaai.org/papers/02755-weakly-supervised-deep-hyperspherical-quantization-for-image-retrieval/,https://cdn.aaai.org/ojs/16380/16380-13-19874-1-2-20210518.pdf
408,Weakly Supervised Semantic Segmentation for Large-Scale Point Cloud,Computer Vision III,Yachao Zhang;Zonghao Li;Yuan Xie;Yanyun Qu;Cuihua Li;Tao Mei;,Xiamen University;East China Normal University;JD;,China;,Technical,https://aaai.org/papers/03421-weakly-supervised-semantic-segmentation-for-large-scale-point-cloud/,https://cdn.aaai.org/ojs/16455/16455-13-19949-1-2-20210518.pdf
409,A SAT-based Resolution of Lam’s Problem,Constraint Satisfaction and Optimization,Curtis Bright;Kevin K. H. Cheung;Brett Stevens;Ilias Kotsireas;Vijay Ganesh;,University of Windsor;Carleton University;Wilfrid Laurier University;University of Waterloo;,Canada;,Technical,https://aaai.org/papers/03669-a-sat-based-resolution-of-lam-s-problem/,https://cdn.aaai.org/ojs/16483/16483-13-19977-1-2-20210518.pdf
410,A Scalable Two Stage Approach to Computing Optimal Decision Sets,Constraint Satisfaction and Optimization,Alexey Ignatiev;Edward Lam;Peter J. Stuckey;Joao Marques-Silva;,Monash University;CSIRO Data61;ANITI;,Australia;France;,Technical,https://aaai.org/papers/03806-a-scalable-two-stage-approach-to-computing-optimal-decision-sets/,https://cdn.aaai.org/ojs/16498/16498-13-19992-1-2-20210518.pdf
411,A Sharp Leap from Quantified Boolean Formula to Stochastic Boolean Satisfiability Solving,Constraint Satisfaction and Optimization,Pei-Wei Chen;Yu-Ching Huang;Jie-Hong R. Jiang;,National Taiwan University;,China;,Technical,https://aaai.org/papers/03697-a-sharp-leap-from-quantified-boolean-formula-to-stochastic-boolean-satisfiability-solving/,https://cdn.aaai.org/ojs/16486/16486-13-19980-1-2-20210518.pdf
412,An Improved Upper Bound for SAT,Constraint Satisfaction and Optimization,Huairui Chu;Mingyu Xiao;Zhe Zhang;,University of Electronic Science and Technology of China;,China;,Technical,https://aaai.org/papers/03707-an-improved-upper-bound-for-sat/,https://cdn.aaai.org/ojs/16487/16487-13-19981-1-2-20210518.pdf
413,Backdoor Decomposable Monotone Circuits and Propagation Complete Encodings,Constraint Satisfaction and Optimization,Petr Kučera;Petr Savický;,"Charles University;Czech Academy of Sciences, Institute of Computer Science;",Czech Republic;,Technical,https://aaai.org/papers/03832-backdoor-decomposable-monotone-circuits-and-propagation-complete-encodings/,https://cdn.aaai.org/ojs/16501/16501-13-19995-1-2-20210518.pdf
414,Binary Matrix Factorisation via Column Generation,Constraint Satisfaction and Optimization,Reka A. Kovacs;Oktay Gunluk;Raphael A. Hauser;,University of Oxford;Cornell University;,United Kingdom;United States;,Technical,https://aaai.org/papers/03823-binary-matrix-factorisation-via-column-generation/,https://cdn.aaai.org/ojs/16500/16500-13-19994-1-2-20210518.pdf
415,Certifying Parity Reasoning Efficiently Using Pseudo-Boolean Proofs,Constraint Satisfaction and Optimization,Stephan Gocht;Jakob Nordström;,Lund University;University of Copenhagen;,Sweden;Denmark;,Technical,https://aaai.org/papers/03768-certifying-parity-reasoning-efficiently-using-pseudo-boolean-proofs/,https://cdn.aaai.org/ojs/16494/16494-13-19988-1-2-20210518.pdf
416,Combining Reinforcement Learning and Constraint Programming for Combinatorial Optimization,Constraint Satisfaction and Optimization,Quentin Cappart;Thierry Moisan;Louis-Martin Rousseau;Isabeau Prémont-Schwarz;Andre A. Cire;,Ecole Polytechnique de Montréal;Element AI;University of Toronto Scarborough;,Canada;,Technical,https://aaai.org/papers/03677-combining-reinforcement-learning-and-constraint-programming-for-combinatorial-optimization/,https://cdn.aaai.org/ojs/16484/16484-13-19978-1-2-20210518.pdf
417,Counting Maximal Satisfiable Subsets,Constraint Satisfaction and Optimization,Jaroslav Bendík;Kuldeep S. Meel;,Masaryk University;National University of Singapore;,Czech Republic;Singapore;,Technical,https://aaai.org/papers/03651-counting-maximal-satisfiable-subsets/,https://cdn.aaai.org/ojs/16481/16481-13-19975-1-2-20210518.pdf
418,Cutting to the Core of Pseudo-Boolean Optimization: Combining Core-Guided Search with Cutting Planes Reasoning,Constraint Satisfaction and Optimization,Jo Devriendt;Stephan Gocht;Emir Demirović;Jakob Nordström;Peter J. Stuckey;,Lund University;University of Copenhagen;KU Leuven;Delft University of Technology;Monash University;,Sweden;Denmark;Belgium;Netherlands;Australia;,Technical,https://aaai.org/papers/03750-cutting-to-the-core-of-pseudo-boolean-optimization-combining-core-guided-search-with-cutting-planes-reasoning/,https://cdn.aaai.org/ojs/16492/16492-13-19986-1-2-20210518.pdf
419,Dependency Stochastic Boolean Satisfiability: A Logical Formalism for NEXPTIME Decision Problems with Uncertainty,Constraint Satisfaction and Optimization,Nian-Ze Lee;Jie-Hong R. Jiang;,National Taiwan University;,China;,Technical,https://aaai.org/papers/03877-dependency-stochastic-boolean-satisfiability-a-logical-formalism-for-nexptime-decision-problems-with-uncertainty/,https://cdn.aaai.org/ojs/16506/16506-13-20000-1-2-20210518.pdf
420,Disjunctive Temporal Problems under Structural Restrictions,Constraint Satisfaction and Optimization,Konrad K Dabrowski;Peter Jonsson;Sebastian Ordyniak;George Osipov;,Durham University;Linköping University;University of Leeds;,United Kingdom;Sweden;,Technical,https://aaai.org/papers/03724-disjunctive-temporal-problems-under-structural-restrictions/,https://cdn.aaai.org/ojs/16489/16489-13-19983-1-2-20210518.pdf
421,"Finding Diverse Trees, Paths, and More",Constraint Satisfaction and Optimization,Tesshu Hanaka;Yasuaki Kobayashi;Kazuhiro Kurita;Yota Otachi;,Chuo University;Kyoto University;National Institute of Informatics;Nagoya University;,Japan;,Technical,https://aaai.org/papers/03778-finding-diverse-trees-paths-and-more/,https://cdn.aaai.org/ojs/16495/16495-13-19989-1-2-20210518.pdf
422,Integrated Optimization of Bipartite Matching and Its Stochastic Behavior: New Formulation and Approximation Algorithm via Min-cost Flow Optimization,Constraint Satisfaction and Optimization,Yuya Hikima;Yasunori Akagi;Hideaki Kim;Masahiro Kohjima;Takeshi Kurashima;Hiroyuki Toda;,NTT Corporation;,Japan;,Technical,https://aaai.org/papers/03796-integrated-optimization-of-bipartite-matching-and-its-stochastic-behavior-new-formulation-and-approximation-algorithm-via-min-cost-flow-optimization/,https://cdn.aaai.org/ojs/16497/16497-13-19991-1-2-20210518.pdf
423,LCollision: Fast Generation of Collision-Free Human Poses using Learned Non-Penetration Constraints,Constraint Satisfaction and Optimization,Qingyang Tan;Zherong Pan;Dinesh Manocha;,University of Maryland;University of Illinois Urbana-Champaign;,United States;,Technical,https://aaai.org/papers/03913-lcollision-fast-generation-of-collision-free-human-poses-using-learned-non-penetration-constraints/,https://cdn.aaai.org/ojs/16510/16510-13-20004-1-2-20210518.pdf
424,Learning To Scale Mixed-Integer Programs,Constraint Satisfaction and Optimization,Timo Berthold;Gregor Hendel;,Fair Isaac Corporation;,Germany;,Technical,https://aaai.org/papers/03661-learning-to-scale-mixed-integer-programs/,https://cdn.aaai.org/ojs/16482/16482-13-19976-1-2-20210518.pdf
425,Necessary and Sufficient Conditions for Avoiding Reopenings in Best First Suboptimal Search with General Bounding Functions,Constraint Satisfaction and Optimization,Jingwei Chen;Nathan R. Sturtevant;,University of Alberta;,Canada;,Technical,https://aaai.org/papers/03688-necessary-and-sufficient-conditions-for-avoiding-reopenings-in-best-first-suboptimal-search-with-general-bounding-functions/,https://cdn.aaai.org/ojs/16485/16485-13-19979-1-2-20210518.pdf
426,New Length Dependent Algorithm for Maximum Satisfiability Problem,Constraint Satisfaction and Optimization,Vasily Alferov;Ivan Bliznets;,JetBrains;Higher School of Economics;Steklov Mathematical Institute of Russian Academy of Sciences;,Cyprus;Russian Federation;,Technical,https://aaai.org/papers/03634-new-length-dependent-algorithm-for-maximum-satisfiability-problem/,https://cdn.aaai.org/ojs/16479/16479-13-19973-1-2-20210518.pdf
427,On Continuous Local BDD-Based Search for Hybrid SAT Solving,Constraint Satisfaction and Optimization,Anastasios Kyrillidis;Moshe Vardi;Zhiwei Zhang;,Rice University;,United States;,Technical,https://aaai.org/papers/03841-on-continuous-local-bdd-based-search-for-hybrid-sat-solving/,https://cdn.aaai.org/ojs/16502/16502-13-19996-1-2-20210518.pdf
428,Online Search with Maximum Clearance,Constraint Satisfaction and Optimization,Spyros Angelopoulos;Malachi Voss;,Centre National de la Recherche Scientifique;Sorbonne Université;Ecole Normale Supérieure;,France;,Technical,https://aaai.org/papers/03642-online-search-with-maximum-clearance/,https://cdn.aaai.org/ojs/16480/16480-13-19974-1-2-20210518.pdf
429,Optimal Decision Trees for Nonlinear Metrics,Constraint Satisfaction and Optimization,Emir Demirović;Peter J. Stuckey;,Delft University of Technology;Monash University;,Netherlands;Australia;,Technical,https://aaai.org/papers/03733-optimal-decision-trees-for-nonlinear-metrics/,https://cdn.aaai.org/ojs/16490/16490-13-19984-1-2-20210518.pdf
430,Optimising Automatic Calibration of Electric Muscle Stimulation,Constraint Satisfaction and Optimization,Graeme Gange;Jarrod Knibbe;,Monash University;University of Melbourne;,Australia;,Technical,https://aaai.org/papers/03759-optimising-automatic-calibration-of-electric-muscle-stimulation/,https://cdn.aaai.org/ojs/16493/16493-13-19987-1-2-20210518.pdf
431,Parallel Constraint Acquisition,Constraint Satisfaction and Optimization,Nadjib Lazaar;,University of Montpellier;,France;,Technical,https://aaai.org/papers/03860-parallel-constraint-acquisition/,https://cdn.aaai.org/ojs/16504/16504-13-19998-1-2-20210518.pdf
432,Parameterizing Branch-and-Bound Search Trees to Learn Branching Policies,Constraint Satisfaction and Optimization,Giulia Zarpellon;Jason Jo;Andrea Lodi;Yoshua Bengio;,Polytechnique Montréal;Mila;Université de Montréal;,Canada;,Technical,https://aaai.org/papers/03931-parameterizing-branch-and-bound-search-trees-to-learn-branching-policies/,https://cdn.aaai.org/ojs/16512/16512-13-20006-1-2-20210518.pdf
433,SAT-based Decision Tree Learning for Large Data Sets,Constraint Satisfaction and Optimization,Andre Schidler;Stefan Szeider;,TU Wien;,Austria;,Technical,https://aaai.org/papers/03904-sat-based-decision-tree-learning-for-large-data-sets/,https://cdn.aaai.org/ojs/16509/16509-13-20003-1-2-20210518.pdf
434,Satisfiability and Algorithms for Non-uniform Random k-SAT,Constraint Satisfaction and Optimization,Oleksii Omelchenko;Andrei Bulatov;,Simon Fraser University;,Canada;,Technical,https://aaai.org/papers/03886-satisfiability-and-algorithms-for-non-uniform-random-k-sat/,https://cdn.aaai.org/ojs/16507/16507-13-20001-1-2-20210518.pdf
435,Scalable Verification of Quantized Neural Networks,Constraint Satisfaction and Optimization,Thomas A. Henzinger;Mathias Lechner;Đorđe Žikelić;,Institute of Science and Technology Austria;,Austria;,Technical,https://aaai.org/papers/03787-scalable-verification-of-quantized-neural-networks/,https://cdn.aaai.org/ojs/16496/16496-13-19990-1-2-20210518.pdf
436,Smooth Convex Optimization Using Sub-Zeroth-Order Oracles,Constraint Satisfaction and Optimization,Mustafa O. Karabag;Cyrus Neary;Ufuk Topcu;,University of Texas at Austin;,United States;,Technical,https://aaai.org/papers/03815-smooth-convex-optimization-using-sub-zeroth-order-oracles/,https://cdn.aaai.org/ojs/16499/16499-13-19993-1-2-20210518.pdf
437,Solving Infinite-Domain CSPs Using the Patchwork Property,Constraint Satisfaction and Optimization,Konrad K Dabrowski;Peter Jonsson;Sebastian Ordyniak;George Osipov;,Durham University;Linköping University;University of Leeds;,United Kingdom;Sweden;,Technical,https://aaai.org/papers/03715-solving-infinite-domain-csps-using-the-patchwork-property/,https://cdn.aaai.org/ojs/16488/16488-13-19982-1-2-20210518.pdf
438,Symmetric Component Caching for Model Counting on Combinatorial Instances,Constraint Satisfaction and Optimization,Timothy van Bremen;Vincent Derkinderen;Shubham Sharma;Subhajit Roy;Kuldeep S. Meel;,Katholieke Universiteit Leuven;Nutanix Software India Pvt. Ltd.;Indian Institute of Technology Kanpur;National University of Singapore;,Belgium;India;Singapore;,Technical,https://aaai.org/papers/03922-symmetric-component-caching-for-model-counting-on-combinatorial-instances/,https://cdn.aaai.org/ojs/16511/16511-13-20005-1-2-20210518.pdf
439,Teaching the Old Dog New Tricks: Supervised Learning with Constraints,Constraint Satisfaction and Optimization,Fabrizio Detassis;Michele Lombardi;Michela Milano;,University of Bologna;Alma Mater Research Institute;,Italy;;,Technical,https://aaai.org/papers/03742-teaching-the-old-dog-new-tricks-supervised-learning-with-constraints/,https://cdn.aaai.org/ojs/16491/16491-13-19985-1-2-20210518.pdf
440,The Power of Literal Equivalence in Model Counting,Constraint Satisfaction and Optimization,Yong Lai;Kuldeep S. Meel;Roland H. C. Yap;,Jilin University;National University of Singapore;,China;Singapore;,Technical,https://aaai.org/papers/03851-the-power-of-literal-equivalence-in-model-counting/,https://cdn.aaai.org/ojs/16503/16503-13-19997-1-2-20210518.pdf
441,Towards More Practical and Efficient Automatic Dominance Breaking,Constraint Satisfaction and Optimization,Jimmy H.M. Lee;Allen Z. Zhong;,Chinese University of Hong Kong;,China;,Technical,https://aaai.org/papers/03868-towards-more-practical-and-efficient-automatic-dominance-breaking/,https://cdn.aaai.org/ojs/16505/16505-13-19999-1-2-20210518.pdf
