Index,Title,Session/Area,Authors,Affiliation,Country,Status,Proceeding URL,PDF URL
1013,Regularization Penalty Optimization for Addressing Data Quality Variance in OoD Algorithms,Machine Learning III,Runpeng Yu;Hong Zhu;Kaican Li;Lanqing Hong;Rui Zhang;Nanyang Ye;Shao-Lun Huang;Xiuqiang He;,Tsinghua University;Huawei;Shanghai Jiao Tong University;,China;,Technical,https://aaai.org/papers/08945-regularization-penalty-optimization-for-addressing-data-quality-variance-in-ood-algorithms/,https://cdn.aaai.org/ojs/20877/20877-13-24890-1-2-20220628.pdf
1014,Reinforcement Learning Augmented Asymptotically Optimal Index Policy for Finite-Horizon Restless Bandits,Machine Learning III,Guojun Xiong;Jian Li;Rahul Singh;,Binghamton University;Indian Institute of Science;,United States;India;,Technical,https://aaai.org/papers/08726-reinforcement-learning-augmented-asymptotically-optimal-index-policy-for-finite-horizon-restless-bandits/,https://cdn.aaai.org/ojs/20852/20852-13-24865-1-2-20220628.pdf
1015,Rethinking Influence Functions of Neural Networks in the Over-Parameterized Regime,Machine Learning III,Rui Zhang;Shihua Zhang;,Chinese Academy of Sciences;University of Chinese Academy of Sciences;,China;,Technical,https://aaai.org/papers/09082-rethinking-influence-functions-of-neural-networks-in-the-over-parameterized-regime/,https://cdn.aaai.org/ojs/20893/20893-13-24906-1-2-20220628.pdf
1016,Reward-Weighted Regression Converges to a Global Optimum,Machine Learning III,Miroslav Štrupl;Francesco Faccio;Dylan R. Ashley;Rupesh Kumar Srivastava;Jürgen Schmidhuber;,Universit à della Svizzera italiana (USI);NNAISENSE;King Abdullah University of Science and Technology;,Switzerland;Saudi Arabia;,Technical,https://aaai.org/papers/08361-reward-weighted-regression-converges-to-a-global-optimum/,https://cdn.aaai.org/ojs/20811/20811-13-24824-1-2-20220628.pdf
1017,Robust Action Gap Increasing with Clipped Advantage Learning,Machine Learning III,Zhe Zhang;Yaozhong Gan;Xiaoyang Tan;,Nanjing University of Aeronautics and Astronautics;MIIT;,China;,Technical,https://aaai.org/papers/09145-robust-action-gap-increasing-with-clipped-advantage-learning/,https://cdn.aaai.org/ojs/20900/20900-13-24913-1-2-20220628.pdf
1018,Robust Optimal Classification Trees against Adversarial Examples,Machine Learning III,Daniël Vos;Sicco Verwer;,Delft University of Technology;,Netherlands;,Technical,https://aaai.org/papers/08520-robust-optimal-classification-trees-against-adversarial-examples/,https://cdn.aaai.org/ojs/20829/20829-13-24842-1-2-20220628.pdf
1019,SAIL: Self-Augmented Graph Contrastive Learning,Machine Learning III,Lu Yu;Shichao Pei;Lizhong Ding;Jun Zhou;Longfei Li;Chuxu Zhang;Xiangliang Zhang;,King Abdullah University of Science and Technology;Inception Institute of Artificial Intelligence;Ant Group;Brandeis University;University of Notre Dame;,Saudi Arabia;China;United States;,Technical,https://aaai.org/papers/08927-sail-self-augmented-graph-contrastive-learning/,https://cdn.aaai.org/ojs/20875/20875-13-24888-1-2-20220628.pdf
1020,Sample-Efficient Reinforcement Learning via Conservative Model-Based Actor-Critic,Machine Learning III,Zhihai Wang;Jie Wang;Qi Zhou;Bin Li;Houqiang Li;,University of Science and Technology of China;Hefei Comprehensive National Science Center;,China;,Technical,https://aaai.org/papers/08612-sample-efficient-reinforcement-learning-via-conservative-model-based-actor-critic/,https://cdn.aaai.org/ojs/20839/20839-13-24852-1-2-20220628.pdf
1021,Scaling Up Influence Functions,Machine Learning III,Andrea Schioppa;Polina Zablotskaia;David Vilar;Artem Sokolov;,Google;,United States;,Technical,https://aaai.org/papers/08179-scaling-up-influence-functions/,https://cdn.aaai.org/ojs/20791/20791-13-24804-1-2-20220628.pdf
1022,Seizing Critical Learning Periods in Federated Learning,Machine Learning III,Gang Yan;Hao Wang;Jian Li;,Binghamton University;Louisiana State University;,United States;,Technical,https://aaai.org/papers/08788-seizing-critical-learning-periods-in-federated-learning/,https://cdn.aaai.org/ojs/20859/20859-13-24872-1-2-20220628.pdf
1023,Self-Adaptive Imitation Learning: Learning Tasks with Delayed Rewards from Sub-optimal Demonstrations,Machine Learning III,Zhuangdi Zhu;Kaixiang Lin;Bo Dai;Jiayu Zhou;,Michigan State University;Google;,United States;,Technical,https://aaai.org/papers/09269-self-adaptive-imitation-learning-learning-tasks-with-delayed-rewards-from-sub-optimal-demonstrations/,https://cdn.aaai.org/ojs/20914/20914-13-24927-1-2-20220628.pdf
1024,Shape Prior Guided Attack: Sparser Perturbations on 3D Point Clouds,Machine Learning III,Zhenbo Shi;Zhi Chen;Zhenbo Xu;Wei Yang;Zhidong Yu;Liusheng Huang;,University of Science and Technology of China;Beihang University;,China;,Technical,https://aaai.org/papers/08277-shape-prior-guided-attack-sparser-perturbations-on-3d-point-clouds/,https://cdn.aaai.org/ojs/20802/20802-13-24815-1-2-20220628.pdf
1025,SimSR: Simple Distance-Based State Representations for Deep Reinforcement Learning,Machine Learning III,Hongyu Zang;Xin Li;Mingzhong Wang;,Beijing Institute of Technology;University of the Sunshine Coast;,China;Australia;,Technical,https://aaai.org/papers/08997-simsr-simple-distance-based-state-representations-for-deep-reinforcement-learning/,https://cdn.aaai.org/ojs/20883/20883-13-24896-1-2-20220628.pdf
1026,SMINet: State-Aware Multi-Aspect Interests Representation Network for Cold-Start Users Recommendation,Machine Learning III,Wanjie Tao;Yu Li;Liangyue Li;Zulong Chen;Hong Wen;Peilin Chen;Tingting Liang;Quan Lu;,Alibaba Group;Hangzhou Dianzi University;,China;,Technical,https://aaai.org/papers/08476-sminet-state-aware-multi-aspect-interests-representation-network-for-cold-start-users-recommendation/,https://cdn.aaai.org/ojs/20824/20824-13-24837-1-2-20220628.pdf
1027,"Spline-PINN: Approaching PDEs without Data Using Fast, Physics-Informed Hermite-Spline CNNs",Machine Learning III,Nils Wandel;Michael Weinmann;Michael Neidlin;Reinhard Klein;,University of Bonn;Delft University of Technology;RWTH Aachen University;,Germany;Netherlands;,Technical,https://aaai.org/papers/08529-spline-pinn-approaching-pdes-without-data-using-fast-physics-informed-hermite-spline-cnns/,https://cdn.aaai.org/ojs/20830/20830-13-24843-1-2-20220628.pdf
1028,SplitFed: When Federated Learning Meets Split Learning,Machine Learning III,Chandra Thapa;Pathum Chamikara Mahawaga Arachchige;Seyit Camtepe;Lichao Sun;,CSIRO Data61;Lehigh University;,Australia;United States;,Technical,https://aaai.org/papers/08485-splitfed-when-federated-learning-meets-split-learning/,https://cdn.aaai.org/ojs/20825/20825-13-24838-1-2-20220628.pdf
1029,Stackelberg Actor-Critic: Game-Theoretic Reinforcement Learning Algorithms,Machine Learning III,Liyuan Zheng;Tanner Fiez;Zane Alumbaugh;Benjamin Chasnov;Lillian J. Ratliff;,"University of Washington;University of California, Santa Cruz;",United States;,Technical,https://aaai.org/papers/09217-stackelberg-actor-critic-game-theoretic-reinforcement-learning-algorithms/,https://cdn.aaai.org/ojs/20908/20908-13-24921-1-2-20220628.pdf
1030,Stage Conscious Attention Network (SCAN): A Demonstration-Conditioned Policy for Few-Shot Imitation,Machine Learning III,Jia-Fong Yeh;Chi-Ming Chung;Hung-Ting Su;Yi-Ting Chen;Winston H. Hsu;,National Taiwan University;National Yang Ming Chiao Tung University;Mobile Drive Technology;,China;;,Technical,https://aaai.org/papers/08866-stage-conscious-attention-network-scan-a-demonstration-conditioned-policy-for-few-shot-imitation/,https://cdn.aaai.org/ojs/20868/20868-13-24881-1-2-20220628.pdf
1031,State Deviation Correction for Offline Reinforcement Learning,Machine Learning III,Hongchang Zhang;Jianzhun Shao;Yuhang Jiang;Shuncheng He;Guanwen Zhang;Xiangyang Ji;,Tsinghua University;Northwestern Polytechnical University;,China;,Technical,https://aaai.org/papers/09022-state-deviation-correction-for-offline-reinforcement-learning/,https://cdn.aaai.org/ojs/20886/20886-13-24899-1-2-20220628.pdf
1032,Structural Landmarking and Interaction Modelling: A “SLIM” Network for Graph Classification,Machine Learning III,Yaokang Zhu;Kai Zhang;Jun Wang;Haibin Ling;Jie Zhang;Hongyuan Zha;,East China Normal University;Stony Brook University;Fudan University;Chinese University of Hong Kong;,China;United States;,Technical,https://aaai.org/papers/09251-structural-landmarking-and-interaction-modelling-a-slim-network-for-graph-classification/,https://cdn.aaai.org/ojs/20912/20912-13-24925-1-2-20220628.pdf
1033,Structure Learning-Based Task Decomposition for Reinforcement Learning in Non-stationary Environments,Machine Learning III,Honguk Woo;Gwangpyo Yoo;Minjong Yoo;,Sungkyunkwan University;,South Korea;,Technical,https://aaai.org/papers/08657-structure-learning-based-task-decomposition-for-reinforcement-learning-in-non-stationary-environments/,https://cdn.aaai.org/ojs/20844/20844-13-24857-1-2-20220628.pdf
1034,Symbolic Brittleness in Sequence Models: On Systematic Generalization in Symbolic Mathematics,Machine Learning III,Sean Welleck;Peter West;Jize Cao;Yejin Choi;,University of Washington;Allen Institute for Artificial Intelligence;,United States;,Technical,https://aaai.org/papers/08629-symbolic-brittleness-in-sequence-models-on-systematic-generalization-in-symbolic-mathematics/,https://cdn.aaai.org/ojs/20841/20841-13-24854-1-2-20220628.pdf
1035,Tailor Versatile Multi-Modal Learning for Multi-Label Emotion Recognition,Machine Learning III,Yi Zhang;Mingyuan Chen;Jundong Shen;Chongjun Wang;,Nanjing University;,China;,Technical,https://aaai.org/papers/09100-tailor-versatile-multi-modal-learning-for-multi-label-emotion-recognition/,https://cdn.aaai.org/ojs/20895/20895-13-24908-1-2-20220628.pdf
1036,Towards Off-Policy Learning for Ranking Policies with Logged Feedback,Machine Learning III,Teng Xiao;Suhang Wang;,Pennsylvania State University;,United States;,Technical,https://aaai.org/papers/08700-towards-off-policy-learning-for-ranking-policies-with-logged-feedback/,https://cdn.aaai.org/ojs/20849/20849-13-24862-1-2-20220628.pdf
1037,Training a Resilient Q-network against Observational Interference,Machine Learning III,Chao-Han Huck Yang;I-Te Danny Hung;Yi Ouyang;Pin-Yu Chen;,Georgia Institute of Technology;Columbia University;Preferred Networks America;IBM;,United States;,Technical,https://aaai.org/papers/08814-training-a-resilient-q-network-against-observational-interference/,https://cdn.aaai.org/ojs/20862/20862-13-24875-1-2-20220628.pdf
1038,TRF: Learning Kernels with Tuned Random Features,Machine Learning III,Alistair Shilton;Sunil Gupta;Santu Rana;Arun Kumar Venkatesh;Svetha Venkatesh;,Deakin University;,Australia;,Technical,https://aaai.org/papers/08286-trf-learning-kernels-with-tuned-random-features/,https://cdn.aaai.org/ojs/20803/20803-13-24816-1-2-20220628.pdf
1039,TS2Vec: Towards Universal Representation of Time Series,Machine Learning III,Zhihan Yue;Yujing Wang;Juanyong Duan;Tianmeng Yang;Congrui Huang;Yunhai Tong;Bixiong Xu;,Peking University;Microsoft;,China;United States;,Technical,https://aaai.org/papers/08980-ts2vec-towards-universal-representation-of-time-series/,https://cdn.aaai.org/ojs/20881/20881-13-24894-1-2-20220628.pdf
1040,Unsupervised Learning of Compositional Scene Representations from Multiple Unspecified Viewpoints,Machine Learning III,Jinyang Yuan;Bin Li;Xiangyang Xue;,Fudan University;,China;,Technical,https://aaai.org/papers/08971-unsupervised-learning-of-compositional-scene-representations-from-multiple-unspecified-viewpoints/,https://cdn.aaai.org/ojs/20880/20880-13-24893-1-2-20220628.pdf
1041,Well-Classified Examples Are Underestimated in Classification with Deep Neural Networks,Machine Learning III,Guangxiang Zhao;Wenkai Yang;Xuancheng Ren;Lei Li;Yunfang Wu;Xu Sun;,Peking University;Beijing Academy of Artificial Intelligence;,China;,Technical,https://aaai.org/papers/09180-well-classified-examples-are-underestimated-in-classification-with-deep-neural-networks/,https://cdn.aaai.org/ojs/20904/20904-13-24917-1-2-20220628.pdf
1042,What about Inputting Policy in Value Function: Policy Representation and Policy-Extended Value Function Approximator,Machine Learning III,Hongyao Tang;Zhaopeng Meng;Jianye Hao;Chen Chen;Daniel Graves;Dong Li;Changmin Yu;Hangyu Mao;Wulong Liu;Yaodong Yang;Wenyuan Tao;Li Wang;,Tianjin University;Huawei;University College London;,China;United Kingdom;,Technical,https://aaai.org/papers/08441-what-about-inputting-policy-in-value-function-policy-representation-and-policy-extended-value-function-approximator/,https://cdn.aaai.org/ojs/20820/20820-13-24833-1-2-20220628.pdf
1043,"With False Friends Like These, Who Can Notice Mistakes?",Machine Learning III,Lue Tao;Lei Feng;Jinfeng Yi;Songcan Chen;,Nanjing University of Aeronautics and Astronautics;MIIT;Chongqing University;JD;,China;,Technical,https://aaai.org/papers/08458-with-false-friends-like-these-who-can-notice-mistakes/,https://cdn.aaai.org/ojs/20822/20822-13-24835-1-2-20220628.pdf
1044,A Deeper Understanding of State-Based Critics in Multi-Agent Reinforcement Learning,Multiagent Systems,Xueguang Lyu;Andrea Baisero;Yuchen Xiao;Christopher Amato;,Northeastern University;,United States;,Technical,https://aaai.org/papers/09396-a-deeper-understanding-of-state-based-critics-in-multi-agent-reinforcement-learning/,https://cdn.aaai.org/ojs/21171/21171-13-25184-1-2-20220628.pdf
1045,Anytime Multi-Agent Path Finding via Machine Learning-Guided Large Neighborhood Search,Multiagent Systems,Taoan Huang;Jiaoyang Li;Sven Koenig;Bistra Dilkina;,University of Southern California;,United States;,Technical,https://aaai.org/papers/09368-anytime-multi-agent-path-finding-via-machine-learning-guided-large-neighborhood-search/,https://cdn.aaai.org/ojs/21168/21168-13-25181-1-2-20220628.pdf
1046,Concentration Network for Reinforcement Learning of Large-Scale Multi-Agent Systems,Multiagent Systems,Qingxu Fu;Tenghai Qiu;Jianqiang Yi;Zhiqiang Pu;Shiguang Wu;,Chinese Academy of Sciences;University of Chinese Academy of Sciences;,China;,Technical,https://aaai.org/papers/09341-concentration-network-for-reinforcement-learning-of-large-scale-multi-agent-systems/,https://cdn.aaai.org/ojs/21165/21165-13-25178-1-2-20220628.pdf
1047,Cooperative Multi-Agent Fairness and Equivariant Policies,Multiagent Systems,Niko A. Grupen;Bart Selman;Daniel D. Lee;,Cornell University;,United States;,Technical,https://aaai.org/papers/09350-cooperative-multi-agent-fairness-and-equivariant-policies/,https://cdn.aaai.org/ojs/21166/21166-13-25179-1-2-20220628.pdf
1048,Decentralized Mean Field Games,Multiagent Systems,Sriram Ganapathi Subramanian;Matthew E. Taylor;Mark Crowley;Pascal Poupart;,University of Waterloo;Vector Institute;University of Alberta;Alberta Machine Intelligence Institute;,Canada;,Technical,https://aaai.org/papers/09439-decentralized-mean-field-games/,https://cdn.aaai.org/ojs/21176/21176-13-25189-1-2-20220628.pdf
1049,Equilibrium Finding in Normal-Form Games via Greedy Regret Minimization,Multiagent Systems,Hugh Zhang;Adam Lerer;Noam Brown;,Harvard University;Meta;,United States;,Technical,https://aaai.org/papers/09484-equilibrium-finding-in-normal-form-games-via-greedy-regret-minimization/,https://cdn.aaai.org/ojs/21181/21181-13-25194-1-2-20220628.pdf
1050,"Finding Nontrivial Minimum Fixed Points in Discrete Dynamical Systems: Complexity, Special Case Algorithms and Heuristics",Multiagent Systems,Zirou Qiu;Chen Chen;Madhav Marathe;S.S. Ravi;Daniel J. Rosenkrantz;Richard Stearns;Anil Vullikanti;,University of Virginia;University at Albany – SUNY;,United States;,Technical,https://aaai.org/papers/09422-finding-nontrivial-minimum-fixed-points-in-discrete-dynamical-systems-complexity-special-case-algorithms-and-heuristics/,https://cdn.aaai.org/ojs/21174/21174-13-25187-1-2-20220628.pdf
1051,Fixation Maximization in the Positional Moran Process,Multiagent Systems,Joachim Brendborg;Panagiotis Karras;Andreas Pavlogiannis;Asger Ullersted Rasmussen;Josef Tkadlec;,Aarhus University;Harvard University;,Denmark;United States;,Technical,https://aaai.org/papers/09304-fixation-maximization-in-the-positional-moran-process/,https://cdn.aaai.org/ojs/21160/21160-13-25173-1-2-20220628.pdf
1052,Flex Distribution for Bounded-Suboptimal Multi-Agent Path Finding,Multiagent Systems,Shao-Hung Chan;Jiaoyang Li;Graeme Gange;Daniel Harabor;Peter J. Stuckey;Sven Koenig;,University of Southern California;Monash University;,United States;Australia;,Technical,https://aaai.org/papers/09313-flex-distribution-for-bounded-suboptimal-multi-agent-path-finding/,https://cdn.aaai.org/ojs/21162/21162-13-25175-1-2-20220628.pdf
1053,Generalization in Mean Field Games by Learning Master Policies,Multiagent Systems,Sarah Perrin;Mathieu Laurière;Julien Pérolat;Romuald Élie;Matthieu Geist;Olivier Pietquin;,University of Lille;Google;DeepMind;,France;United States;,Technical,https://aaai.org/papers/09413-generalization-in-mean-field-games-by-learning-master-policies/,https://cdn.aaai.org/ojs/21173/21173-13-25186-1-2-20220628.pdf
1054,Hedonic Games with Fixed-Size Coalitions,Multiagent Systems,Vittorio Bilò;Gianpiero Monaco;Luca Moscardelli;,University of Salento;University of L'Aquila;University of Chieti-Pescara;,Italy;,Technical,https://aaai.org/papers/09287-hedonic-games-with-fixed-size-coalitions/,https://cdn.aaai.org/ojs/21156/21156-13-25169-1-2-20220628.pdf
1055,How Many Representatives Do We Need? The Optimal Size of a Congress Voting on Binary Issues,Multiagent Systems,Manon Revel;Tao Lin;Daniel Halpern;,Massachusetts Institute of Technology;Harvard University;,United States;,Technical,https://aaai.org/papers/09431-how-many-representatives-do-we-need-the-optimal-size-of-a-congress-voting-on-binary-issues/,https://cdn.aaai.org/ojs/21175/21175-13-25188-1-2-20220628.pdf
1056,Incentivizing Collaboration in Machine Learning via Synthetic Data Rewards,Multiagent Systems,Sebastian Shenghong Tay;Xinyi Xu;Chuan Sheng Foo;Bryan Kian Hsiang Low;,National University of Singapore;Institute for Infocomm Research;,Singapore;,Technical,https://aaai.org/papers/09448-incentivizing-collaboration-in-machine-learning-via-synthetic-data-rewards/,https://cdn.aaai.org/ojs/21177/21177-13-25190-1-2-20220628.pdf
1057,Learning the Optimal Recommendation from Explorative Users,Multiagent Systems,Fan Yao;Chuanhao Li;Denis Nekipelov;Hongning Wang;Haifeng Xu;,University of Virginia;,United States;,Technical,https://aaai.org/papers/09457-learning-the-optimal-recommendation-from-explorative-users/,https://cdn.aaai.org/ojs/21178/21178-13-25191-1-2-20220628.pdf
1058,MDPGT: Momentum-Based Decentralized Policy Gradient Tracking,Multiagent Systems,Zhanhong Jiang;Xian Yeow Lee;Sin Yong Tan;Kai Liang Tan;Aditya Balu;Young M Lee;Chinmay Hegde;Soumik Sarkar;,Johnson Controls;Iowa State University;New York University;,United States;,Technical,https://aaai.org/papers/09377-mdpgt-momentum-based-decentralized-policy-gradient-tracking/,https://cdn.aaai.org/ojs/21169/21169-13-25182-1-2-20220628.pdf
1059,MLink: Linking Black-Box Models for Collaborative Multi-Model Inference,Multiagent Systems,Mu Yuan;Lan Zhang;Xiang-Yang Li;,University of Science and Technology of China;,China;,Technical,https://aaai.org/papers/09475-mlink-linking-black-box-models-for-collaborative-multi-model-inference/,https://cdn.aaai.org/ojs/21180/21180-13-25193-1-2-20220628.pdf
1060,Multi-Agent Incentive Communication via Decentralized Teammate Modeling,Multiagent Systems,Lei Yuan;Jianhao Wang;Fuxiang Zhang;Chenghe Wang;ZongZhang Zhang;Yang Yu;Chongjie Zhang;,Nanjing University;Polixir Technologies;Tsinghua University;Pengcheng Laboratory;,China;,Technical,https://aaai.org/papers/09466-multi-agent-incentive-communication-via-decentralized-teammate-modeling/,https://cdn.aaai.org/ojs/21179/21179-13-25192-1-2-20220628.pdf
1061,Participatory Budgeting with Donations and Diversity Constraints,Multiagent Systems,Jiehua Chen;Martin Lackner;Jan Maly;,Technical University of Vienna;,Austria;,Technical,https://aaai.org/papers/09323-participatory-budgeting-with-donations-and-diversity-constraints/,https://cdn.aaai.org/ojs/21163/21163-13-25176-1-2-20220628.pdf
1062,Partner-Aware Algorithms in Decentralized Cooperative Bandit Teams,Multiagent Systems,Erdem Biyik;Anusha Lalitha;Rajarshi Saha;Andrea Goldsmith;Dorsa Sadigh;,Stanford University;Princeton University;,United States;,Technical,https://aaai.org/papers/09296-partner-aware-algorithms-in-decentralized-cooperative-bandit-teams/,https://cdn.aaai.org/ojs/21158/21158-13-25172-1-2-20220628.pdf
1063,Practical Fixed-Parameter Algorithms for Defending Active Directory Style Attack Graphs,Multiagent Systems,Mingyu Guo;Jialiang Li;Aneta Neumann;Frank Neumann;Hung Nguyen;,University of Adelaide;,Australia;,Technical,https://aaai.org/papers/09360-practical-fixed-parameter-algorithms-for-defending-active-directory-style-attack-graphs/,https://cdn.aaai.org/ojs/21167/21167-13-25180-1-2-20220628.pdf
1064,Pretrained Cost Model for Distributed Constraint Optimization Problems,Multiagent Systems,Yanchen Deng;Shufeng Kong;Bo An;,Nanyang Technological University;,Singapore;,Technical,https://aaai.org/papers/09331-pretrained-cost-model-for-distributed-constraint-optimization-problems/,https://cdn.aaai.org/ojs/21164/21164-13-25177-1-2-20220628.pdf
1065,"Shard Systems: Scalable, Robust and Persistent Multi-Agent Path Finding with Performance Guarantees",Multiagent Systems,Christopher Leet;Jiaoyang Li;Sven Koenig;,University of Southern California;,United States;,Technical,https://aaai.org/papers/09386-shard-systems-scalable-robust-and-persistent-multi-agent-path-finding-with-performance-guarantees/,https://cdn.aaai.org/ojs/21170/21170-13-25183-1-2-20220628.pdf
1066,When Can the Defender Effectively Deceive Attackers in Security Games?,Multiagent Systems,Thanh Nguyen;Haifeng Xu;,University of Oregon;University of Virginia;,United States;,Technical,https://aaai.org/papers/09405-when-can-the-defender-effectively-deceive-attackers-in-security-games/,https://cdn.aaai.org/ojs/21172/21172-13-25185-1-2-20220628.pdf
1067,Achieving Long-Term Fairness in Sequential Decision Making,Philosophy and Ethics of AI,Yaowei Hu;Lu Zhang;,University of Arkansas;,United States;,Technical,https://aaai.org/papers/09549-achieving-long-term-fairness-in-sequential-decision-making/,https://cdn.aaai.org/ojs/21188/21188-13-25201-1-2-20220628.pdf
1068,Algorithmic Fairness Verification with Graphical Models,Philosophy and Ethics of AI,Bishwamittra Ghosh;Debabrota Basu;Kuldeep S Meel;,National University of Singapore;University of Lille;,Singapore;France;,Technical,https://aaai.org/papers/09539-algorithmic-fairness-verification-with-graphical-models/,https://cdn.aaai.org/ojs/21187/21187-13-25200-1-2-20220628.pdf
1069,Certified Robustness of Nearest Neighbors against Data Poisoning and Backdoor Attacks,Philosophy and Ethics of AI,Jinyuan Jia;Yupei Liu;Xiaoyu Cao;Neil Zhenqiang Gong;,Duke University;,United States;,Technical,https://aaai.org/papers/09575-certified-robustness-of-nearest-neighbors-against-data-poisoning-and-backdoor-attacks/,https://cdn.aaai.org/ojs/21191/21191-13-25204-1-2-20220628.pdf
1070,Cosine Model Watermarking against Ensemble Distillation,Philosophy and Ethics of AI,Laurent Charette;Lingyang Chu;Yizhou Chen;Jian Pei;Lanjun Wang;Yong Zhang;,Huawei;McMaster University;Simon Fraser University;Tianjin University;,Canada;China;,Technical,https://aaai.org/papers/09512-cosine-model-watermarking-against-ensemble-distillation/,https://cdn.aaai.org/ojs/21184/21184-13-25197-1-2-20220628.pdf
1071,DeepAuth: A DNN Authentication Framework by Model-Unique and Fragile Signature Embedding,Philosophy and Ethics of AI,Yingjie Lao;Weijie Zhao;Peng Yang;Ping Li;,Clemson University;Baidu;,United States;,Technical,https://aaai.org/papers/09595-deepauth-a-dnn-authentication-framework-by-model-unique-and-fragile-signature-embedding/,https://cdn.aaai.org/ojs/21193/21193-13-25206-1-2-20220628.pdf
1072,Do Feature Attribution Methods Correctly Attribute Features?,Philosophy and Ethics of AI,Yilun Zhou;Serena Booth;Marco Tulio Ribeiro;Julie Shah;,Massachusetts Institute of Technology;Microsoft;,United States;,Technical,https://aaai.org/papers/09623-do-feature-attribution-methods-correctly-attribute-features/,https://cdn.aaai.org/ojs/21196/21196-13-25209-1-2-20220628.pdf
1073,Fairness without Imputation: A Decision Tree Approach for Fair Prediction with Missing Values,Philosophy and Ethics of AI,Haewon Jeong;Hao Wang;Flavio P. Calmon;,Harvard University;,United States;,Technical,https://aaai.org/papers/09558-fairness-without-imputation-a-decision-tree-approach-for-fair-prediction-with-missing-values/,https://cdn.aaai.org/ojs/21189/21189-13-25202-1-2-20220628.pdf
1074,Fast Sparse Decision Tree Optimization via Reference Ensembles,Philosophy and Ethics of AI,Hayden McTavish;Chudi Zhong;Reto Achermann;Ilias Karimalis;Jacques Chen;Cynthia Rudin;Margo Seltzer;,"University of British Columbia;University of California, San Diego;Duke University;",Canada;United States;,Technical,https://aaai.org/papers/09604-fast-sparse-decision-tree-optimization-via-reference-ensembles/,https://cdn.aaai.org/ojs/21194/21194-13-25207-1-2-20220628.pdf
1075,Incorporating Item Frequency for Differentially Private Set Union,Philosophy and Ethics of AI,Ricardo Silva Carvalho;Ke Wang;Lovedeep Singh Gondara;,Simon Fraser University;,Canada;,Technical,https://aaai.org/papers/09504-incorporating-item-frequency-for-differentially-private-set-union/,https://cdn.aaai.org/ojs/21183/21183-13-25196-1-2-20220628.pdf
