番号,title,status,decision_raw,rating,all_ratings,authors,href
6231,On Overcompression in Continual Semantic Segmentation,reject,Reject,3.5,"[3, 4, 3, 4]","Maciej Kowalski, Thomas L Lee, Amos Storkey",https://openreview.net/forum?id=k_XHLBD4qPO
1270,Hilbert Distillation for Cross-Dimensionality Networks,poster,Accept,7.0,"[7, 7, 8, 6]","Dian Qin, Haishuai Wang, Zhe Liu, HONGJIA XU, Sheng Zhou, Jiajun Bu",https://openreview.net/forum?id=kZnGYt-3f_X
11067,Anchor-Changing Regularized Natural Policy Gradient for Multi-Objective Reinforcement Learning,poster,Accept,6.5,"[5, 7, 7, 7]","Ruida Zhou, Tao Liu, Dileep Kalathil, Panganamala Kumar, Chao Tian",https://openreview.net/forum?id=kY1RbKE7DWE
12689,Context-enriched molecule representations improve few-shot drug discovery,reject,Reject,5.33,"[4, 7, 5]","Johannes Schimunek, Philipp Seidl, Lukas Friedrich, Daniel Kuhn, Friedrich Rippmann, Sepp Hochreiter, Günter Klambauer",https://openreview.net/forum?id=kXXPLBEBVGH
3331,CageNeRF: Cage-based Neural Radiance Field for Generalized 3D Deformation and Animation,poster,Accept,5.33,"[6, 7, 3]","Yicong Peng, Yichao Yan, Shengqi Liu, Yuhao Cheng, Shanyan Guan, Bowen Pan, Guangtao Zhai, Xiaokang Yang",https://openreview.net/forum?id=kUnHCGiILeU
7467,AdaFocal: Calibration-aware Adaptive Focal Loss,poster,Accept,5.25,"[6, 6, 5, 4]","Arindam Ghosh, Thomas Schaaf, Matthew R. Gormley",https://openreview.net/forum?id=kUOm0Fdtvh
6096,Adaptive Multi-stage Density Ratio Estimation for Learning Latent Space Energy-based Model,poster,Accept,7.0,"[7, 7, 7]","Zhisheng Xiao, Tian Han",https://openreview.net/forum?id=kS5KG3mpSY
2453,Thompson Sampling Efficiently Learns to Control Diffusion Processes,poster,Accept,6.0,"[7, 5, 6, 6]","Mohamad Kazem Shirani Faradonbeh, Mohamad Sadegh Shirani Faradonbeh, Mohsen Bayati",https://openreview.net/forum?id=kRgOlgFW9aP
12178,Coreset for Line-Sets Clustering,poster,Accept,6.33,"[5, 7, 7]","Sagi Lotan, Ernesto Evgeniy Sanches Shayda, Dan Feldman",https://openreview.net/forum?id=kQgLvIFLyIu
2352,Contrastive Neural Ratio Estimation,poster,Accept,6.67,"[6, 8, 6]","Benjamin Kurt Miller, Christoph Weniger, Patrick Forré",https://openreview.net/forum?id=kOIaB1hzaLe
6405,RTFormer: Efficient Design for Real-Time Semantic Segmentation with Transformer,poster,Accept,5.0,"[5, 5, 5, 5]","Jian Wang, Chenhui Gou, Qiman Wu, Haocheng Feng, Junyu Han, Errui Ding, Jingdong Wang",https://openreview.net/forum?id=kMiL9hWbD1z
9198,Feature Learning in $L_2$-regularized DNNs: Attraction/Repulsion and Sparsity,poster,Accept,5.67,"[7, 5, 5]","Arthur Jacot, Eugene Golikov, Clément Hongler, Franck Gabriel",https://openreview.net/forum?id=kK200QKfvjB
1977,Large-batch Optimization for Dense Visual Predictions: Training Faster R-CNN in 4.2 Minutes,poster,Accept,5.5,"[5, 4, 6, 7]","Zeyue Xue, Jianming Liang, Guanglu Song, Zhuofan Zong, Liang Chen, Yu Liu, Ping Luo",https://openreview.net/forum?id=kImIIKGqDFA
10260,Risk-Driven Design of Perception Systems,poster,Accept,7.0,"[6, 9, 6]","Anthony Corso, Sydney Michelle Katz, Craig A Innes, Xin Du, Subramanian Ramamoorthy, Mykel Kochenderfer",https://openreview.net/forum?id=kI_kL5vq6Oa
1942,Sym-NCO: Leveraging Symmetricity for Neural Combinatorial Optimization,poster,Accept,6.33,"[6, 6, 7]","Minsu Kim, Junyoung Park, Jinkyoo Park",https://openreview.net/forum?id=kHrE2vi5Rvs
2981,NS3: Neuro-symbolic Semantic Code Search,poster,Accept,5.5,"[7, 5, 5, 5]","Shushan Arakelyan, Anna Hakhverdyan, Miltiadis Allamanis, Luis Antonio Garcia, Christophe Hauser, Xiang Ren",https://openreview.net/forum?id=kHeotl7q9dU
5382,Consistent Sufficient Explanations and Minimal Local Rules for explaining the decision of any classifier or regressor,poster,Accept,5.5,"[6, 5, 7, 4]","Salim I. Amoukou, Nicolas J-B. Brunel",https://openreview.net/forum?id=kHNKDNLVp1E
8802,Coresets for Wasserstein Distributionally Robust Optimization Problems,poster,Accept,6.25,"[5, 6, 7, 7]","Ruomin Huang, Jiawei Huang, Wenjie Liu, Hu Ding",https://openreview.net/forum?id=kGQz0lt6Zu6
5916,Causal Discovery in Heterogeneous Environments Under the Sparse Mechanism Shift Hypothesis,poster,Accept,5.67,"[6, 6, 5]","Ronan Perry, Julius Von Kügelgen, Bernhard Schölkopf",https://openreview.net/forum?id=kFRCvpubDJo
1189,Deterministic Langevin Monte Carlo with Normalizing Flows for Bayesian Inference,poster,Accept,5.67,"[4, 6, 7]","Richard D.P. Grumitt, Biwei Dai, Uros Seljak",https://openreview.net/forum?id=kEPAmGivMD
11420,Enhanced Meta Reinforcement Learning via Demonstrations in Sparse Reward Environments,poster,Accept,6.33,"[7, 7, 5]","Desik Rengarajan, Sapana Chaudhary, Jaewon Kim, Dileep Kalathil, Srinivas Shakkottai",https://openreview.net/forum?id=kCtnkLv-_W0
2732,"Mirror Descent with Relative Smoothness in Measure Spaces, with application to Sinkhorn and EM",poster,Accept,6.75,"[6, 6, 9, 6]","Pierre-Cyril Aubin-Frankowski, Anna Korba, Flavien Léger",https://openreview.net/forum?id=kCU2pUrmMih
504,Prototypical VoteNet for Few-Shot 3D Point Cloud Object Detection,poster,Accept,5.5,"[4, 7, 4, 7]","Shizhen Zhao, XIAOJUAN QI",https://openreview.net/forum?id=kCTZt0b9DQz
2811,Unsupervised Cross-Task Generalization via Retrieval Augmentation,poster,Accept,6.0,"[6, 6, 6]","Bill Yuchen Lin, Kangmin Tan, Chris Scott Miller, Beiwen Tian, Xiang Ren",https://openreview.net/forum?id=kB9jrZDenff
1359,Video-based Human-Object Interaction Detection from Tubelet Tokens,poster,Accept,5.33,"[5, 5, 6]","Danyang Tu, Wei Sun, xiongkuo min, Guangtao Zhai, Wei Shen",https://openreview.net/forum?id=kADW_LsENM
10660,Adaptive Stochastic Variance Reduction for Non-convex Finite-Sum Minimization,poster,Accept,5.67,"[5, 6, 6]","Ali Kavis, EFSTRATIOS PANTELEIMON SKOULAKIS, Kimon Antonakopoulos, Leello Tadesse Dadi, Volkan Cevher",https://openreview.net/forum?id=k98U0cb0Ig
44,A Lower Bound of Hash Codes' Performance,poster,Accept,5.33,"[6, 3, 7]","Xiaosu Zhu, Jingkuan Song, Yu Lei, Lianli Gao, Hengtao Shen",https://openreview.net/forum?id=k7xZKpYebXL
2582,Elucidating the Design Space of Diffusion-Based Generative Models,poster,Accept,8.0,"[7, 8, 9, 8]","Tero Karras, Miika Aittala, Timo Aila, Samuli Laine",https://openreview.net/forum?id=k7FuTOWMOc7
2126,Large-Scale Differentiable Causal Discovery of Factor Graphs,poster,Accept,6.0,"[6, 7, 5]","Romain Lopez, Jan-Christian Huetter, Jonathan Pritchard, Aviv Regev",https://openreview.net/forum?id=k713e8vXzwR
3119,Factored DRO: Factored Distributionally Robust Policies for Contextual Bandits,poster,Accept,5.8,"[6, 6, 6, 5, 6]","Tong Mu, Yash Chandak, Tatsunori Hashimoto, Emma Brunskill",https://openreview.net/forum?id=k6WzeLZjxuP
3322,Boosting the Transferability of Adversarial Attacks with Reverse Adversarial Perturbation,poster,Accept,5.25,"[6, 5, 5, 5]","Zeyu Qin, Yanbo Fan, Yi Liu, Li Shen, Yong Zhang, Jue Wang, Baoyuan Wu",https://openreview.net/forum?id=k5uFiFLWv3X
7199,On Scrambling Phenomena for Randomly Initialized Recurrent Networks ,poster,Accept,6.0,"[5, 6, 9, 4]","Vaggos Chatziafratis, Ioannis Panageas, Clayton Sanford, Stelios Andrew Stavroulakis",https://openreview.net/forum?id=k5idxiVdJ3p
8052,Implicit Bias of Gradient Descent on Reparametrized Models: On Equivalence to Mirror Descent,poster,Accept,6.33,"[6, 8, 5]","Zhiyuan Li, Tianhao Wang, Jason D. Lee, Sanjeev Arora",https://openreview.net/forum?id=k4KHXS6_zOV
9171,Assistive Teaching of Motor Control Tasks to Humans,poster,Accept,5.75,"[6, 5, 6, 6]","Megha Srivastava, Erdem Biyik, Suvir Mirchandani, Noah Goodman, Dorsa Sadigh",https://openreview.net/forum?id=k3MX8EK6Zf
3211,TCT: Convexifying Federated Learning using Bootstrapped Neural Tangent Kernels,poster,Accept,6.0,"[6, 6, 6]","Yaodong Yu, Alexander Wei, Sai Praneeth Karimireddy, Yi Ma, Michael Jordan",https://openreview.net/forum?id=jzd2bE5MxW
9871,CascadeXML: Rethinking Transformers for End-to-end Multi-resolution Training in Extreme Multi-label Classification,poster,Accept,6.5,"[5, 7, 7, 7]","Siddhant Kharbanda, Atmadeep Banerjee, Erik Schultheis, Rohit Babbar",https://openreview.net/forum?id=jxezD-1XYr
5206,"Convolutional Neural Networks on Graphs with Chebyshev Approximation, Revisited",poster,Accept,6.67,"[6, 6, 8]","Mingguo He, Zhewei Wei, Ji-Rong Wen",https://openreview.net/forum?id=jxPJ4QA0KAb
8074,Redundancy-Free Message Passing for Graph Neural Networks,poster,Accept,6.25,"[7, 7, 6, 5]","Rongqin Chen, Shenghui Zhang, Leong Hou U, Ye Li",https://openreview.net/forum?id=jwVZZzzNKkW
11172,Adversarially Robust Learning with Tolerance,reject,Reject,5.5,"[7, 7, 4, 4]","Hassan Ashtiani, Vinayak Pathak, Ruth Urner",https://openreview.net/forum?id=jwOg8J1yZ-a
5631,NeMF: Neural Motion Fields for Kinematic Animation,poster,Accept,7.25,"[8, 8, 7, 6]","Chengan He, Jun Saito, James Zachary, Holly Rushmeier, Yi Zhou",https://openreview.net/forum?id=jwGa6cEUFRn
10056,A composable machine-learning approach for steady-state simulations on high-resolution grids,poster,Accept,6.33,"[6, 7, 6]","Rishikesh Ranade, Derek Christopher Hill, Lalit Ghule, Jay Pathak",https://openreview.net/forum?id=jvFTMD5QTq
5108,Towards Skill and Population Curriculum for MARL,reject,Reject,3.75,"[4, 4, 4, 3]","Rundong Wang, Longtao Zheng, Wei Qiu, Bowei He, Bo An, Zinovi Rabinovich, Yujing Hu, Yingfeng Chen, Tangjie Lv, Changjie Fan",https://openreview.net/forum?id=jv1bis_HYBL
340,Polynomial Neural Fields for Subband Decomposition and Manipulation,poster,Accept,6.75,"[7, 8, 5, 7]","Guandao Yang, Sagie Benaim, Varun Jampani, Kyle Genova, Jonathan T. Barron, Thomas Funkhouser, Bharath Hariharan, Serge Belongie",https://openreview.net/forum?id=juE5ErmZB61
5921,Learning Expressive Meta-Representations with Mixture of Expert Neural Processes,poster,Accept,6.67,"[6, 7, 7]","Qi Wang, Herke van Hoof",https://openreview.net/forum?id=ju38DG3sbg6
1294,Geometry-aware Two-scale PIFu Representation for Human Reconstruction,poster,Accept,5.25,"[5, 5, 5, 6]","Zheng Dong, Ke Xu, Ziheng Duan, Hujun Bao, Weiwei Xu, Rynson W. H. Lau",https://openreview.net/forum?id=jtq4KwZ9_n9
8184,Maximum-Likelihood Quantum State Tomography by Soft-Bayes,reject,Reject,4.0,"[3, 4, 5, 4]","Chieng-Ming Lin, Yu-Ming Hsu, Yen-Huan Li",https://openreview.net/forum?id=jtW73TIGnd
2043,Masked Generative Adversarial Networks are Data-Efficient Generation Learners,poster,Accept,5.25,"[6, 3, 7, 5]","Jiaxing Huang, Kaiwen Cui, Dayan Guan, Aoran Xiao, Fangneng Zhan, Shijian Lu, Shengcai Liao, Eric Xing",https://openreview.net/forum?id=js2ssA77fX
7747,TaSIL: Taylor Series Imitation Learning,poster,Accept,5.5,"[5, 4, 7, 6]","Daniel Pfrommer, Thomas TCK Zhang, Stephen Tu, Nikolai Matni",https://openreview.net/forum?id=jqzoJw7xamd
279,On Trace of PGD-Like Adversarial Attacks,reject,Reject,5.25,"[4, 6, 6, 5]","Mo Zhou, Vishal Patel",https://openreview.net/forum?id=jowVZoitZYu
8523,DiSC: Differential Spectral Clustering of Features,poster,Accept,5.75,"[6, 6, 7, 4]","Ram Dyuthi Sristi, Gal Mishne, Ariel Jaffe",https://openreview.net/forum?id=joZ4CuOyKY8
9926,Generalization Bounds for Gradient Methods via Discrete and Continuous Prior,poster,Accept,5.5,"[7, 5, 5, 5]","Xuanyuan Luo, Bei Luo, Jian Li",https://openreview.net/forum?id=jm_opnaGmm5
6548,Exponential Separations in Symmetric Neural Networks,poster,Accept,7.25,"[7, 7, 8, 7]","Aaron Zweig, Joan Bruna",https://openreview.net/forum?id=jjlQkcHxkp0
8958,"Chromatic Correlation Clustering, Revisited",poster,Accept,6.0,"[8, 5, 5, 6]","Qing Xiu, Kai Han, Jing Tang, Shuang Cui, He Huang",https://openreview.net/forum?id=jjJgLNrCQB
10730,Trustworthy Monte Carlo,poster,Accept,5.25,"[6, 7, 3, 5]","Juha Harviainen, Mikko Koivisto, Petteri Kaski",https://openreview.net/forum?id=jglXPY6gH-1
4932,Accelerated Linearized Laplace Approximation for Bayesian Deep Learning,poster,Accept,6.0,"[5, 7, 6]","Zhijie Deng, Feng Zhou, Jun Zhu",https://openreview.net/forum?id=jftNpltMgz
6138,Generalization Error Bounds on Deep Learning with Markov Datasets,poster,Accept,6.0,"[3, 7, 8]",Lan V. Truong,https://openreview.net/forum?id=jdsmBlsHGF2
8125,Mixture-of-Experts with Expert Choice Routing,poster,Accept,6.75,"[7, 7, 6, 7]","Yanqi Zhou, Tao Lei, Hanxiao Liu, Nan Du, Yanping Huang, Vincent Y Zhao, Andrew M. Dai, Zhifeng Chen, Quoc V Le, James Laudon",https://openreview.net/forum?id=jdJo1HIVinI
2836,Pessimism for Offline Linear Contextual Bandits using $\ell_p$ Confidence Sets,poster,Accept,6.75,"[6, 7, 6, 8]","Gene Li, Cong Ma, Nathan Srebro",https://openreview.net/forum?id=jcIIVkbCaHO
11979,Escaping from the Barren Plateau via Gaussian Initializations in Deep Variational Quantum Circuits,poster,Accept,6.5,"[7, 7, 6, 6]","Kaining Zhang, Liu Liu, Min-Hsiu Hsieh, Dacheng Tao",https://openreview.net/forum?id=jXgbJdQ2YIy
7798,Outlier-Robust Sparse Mean Estimation for Heavy-Tailed Distributions,poster,Accept,5.0,"[7, 3, 5, 4, 6]","Ilias Diakonikolas, Daniel Kane, Jasper C.H. Lee, Ankit Pensia",https://openreview.net/forum?id=jWgGtPmi8c
1510,Antigen-Specific Antibody Design and Optimization with Diffusion-Based Generative Models for Protein Structures,poster,Accept,6.67,"[6, 7, 7]","Shitong Luo, Yufeng Su, Xingang Peng, Sheng Wang, Jian Peng, Jianzhu Ma",https://openreview.net/forum?id=jSorGn2Tjg
7514,Simplified Graph Convolution with Heterophily,poster,Accept,4.5,"[5, 4, 3, 6]","Sudhanshu Chanpuriya, Cameron N Musco",https://openreview.net/forum?id=jRrpiqxtrWm
10491,Contrastive and Non-Contrastive Self-Supervised Learning Recover Global and Local Spectral Embedding Methods,poster,Accept,5.75,"[6, 6, 6, 5]","Randall Balestriero, Yann LeCun",https://openreview.net/forum?id=jQgsZDspz5h
2438,Respecting Transfer Gap in Knowledge Distillation,poster,Accept,4.67,"[4, 5, 5]","Yulei Niu, Long Chen, Chang Zhou, Hanwang Zhang",https://openreview.net/forum?id=jQR9YF2-Jhg
3066,Biologically-plausible backpropagation through arbitrary timespans via local neuromodulators,poster,Accept,6.5,"[5, 7, 7, 7]","Yuhan Helena Liu, Stephen Smith, Stefan Mihalas, Eric Todd SheaBrown, Uygar Sümbül",https://openreview.net/forum?id=jPx7vYUNUCt
9853,Private Isotonic Regression,poster,Accept,7.0,"[7, 7, 7, 7]","Badih Ghazi, Pritish Kamath, Ravi Kumar, Pasin Manurangsi",https://openreview.net/forum?id=jOYdlD4oYrn
1829,SPD: Synergy Pattern Diversifying Oriented Unsupervised Multi-agent Reinforcement Learning,poster,Accept,5.75,"[6, 6, 7, 4]","Yuhang Jiang, Jianzhun Shao, Shuncheng He, Hongchang Zhang, Xiangyang Ji",https://openreview.net/forum?id=jJwy2kcBYv
2838,Understanding the Eluder Dimension,poster,Accept,6.33,"[5, 7, 7]","Gene Li, Pritish Kamath, Dylan J Foster, Nathan Srebro",https://openreview.net/forum?id=jHIn0U9U6RO
7186,"Bounded-Regret MPC via Perturbation Analysis: Prediction Error, Constraints, and Nonlinearity",poster,Accept,6.0,"[8, 5, 6, 5]","Yiheng Lin, Yang Hu, Guannan Qu, Tongxin Li, Adam Wierman",https://openreview.net/forum?id=jFVfKsmKa-
11311,Neural Abstractions,poster,Accept,6.33,"[6, 7, 6]","Alessandro Abate, Alec Edwards, Mirco Giacobbe",https://openreview.net/forum?id=jF7u0APnGOv
8518,DASCO: Dual-Generator Adversarial Support Constrained Offline Reinforcement Learning,poster,Accept,6.0,"[6, 7, 5, 6, 6]","Quan Vuong, Aviral Kumar, Sergey Levine, Yevgen Chebotar",https://openreview.net/forum?id=jBTQGGy9qA-
1779,Adaptive Attention Link-based Regularization for Vision Transformers,reject,Reject,5.25,"[6, 6, 6, 3]","Heegon Jin, Jongwon Choi",https://openreview.net/forum?id=jAL8Rt7HqB
11795,Towards Practical Few-shot Query Sets: Transductive Minimum Description Length Inference,poster,Accept,5.75,"[5, 6, 7, 5]","Ségolène Tiffany Martin, Malik Boudiaf, Emilie Chouzenoux, Jean-Christophe Pesquet, Ismail Ben Ayed",https://openreview.net/forum?id=j9JL96S8Vl
8358,Transferring Pre-trained Multimodal Representations with Cross-modal Similarity Matching,poster,Accept,5.2,"[5, 7, 6, 3, 5]","Byoungjip Kim, Sungik Choi, Dasol Hwang, Moontae Lee, Honglak Lee",https://openreview.net/forum?id=j2Vtg_jhKZ
11505,Single Model Uncertainty Estimation via Stochastic Data Centering,poster,Accept,6.0,"[6, 5, 7, 6]","Jayaraman J. Thiagarajan, Rushil Anirudh, Vivek Narayanaswamy, Peer-timo Bremer",https://openreview.net/forum?id=j0J9upqN5va
5598,Learning to Generate Inversion-Resistant Model Explanations,poster,Accept,6.75,"[6, 7, 8, 6]","Hoyong Jeong, Suyoung Lee, Sung Ju Hwang, Sooel Son",https://openreview.net/forum?id=iy2G-yLGuku
3247,A Transformer-Based Object Detector with Coarse-Fine Crossing Representations,poster,Accept,6.33,"[5, 7, 7]","Zhishan Li, Ying Nie, Kai Han, Jianyuan Guo, Lei Xie, Yunhe Wang",https://openreview.net/forum?id=iuW96ssPQX
12076,LST: Ladder Side-Tuning for Parameter and Memory Efficient Transfer Learning,poster,Accept,4.25,"[3, 4, 4, 6]","Yi-Lin Sung, Jaemin Cho, Mohit Bansal",https://openreview.net/forum?id=isPnnaTZaP5
4448,Imitating Past Successes can be Very Suboptimal,poster,Accept,6.67,"[7, 6, 7]","Benjamin Eysenbach, Soumith Udatha, Ruslan Salakhutdinov, Sergey Levine",https://openreview.net/forum?id=iqCO3jbPjYF
8642,Differentially Private Learning Needs Hidden State (Or Much Faster Convergence),poster,Accept,6.5,"[7, 4, 8, 7]","Jiayuan Ye, Reza Shokri",https://openreview.net/forum?id=ipAz7H8pPnI
887,In the Eye of the Beholder: Robust Prediction with Causal User Modeling,poster,Accept,6.0,"[5, 6, 7]","Amir Feder, Guy Horowitz, Yoav Wald, Roi Reichart, Nir Rosenfeld",https://openreview.net/forum?id=ikXoMuy_H4
12480,Generalization for multiclass classification with overparameterized linear models,poster,Accept,6.25,"[7, 5, 6, 7]","Vignesh Subramanian, Rahul Arya, Anant Sahai",https://openreview.net/forum?id=ikWvMRVQBWW
4319,Expectation-Maximization Contrastive Learning for Compact Video-and-Language Representations,poster,Accept,5.5,"[6, 6, 6, 4]","Peng Jin, Jinfa Huang, Fenglin Liu, Xian Wu, Shen Ge, Guoli Song, David A. Clifton, Jie Chen",https://openreview.net/forum?id=ijzm0EhAY_w
6394,On the Computational Efficiency of Adapting Transformer Models via Adversarial Noise,reject,Reject,6.0,"[6, 5, 7]","Minjia Zhang, U.N. Niranjan, Yuxiong He",https://openreview.net/forum?id=iivHwZoWzR4
7255,$\alpha$-ReQ : Assessing Representation Quality in Self-Supervised Learning by measuring eigenspectrum decay,poster,Accept,5.33,"[5, 5, 6]","Kumar Krishna Agrawal, Arnab Kumar Mondal, Arna Ghosh, Blake Aaron Richards",https://openreview.net/forum?id=ii9X4vtZGTZ
4427,Augmentations in Hypergraph Contrastive Learning: Fabricated and Generative,poster,Accept,5.33,"[6, 5, 5, 4, 6, 6]","Tianxin Wei, Yuning You, Tianlong Chen, Yang Shen, Jingrui He, Zhangyang Wang",https://openreview.net/forum?id=igMc_C9pgYG
726,Deliberated Domain Bridging for Domain Adaptive Semantic Segmentation,poster,Accept,6.0,"[6, 6, 6, 6]","Lin Chen, Zhixiang Wei, Xin Jin, Huaian Chen, Miao Zheng, Kai Chen, Yi Jin",https://openreview.net/forum?id=ievxJqXwPCm
9408,A Robust Phased Elimination Algorithm for Corruption-Tolerant Gaussian Process Bandits,poster,Accept,5.0,"[6, 5, 6, 3]","Ilija Bogunovic, Zihan Li, Andreas Krause, Jonathan Scarlett",https://openreview.net/forum?id=icGMu0iPonB
8985,MetricFormer: A Unified Perspective of Correlation Exploring in Similarity Learning,poster,Accept,6.25,"[6, 5, 7, 7]","Jiexi Yan, Erkun Yang, Cheng Deng, Heng Huang",https://openreview.net/forum?id=ibxa2Y0y8yr
7642,Branch & Learn for Recursively and Iteratively Solvable Problems in Predict+Optimize,poster,Accept,6.0,"[7, 6, 5, 6]","Xinyi HU, Jasper C.H. Lee, Jimmy H.M. Lee, Allen Z. Zhong",https://openreview.net/forum?id=iWg5LjFbeT_
8323,STNDT: Modeling Neural Population Activity with Spatiotemporal Transformers,poster,Accept,5.33,"[4, 6, 6]","Trung Le, Eli Shlizerman",https://openreview.net/forum?id=iUOUnyS6uTf
2388,SAMURAI: Shape And Material from Unconstrained Real-world Arbitrary Image collections,poster,Accept,6.0,"[6, 6, 6]","Mark Boss, Andreas Engelhardt, Abhishek Kar, Yuanzhen Li, Deqing Sun, Jonathan T. Barron, Hendrik Lensch, Varun Jampani",https://openreview.net/forum?id=iQpaHC7cPfR
1841,CUP: Critic-Guided Policy Reuse,poster,Accept,6.0,"[6, 7, 5, 6]","Jin Zhang, Siyuan Li, Chongjie Zhang",https://openreview.net/forum?id=iMK2LP0AogI
1726,Planning for Sample Efficient Imitation Learning,poster,Accept,6.33,"[7, 5, 7]","Zhao-Heng Yin, Weirui Ye, Qifeng Chen, Yang Gao",https://openreview.net/forum?id=iKKfdIm81Jt
993,Learning Active Camera  for Multi-Object Navigation,poster,Accept,6.33,"[7, 6, 6]","Peihao Chen, Dongyu Ji, Kunyang Lin, Weiwen Hu, Wenbing Huang, Thomas H. Li, Mingkui Tan, Chuang Gan",https://openreview.net/forum?id=iH4eyI5A7o
4888,Pyramid Attention For Source Code Summarization,poster,Accept,5.5,"[7, 4, 7, 4]","Lei Chai, Ming Li",https://openreview.net/forum?id=iFJJevyrIEf
716,Exploit Reward Shifting in Value-Based Deep-RL: Optimistic Curiosity-Based Exploration and Conservative Exploitation via Linear Reward Shaping,poster,Accept,5.33,"[6, 4, 6]","Hao Sun, Lei Han, Rui Yang, Xiaoteng Ma, Jian Guo, Bolei Zhou",https://openreview.net/forum?id=iCxRsZcVVAH
11585,An empirical analysis of compute-optimal large language model training,poster,Accept,7.75,"[8, 8, 8, 7]","Jordan Hoffmann, Sebastian Borgeaud, Arthur Mensch, Elena Buchatskaya, Trevor Cai, Eliza Rutherford, Diego de las Casas, Lisa Anne Hendricks, Johannes Welbl, Aidan Clark, Tom Hennigan, Eric Noland, Katherine Millican, George van den Driessche, Bogdan Damoc, Aurelia Guy, Simon Osindero, Karen Simonyan, Erich Elsen, Oriol Vinyals, Jack William Rae, Laurent Sifre",https://openreview.net/forum?id=iBBcRUlOAPR
4751,House of Cans: Covert Transmission of Internal Datasets via Capacity-Aware Neuron Steganography,poster,Accept,6.0,"[8, 5, 5]","Xudong Pan, Shengyao Zhang, Mi Zhang, Yifan Yan, Min Yang",https://openreview.net/forum?id=iAktFMVfeff
9125,AnoFormer: Time Series Anomaly Detection using Transformer-based GAN with Two-Step Masking,reject,Reject,4.0,"[3, 4, 5]","Ah-Hyung Shin, Seong Tae Kim, Gyeong-Moon Park",https://openreview.net/forum?id=iAWNOXfLz0
11159,Improved Differential Privacy for SGD via Optimal Private Linear Operators on Adaptive Streams,poster,Accept,6.33,"[7, 6, 6]","Serguei Denissov, Hugh Brendan McMahan, J Keith Rush, Adam Smith, Abhradeep Guha Thakurta",https://openreview.net/forum?id=i9XrHJoyLqJ
1927,Continual Learning with Evolving Class Ontologies,poster,Accept,5.33,"[6, 5, 5]","Zhiqiu Lin, Deepak Pathak, Yu-Xiong Wang, Deva Ramanan, Shu Kong",https://openreview.net/forum?id=i7WqjtdD0u
5279,Hierarchical Channel-spatial Encoding for Communication-efficient Collaborative Learning,poster,Accept,5.75,"[6, 5, 6, 6]","Qihua Zhou, Song Guo, LIU Yi, Jie Zhang, Jiewei Zhang, Tao GUO, Zhenda XU, XUN LIU, Zhihao Qu",https://openreview.net/forum?id=i3k6WjDXECC
10659,Invariance Learning in Deep Neural Networks with Differentiable Laplace Approximations,poster,Accept,6.67,"[7, 7, 6]","Alexander Immer, Tycho F.A. van der Ouderaa, Gunnar Ratsch, Vincent Fortuin, Mark van der Wilk",https://openreview.net/forum?id=i3ewAfTbCxJ
3972,Iterative Scene Graph Generation,poster,Accept,4.33,"[4, 6, 3]","Siddhesh Khandelwal, Leonid Sigal",https://openreview.net/forum?id=i0FnLiIRj6U
12086,Marksman Backdoor: Backdoor Attacks with Arbitrary Target Class,poster,Accept,5.0,"[5, 4, 5, 6]","Khoa D Doan, Yingjie Lao, Ping Li",https://openreview.net/forum?id=i-k6J4VkCDq
7149,Semi-supervised Active Linear Regression,poster,Accept,6.67,"[7, 7, 6]","Nived Rajaraman, Fnu Devvrit, Pranjal Awasthi",https://openreview.net/forum?id=i-UdJ6fWUFc
4275,Does Momentum Change the Implicit Regularization on Separable Data?,poster,Accept,6.25,"[6, 7, 6, 6]","Bohan Wang, Qi Meng, Huishuai Zhang, Ruoyu Sun, Wei Chen, Zhi-Ming Ma, Tie-Yan Liu",https://openreview.net/forum?id=i-8uqlurj1f
7541,"If Influence Functions are the Answer, Then What is the Question?",poster,Accept,6.5,"[7, 6, 7, 6]","Juhan Bae, Nathan Hoyen Ng, Alston Lo, Marzyeh Ghassemi, Roger Baker Grosse",https://openreview.net/forum?id=hzbguA9zMJ
4008,Margin-Based Few-Shot Class-Incremental Learning with Class-Level Overfitting Mitigation,poster,Accept,5.67,"[5, 6, 6]","Yixiong Zou, Shanghang Zhang, Yuhua Li, Ruixuan Li",https://openreview.net/forum?id=hyc27bDixNR
11664,Task Discovery: Finding the Tasks that Neural Networks Generalize on,poster,Accept,7.0,"[7, 8, 6, 7]","Andrei Atanov, Andrey Filatov, Teresa Yeo, Ajay Sohmshetty, Amir Zamir",https://openreview.net/forum?id=hw-n6BUmiyI
4477,Robust Imitation via Mirror Descent Inverse Reinforcement Learning,poster,Accept,5.0,"[6, 2, 6, 6]","Dong-Sig Han, Hyunseo Kim, Hyundo Lee, JeHwan Ryu, Byoung-Tak Zhang",https://openreview.net/forum?id=huT1G2dtSr
2415,Random Sharpness-Aware Minimization,poster,Accept,6.25,"[7, 6, 8, 4]","Yong Liu, Siqi Mai, Minhao Cheng, Xiangning Chen, Cho-Jui Hsieh, Yang You",https://openreview.net/forum?id=htUvh7xPoa
8656,On Elimination Strategies for Bandit Fixed-Confidence Identification,poster,Accept,5.5,"[6, 5, 5, 6]","Andrea Tirinzoni, Rémy Degenne",https://openreview.net/forum?id=htR7ZXXe_TY
1769,Vision GNN: An Image is Worth Graph of Nodes,poster,Accept,6.75,"[8, 8, 7, 4]","Kai Han, Yunhe Wang, Jianyuan Guo, Yehui Tang, Enhua Wu",https://openreview.net/forum?id=htM1WJZVB2I
3932,Cluster Randomized Designs for One-Sided Bipartite Experiments,poster,Accept,6.0,"[8, 6, 6, 4]","Jennifer Rogers Brennan, Vahab Mirrokni, Jean Pouget-Abadie",https://openreview.net/forum?id=hqtSdpAK39W
7169,Globally Gated Deep Linear Networks,poster,Accept,7.0,"[7, 7, 7]","Qianyi Li, Haim Sompolinsky",https://openreview.net/forum?id=hqRwcqzegr7
8211,Associating Objects and Their Effects in Video through Coordination Games,poster,Accept,6.0,"[7, 7, 6, 4]","Erika Lu, Forrester Cole, Weidi Xie, Tali Dekel, William T. Freeman, Andrew Zisserman, Michael Rubinstein",https://openreview.net/forum?id=hq-p55-qil9
8393,CoNSoLe: Convex Neural Symbolic Learning,poster,Accept,6.25,"[7, 6, 6, 6]","Haoran Li, Yang Weng, Hanghang Tong",https://openreview.net/forum?id=hk8v6BoKs-w
