番号,title,status,decision_raw,rating,all_ratings,authors,href
4306,Masked Prediction: A Parameter Identifiability View,poster,Accept,6.5,"[7, 6, 6, 7]","Bingbin Liu, Daniel Hsu, Pradeep Kumar Ravikumar, Andrej Risteski",https://openreview.net/forum?id=Hbvlb4D1aFC
6151,Learning to Find Proofs and Theorems by Learning to Refine Search Strategies: The Case of Loop Invariant Synthesis,poster,Accept,5.33,"[5, 7, 4]","Jonathan Laurent, Andre Platzer",https://openreview.net/forum?id=Hb37zNk14e5
8061,Incrementality Bidding via Reinforcement Learning under Mixed and Delayed Rewards,poster,Accept,6.75,"[7, 7, 7, 6]","Ashwinkumar Badanidiyuru, Zhe Feng, Tianxi Li, Haifeng Xu",https://openreview.net/forum?id=Haj8_Rwqq_H
9450,Inverse Design for Fluid-Structure Interactions using Graph Network Simulators,poster,Accept,6.25,"[7, 5, 6, 7]","Kelsey R Allen, Tatiana Lopez-Guavara, Kim Stachenfeld, Alvaro Sanchez-Gonzalez, Peter Battaglia, Jessica B Hamrick, Tobias Pfaff",https://openreview.net/forum?id=HaZuqj0Gvp2
4670,Zero-Shot 3D Drug Design by Sketching and Generating,poster,Accept,5.67,"[7, 4, 6]","Siyu Long, Yi Zhou, Xinyu Dai, Hao Zhou",https://openreview.net/forum?id=H_xAgRM7I5N
8139,Sparsity in Continuous-Depth Neural Networks,poster,Accept,6.25,"[7, 6, 7, 5]","Hananeh Aliee, Till Richter, Mikhail Solonin, Ignacio Ibarra, Fabian J Theis, Niki Kilbertus",https://openreview.net/forum?id=HZ20IYYAwah
11811,Concept Embedding Models: Beyond the Accuracy-Explainability Trade-Off,poster,Accept,6.25,"[5, 7, 6, 7]","Mateo Espinosa Zarlenga, Pietro Barbiero, Gabriele Ciravegna, Giuseppe Marra, Francesco Giannini, Michelangelo Diligenti, Zohreh Shams, Frederic Precioso, Stefano Melacci, Adrian Weller, Pietro Lio, Mateja Jamnik",https://openreview.net/forum?id=HXCPA2GXf_
3725,Neur2SP: Neural Two-Stage Stochastic Programming,poster,Accept,6.5,"[7, 8, 7, 4]","Rahul Mihir Patel, Justin Dumouchelle, Elias Boutros Khalil, Merve Bodur",https://openreview.net/forum?id=HQDvPsdXS-F
9297,Isometric 3D Adversarial Examples in the Physical World,poster,Accept,6.33,"[5, 8, 6]","Yibo Miao, Yinpeng Dong, Jun Zhu, Xiao-Shan Gao",https://openreview.net/forum?id=HOG-G4arLnU
6776,A Consistent and Differentiable Lp Canonical Calibration Error Estimator,poster,Accept,6.67,"[6, 6, 8]","Teodora Popordanoska, Raphael Sayer, Matthew B. Blaschko",https://openreview.net/forum?id=HMs5pxZq1If
11763,Improving Multi-Task Generalization via Regularizing Spurious Correlation,poster,Accept,6.75,"[7, 6, 7, 7]","Ziniu Hu, Zhe Zhao, Xinyang Yi, Tiansheng Yao, Lichan Hong, Yizhou Sun, Ed H. Chi",https://openreview.net/forum?id=HLzjd09oRx
1803,AutoMS: Automatic Model Selection for Novelty Detection with Error Rate Control,poster,Accept,5.33,"[6, 4, 6]","Yifan Zhang, Haiyan Jiang, Haojie Ren, Changliang Zou, Dejing Dou",https://openreview.net/forum?id=HIslGib8XD
4073,BR-SNIS: Bias Reduced Self-Normalized Importance Sampling,poster,Accept,5.5,"[5, 5, 6, 6]","Gabriel Cardoso, Sergey Samsonov, Achille Thin, Eric Moulines, Jimmy Olsson",https://openreview.net/forum?id=HH_jBD2ObPq
9809,Revisiting Populations in Multi-Agent Communication,reject,Reject,5.0,"[6, 5, 4]","Paul Michel, Mathieu Rita, Kory Wallace Mathewson, Olivier Tieleman, Angeliki Lazaridou",https://openreview.net/forum?id=HH3GHN_Q1Ba
2606,Multi-Scale Adaptive Network for Single Image Denoising,poster,Accept,7.0,"[7, 7, 7, 7, 7]","Yuanbiao Gou, Peng Hu, Jiancheng Lv, Joey Tianyi Zhou, Xi Peng",https://openreview.net/forum?id=HFm7AxNa9Wo
10757,Augmenting Online Algorithms with $\varepsilon$-Accurate Predictions,poster,Accept,6.0,"[7, 6, 6, 5]","Anupam Gupta, Debmalya Panigrahi, Bernardo Subercaseaux, Kevin Sun",https://openreview.net/forum?id=HFkxZ_V0sBQ
2575,Dict-TTS: Learning to Pronounce with Prior Dictionary Knowledge for Text-to-Speech,poster,Accept,6.25,"[7, 4, 7, 7]","Ziyue Jiang, Zhe Su, Zhou Zhao, Qian Yang, Yi Ren, Jinglin Liu, Zhenhui Ye",https://openreview.net/forum?id=HEcYYV5MPxa
12724,Human-Robotic Prosthesis as Collaborating Agents for Symmetrical Walking,poster,Accept,6.0,"[7, 5, 6]","Ruofan Wu, Junmin Zhong, Brent Abraham Wallace, Xiang Gao, He Huang, Jennie Si",https://openreview.net/forum?id=HBGvWy9Vxq
11583,Dynamic Pricing with Monotonicity Constraint under Unknown Parametric Demand Model,poster,Accept,5.6,"[5, 7, 5, 5, 6]","Su Jia, Andrew A Li, Ramamoorthi Ravi",https://openreview.net/forum?id=H88qfUs3U2W
1504,BMU-MoCo: Bidirectional Momentum Update for Continual Video-Language Modeling,poster,Accept,5.0,"[5, 6, 4]","Yizhao Gao, Nanyi Fei, Haoyu Lu, Zhiwu Lu, Hao Jiang, Yijie Li, Zhao Cao",https://openreview.net/forum?id=H5z5Q--YdYd
8310,Integral Probability Metrics PAC-Bayes Bounds,poster,Accept,6.5,"[6, 6, 7, 7]","Ron Amit, Baruch Epstein, Shay Moran, Ron Meir",https://openreview.net/forum?id=H547BtAyOJ4
8562,Computationally Efficient Horizon-Free Reinforcement Learning for Linear Mixture MDPs,poster,Accept,6.75,"[5, 8, 7, 7]","Dongruo Zhou, Quanquan Gu",https://openreview.net/forum?id=H4GmqyYMxFP
6803,FlashAttention: Fast and Memory-Efficient Exact Attention with IO-Awareness,poster,Accept,7.2,"[7, 7, 8, 6, 8]","Tri Dao, Daniel Y Fu, Stefano Ermon, Atri Rudra, Christopher Re",https://openreview.net/forum?id=H4DqfPSibmx
3888,Optimal Transport-based Identity Matching for Identity-invariant Facial Expression Recognition,poster,Accept,5.33,"[6, 6, 4]","Daeha Kim, Byung Cheol Song",https://openreview.net/forum?id=H3o9a6l0wz
271,Self-Supervised Visual Representation Learning with Semantic Grouping,poster,Accept,6.25,"[6, 7, 5, 7]","Xin Wen, Bingchen Zhao, Anlin Zheng, Xiangyu Zhang, XIAOJUAN QI",https://openreview.net/forum?id=H3JObxjd8S
11335,FP8 Quantization: The Power of the Exponent,poster,Accept,5.25,"[4, 8, 5, 4]","Andrey Kuzmin, Mart Van Baalen, Yuwei Ren, Markus Nagel, Jorn Peters, Tijmen Blankevoort",https://openreview.net/forum?id=H3Gv7XEGzYV
5569,Distributed Learning of Conditional Quantiles in the Reproducing Kernel Hilbert Space,poster,Accept,5.0,"[4, 5, 6, 5]",Heng Lian,https://openreview.net/forum?id=H1FQgq2QbV1
2256,A Unified Diversity Measure for Multiagent Reinforcement Learning,poster,Accept,6.0,"[6, 5, 7]","Zongkai Liu, Chao Yu, Yaodong Yang, peng sun, Zifan Wu, Yuan Li",https://openreview.net/forum?id=H-6iczs__Ro
3768,Hardness of Noise-Free Learning for Two-Hidden-Layer Neural Networks,poster,Accept,7.33,"[7, 8, 7]","Sitan Chen, Aravind Gollakota, Adam Klivans, Raghu Meka",https://openreview.net/forum?id=GzESlaXaN04
11849,Instability and Local Minima in GAN Training with Kernel Discriminators,poster,Accept,6.0,"[5, 6, 7]","Evan Becker, Parthe Pandit, Sundeep Rangan, Alyson Fletcher",https://openreview.net/forum?id=GyWsthkJ1E2
7921,Energy-Based Contrastive Learning of Visual Representations,poster,Accept,6.67,"[7, 6, 7]","Beomsu Kim, Jong Chul Ye",https://openreview.net/forum?id=GwwC16ECrM5
597,Estimating Noise Transition Matrix with Label Correlations for Noisy Multi-Label Learning,poster,Accept,5.5,"[6, 4, 7, 5]","Shikun Li, Xiaobo Xia, Hansong Zhang, Yibing Zhan, Shiming Ge, Tongliang Liu",https://openreview.net/forum?id=GwXrGy_vc8m
1914,Generative Visual Prompt: Unifying Distributional Control of Pre-Trained Generative Models,poster,Accept,6.0,"[5, 6, 6, 7]","Chen Henry Wu, Saman Motamed, Shaunak Srivastava, Fernando De la Torre",https://openreview.net/forum?id=Gsbnnc--bnw
565,Towards Lightweight Black-Box Attack Against Deep Neural Networks,poster,Accept,6.0,"[7, 5, 6, 6]","Chenghao Sun, Yonggang Zhang, Wan Chaoqun, Qizhou Wang, Ya Li, Tongliang Liu, Bo Han, Xinmei Tian",https://openreview.net/forum?id=Gpqqm4p91Ez
967,End-to-end Symbolic Regression with Transformers,poster,Accept,6.0,"[7, 5, 6]","Pierre-Alexandre Kamienny, Stéphane d'Ascoli, Guillaume Lample, Francois Charton",https://openreview.net/forum?id=GoOuIrDHG_Y
3221,CogView2: Faster and Better Text-to-Image Generation via Hierarchical Transformers,poster,Accept,5.75,"[6, 8, 6, 3]","Ming Ding, Wendi Zheng, Wenyi Hong, Jie Tang",https://openreview.net/forum?id=GkDbQb6qu_r
3037,Improving Variational Autoencoders with Density Gap-based Regularization,poster,Accept,6.33,"[5, 8, 6]","Jianfei Zhang, Jun Bai, Chenghua Lin, Yanmeng Wang, Wenge Rong",https://openreview.net/forum?id=GjWDguPZRmr
12723,Uni[MASK]: Unified Inference in Sequential Decision Problems,poster,Accept,8.0,"[9, 7, 8]","Micah Carroll, Orr Paradise, Jessy Lin, Raluca Georgescu, Mingfei Sun, David Bignell, Stephanie Milani, Katja Hofmann, Matthew Hausknecht, Anca Dragan, Sam Devlin",https://openreview.net/forum?id=GisHNaleWiA
4442,SAPD+: An Accelerated Stochastic Method for Nonconvex-Concave Minimax Problems,poster,Accept,6.0,"[5, 6, 7]","Xuan Zhang, Necdet Aybat, Mert Gurbuzbalaban",https://openreview.net/forum?id=GiUpEVQmNx8
5431,Wasserstein Iterative Networks for Barycenter Estimation,poster,Accept,6.0,"[6, 7, 6, 5]","Alexander Korotin, Vage Egiazarian, Lingxiao Li, Evgeny Burnaev",https://openreview.net/forum?id=GiEnzxTnaMN
8206,Provably Efficient Model-Free Constrained RL with Linear Function Approximation,poster,Accept,6.5,"[7, 7, 5, 7]","Arnob Ghosh, Xingyu Zhou, Ness Shroff",https://openreview.net/forum?id=Gf5DxrgD2cT
11756,Online Bipartite Matching with Advice: Tight Robustness-Consistency Tradeoffs for the Two-Stage Model,poster,Accept,6.75,"[6, 7, 7, 7]","Billy Jin, Will Ma",https://openreview.net/forum?id=GeT7TSy1_hL
8252,Few-shot Task-agnostic Neural Architecture Search for Distilling Large Language Models,poster,Accept,6.0,"[4, 7, 7]","Dongkuan Xu, Subhabrata Mukherjee, Xiaodong Liu, Debadeepta Dey, Wenhui Wang, Xiang Zhang, Ahmed Hassan Awadallah, Jianfeng Gao",https://openreview.net/forum?id=GdMqXQx5fFR
10202,Bayesian Optimistic Optimization: Optimistic Exploration for Model-based Reinforcement Learning,poster,Accept,5.67,"[6, 6, 5]","Chenyang Wu, Tianci Li, Zongzhang Zhang, Yang Yu",https://openreview.net/forum?id=GdHVClGh9N
7509,A Combinatorial Perspective on the Optimization of Shallow ReLU Networks,poster,Accept,5.75,"[7, 5, 5, 6]","Michael S Matena, Colin Raffel",https://openreview.net/forum?id=GbpEszOdiTV
11265,A theory of weight distribution-constrained learning,poster,Accept,5.75,"[7, 8, 4, 4]","Weishun Zhong, Ben Sorscher, Daniel Lee, Haim Sompolinsky",https://openreview.net/forum?id=GaLgQ5_CZwB
5258,Learning Neural Set Functions Under the Optimal Subset Oracle,poster,Accept,7.2,"[8, 8, 7, 6, 7]","Zijing Ou, Tingyang Xu, Qinliang Su, Yingzhen Li, Peilin Zhao, Yatao Bian",https://openreview.net/forum?id=GXOC0zL0ZI
2178,PopArt: Efficient Sparse Regression and Experimental Design for Optimal Sparse Linear Bandits,poster,Accept,6.67,"[6, 7, 7]","Kyoungseok Jang, Chicheng Zhang, Kwang-Sung Jun",https://openreview.net/forum?id=GWcdXz0M6a
6189,Order-Invariant Cardinality Estimators Are Differentially Private,poster,Accept,6.5,"[6, 7, 6, 7]","Charlie Dickens, Justin Thaler, Daniel Ting",https://openreview.net/forum?id=GTde0BIHMGB
10977,A New Family of Generalization Bounds Using Samplewise Evaluated CMI,poster,Accept,6.5,"[5, 7, 7, 7]","Fredrik Hellström, Giuseppe Durisi",https://openreview.net/forum?id=GRd5UCkkXcV
10576,A Unified Hard-Constraint Framework for Solving Geometrically Complex PDEs,poster,Accept,5.75,"[3, 6, 6, 8]","Songming Liu, Zhongkai Hao, Chengyang Ying, Hang Su, Jun Zhu, Ze Cheng",https://openreview.net/forum?id=GNt5ntEGjD3
10709,A Boosting Approach to Reinforcement Learning,poster,Accept,7.0,"[6, 8]","Nataly Brukhim, Elad Hazan, Karan Singh",https://openreview.net/forum?id=GNHyNOR8Sn
6655,Phase diagram of Stochastic Gradient Descent in high-dimensional two-layer neural networks,poster,Accept,6.67,"[7, 6, 7, 7, 7, 6]","Rodrigo Veiga, Ludovic STEPHAN, Bruno Loureiro, Florent Krzakala, Lenka Zdeborova",https://openreview.net/forum?id=GL-3WEdNRM
508,Recurrent Video Restoration Transformer with Guided Deformable Attention,poster,Accept,6.67,"[8, 6, 6]","Jingyun Liang, Yuchen Fan, Xiaoyu Xiang, Rakesh Ranjan, Eddy Ilg, Simon Green, Jiezhang Cao, Kai Zhang, Radu Timofte, Luc Van Gool",https://openreview.net/forum?id=GKfNB4BegL
9166,Relational Reasoning via Set Transformers: Provable Efficiency and Applications to MARL,poster,Accept,5.67,"[6, 7, 4]","Fengzhuo Zhang, Boyi Liu, Kaixin Wang, Vincent Tan, Zhuoran Yang, Zhaoran Wang",https://openreview.net/forum?id=GJGU6FgB7mg
6814,SUNMASK: Mask Enhanced Control in Step Unrolled Denoising Autoencoders,reject,Reject,4.8,"[5, 7, 3, 6, 3]","Kyle Kastner, Tim Cooijmans, Yusong Wu, Aaron Courville",https://openreview.net/forum?id=GIZlheqznkT
6142,Enhancing Safe Exploration Using Safety State Augmentation,poster,Accept,5.25,"[7, 3, 7, 4]","Aivar Sootla, Alexander Imani Cowen-Rivers, Jun Wang, Haitham Bou Ammar",https://openreview.net/forum?id=GH4q4WmGAsl
360,Orthogonal Transformer: An Efficient Vision Transformer Backbone with Token Orthogonalization,poster,Accept,5.0,"[6, 5, 5, 4]","Huaibo Huang, Xiaoqiang Zhou, Ran He",https://openreview.net/forum?id=GGtH47T31ZC
4815,Characteristic Neural Ordinary Differential Equations,reject,Reject,5.67,"[7, 6, 4]","Xingzi Xu, Ali Hasan, Khalil Elkhalil, Jie Ding, Vahid Tarokh",https://openreview.net/forum?id=GGi4igGZEB-
5335,Effective Decision Boundary Learning for Class Incremental Learning,reject,Reject,4.5,"[4, 5, 5, 4]","KunChi Li, Jun Wan, Sergio Escalera, Zhen Lei, Shan Yu",https://openreview.net/forum?id=GGBe1uQ_g_8
4140,Museformer: Transformer with Fine- and Coarse-Grained Attention for Music Generation,poster,Accept,5.5,"[4, 7, 7, 4]","Botao Yu, Peiling Lu, Rui Wang, Wei Hu, Xu Tan, Wei Ye, Shikun Zhang, Tao Qin, Tie-Yan Liu",https://openreview.net/forum?id=GFiqdZOm-Ei
2461,Parametrically Retargetable Decision-Makers Tend To Seek Power,poster,Accept,6.0,"[7, 7, 4, 6]","Alexander Matt Turner, Prasad Tadepalli",https://openreview.net/forum?id=GFgjnk2Q-ju
2230,Finite-Time Analysis of Adaptive Temporal Difference Learning with Deep Neural Networks,poster,Accept,5.5,"[4, 5, 7, 6]","Tao Sun, Dongsheng Li, Bao Wang",https://openreview.net/forum?id=GCNIm4cKoRx
11846,MMRR: Unsupervised Anomaly Detection through Multi-Level Masking and Restoration with Refinement,reject,Reject,3.33,"[5, 3, 2]","Jaesung Ahn, Janghyeon Lee, Hanbyel Cho, Yooshin Cho, HyeongGwon Hong, Junmo Kim",https://openreview.net/forum?id=GBEimWWM9ii
1498,GET3D: A Generative Model of High Quality 3D Textured Shapes Learned from Images,poster,Accept,7.0,"[7, 7, 6, 8]","Jun Gao, Tianchang Shen, Zian Wang, Wenzheng Chen, Kangxue Yin, Daiqing Li, Or Litany, Zan Gojcic, Sanja Fidler",https://openreview.net/forum?id=GAUwreODU5L
9685,Adjoint-aided inference of Gaussian process driven differential equations,poster,Accept,5.5,"[4, 6, 5, 7]","Paterne Gahungu, Christopher W Lanyon, Mauricio A Álvarez, Engineer Bainomugisha, Michael Thomas Smith, Richard David Wilkinson",https://openreview.net/forum?id=G8BExMno316
10348,Is Integer Arithmetic Enough for Deep Learning Training?,poster,Accept,6.25,"[5, 8, 6, 6]","Alireza Ghaffari, Marzieh S. Tahaei, Mohammadreza Tayaranian, Masoud Asgharian, Vahid Partovi Nia",https://openreview.net/forum?id=G7MX_0J6JKX
367,On Enforcing Better Conditioned Meta-Learning for Rapid Few-Shot Adaptation,poster,Accept,6.25,"[6, 6, 8, 5]","Markus Hiller, Mehrtash Harandi, Tom Drummond",https://openreview.net/forum?id=G6cJsOOx2R3
11702,Fine-tuning language models to find agreement among humans with diverse preferences,poster,Accept,6.0,"[3, 6, 6, 9]","Michiel A. Bakker, Martin J Chadwick, Hannah Sheahan, Michael Henry Tessler, Lucy Campbell-Gillingham, Jan Balaguer, Nat McAleese, Amelia Glaese, John Aslanides, Matthew Botvinick, Christopher Summerfield",https://openreview.net/forum?id=G5ADoRKiTyJ
4577,Algorithms that Approximate Data Removal: New Results and Limitations,poster,Accept,6.0,"[6, 5, 7]","Vinith Menon Suriyakumar, Ashia Camage Wilson",https://openreview.net/forum?id=G4VOQPYxBsI
11294,Embrace the Gap: VAEs Perform Independent Mechanism Analysis,poster,Accept,6.33,"[7, 6, 6]","Patrik Reizinger, Luigi Gresele, Jack Brady, Julius Von Kügelgen, Dominik Zietlow, Bernhard Schölkopf, Georg Martius, Wieland Brendel, Michel Besserve",https://openreview.net/forum?id=G4GpqX4bKAH
5955,FedAvg with Fine Tuning: Local Updates Lead to Representation Learning,poster,Accept,6.75,"[7, 6, 7, 7]","Liam Collins, Hamed Hassani, Aryan Mokhtari, Sanjay Shakkottai",https://openreview.net/forum?id=G3fswMh9P8y
3622,Detection and Localization of Changes in Conditional Distributions,poster,Accept,6.5,"[7, 7, 6, 6]","Lizhen Nie, Dan L Nicolae",https://openreview.net/forum?id=G2kkDEujOw
7677,OPEN: Orthogonal Propagation with Ego-Network Modeling,poster,Accept,5.33,"[7, 4, 5]","Liang Yang, Lina Kang, Qiuliang Zhang, Mengzhe Li, Bingxin Niu, Dongxiao He, Zhen Wang, Chuan Wang, Xiaochun Cao, Yuanfang Guo",https://openreview.net/forum?id=G25uStbmC7
933,Mining Unseen Classes via Regional Objectness: A Simple Baseline for Incremental Segmentation,poster,Accept,5.8,"[4, 7, 7, 4, 7]","Zekang Zhang, Guangyu Gao, Zhiyuan Fang, Jianbo Jiao, Yunchao Wei",https://openreview.net/forum?id=G1vrYk9uX-_
2840,Exponential Family Model-Based Reinforcement Learning via Score Matching,poster,Accept,6.67,"[7, 6, 7]","Gene Li, Junbo Li, Anmol Kabra, Nathan Srebro, Zhaoran Wang, Zhuoran Yang",https://openreview.net/forum?id=G1uywu6vNZe
3875,Monte Carlo Tree Descent for Black-Box Optimization,poster,Accept,5.25,"[6, 2, 7, 6]","Yaoguang Zhai, Sicun Gao",https://openreview.net/forum?id=FzdmrTUyZ4g
3116,Fixed-Distance Hamiltonian Monte Carlo,poster,Accept,6.0,"[6, 6, 6]","Hadi Mohasel Afshar, Sally Cripps",https://openreview.net/forum?id=Fytzfxj3Bq7
7389,Signal Propagation in Transformers: Theoretical Perspectives and the Role of Rank Collapse,poster,Accept,5.33,"[4, 7, 5]","Lorenzo Noci, Sotiris Anagnostidis, Luca Biggio, Antonio Orvieto, Sidak Pal Singh, Aurelien Lucchi",https://openreview.net/forum?id=FxVH7iToXS
4870,A Simple and Provably Efficient Algorithm for Asynchronous Federated Contextual Linear Bandits,poster,Accept,5.67,"[6, 6, 5]","Jiafan He, Tianhao Wang, Yifei Min, Quanquan Gu",https://openreview.net/forum?id=Fx7oXUVEPW
11044,Learning Interface Conditions in Domain Decomposition Solvers,poster,Accept,6.0,"[6, 6, 6]","Ali Taghibakhshi, Nicolas Nytko, Tareq Uz Zaman, Scott MacLachlan, Luke Olson, Matthew West",https://openreview.net/forum?id=FvdOlVWL-w
14,Sample Complexity of Learning Heuristic Functions for Greedy-Best-First and A* Search,poster,Accept,7.33,"[8, 7, 7]","Shinsaku Sakaue, Taihei Oki",https://openreview.net/forum?id=FurHLDnmC5v
9566,Accelerated Primal-Dual Gradient Method for Smooth and Convex-Concave Saddle-Point Problems with Bilinear Coupling,poster,Accept,7.25,"[7, 6, 9, 7]","Dmitry Kovalev, Alexander Gasnikov, Peter Richtárik",https://openreview.net/forum?id=FncDhRcRYiN
6497,NIERT: Accurate Numerical Interpolation through Unifying Scattered Data Representations using Transformer Encoder,reject,Reject,5.67,"[6, 6, 5]","Shizhe Ding, Dongbo Bu",https://openreview.net/forum?id=Fn17vlng9pD
2148,Adaptive Data Debiasing through Bounded Exploration,poster,Accept,6.67,"[7, 6, 7]","Yifan Yang, Yang Liu, Parinaz Naghizadeh",https://openreview.net/forum?id=Fm7Dt3lC_s2
8042,Quantifying Statistical Significance of Neural Network-based Image Segmentation by Selective Inference,poster,Accept,5.67,"[6, 6, 5]","Vo Nguyen Le Duy, Shogo Iwazaki, Ichiro Takeuchi",https://openreview.net/forum?id=FlrQGoHPcvo
11458,Residual Multiplicative Filter Networks for Multiscale Reconstruction,poster,Accept,6.0,"[5, 6, 7]","Shayan Shekarforoush, David B. Lindell, David J. Fleet, Marcus A Brubaker",https://openreview.net/forum?id=FlWdTyUznCc
7156,Natural image synthesis for the retina with variational information bottleneck representation,poster,Accept,6.0,"[6, 6, 7, 5]","Babak Rahmani, Demetri Psaltis, Christophe Moser",https://openreview.net/forum?id=FkPZGtTxXx6
9225,Shielding Federated Learning: Aligned Dual Gradient Pruning Against  Gradient Leakage,reject,Reject,4.5,"[5, 4, 4, 7, 4, 3]","Shengshan Hu, Lulu Xue, Ruizhi Zhao, Leo Yu Zhang, Chaowei Xiao, Lichao Sun, Minghui Li, Hai Jin",https://openreview.net/forum?id=Fjw_7Hv-mwB
10057,Prompt Injection: Parameterization of Fixed Inputs,reject,Reject,6.33,"[7, 5, 7]","Eunbi Choi, Yongrae Jo, Joel Jang, Minjoon Seo",https://openreview.net/forum?id=FjqBs4XKe87
6212,Task-level Differentially Private Meta Learning,poster,Accept,5.0,"[4, 6, 5]","Xinyu Zhou, Raef Bassily",https://openreview.net/forum?id=FhyrZ92DcI9
6562,Listen to Interpret: Post-hoc Interpretability for Audio Networks with NMF,poster,Accept,6.5,"[6, 6, 7, 7]","Jayneel Parekh, Sanjeel Parekh, Pavlo Mozharovskyi, Florence d'Alché-Buc, Gaël Richard",https://openreview.net/forum?id=FhuM-kk8Pbk
11793,Differentially Private Graph Learning via Sensitivity-Bounded Personalized PageRank,poster,Accept,5.5,"[7, 6, 6, 3]","Alessandro Epasto, Vahab Mirrokni, Bryan Perozzi, Anton Tsitsulin, Peilin Zhong",https://openreview.net/forum?id=Fhty8PgFkDo
2201,Geo-SIC: Learning Deformable Geometric Shapes in Deep Image Classifiers,poster,Accept,6.67,"[7, 7, 6]","Jian Wang, Miaomiao Zhang",https://openreview.net/forum?id=FhWQzNY2UYR
8356,Gaussian Copula Embeddings,poster,Accept,6.33,"[7, 7, 5]","Chien Lu, Jaakko Peltonen",https://openreview.net/forum?id=Fh9l_pVsBfv
3142,Category-Level 6D Object Pose Estimation in the Wild: A Semi-Supervised Learning Approach and A New Dataset,poster,Accept,4.75,"[6, 4, 7, 2]","Yang Fu, Xiaolong Wang",https://openreview.net/forum?id=FgDzS8_Fz7c
10986,On the Adversarial Robustness of Mixture of Experts,poster,Accept,5.5,"[6, 6, 5, 5]","Joan Puigcerver, Rodolphe Jenatton, Carlos Riquelme Ruiz, Pranjal Awasthi, Srinadh Bhojanapalli",https://openreview.net/forum?id=Fd05J4Bu5Sp
12840,The Impact of Task Underspecification in Evaluating Deep Reinforcement Learning,poster,Accept,6.33,"[6, 7, 6]","Vindula Jayawardana, Catherine H Tang, Sirui Li, Dajiang Suo, Cathy Wu",https://openreview.net/forum?id=F_9w7Wl78IH
7097,Online Allocation and Learning in the Presence of Strategic Agents,poster,Accept,6.0,"[7, 5, 6]","Steven Yin, Shipra Agrawal, assaf zeevi",https://openreview.net/forum?id=FYGrMDwQyL
4548,Pre-Trained Language Models for Interactive Decision-Making,poster,Accept,7.0,"[7, 7, 7]","Shuang Li, Xavier Puig, Chris Paxton, Yilun Du, Clinton Wang, Linxi Fan, Tao Chen, De-An Huang, Ekin Akyürek, Anima Anandkumar, Jacob Andreas, Igor Mordatch, Antonio Torralba, Yuke Zhu",https://openreview.net/forum?id=FWMQYjFso-a
4099,TA-MoE: Topology-Aware Large Scale Mixture-of-Expert Training,poster,Accept,5.33,"[6, 5, 5]","Chang Chen, Min Li, Zhihua Wu, Dianhai Yu, Chao Yang",https://openreview.net/forum?id=FRDiimH26Tr
12671,On-Demand Sampling: Learning Optimally from Multiple Distributions,poster,Accept,7.25,"[7, 7, 7, 8]","Nika Haghtalab, Michael Jordan, Eric Zhao",https://openreview.net/forum?id=FR289LMkmxZ
11908,When Does Differentially Private Learning Not Suffer in High Dimensions?,poster,Accept,7.0,"[7, 6, 8]","Xuechen Li, Daogao Liu, Tatsunori Hashimoto, Huseyin A Inan, Janardhan Kulkarni, YinTat Lee, Abhradeep Guha Thakurta",https://openreview.net/forum?id=FR--mkQu0dw
4812,Pre-Trained Image Encoder for Generalizable Visual Reinforcement Learning,poster,Accept,5.33,"[7, 3, 6]","Zhecheng Yuan, Zhengrong Xue, Bo Yuan, Xueqian Wang, Yi Wu, Yang Gao, Huazhe Xu",https://openreview.net/forum?id=FQtku8rkp3
6354,Off-Policy Evaluation with Policy-Dependent Optimization Response,poster,Accept,6.0,"[4, 6, 7, 7]","Wenshuo Guo, Michael Jordan, Angela Zhou",https://openreview.net/forum?id=FO0Gb8IL1p5
3253,TREC: Transient Redundancy Elimination-based Convolution,poster,Accept,5.25,"[5, 5, 6, 5]","Jiawei Guan, Feng Zhang, Jiesong Liu, Hsin-Hsuan Sung, Ruofan Wu, Xiaoyong Du, Xipeng Shen",https://openreview.net/forum?id=FNzLe2-ppRO
7229,Monte Carlo Augmented Actor-Critic for Sparse Reward Deep Reinforcement Learning from Suboptimal Demonstrations,poster,Accept,5.5,"[5, 5, 6, 6]","Albert Wilcox, Ashwin Balakrishna, Jules Dedieu, Wyame Benslimane, Daniel S. Brown, Ken Goldberg",https://openreview.net/forum?id=FLzTj4ia8BN
6146,ZooD: Exploiting Model Zoo for Out-of-Distribution Generalization,poster,Accept,5.67,"[5, 5, 7]","Qishi Dong, Muhammad Awais, Fengwei Zhou, Chuanlong Xie, Tianyang Hu, Yongxin Yang, Sung-Ho Bae, Zhenguo Li",https://openreview.net/forum?id=FJVB_tkiWpw
6600,LECO: Learnable Episodic Count for Task-Specific Intrinsic Reward,poster,Accept,5.33,"[6, 6, 4]","Daejin Jo, Sungwoong Kim, Daniel Wontae Nam, Taehwan Kwon, Seungeun Rho, Jongmin Kim, Donghoon Lee",https://openreview.net/forum?id=FJ42JCNNUYT
9364,Consistency of Constrained Spectral Clustering under Graph Induced Fair Planted Partitions,poster,Accept,6.25,"[7, 6, 6, 6]","Shubham Gupta, Ambedkar Dukkipati",https://openreview.net/forum?id=FHgpw2Cn__
6121,Matrix Multiplicative Weights Updates in Quantum Zero-Sum Games: Conservation Laws & Recurrence,poster,Accept,6.25,"[7, 5, 6, 7]","Rahul Jain, Georgios Piliouras, Ryann Sim",https://openreview.net/forum?id=FFZYhY2z3j
6679,Large-scale Optimization of Partial AUC in a Range of False Positive Rates,poster,Accept,6.0,"[6, 6, 7, 5]","Yao Yao, Qihang Lin, Tianbao Yang",https://openreview.net/forum?id=FFPcFtWJwsB
11378,Environment Diversification with Multi-head Neural Network for Invariant Learning,poster,Accept,6.25,"[7, 7, 6, 5]","Bo-Wei Huang, Keng-Te Liao, Chang-Sheng Kao, Shou-De Lin",https://openreview.net/forum?id=FDmIo6o09H
9320,Meta-Learning with Self-Improving Momentum Target,poster,Accept,6.25,"[7, 6, 6, 6]","Jihoon Tack, Jongjin Park, Hankook Lee, Jaeho Lee, Jinwoo Shin",https://openreview.net/forum?id=FCNMbF_TsKm
4776,On the Effective Number of Linear Regions in Shallow Univariate ReLU Networks: Convergence Guarantees and Implicit Bias,poster,Accept,7.0,"[8, 7, 8, 5]","Itay Safran, Gal Vardi, Jason D. Lee",https://openreview.net/forum?id=F8UV5CItyRG
